rating,time_created,text,useful,funny,cool,username,user_loc,user_friends,user_reviews,user_photos
4.0,7/3/2011,"Part of Daniel Boulud's empire, this white tablecloth restaurant was an excellent eating experience.  Entrance to the right upon entering the Surrey Hotel, you'll be escorted into a handsome dining room in shades of beige and brown, dark woods, accented by red seats, lit with soft, excellent lighting.  Our waitstaff were attentive and efficient.  The patrons are well-dressed so leave the casual duds at home.Besides the tasting menu, the menu is divided into four sections under the themes of traditional, seasonal, vegetable, and Mexican (their ""la voyage"" section).  We did not choose the tasting menu but between the four of us, we selected eight unique appetizers and entrees from across the menu and specials for the night, and rotated between every person to make our own 8-course tasting (plus 3 desserts).  Drinks menu is the same as from Bar Pleiades, with a great selection of cocktails, wines, and beers.Portion sizes were as expected, and just enough for all four of us to have a good taste of each.  We had diverse choices, so we were able to sample pasta, veal, duck, striped bass, pate and others.  It was a fun experience to sample and rotate dishes, then compare notes when we were done.  Universally, we liked almost everything, but there were some clear favorites in appetizers and entrees.  Their menu changes frequently, but I am assured that the kitchen handles food very well.A special shout out to the unbelievably good strawberry rhubarb tart that they brought to the table for us to see.  This was simply the BEST rhubarb tart I've ever had, and since I can't refuse rhubarb tarts, that's the best of many.",0,0,0,Valery C.,"Forest Hills, NY",56,837,9616
5.0,7/1/2011,"Terrific, welcoming restaurant with great food, service and really great wine.",0,0,0,Jason C.,"New York, NY",24,161,33
4.0,6/24/2011,"3.5 stars.. It was good but nothing memorable. Service was good but again, nothing to write home about.The best part of the meal was sitting a few table away from Padma! She is gorgeous!",0,0,0,Drew F.,"San Jose, CA",38,102,2
4.0,6/13/2011,"I came here for my Sunday birthday brunch eager to try out one of nyc's top restaurants, but slightly concerned about atmosphere. As reviews say, atmosphere is slightly stuffy with UES snobs, but not that overbearing. Just be sure to dress up as this is a Michelin starred restaurant. The setting is very modern and formal. Service- did seem a little impersonal as they had four or five people attending to us. Still everything was done very precisely. As this is my first Michelin restaurant, i guess this is how service is.Onto the food-  They served an amuse bouche of risotto balls maybe with pea puree? It was ok, tasted like just rice in a ball. 1st course was db's smoked salmon with capers on a toasted brioche. Salmon was good and the flavors all meshed well with the creaminess and slightly sweetness of the creme fraiche with the pungent bites of capers. They also had small shredded bits of this yellow substance, most likely lemon? Good, but nothing too special.2nd course- was maine peektoe crab benedict with with wilted arrowleaf spinach and sauce choron. This was very tasty, slightly sweet and sour at the same time. The portion was pretty big, probably twenty bites to eat it. At the end, it was a little too much, but it was definitely tasty at first bite.3rd course- dessert! i had a white chocolate coconut mousse with almond dacquoise, passionfruit sauce pina and colada sorbet. Sorbet was very good, it had this airy but still substantial tangy flavor. and combined with the almond cracker like crust and chocolate bits made it sweet and sour, but with a subtle flair. The white chocolate cake was also good as well, the cake being lightly sweet and also slightly sour with passionfruit sauce on top.  The dessert was definitely the high point of the meal. Overall, it was a nice restaurant, and I highly recommend saving room for dessert!",0,0,0,Christine L.,"New York, NY",4,59,1
4.0,6/9/2011,"As snobby as this sounds, I am generally more a fan of white table cloth UES/West Village dining than grungy E. Village dining. So if you are like me, you will enjoy Cafe Boulud. My husband and I took my sister here for her a quick birthday brunch since it is close to where she works (Cornell hospital is only a few blocks over!) and were surprised that at 1:45, there was still a small wait to get seated by the Maitre'd. So happens, this place is PACKED with UES ladies having a late lunch with their Chanel-or-Hermes-handbag-Fendi-defile-runway-dress-Manolo Blahnik-shoe wearing (sorry to name names, I'm in the industry... can't be helped!) girlfriends and an occasional couple of tables with power-lunching businessmen. Despite some looks from one particular older lady sitting near us, most guests were really to themselves.Service wise, they were warm, welcoming and thoughtful in remembering to wish my sister a Happy Birthday. Food wise, I really loved the lunch pre-fixe special (appetizer, main & dessert). It was somewhere between $35-45 for the lunch pre-fixe in which I had the broccoli parmesan soup, roasted duck and tangy lemon tart. All perfectly executed and vibrant with flavor. Yum.Really like this place, but note that if you're  more sensitive to snooty patrons--try sitting outside on the terrace for brunch instead.",2,0,0,Clara H.,"Manhattan, NY",35,138,159
4.0,6/6/2011,"I came here last Friday night.  This beautiful summer evening began with drinking on the roof of the Met for 3 hours, then knocking back 2 Bookers on the rocks at the Carlyle Hotel while soaking in some jazz, and finally, randomly walking into Cafe Boulud with a party of 6 at around 10pm.  We were seated right away and the table got down to business on pre-dinner cocktails.  Dirty Hendricks Martini on the rocks with 4 olives just to get my bearings on the wine list.  Since it is summer, some Rose for the table, followed by a bottle of Chateauneuf du Pape for the mains.As you would expect and have read before, impeccable service (even while I was wearing red pants and no jacket), pristine food, but most of all, fantastic company.  Go.PS - be forewarned - the crowd is old.",0,2,0,Brian B.,"New York, NY",10,37,0
4.0,5/25/2011,"I came here on someone else's dime (yay); just note that I think my review would be a smidge less starry if I had been the one footing the bill.This was my first foray into Boulud-land and admittedly, I liked what I saw. I wore my finest black dress, pearls and a shawl and was able to blend in perfectly with the (much, much older) Upper East Side crowd, although there were a few boisterous jeans-wearers. The vibe was a little stuffy, but not pretentious. I do wish that they had a better place to sit and wait, as I was the first of my party to arrive and did not enjoy standing awkwardly in front of the coat check. On to the food. It's a very interesting menu - all a la carte, in four categories. You're offered bread right away, and continuously throughout the entire meal. It's good (you'll always have bread when you need it...), but didn't taste particularly special and got a bit oppressive after a while. Wine selection was good - hilariously marked-up - and I liked watching the sommelier sashay around like he owned the place.The pea soup was perfect (complete with ravioli surprise at the bottom) and my poulet rouge was the juiciest, most flavorful chicken I've had in ages. All the tiny accoutrements (sabayon, crispy spiral, a single perfectly prepared asparagus spear) reminded me that, yes, I was Somewhere Fancy. Other highlights were the lamb and the beef entrecote, although the latter was the smallest beef portion I have ever seen - I understand fine dining, but this was almost ridiculous, considering the price. Apparently the monkfish (off the Voyage menu) was not great...so maybe don't get that.Desserts were a standout, all of them, and damned if they don't brew a fabulous cup of coffee.",1,1,0,Julie A.,"Manhattan, NY",38,183,4
3.0,4/15/2011,"I had high expectation for this place because of the high praises from several respected food bloggers and the Michelin Guide.  The expectation was not met.  Bread service was disappointing.  The selections were cold and the mini baguette was a bit soggy and had no crunch.  Butter temperature was still too cold to spread.  The octopus carpaccio appetizer was the star of the night - fresh, flavorful, perfectly executed - a solid 5-star performance.  The squid ink pasta was good, but it was nothing to write home about.  The beef ribeye was tiny in portion considering the hefty price tag.  The meat was not very marbled and tasted a bit dry without the sauce - huge disappointment.  The baba au rhum was almost perfect, except for the generous drizzle of fresh rum table side.  While I appreciated the show, I thought the extra rum ruined the balance of an otherwise perfectly soaked cake.  The complimentary madeleine was as good as the ones in Daniel.  Service was great.  Decor is neutral and comfortable.  But the seats were too close to one another, making going to the washroom a hectic affair.  The crowd was decidedly old.  I'm pretty sure we were the only two people below the age of 40.  I wanted to give it a higher rating because the service was great and the appetizer was excellent.  Unfortunately, the rest of the dinner simply fell short.  Perhaps it was an off night.  But based on this visit, I do not see how this place could get a Michelin star.",0,0,0,Rich W.,"Palatine, IL",45,100,1
4.0,4/10/2011,"My girlfriend and I went out for a nice weekend dinner here last night. We haven't dabbled in much French cuisine, so it was a nice change of palette. The servers were very courteous and very helpful in explaining various appetizers that we weren't quite sure of based on the descriptions. The bread server came around often, and our water glasses were always filled. Definitely better service compared to some of the more high-end places I've been to in New York.As for the food itself - very well, with one exception. The appetizers were very well put-together...I got the ahi tuna nicoise, while my girlfriend got one of the daily specials (the Australian hiramasa crudo, which it turns out is yellowtail amberjack). The ahi tuna was a mix of both raw and cooked tuna, which provided a nice contrast. What really brought out the fish was the rest of the dish, which added a very diverse flavor to both appetizers. For the main course, I had the grilled Arctic char, while my girlfriend had the lamb loin. Both were delicious; the lamb was very succulent and infused with a lightly peppered taste. The char was basically what I would imagine salmon to be if it had a little firmer texture. That being said, some parts of the lamb were a bit chewier than I would expect. And the one big strike against the char was that while the top half was grilled, the underside and the middle of the filet was definitely undercooked. I know it's not supposed to be firm all the way around, but it definitely shouldn't have the texture of lukewarm mush. To top off the meal, dessert was great - the molten chocolate cake was not the best I've had, but it was very rich. I had the rum-soaked cake with pineapples, with macadamia brittle vanilla ice cream, which was amazing...the rum wasn't too harsh a taste, and the ice cream was the highlight of the dish.All in all, it was a very enjoyable dining experience. The portions are a bit small relative to other upscale places I've been, but all of the food was very delicious. If you do get fish, just make sure that it's cooked all the way through...that was the only major blemish for an otherwise stellar dinner.",2,1,2,Asuka N.,"New York, NY",371,1653,169
4.0,4/5/2011,"Conclusion: going to restaurants with people who know people is infinitely more rewarding to my taste buds. Perhaps I should back up. One of my friends happens to know Chef Gavin Kaysen*, so we stopped in the kitchen and brought the staff some choice beers. Kaysen was a great sport about us poking our heads in and he seems like a great guy. Since my first visit here, my taste preferences have changed and grown (hopefully for the better). While my mind wasn't as blown because I've since become accustomed to good food, my meal was positively delightful and the Chef came to check on us a couple times before heading out for the night. It's difficult, but infinitely fun, eating with a small group of young chefs. We all ordered different dishes and passed them around so we could each sample a bit or two of the savory goodness. As a result, I'm not really going to list every dish that I enjoyed. Suffice to say that I had a great time and would definitely go back to Cafe Boulud. It's definitely my kind of food and as long as Chef Gavin Kaysen is there, I will gladly put my dinner in his hands.-------------------------*In 2007, he represented the US at the Bocuse d'Or. He was also a contestant on The Next Iron Chef (and made it to the third round before being eliminated for ""underseasoning"" and ""undersalting"" his food). In 2008, Kaysen won a James Beard Foundation Award for the Rising Star Chef of the Year. Not too shabby, Chef!",5,3,4,Jenn L.,"New York, NY",221,317,547
5.0,4/3/2011,"Café Boulud exists on another level. There are maybe 10 restaurants in New York City that are worth comparing it to. There should be a completely separate section of Yelp for these restaurants, because to compare them to every other restaurant in New York makes absolutely no sense. Everything about Café Boulud is world class. Some reviewers are picky because they think its too expensive or because it was restaurant week so they feel entitled. To give Café Boulud 4 stars is to somehow pretend that any restaurant in New York has the potential to compete with it. Which is of course ridiculous.",0,0,0,Ben P.,"Brooklyn, NY",0,4,0
5.0,4/1/2011,"I brought my mother here for her 50th birthday in mid March. She wanted fancy (but she doesn't have fancy tastebuds) so I did my best to find a place that will be foo-foo enough to make her happy but have food on the menu that won't intimidate her; that she will actually EAT. Cafe Boulud fit the bill, even though she did ask the waiter if the lamb was ""LAMBY"". The atmosphere is surprisingly laid back. People were talking. Tables were talking to other tables. We made friends! The service is good; not the best I have ever experienced, but good. The menu here is fantastic. You can pick from any of the categories for the prix fixe (La tradition, classics & country cooking; La Saison, flavors of the season; Le Potager, inspired by the market; Le Vogage, inspired by other cultures) You can also do a 7 course tasting menu, which I would have done with other company, but my mom doesn't eat many things. Next time, I will definitely want to try the chef's tasting menu. Firstly, I began my meal with the Pleiades Cobbler, a drink that sounds like a dessert, but instead of fat, there's booze. Great. Then, out came the bread. Delicious little rolls with whole kalamata olives baked in! Yay!Time to order. I chose the foie gras served with pain perdue cubes and orange marmalade for my appetizer. Classic, executed flawlessly. My mother ordered the short rib dumplings which were wonderfully savory with a crispy, thin wrapper. I could have eaten both appetizers myself and not thought twice. For my entree, I had the venison loin with some sort of root vegetable... springy, moussey triangle thing?! I honestly don't remember exactly what it was but I believe it contained rutabaga. Regardless, it was brilliant. Small cubes of beautifully cooked, medium rare venison sat upon my plate like an edible work of art. I have pictures. You'll agree it's one good-lookin' plate. Mother ordered the lamb, which came with some sort of gelee that she quarantined to the corner of her plate. She agreed that the lamb was not ""LAMBY"" (which, I guess means gamey?) and enjoyed every last bite.Dessert time!!!!!!!!!!!!!!!!!!!!!!!!!!!!!!!!!!!!!!!!!!!!!!!!!!!!!!!!!!!Since the portions are small (which most people in the good US of A would complain about... but I'm not looking to gorge myself til' I'm sick and still manage to leave with a duffel sized doggie bag) I had PLENTY of room to enjoy dessert. My mother ordered the souffle (I'm not a souffle person. I think they taste like flavored scrambled eggs.) and I got TWO desserts. Count 'em. TWO. It's my body. I do what I want.First: a heavenly butterscotch & chocolate bar topped with sea salt. Creamy, rich, and sweet. And finally, the piece de resistance: a simple citrus napolean. Fresh orange, tangerine, and grapefruit segments layered with pastry cream between buttery tuille cookies with a citrus sorbet. So refreshing and delicious! I would consider it a perfect dessert.I'm totally psyched to see what they'll have going on for Spring and Summer with the abundance of local fruits and vegetables. I'll be back in to eat, without a doubt.",5,3,3,Liana L.,"Brooklyn, NY",283,320,26
4.0,3/23/2011,"Cafe Boulud has a menu full of temptations.  Separated into four categories--traditional, seasonal, from the market, and overseas--the menu has something for everyone.  I began with the Japanese-inspired hamachi (yellowtail tuna) appetizer ($21), presented as a sliced sashimi rolled around crispy rice, edamame and togarashi pepper flakes.  It was light, fresh, and so delicious that it practically disappeared from my plate!  My main course, the poulet rouge ($35) a coq au vin, was superb!  Although the chicken is often ordered as the ""thrifty"" option on the menu, this dish is rich and delicious and well worth ordering.  It was certainly not a ""cheap"" meal in terms of flavor or presentation.  For desert I opted for the sensuous baked apples ($14) with calvados ice cream.  It was wonderful.  The best part was the calvados ice cream, of which I could have happily consumed a whole bowl!The restaurant is beautiful, and the service is great.  I could even write a happy paragraph of the wonders of the olive bread (but I won't).  Although this is a rather expensive restaurant, the food is divine.",0,0,0,Julia F.,"Kansas City, MO",223,319,215
4.0,3/22/2011,This restaurant has really good food.  Very dressy with a stuffy upper East Side crowd but the experience is memorable and worth the expense for a special event.,1,0,1,Terry L.,"San Francisco, CA",17,27,0
5.0,3/18/2011,"If you're anything like me, when confronted with an expansive and varied menu at a fine dining restaurant, you panic. it's impossible to decide exactly what you want because everything looks irresistible. Also, if you're anything like me, you don't like making choices in great restaurants anyway, since you trust the chef and want him to to choose what he thinks is best. So, if you're like me, you take a perfunctory look at the menu when it's offered and then promptly ignore it and ask for the tasting menu (which isn't on the printed menu, you have to inquire about it). You also order the wine pairing because hey, it's your birthday and you don't mind getting a little tipsy. Then you sit back and enjoy the ride.5 courses was actually more like 8 with the amuse and desserts taken into account, each paired with a glass of wine that matched the course perfectly (or almost perfectly in one or two cases). Earlier courses focused mainly on seafood, starting raw, progressing to cooked then to pasta and then meat in later courses. My girlfriend and I each got different, though similar, dishes for each course and most of the courses had 3 or 4 components from the menu so by the end of the meal I think we'd sampled almost everything.Everything was cooked perfectly, delays were few, with just enough space between courses to finish our wine and discuss the last course. The service was simultaneously very efficient and friendly. One of the waiters was obviously new which through a little hitch into the service as he tried to remember the placement of the forks between courses and get our wine pours even, but he managed to play it off and just added some comic relief to the evening.Attire is all over the map, from dressy to casual. Several people were there in hoodies and jeans, but hey, at least they put on their dress hoodies (ooh, cashmere!). I think I even remember a guy in a hawaiian shirt and a trucker cap, but he, thankfully, was seated out of the way, near the bathroom. Really, just dig through your closet for something nice. Maybe even iron it. This isn't Papaya Dog. 5 stars to Cafe Boulud and Chef Kaysen for a great meal and 5 stars to my girlfriend for not even making that bad of a face upon eating her first raw oyster, even if she did have to down a glass of champagne and a few slices of bread immediately after.",2,2,2,Andrew M.,"Berkeley, CA",16,90,0
4.0,3/3/2011,"1st time frequenting Daniel Boulub establishment. The restaurant is actually in the lobby of the hotel, and for me still kept that fancy carpeted lobby feel. Noticed that they weren't too particular about the dress code (some people wore jeans)...must have been the cold rainy afternoon.  Staff was attentive but having so many servers also created that impersonal feel. Menu for restaurant week was rather esoteric, no feature of main items of their regular menu. The side bread was wonderful.Started out with the  puff pastry, then the octopus salad (my favorite) and ended with a delicious molten chocolate cake. Also enjoyed my date's white bean soup and beef dish. Food overall was superb but small portions (womp womp)Turn off: The factory dining experience.  I should blame RW but our dinner felt rush. Food came out relatively quick after our order, making us think it was probably warming in the back for a while.Still everything came out tasting good. I'm sure their regular menu offers a greater culinary experience.",1,0,0,Annie T.,"Brooklyn, NY",670,601,732
5.0,2/18/2011,"Words can't describe how happy I was with my experience here. Came for dinner and left describing it as one of the best meals i've ever had. I didn't see a pinot grigio on the wine list, so I asked the waiter for a recommendation and he was spot on with something similar. The amuse bouche was aracini filled with fontina. It was so decadent and definitely got me excited for the meal ahead. We started with the short rib dumplings and the bucatini carbonara. While the dumplings were fabulous, the bucatini carbonara was definitely my favorite. Unfortunately it was a special so I can't rely on being able to have it on my next visit. If any of the managers are reading this please take this as my formal suggestion to ADD THIS TO THE MENU!!For my entree I had the veal milanese served with a deep, rich sauce and creamy polenta, my new favorite side dish. My date ordered the beef bordelaise and from the few tastes I had I could tell it was perfect as well. For dessert we ordered one of the specials which was their take on pumpkin cheesecake, as well as a chocolate cake. Both were presented beautifully and I enjoyed every sinful bite! As if we hadn't eaten enough, we were also presented with a basket of warm madeleines and to describe them as amazing doesn't even come close to doing them justice. I find myself craving them with my coffee every morning now!All in a all, a fabulous meal in a beautiful restaurant. Can't praise Cafe Boulud enough!",0,0,0,Jen G.,"New York, NY",36,188,0
