rating,time_created,text,useful,funny,cool,username,user_loc,user_friends,user_reviews,user_photos
2.0,4/29/2019,"TLDR: Food was mediocre. Found something that looked like plastic in my food. Waiter brushed me off and insulted my intelligence asking whether I knew what I was talking about. Service is not warm or friendly. Place felt stuck up with price tags to match. Spend your money elsewhere. God knows there are places in NYC with much better food and service.LONG FORMCame here to celebrate gf's cousin's 40th bday. I've been meaning to try this place and Daniel for a while so glad I finally got the chance to come. Our experience however, was below average.BIG BANG and VIEUX CARRE - We started with some cocktails which were inventive enough. I had the Big Bang which has a unique sesame note and was very smoky from the chicory. The vieux carre could have been a little better balanced. It was too spirit forward. They need a better mixologist.HAMACHI TARTARE - I started with the hamachi tartare which was very refreshing and had a great crunchy texture to break up the monotony of tartare. THE DUCK - For my entree I had the duck which was cooked to perfection. However, the seasoning on the duck was quite uneven. Parts of the duck had no seasoning while other parts tasted like the Dead Sea. The entree also came with these fried potato balls decorated with a marcona almond. These were especially dry and were not pleasant to eat. I did eat them anyway because I was hungry from the tiny portions but I have to say they were not good.BANANE - we brought a cake since it was our friend's bday but I also ordered the banane because it looked so interesting. I wasn't sure what this was. It came with a quarter of a caramelized banana (Really? You can't afford a whole banana for a $16 dessert?) and then there was a few batons of cakes stacked together and a scoop of molasses ice cream. It wasn't bad but it wasn't great either.SERVICE - Our server was ok. Very professional but not that warm or friendly. The entire place felt somewhat stuck up. My biggest issue with this place was that I found an unknown piece of material in my gf's lamb dish. It was thin and irregularly shaped and had the consistency of plastic or wax. I showed our waiter and later a man in a suit came by (didn't introduce himself) and I was told that it was cartilage from my duck. I looked skeptical and he then asked me if I had ever butchered a duck before. (It looked nothing like cartilage and you do NOT talk down to a customer.) It was then that I told him that I  actually found it in the lamb dish my gf had and his response was ""That's interesting."" And then walked away and never acknowledged me again for the rest of the night.It was a bday celebration so I didn't want to make a fuss but this is absolutely subpar service for what is suppose to be a fine dining restaurant.PRICE - With drinks, food, and a couple desserts and coffee, we spent $160 per person. Certainly not a cheap night out.If this is the level of food and service to be expected of Daniel Boulud's restaurants, then I count myself lucky to have only had to suffer this one in the 8 years I've lived in this city. The only thing keeping this from one star was the fact that we were allowed to bring a birthday cake.",3,0,1,Peter K.,"Manhattan, NY",470,686,86
3.0,4/27/2019,"I found Cafe Boulud to be resting on its laurels and only capable of occasional jolts of excellence. The unevenness of execution was my main impression when I had a quick lunch here. I started with a wonderfully bold and delicious turnip veloute and it was immediate followed by a painfully bland and un-textured beef bourguignon, substandard in any restaurant let alone a michelin starred one. The disparity in quality was hugely disappointing.",0,0,0,Zhewei J.,"Queens, Queens, NY",0,13,107
1.0,4/25/2019,Too salty.. I couldn't even finished a half of my dish.It was the first experience that I thought the reviews are not real. But the atmosphere was nice though.,0,0,0,Nam B.,"Flushing, NY",116,1,0
5.0,4/23/2019,Great French restaurant. Staff is very friendly and attentive. Amazing food. Love the atmosphere. Always 5-star experience. Thank you,0,0,0,Aron W.,"Manhattan, New York, NY",0,8,0
2.0,4/11/2019,Had breakfast  there/. Bad service and food overpriced. Nothing special. You are better off somewhere else less pretentious. Same goes for the hotel.,0,0,0,Michele O.,"Los Angeles, CA",0,19,0
3.0,4/8/2019,"Went here for my birthday brunch .The place itself is pretty and old school French . The bread was absolutely delicious. We got a basket of the viennoiseries and let me tell you about those amazing croissants! So flakey and perfect ! It didn't come w a danish though . The oysters were AMAZING get these regardless of whatever else you get.The lamb navarin was probably the best thing on the menu to get . And the presentation was so beautiful too . I got the steak and eggs which was also pretty delicious . The dressing on the side salads on all our meals were amazing. Finally , I wish we had gotten pancakes or French toast as dessert because their dessert cart was mediocre at best . I really really wanted to love this place . But it was a little underwhelming. The host was really nice and the check in process was well done . And I know I'm  being overly picky but only bcoz this was a pricey meal 1. The guy hardly refilled my water , it was really annoying actually. 2. So after we got individual dessert from the cart , they brought out my complimentary dessert which was one of the only ones we didn't pick like why not ask someone from my party which dessert to pick or just comp one of the desserts we already picked . Made zero sense . It was a pretty crappy dessert to . Rather would not have had it .3. The cappuccino was mediocre at best and I think it's priced at $8 or somethingProbably will come back for dinner and I'm sure that'll get a 5 star review",0,0,0,Sabah S.,"Brooklyn, NY",1,47,116
1.0,4/7/2019,Been here before for dinnerAmazingBreakfastPainfulService non existentWait from time to order to food coming outOver 45 minutes and that was only half the orderSecond half 10 minutes later 3 out of 4 orders came out wrong Cream for coffee curdsWorst partTold what appeared to be manager and he could care less And to add insult to injuryParty of 4 and they charge a service charge of 20%No wonder service sucks!Every table around us was having issuesStay away for breakfast!!!,1,0,0,Em V.,"San Diego, CA",0,15,1
5.0,3/24/2019,I have only been here for brunch but it is always amazing. I have tried other restaurants in the area and nothing compares. Everything on the menu is great and the dessert cart is always so unique and festive. Great service always.,0,0,0,Alex M.,"New York, NY",271,28,12
2.0,3/23/2019,"Unfortunately my experience here was underwhelming. My husband and I have dined at many Michelin Star restaurants and I'm perplexed at how this place was able to obtain one. Maybe it was an off night but the service was terrible and the kitchen was slow. It took over 15 minutes for someone to even notice us and serve us bread. Then by the time was got our entree it was at least 1015pm (we arrived at 830). The food is very well executed, but everything else fell short. The attention to detail in terms of service is just not here. Normally I wouldn't complain, but when you're spending over $400 for dinner, I expect a certain level of detail and service.",0,0,0,Nicole V.,"Atlanta, GA",160,22,0
5.0,3/21/2019,"Cafe Boulud is probably one of the best restaurants in New York. It is the first restaurant I went to during my first visit to New York. I had dinner here with my boyfriend's family - they're regulars so they knew exactly what to order. The food was excellent - seasonal (winter) menu was great! Great to eat family-style (share everything because everything from the complimentary bread to the complimentary dessert is amazing). I ended up opting for the sea bass, which was so delicious. Very fancy but perfectly very chill at the same time! I highly recommend this place!!",0,0,0,Samantha A.,"San Francisco, CA",223,42,37
5.0,3/20/2019,"My wife and I have been to Café Boulud a few times over the past 6 months or so.  The food was always excellent as was the service.  For us it needs to be a bit of a treat because we do not normally want to pay $18+ for pancakes or $9+ for a latte at breakfast.  The CAFÉ BOULUD ""CROQUE MADAME"" was a delicious plate of food, though, I must say.  Recommend, especially if you have no problem affording higher-end Manhattan restaurants.",0,0,0,Gary S.,"Lake Zurich, IL",0,4,4
3.0,3/17/2019,"Pancakes were great, Croque Madame was ordinary and missing an egg (served Croque Monsignor even thought that was not on menu) service was uninspired.",0,0,0,Mark C.,"San Clemente, CA",122,4,0
5.0,3/7/2019,This is one of the must-go restaurants in NYC! Have been visiting this place since 2014 and it never fails me. The French cousines and great wine selections make it a wonderful place to talk and to enjoy. The service is for sure best grade level.Will visit soon!,0,0,0,Helen L.,"Las Vegas, NV",2,2,3
5.0,3/7/2019,"Spectacular lunch here. Service was top notch. From the chefs compliments to the beignets at the end the food was mouthwatering from start to finish. Surrounding by wall street bankers, doctors and foodies alike, the crowd reflects the quality of the food. I love how they offer light vs. heavy (filling) entree options depending on how hungry you are for lunch. The carrot cake dessert was absolutely incredible. Bravo to the pastry chef. Will be returning. Probably my favorite prix-fix lunch in nyc!",0,0,0,Parth D.,"New York, NY",0,17,22
2.0,3/6/2019,"I took a friend there recently for their birthday.The staff was cordial and attentive and the space itself was comfortable.My friend enjoyed the meal, the service and the experience.I had a excellent appetizer which I enjoyed.The steak I ordered was full of grizzle and half of which was uneatable. The waiter offered a salad as compensation which didn't entice me or interest me. I received a coffee and sorbet in lieu of what should have been a memorable $52 steak.PS The two stars is because of my friends experience there.",0,0,0,Kent F.,"Queens, Queens, NY",0,3,0
5.0,2/24/2019,"The star of the night went to the cod dish. Very delicate and perfectly balanced. Soft cod served on hash browns, crunchy on the skin and soft on the inside. The sauce was creamy and rich, perfectly complemented with the artichoke heart. Second place goes to the Sturgeon. Rich, creamy and flavorful. Total respect to the ingredients.The lamb dish was good on its own, without supplementary sauces. The chicken pate was nice. And the chocolate dessert was nice.Great service and atmosphere.",0,0,0,Jason E.,"New York, NY",55,65,279
5.0,2/11/2019,"We went for restaurant week and got the duck dish, the curry fish in banana leaf dish, the fish/shrimp kabab and crab tartare. We also got the apple tart for dessert. The main course was amazing!!! The waiters were also really nice and walked around serving 4 types of different bread. After dessert we were also served complimentary mandolines. We loved our experience there.",0,0,0,Katherine L.,"Manhattan, New York, NY",1,27,42
5.0,2/10/2019,"Thank you for the exemplary meal. Bread & Butter (complementary)Cheese Arancini (complementary)Cauliflower VeloutéBeef BourguignonGuava Cheesecake MousseMadeleine (complimentary)Restaurant Week, first Michelin Star Restaurant fine dining experience of 2019 The complementary arancini had great flavor.  The following velouté was exceptionally seasoned, I could eat/drink it all day.  The bœuf bourguignon was juicy and tender, wish the serving size was larger because it is that good.  The cheesecake mousse was a nice culmination to the meal followed by the madeleines. P.S. I will assume that was my server's name on the cheque so therefore it was an honor to have been served by the Mad Titan himself.",1,0,0,D W.,"Manhattan, NY",56,7,42
1.0,2/10/2019,"It's my mistake, come in the morning and expect the perfect breakfast. All was bad. Coffee, sause, dry potato, brioshe,  service. Ok, I want to be objective. The eggs cooked right, and croissant was good. But I don't understand the other things. It's just awfull. Also service is terrible. I didn't understand why I hear about reservation on the table near the window, but 10 minutes later the manager sit there people without reservation.I didn't understand why He asked me about first-served dishes, bur when it done, its wrong. And I didn't  thank you and goodbye from your hostess. Yes, and Service included. If you don't have a good service - doesn't matter. Thank you for most untalentedly spent money!",1,0,0,Evgenia Popova P.,"Pinedale, WY",0,29,52
5.0,2/8/2019,"A Wonderful Experience - While it would be easy to write a review complimenting the fantastic food that we enjoyed at Cafe Boulud, it is my pleasure to compliment the restaurant and its staff on its impeccable service, even when seating a family with young children. Our daughters were treated like princesses as we arrived and were recipients of all the nuances of a fine dining experience. Of course the meal was on par with the service and the reputation that drew us to the restaurant to begin with.",0,0,0,Joe D.,"Syosset, NY",69,5,7
4.0,2/8/2019,"Dining here is an experience. It's a journey of a culinary experience from Chef Aaron Bludorn's perspective. My friend and I got the pre-fixe dinner meal which we thought would prolly give us a chance to taste more food varieties than a la carte. The service was on point right from entering the main door to our booth. Food kept coming very quick one after another. I was pleasantly surprised with the quantity of every dish- the portions were great and very diff from one another. Started with three appetizers to share- had a bacon salad(my top pick) ,baked potatoes and a charcuterie board( my second pick). Then came the entree- I ordered the trout dish and it was beautiful presented with a sauce made with  avocado and more things.. it was so different and well cooked but very filling coz the portions were very good for such a fancy place. Along with the main entree were three side dishes to share( mac and cheese-so good!!!, beets with a cheese and cabbage with bacon).The main show stealer was the dessert phase. I call it a phase coz it had the main dessert ( chestnut bouche) with ice cream and freshly baked Madelines ( freshly baked is a whole diff story of tastefulness) . I was transported to a diff world when I had the dessert. It was the best part. I was so full by the end of this journey.The ambiance is very upscale.",1,0,1,Kristy B.,"New York, NY",219,244,413
5.0,2/7/2019,I tried Prix-Fixe 3 course menu. Had cauliflower soup as appetizer and beef for main course. Soup was great! It was hot and creamy with nice texture inside the soup! The main course was pretty but I prefer my husband's salmon. Chocolate dessert wasn't sweet which I like. Will go back next time when I am in town.,0,0,0,Irene G.,"Pompano Beach, FL",0,6,6
4.0,2/5/2019,"Came with my bf during the Restaurant Week. Very solid place for traditional French food, I gave four stars because i want to believe it would be nicer during regular times. For this one time experience, I might give a 3.5 stars if I can. First, food... It's a mixture of marvelous deliciousness and some less impressive dishes. I got the cauliflower velouté and the beef burguignon, both very delicious and well presented. My bf got the arugula salad and the scottish salmon. The arugula? Well it's arugula and I don't see any michelin level execution or creativity on this dish. My bf said I made better salmon, I didn't try it so I can't really comment... The dessert, we got the pineapple upside down and the guava, both are nice, but nothing out of the world as I had high expectations for their desserts. On the other hand, the complimentary madeline they give at the end is heaven... For the food's sake, we might give it another try at some point but there are just so many choices in the city so I don't see it happening soon. Service... mixed feelings again. First, the drinks we ordered never came amd we asked twice for a drink menu before that. So obviously Cafe Boulud disapproves day drinking... Secondly, while they forgot the drink menu then the drinks, there was TOO MUCH foot traffic in the restaurant. Not only the waitstaff but also managers who circles around the room. I, for one, really hate that. I believe a good manager can be discreet in a corner while observing your customers enjoying their food, rather than marching around the room. It's not like he's socializing with customers, because that I would understand. Overall, it's not a bad experience but I do sense the chaotics during RW.",0,0,0,Chloe L.,"Brooklyn, NY",0,69,0
5.0,2/3/2019,"The Brioche French Toast beyond being fun to say aloud turned a morning accidentally slamming my finger in my front door into a simply joyful one.So tender, light and moist on the inside with a perfect caramelized crisp thin crust on the outside. Though the side pourings rotate, on this happy occasion my French toast was accompanied by a citrus butter, traditional maple syrup and PASSION FRUIT WATER. The latter, well-deserving of all-caps for emphasis, made this dish for me. Not only because I have a deep passion for this fruit, but also because the equally potent and watery nature of it was so conducive to soaking and flavoring the inside of the toast. Delectable.The waiters were so sweet and gifted us a basket of madeleines at the end of our Sunday brunch. Thank you. :) Will return, with a smile--and with loved ones--to which when deciding on a dish I will propose a toast!",0,0,0,Maria A.,"New York, NY",24,128,28
5.0,2/3/2019,"This place definitely earned its star .Everything felt very upscale. I made reservations for 5:00PM and when I arrived, no one was there but then again, 5:00PM is slightly early for dinner. Shortly afterward, the place was very much packed. Food:Smoked Sturgeon ( fish, avocado, hearts of palm, caviar)Yogurt Roasted Cauliflower (coconut, cashew, tomato masala sauce)Crescent Farm Duck (duck, sweet potato, black barley)And the special, Branzino with truffleDessert:Vacherin (ice cream, vanilla sorbet, chantilly finger lime)Complimentary beignets and macaroons.Also, I had three rounds of wine tasting. Let's just say everything was great. The presentation of everything was superb. The fish was cooked to perfection. The duck especially was unforgettable. The cauliflower was great, but it was too hearty. I feel like they give very generous portion sizes. The service was incredible because the staff was very knowledgeable and helpful. I would definitely recommend this place to anyone.",2,1,2,Cherry J.,"New York, NY",359,34,91
3.0,2/1/2019,"I had the  Watercress soup and mushroom risotto. If you're looking for a culinary experience do not order the soup or risotto. The soup was good but not amazing. The star of the soup were the oysters. The risotto can best be described as ""just food"".  It was unremarkable. The majority of the clientele we're middle-aged white Americans so the lack of bold flavor profiles may be appreciated.  It would also be appropriate for a business dinner on an expense account.",0,0,0,jeremy c.,"Manhattan, NY",289,7,1
1.0,1/30/2019,"I am very dissatisfied wit my breakfast this morning.    It took my father and I over an hour to get our breakfast, and then had to wait for our sides 10 minutes later. There was more than enough staff in the restaurant, and I can honestly say that 1 out of 8 of the waiters actually did anything useful. Our bacon was burnt to a tar making it almost inedible.For a ""five-star"" restaurant, they need to do better.",0,0,0,Amanda H.,"Fairfield, CT",0,1,1
5.0,1/25/2019,"Its it wrong to say that I could have a bromance with Daniel Boulud?The guy just gets me. He could only open expensive places like Daniel and keep me away but he opens DBGBs, Épicerie Boulud and DB Bistro. I was here for a restaurant week visit in NYC, let the dopes go get $24.07 hamburgers. When I saw Cafe Boulud listed, my first thought was why? My second thought was sounding more like Pepé Le Pew, Let me take you in my arms my love and show me your Pate.Speaking of which, I am a fan of charcuterie and pate which Chef Boulud excels in. Its offered as a selection on their summer restaurant week menu.I also ordered the Harissa Marinated Flounder. THIS is how fish should properly be cooked. Simply outstanding.Un oh, My Pepé Le Pew is coming out..You are ze corned beef to me, and I am ze cabbage to you...Dessert. Now It doesn't matter where it comes from, Dessert is the food language of love. How does this sound? Dark Chocolate Mousse with Coffee Cremeux, Chocolate Sable and a dollop of Nouget Ice Cream?Pepé?Vive L'amour my sweet..Now some people may be intimidated ranging from asking about French wines, asking what Pan Roasted Poussin is, to the dining room, etc.. my advice? Never let anyone make you feel uncomfortable. I'll grab the friggin guy by the neck if I have a question about the menu. Its my money and I want to enjoy how its being spent. (even though its $24 bucks) And the wait staff? Very, very professional. They were all over me, cleaning crumbs, food came out perfect and quickly. I asked about the food and got a great response. Professional and this is why I heart this place. 10 Yelp stars.Just a PS - Is it me or does Daniel Boulud look like Mayor Carmine DePasto from Animal House?",10,13,13,Bill S.,"Long Island, NY",601,2493,5315
5.0,1/25/2019,"Came here on a reservation with a qt friend for restaurant week. They serve an al a carte 2.5 course mix and match ""no rules"" consisting of appetizer, main, and dessert. The dishes are organized into classic French, seasonal, vegetarian and Indian. For alcoholics, there is a comprehensive wine menu and cocktails, which are provided by the bar adjacent to Cafe Boulud. The service is fantastic, Michelin tier for sure. The venue is upscale French, you know, white table cloths, formal dining arrangements, booths etc.Ordered:Crab salad - appetizer, apple crab and uni mix. A fresh starter but I liked the next one better Escargot gnocchi - appetizer, earthy gnocchi with deep fried snails, truffle, nice crispy and soft texturesLobster risotto - my favorite, big pieces of soft rich gnocchi with generous portions of lobsterChicken puff pastry - a very large main with a variety of chicken cuts, garnished with shallots and roots, surrounded by a ring of puff pastry and finished with red wine jus. Very rich!",0,0,0,Sean W.,"New York, NY",3,352,521
5.0,1/16/2019,"Sublime. That's the word that comes to mind after my Saturday meal here. I have a yearly outing to the opera and every year I choose a restaurant on wish list to visit. Cafe Boulud was the fortunate one this go around; or I should say I was the fortunate one. I felt so welcomed when I entered the space-- it almost looks like a side entrance if you're not looking for it, but when you do you're greeted with the biggest smiles. I have to say that every single one of the staff made it a point to smile or greet me and that speaks volumes. Aesthetics: Right up my alley. The art isn't overdone. There was a piece on the wall that reminded of a piece done by Paul Newman and that made me love the space even more. There were floral arrangements that one of my dates wanted to order herself or take home right then and there. So another hit there. Service: I was attended by Thanos (he's from Greece) and Rafael. Rafael handled my libations (I had the Big Bang) and Thanos was our main waiter. Both were incredibly knowledgeable about their offerings and answered every one of my questions, including their personal recommendations. Also, there was one other person, I don't want to give him another name since it's currently escaping me, but he was amazing with presenting us with complimentary baked cheese truffles and bread and really all the deliciously sinful carbs. Food/Drink: I had the shrimp and swordfish kabab with a green mango chutney and chili-ginger sauce for my primero. That swordfish? I literally paced myself so as not to finish the whole dish in seconds.  Beautifully prepared and presented. My secondi was a banana leaf wrapped red snapper served with pumpkin curry and peanut chutney. I'm done with typing quite frankly but there's more. Dessert was a pomegranite coupe-- small vanilla caked placed in a small glass with a lime foam/mousse, topped with a pomegranate littered wafer meant to be broken into the glass. Drinks will be described in pictures.Friends: Lamb Roganjosh, Yogurt Cauliflower, Striped Bass and Sunchoked Rissoto. The lamb originally came out rare, but Dafne had forgotten to mention she wanted it medium-well and when I mentioned it to Thanos, they were so quick to accommodate us.I could go on, but I think I may have inundated you. What a way to to start my evening. I will most certainly be back. As always, happy eating and drinking. MarieMG",0,0,0,Marie-Madeleine G.,"Brooklyn, NY",41,85,201
5.0,1/12/2019,"This was an amazing dining experience, from the waitstaff to the food everything was excellent.  The vegetarian options were just as delicious as the other options.  I can't wait to go back. I had the lobster gnocchi and it was fabulous.",0,0,0,XaJea L.,"New Rochelle, NY",38,15,3
