rating,time_created,text,useful,funny,cool,username,user_loc,user_friends,user_reviews,user_photos
3.0,1/13/2016,"Oof. I don't really know what the hype here was. For bang for your buck at an Altamarea restaurant, Osteria Morini is still better.Had dinner with my parents while they were visiting New York. Stars for service, which was attentive and speedy. Cocktails were straightforward enough, and at $15, Manhattan-ly overpriced but not as totally egregious as they could've made them. Which is kind of damning them with faint praise, I suppose.Stars for food, not as much; the polipo/octopus appetizer was lovely, though the flavors were pretty simple, but my father's eggplant parmigiana entree, the single vegetarian option for someone who didn't want to eat pasta (the menu on this Yelp profile, by the way, is obsolete), was a wash-- the eggplant was undercooked but the breading was soggy and clumping. The swiss chard under my arctic char was gritty, as if it hadn't been washed properly-- felt like I was chewing sand at one point-- but the fish itself was cooked well, as was my mother's branzino. Complimentary amuse bouche of some sort of truffle cream on slightly stale crisps of some kind was nice, but not impressive; complimentary chocolate hazelnut almond dessert, possibly a panforte, was quite good and a pleasant surprise. I give it a /mehhhhhh/. I wouldn't come back here for the food, but it wasn't an unpleasant experience, at least.",1,0,0,Ali T.,"Manhattan, NY",3,30,0
4.0,1/1/2016,"Ate here for NYE and it was great. Really appreciated that the menu was their regular menu and not some prefixe thing. We had the calamari, burratta, roasted artichokes, lemon spaghetti, meatballs, roasted chicken and gnocchi. Every single thing was clean and fresh and delicious. We will be back.",0,1,0,Trenten S.,"Brooklyn, NY",1,14,0
5.0,12/19/2015,"This place is awesome! My husband and I went on a Sunday when they had their pre-fixe and you share everything at the table. Right from the beginning you could tell this was going to be a good place...their bread is sooo delicious!!! It's focaccia I believe? So good though. For appetizers, it came with burrata, fritto misto and a salad. We also ordered the foie gras as an additional app. Everything was so delicious. I don't even like foie gras or burrata, but i happily ate them all. The fritto misto was possibly the best fried calamari I've ever had.For entrees it was the mixed grill and a ravioli with truffle oil. The pasta was so good, I can't really remember the meats very well. Not to say the meats weren't also good. My husband devoured them (included steak, lamb and chicken) and I ate a lot of them too, but that ravioli was to die for.For dessert we got a couple extra including the torta di cioccolata and the cinnamon donuts. Even though I was so stuffed I couldn't move, the desserts were gone in seconds. Everything here is fantastic including the service. One thing that surprised me atmosphere wise is there were a lot of families. We saw one with 2 small children, but a lot of them seemed to be teenagers and their parents.",1,0,0,Siri C.,"Frisco, TX",53,225,0
1.0,12/16/2015,"This restaurant is very very slow if you order food from postmate. It can take up to one and half hours to be ready. When I call to ask if the food is ready yet after an hour, the person said he is going to check but he hung up instead. They didn't apologize for the long wait at all.  All three orders takes more than an hour to get ready.",0,0,0,Ye R.,"Jamaica, NY",68,1,0
4.0,12/5/2015,Would have been five stars but the bathroom M is inadequate and the extreme prices of the wine by bottle and the glass warrants one less star.Greeting- yes by five young ladiesVibe- high class modern coolBathroom M - Fail only one toilet and no dividers between urinals.?Parking- street or garageService- professionalPrice- $75 four course menu is a deal. Otherwise very expensiveWine list- rape! Wine by glass- rape!! FoodTable bread/ light and airy focacciaFried calamari and shrimp tasted fresh as can beChicken meatballs are boringPastas are top notch. Black tortellini and gamelli are outstanding-rib veal chop is excellentDessertsDonuts are light and airyRum raisin semifreddo is goodWIGB? Yes $75 deal is a steal for some of the best food in the city. Just drink water,4,2,5,Hungry K.,"Boca Raton, FL",3083,814,7761
5.0,11/21/2015,Great service and great food. Went there for my birthday with some friends and we had a great time. The pastas were amazing. Will def be back,0,0,0,Mashi M.,"New York, NY",1,33,25
5.0,11/18/2015,"Great cocktails, great service.  Worth the wait.    Started with a banana daiquiri, pretty good but only a slight hint of banana.  I had the grilled branzino paired with a white wine.  This is a nice light dish to eat while you drink.  There are so many restaurants in nyc but I'd come back to this one.",1,0,1,Josh J.,"Austin, TX",95,88,54
5.0,11/1/2015,"A Girl's Night Out selection from a fellow foodie.....can we say awesomely amazing choice. So we started at the bar where the staff is pleasant and attentive......okay let me drive home that the entire staff down to the manager Alexandria is attentive....youthful and professional. They are just down right impressive with great recommendations on libations, as well as knowing the entire menu sight unseen. Drinks were amazing from royale blushes, highland smokes to FIORI DI SAMBUCO and they're kinda enuff to bring one's drinks from the bar to your table......Fanci!!!!! they be.I must say that the overall experience was grand and I plan to go back with #moiBeastie for a date night. Did I say the staff amazingly attentive polite and professional and on point.....tables cleaned immediately but without intrusion and rushed awkwardness, and there was endless visits from the manager Alexandria Kennedy to make sure all was well and to offer great recommendations.I like this place.",0,0,0,S S.,"Bronx, NY",127,239,1804
5.0,10/21/2015,This is a wonderful restaurant the scallops are perfectly delicious!,0,0,0,James S.,"Manhattan, NY",20,7,0
5.0,10/20/2015,"So I'm not sure why this place only has 4 star reviews but I went tonight with one of my old college buddies and we had a blast.  The bartenders were super friendly and the drinks were delicious.  We ordere the shishito peppers (every other pepper was spicy, just a heads up!) the calamari which was crunch fresh and delicious which came with an amazing spicy mayo dipping sauce.  For dinner we had the fusilli pasta which was fresh, homemade, and also delicious!  I destroyed the whole thing and since we were there on a Tuesday it was only $10 pasta which's normally 20+ each per pasta entree.Highly recommend and another place I will be back in NYC.",1,0,0,Miles V.,"Miami, FL",166,143,291
5.0,9/29/2015,"Great ambiance, excellent food, friendly staff. I had the orecchiette pasta. Each shell was infused with flavor from what seemed to be a type of pesto. They also have a list of cheeses for those who like to sample cheese. Smiles were all around from the time we arrived to when we left. Ristorante Morini is an excellent choice for authentic Italian food.",0,0,0,Rennie R.,"South Richmond Hill, NY",52,25,26
2.0,9/26/2015,Fish is at best fair. Tiny portions for the price and fish did not even taste fresh. It is a nice restaurant with decent service but the price doesn't match the food. You can get better fish around the neighborhood for the same $40.,0,0,0,Susan B.,"Manhattan, NY",0,16,0
2.0,9/24/2015,"If you're here because you're hungry, try somewhere else.These portion sizes do not match the prices.  I feel like I just opened a Mcdonald's kids meal.",1,0,0,Archie A.,"New York, NY",3,20,1
5.0,9/17/2015,"Another one of my Go To's especially if you're in the mood for the best pasta of your life!  Every time I go, I like the place more and more.  The manager David, is a true hospitality professional and really makes us feel important which makes the whole experience even better. I have come here w large groups and other times with just my fiancée. They have a great deal Monday-Weds after 8:30pm; $10 pasta dishes. Prob the only good deal in NYC! Try this place out if you want amazing Italian and you will be happy.",0,0,0,Rob Z.,"Manhattan, NY",103,72,11
5.0,9/17/2015,"Loved their Hanger Steak and Rigatoni! It's a bit pricey (our bill was around $90; that's just me and my friend), but it was a good meal nonetheless. The dessert selections were lovely; loved the chocolate mousse with ice cream (forgot what it's called). :)",0,0,0,Fam A.,"Stanford, CA",355,10,9
5.0,9/12/2015,"2 friends and I were exploring the MET, and seeing all the Italian artifacts, suddenly wanted some Italian food. We chose this restaurant because the accessibility, which was within walking distance.We walked in, and the interior was beautifully furnished in a trendy, modern way. As it was a beautiful summer day, we chose outdoor seating. I choose the 4 course pre-fix meal. The menu was a traditional Italian menu, with a meat and pasta course, as well as the appetizer and desert. Before the courses, complementary bread with olive oil and vinegar was served. I thoroughly enjoyed all four of my courses. The appetizer, was one of my favorites- the lobster was juicy and fresh. The desert, a small cake with a thin piece of toffee was also excellent- sweet and flavorful.The service for the price was exceptional. The waiter provided a new set of utensils for all 4 courses, and refilled my drink very frequently. He described the food in detail, and elaborated on each ingredient. Additionally, the waiter was polite and respectful. I would highly recommend this restaurant for anyone seeking a trendy modern Italian restaurant with exceptional service and great food.",0,0,0,Evan C.,"Clarksville, MD",3,15,0
5.0,8/28/2015,"Excellent meal on Mondays Pasta night.  Kat, Guillermo, Aaron, John and Will were true examples of great customer service.  Felt right at home and the food was delicious.  I had the blackened tortellini stuffed with lobster and the pasta with the pork shoulder both excellent.",0,0,0,Christina W.,"Manhattan, NY",0,22,28
4.0,8/23/2015,"Food quite good.  Enjoyed lobster special, tuna appetizer.  Pretty room.  Be sure to sit upstairs.  Nice wines, mostly on the higher end.  Great service.",0,0,0,Josh F.,"San Francisco, CA",1,8,1
4.0,8/10/2015,"This restaurant is big, spacious, and nicely decorated. I really enjoyed the ambience. To start, they gave us two tiny potato balls which were super cute and tasty as well as bread.POLIPO (octopus appetizer): This dish was full of flavor and so tender! It was so good expect for the fact that it took two bites to eat it all. RISOTTO AL PESCATORE (seafood risotto): I really liked the flavors in this dish. The lemon adds a very nice touch to it. The risotto was cooked perfectly and wasn't dry. The only thing was that there was hardly any seafood. I expected more seafood relative to the price.TORTELLI (lobster ravioli): This dish blew me away. I've never had lobster ravioli that I've actually enjoyed. The pasta was al dente and the filling tasted amazing! So good. It came with a tomato sauce. It had the same seafood as the risotto did (I think it's it's similar to squid/cuttlefish).",6,0,5,Jessie Y.,"New York, NY",242,213,218
5.0,8/10/2015,"Love the food, service and decoration here. We went there for a restaurant week lunch deal and everything was just perfect. The app I did the mare which is a generous portion of seafood. Main was a grill banzino, it's cooked perfectly. I must come back here.",0,0,0,Sea P.,"Manhattan, NY",3,27,23
5.0,8/2/2015,Excellent food and service Walked in with the wife and the dwarfs (my babies) no reservations and needed La Mangia!!! Excellent food wonderful service lovely ambiance. Will be dining here again.,0,1,0,Abraham A.,"Dallas, TX",1,37,28
5.0,7/26/2015,This place is consistently good and the service is great. It's pricey but worth it. And the interior is beautiful.,0,0,0,Patrick R.,"New York, NY",0,3,0
5.0,7/26/2015,"Another MW geniosity. Long trip uptown for me lol. Worth the $24 cab. F* it. I'm on my way to procuring another presumptuous outlay of premier pasta creations. We intentionally double dated here with some friends who have similar preferential palates. We knew we could order every pasta on the menu and split all 10 dishes with the other couple. Call it gluttonous. Call it overkill. I call you crazy. We went on a Tuesday night ;) and we crussshed. I will be honest, one of the best pasta meals you can find. Best in class. I couldn't move after. You're welcome.",0,0,0,Eric T.,"Manhattan, NY",173,18,3
5.0,7/19/2015,"Waitstaff was very friend and professional. Handed me is, folded napkins etching. Eggs Benedict was  wonderful as was steak and eggs.",0,0,1,Caitlin S.,"Flower Mound, TX",7,22,17
5.0,7/17/2015,"INCREDIBLE. ABSOLUTELY INCREDIBLE. Went for lunch, loved it. But don't get the salted caramel gelato.",1,0,0,Angela C.,"Scarsdale, NY",409,10,1
5.0,6/25/2015,Had dinner tonight.  Fantastic food.  The burata appetizer and the Bronzino and pasta with morels and asparagus.  Excellent all around.  Would highly recommend this to anyone.,1,0,0,Ray G.,"Memphis, TN",0,9,0
4.0,6/20/2015,"As the fourth stop on my tour of all restaurants by Michael White, I came here for dinner on a Friday night and had no problem getting a last minute reservation. We were seated downstairs in the front which we weren't thrilled about and probably should have asked to be moved upstairs where it is presumably more intimate. We decided to go with the price fixe and cocktails and left feeling satisfied and very full (we even brought home leftovers)The divine revenge cocktail was very good and refreshing. I also enjoyed the Madison Avenue. Both were slightly sweet and fruity. Now the food: we both loved the soft shell crab and tuna tonno appetizer. These were the highlight of the meal for us. My boyfriend got the tortelli and thought it was slightly overcooked but otherwise loved the dish. I got the carbonara which was very good but maybe missing a little extra oomph of flavor.  The lamb and steak were both very good and cooked to our liking (medium rare and rare, respectively)  for dessert I really enjoyed the vanilla donuts. You can't beat the price for this amount and quality of food. Definitely worth checking out and I will probably be a repeat customer.",2,0,0,Molly Z.,"New York, NY",7,87,0
4.0,6/6/2015,"Wonderful upscale Italian.  I'm still looking for the 'downtown' vibe in my local 'hood, and while this doesn't match it, it is nice to see it doesn't completely clear out around 10 pm.  Service is knowledgeable and friendly and the pastas are delicious.  Continuously order the burrata - love it here.  Very good wine list.  Not an inexpensive night out, but when looking to stay local, this place is a winner.",1,0,0,Stacey F.,"Tampa, FL",13,129,5
5.0,5/26/2015,"I've been there twice.  No complaints whatsoever.  Beautiful location, great food, great wine.  One thing I will note is the snobbishness of the other patrons in the restaurant.  I don't know what's up their you-know-what.  But the staff has been great.  I will definitely be returning for a third trip.  It's def not a cheap place to grab a meal, but I've been happy with everything.",0,0,0,Richard H.,"Bronxville, NY",1,15,0
5.0,5/25/2015,"This place is expensive...no lie. This place is worth every penny..no lie.  If you want to experience amazing Italian cuisine with creative succulent dishes..go.  The service was a bit spotty, but the food made it all worth the experience.",0,0,0,Ray C.,"Newport Beach, CA",30,11,0
1.0,5/18/2015,"Ristorante Morini is the worst restaurant in the world. The people who work there are rude and arrogant as hell, especially the host with glasses and the bartender have attitude. Hey, there are tons of upscale restaurants which are way better than you guys, how could you have such an attitude like that? so funny.  No wonder you are on GILT. ...One Sunday, me and my friends went there for Brunch. The restaurant was almost empty . I asked for a table, then the host said, they were fully ""committed"" then just starring at me.... I said I can wait or something then she said "" you can sit at the bar."" We sat, the bartender never looked at us, said hi to us, or nothing. HE WAS NOT BUSY , and we were right in front of him. We waited and gave him sometime, but he never even .... cared as if we did not exist . I just could not believe....  When we came out with terribly astonished faces, the manager looking guy would look at us with no expression on his face.... We eventually walked away.  I guess the restaurant is for people who are miserable..... I feel bad for you living life in that way. and I am not thankful that you ruined our beautiful Sunday . What an awful experience ?!  VERY negative energy is surrounded by them.",5,2,0,Gina S.,"New York, NY",96,6,2
5.0,5/13/2015,"I don't understand the relatively low rankings for this restaurant.  It is Michael White and the quality is as stellar as what you would find at Ai Fiori, Marea, or any of his other high-end establishments.  Great cocktail and wine list, wonderful italian food, and excellent service.  What more could you ask for?Here's what we tried, and everything was awesome:- Burrata (with farro, fava beans, preserved lemon, peas, mint)- Foie Gras and Duck Confit terrine with fig marmellata, Sicilian pistachio, and toasted brioche- Fritto Misto (crispy calamari and shrimp, zucchini, lemon aioli)- Lobster Tortelli (Maine lobster ravioli, seppia, crustacean brodetto)- Grilled sea bass with cranberry beans swiss chard, bagna cauda- Tiramisu (This was a very unique presentation of tiramisu I'd not seen before)- Coppa (toasted meringue, strawberry, basil, vanilla gelato, strawberry sobert)I would definitely go back.  And this place clearly deserves a Michelin star.",3,0,0,Chad T.,"Manhattan, NY",52,776,127
5.0,4/15/2015,"Food is excellent.  Portions are appropriate and they even offer half portions of pasta!  Service was just as on point-attentive, polite & polished.  Thank you Michael White for bringing yet another great restaurant to a neighborhood that was lacking.  I don't know what the other reviewers can complain about... Especially the person who complained after purchasing & using a COUPON",1,0,0,Christina C.,"Manhattan, NY",0,5,0
4.0,4/13/2015,Among the seven of us there was not a single complaint.  This beautifully appointed restaurant with excellent service is certainly a find in on the Upper East Side.  Everything was well prepared and tasty.  I can't imagine one going wrong with this crowd pleaser.  Excellent for business gatherings or for small private dinners.,0,0,1,Tony R.,"Manhattan, NY",11,219,1
4.0,4/11/2015,"Not a bad choice for quality Italian food. Pasta was delicious, cotoletta alla milanese was nice and the choice of wines was pretty impressive. Service was attentive but not as polished as you would except from a restaurant with such a high level of prices. And yeah, restaurant Morini is by no means a cheap choice.Proximity to the museum mile of NYC makes it a nice post-museum option. During my visit, I was sitting on the first floor, but went up to check out the second floor while looking for bathroom. In my opinion the ambiance on the second floor is nicer, so if you make a reservation I'd indicate desire to be on the second floor. First floor feels a little bit like a trendy bar.",2,1,1,Igor A.,"Ossining, NY",3,40,5
1.0,4/11/2015,"Disappointment.This place is gorgeous and that unfortunately is the only positive thing I can say. The entire wait and bar staff with  the exception of woman greeter, were total novices and generally inattentive despite a man in a suit who seemed to be checking on things but not improving anything.We waited too long for everything; drinks, bread, entrees, glass of wine, EVERYTHING.And the food was not great, it was barely good and I soo wanted to enjoy this place as I do Marea.The food was rich, not memorable.We came with Gilt coupon and felt ripped off despite discount.Usually you get what you pay for, in this case we came up short.",0,0,0,garry p.,"Manhattan, NY",35,4,0
2.0,4/7/2015,"I was there tonight and just read most of the reviews.   The one from April 7 is most accurate, sadly, but there is some truth to others.Food - Good, but portions are insultingly small given the enormous prices.   I am not sure how one reviewer called the Prix Fixe menu a bargain....$75 plus surcharges?!?Service - Efficient, but robotic.   Zero (maybe less) personalityAmbiance - Casually elegant, noise level moderate to quietThere are SO many great restaurants in NYC, you don't need to overpay at this one.",0,0,0,Donald C.,"Scarsdale, NY",0,28,0
1.0,4/7/2015,"Terrible meal! Very disappointed. Had two pasta entrees that were the WORST. Overpriced for the quality. Spaghetti white clam was exactly a plate of dry spaghetti with some chewy clams, NO SAUCE, no flavor. Husband had the orecchiette and said it was just ""okay"". Dining room was not full but they seated people right on top of each other so they could admire the space and privacy at the empty tables. Sommelier needs a lesson on wine pricing and suggestions as after drinking a reasonably priced wine, brings us one of the most expensive by the glass, poor move. The bill was over $300 and we felt that we wasted a lot of money on a really unimpressive dining experience.",0,0,0,June V.,"Manhattan, NY",0,18,0
4.0,3/30/2015,"Went without a reservation on Saturday night and sat at the bar downstairs. We drank Belgian beer, and shared an appetizer of calamari over kale which, while not inspired, was tasty. Moved on to some delicious black pasta stuffed with lobster and Bronzino with beans. Divine lemon tart with meringue and pistachio gelato for dessert. Really, none of the food combinations were inspired, but everything was very tasty, portions were quite small (for the very thin upper east side crowd.) We were not rushed or crowded at all, which is unusual for bar service. We watched the bartenders make many many frothy pink drinks, which must be a specialty here. Conveniently close to the Metropolitan Museum. As we were leaving, a party of six, all with gray hair, checked their coats and a young woman ushered them upstairs into the main dining room by saying, ""ok you guys, follow me""",0,0,0,Jennifer D.,"Glen Cove, NY",105,65,39
5.0,3/29/2015,"Loved loved loved this place.  Been open about a year and is a sister restaurant to the highly acclaimed Marea.  We had a delightful meal there - chicken meatballs to die for, misto salad, carpaccio, and fava, quinoa spring salad all fabulous starters. Fresh, flavorful, right portions for the price - delicious.   We ordered several pastas- the carbonara is traditional and fabulous - no cream or onion or any of that nonsense. Just fresh made pasta, eggs, pecorino, and parma.  Wow.  One of us had their bolognese tagliatelle - also delicious.  We tried several desserts between us - and those too were delicious - one was the beignet/donuts and other gelatos which were to die for too.  Our servers were amazing. The sommelier helped us pick out a perfect wine given we are not familiar with Italian wines which predominantly make up the wine list.  They are down to earth, friendly and the food was fabulous. I can't wait to go back.  I loved the atmosphere too - this place is a real find and I'd recommend it time and time over.",0,0,0,A C S.,"Burlingame, CA",2,84,0
2.0,3/14/2015,Beautiful and serene dining room Great bartenders. However the  service and food was not up to reputation of chef.  My fish came out  cold with broth that was not even lukewarm. Two diners had short ribs which were stringy and dry.  The waitstaff did not offer fresh pepper and we finally had to request a wine list as it was never offered.  One of our table mates  drinks were removed before she finished it and my wine glass as well. The check arrived  before we requested it. This was  a shame as. It was expected to be a totally great dining experience at the price point charged and came up short of expectations,5,0,1,Ellie C.,"New York, NY",59,57,1
5.0,2/27/2015,"A refined menu à la carte selections and a caviar menu is great, request a trio (amberjack with sturgeon caviar, sliced Nantucket scallops, and big eye tuna with blood orange and fennel) try the appetizer of olive oil-poached red shrimp in a briny zabaglione. House-made pasta is de rigueur. I suggest the pillowy norcia, a dish of potato gnocchi, anchovy butter and black truffles. Lightly crusted duck breast set on a pool of huckleberry and lentils, or branzino grilled to a slightly salty turn with Ligurian olives are two standout main courses. International wine list available by the glass.",0,0,0,Adam C.,"Manhattan, NY",0,31,0
