rating,time_created,text,useful,funny,cool,username,user_loc,user_friends,user_reviews,user_photos
3.0,4/12/2015,"Very pretentious! Dress nicely and bring money! You don't need a lot unless you drink a lot, but bring money. Make a reservation and be prepared to wait. I took my lovely great white buffalo/snow angel here for a nice Saturday evening dinner. We made our reservations well in advanced but still  waited. When we arrived the hostess told us to hang out at the bar until our table was ready. So, why not? We ended up having several drinks racking up a bill bigger than our own dinner. Granted we waited for over an hour! Over an hour wait even with reservations! When we were finally seated, the waiters were very quick to take our drinks and order. They provided bread with the best fish/butter spread ever. I ordered the 20oz bone in New York strip while the lady ordered a 2 pound lobster. The wait was extensive and very taxing. We ended up getting so wasted we bearly touched our actual meals. I felt kind of bad as we almost passed out on our own dining table. From what I remember, the food itself was fantastic. Steak was so juicy and well prepared. Comes out sizzling and somewhat precut for you!! For a moment I though I was going to be spoon fed. Lobster was also juicy and well made. Creme brûlée for desert, not a bad way to top it off. I really would love to give this restaurant a full 5 stars!! Their food quality really does deserve a full 5! Problem is the wait to get a table was extensive and waiting for the food was longer than a French restaurant. Takes a lot away. We could have probably gotten full off alcohol. Sorry no food pictures, got completely white girl wasted and forgot...",6,13,1,Luc V.,"Houston, TX",124,232,675
5.0,4/9/2015,"Dining at the Sea Fire Grill was superb. Nearly everything was phenomenal, especially the blackened Montauk swordfish and the special kale salad appetizer (had both trout and some fruity flavors -- a bold choice that paid off). Only thing that could have used improvement was the brussel sprouts side; a bit overcooked for my liking. Also, our waiter (Jaime R.) was attentive and pleasant.",0,0,1,Eric B.,"New York, NY",1,8,0
4.0,4/8/2015,The food was great but for the price it was not stellar. It is great to visit if work is treating or you can afford it but otherwise you can get cheaper seafood for a considerably lower price elsewhere.,0,0,0,Mark K.,"New York, NY",0,49,3
5.0,4/6/2015,Great meal and service for our large group of 10. Really liked all the food. Oysters Rockefeller and the scallops were highlights.Service was very attentive and I felt like the waiter and staff were genuinely happy to serve us.Not cheap but I thought the price was reasonable for the quality and service.,1,1,1,Todd D.,"Santa Clara, CA",7,40,6
4.0,4/5/2015,"Went here for Valentine's Day and enjoyed their set menu for the evening. Its a fine dining experience. The menu wasn't creative but a traditional dependable menu with the regulars for entrees, sides, and starters. The crowd was a bit odd. It seemed like a lot of people who don't often go out to upscale restaurants, but made the visit for Valentine's Day. The set menu was affordable given the options and compared to the other Valentine's Day set menus of other restaurants in the city. It's not a trendy spot that I'm more accustomed to lately with the newer restaurants popping up everywhere but more of the odd school fine dining experience, which is sometimes all you need as long as the food lives up. The wine list was also extensive although I didn't enjoy the bottle of Sancerre we ordered as much I usually like sancerres.",0,1,0,Lindsay W.,"Boston, MA",68,374,87
5.0,4/5/2015,"I would recommend this place to anyone and everyone!!! The decor, the service and most importantly the food is simply incredible!!!",0,0,0,Tatty B.,"Brooklyn, NY",25,4,8
4.0,4/4/2015,excellent service and seafood.  It was a little pricey but worth it.  their happy hour is awesome and i highly recommend it.,0,0,0,Sal M.,"Secaucus, NJ",1,38,34
4.0,4/2/2015,"Clean cut and sophisticated decor and food that delivers!  The ribeye was one of the best Ive had, cooked medium rare yet perfectly crispy almost on the outside and so juicy.",0,0,0,Diana G.,"Brooklyn, NY",130,151,93
4.0,3/31/2015,"Great Food. Beautiful Dining Room. Just a bit pricey, but worth it!",0,0,0,Billy M.,"New York, NY",81,41,87
4.0,3/31/2015,"Not So Mad, Madmen Week's Lunch!Having tried this restaurant for the first time for their Madmen Week pre-fix lunch deal, we were pleasantly surprised. Thought the pre-fix menu was relatively limited,  the items ordered were expected to perfection. The bread basket which was accompanied by a unique seafood cream spread was a good start followed by simple but hearty salads and soups with an entrée of salmon expertly executed.Good business lunch venue with even greater date night dinner potential. The great service received was simply the icing atop a genuinely positive experience for the midtown east area!",0,0,0,Salka H.,"Brooklyn, NY",209,14,59
5.0,3/28/2015,"The bar was great with a fantastic Bordeaux and good sparkling champagne drink.  The dinner was perfect with my family arguing over the swordfish and the red snapper, over which was the best.  The lamb was cooked perfectly and the crab cakes where good with both sauses the brought.  I saw the calimari recommended by others, and it was a perfect light appetizer. The best side between potatos, kale, and brussel sprouts was the sprouts!  My 16 year old ate all of them after I got one bite.   To top it off Milton our waiter was pleasant and patient with my teenagers.  He made great recommendations after listening to us and was attentive to us with the restaurant very busy.  Milton is an asset to the fine dining experience.  We also dressed in business casual and we were very comfortable in the great environment.",1,0,0,Mark P.,"Greer, SC",0,8,1
4.0,3/24/2015,"Pretty decent food, moderately priced, and ambience wasn't too bad. I would come back again on vacation. The seafood was good however the dry aged steak was mediocre.",0,0,0,lynn c.,"Fremont, CA",36,29,26
5.0,3/22/2015,This was my second visit to Seafire grill in New York . It was a night to remember starting with grilled prawns and the scallops.We shared a porter house which  was one of the best I ever had .don't skip the lobster mac and cheese .Our server Arben suggested a great wine for our meal. Really great experience,1,0,0,Jonathan T.,"Harrison, NY",0,1,2
4.0,3/16/2015,Ask for Aron the maitre Di.  Bar is great. Bourbon choices could be expanded. Lively. Fish choices are expansive and delicious. Preparations are top notch. 20 ounce bone in ribeye was cooked to perfection. Ask for the crab meat accompaniment.  Expensive but not over the top. Service tends to be slow and staff is difficult to understand at times.,0,0,0,Rex M.,"Columbus, OH",0,14,0
4.0,3/15/2015,I have great time . The food were good  specially the Mac and cheese lobster . Service was great . The place was nicely decorating. The music was perfectly fit with the restaurant atmosphere . Great place to celebrated your birthday or any special occasion .,0,0,0,Mireya H.,"Brooklyn, NY",0,3,0
4.0,3/15/2015,"For me the higher the price, the higher the threshold to earn a few stars on Yelp!There was much that was very good about the Sea Fire. The cocktails, wine and food were all prepared with talent - very tasty. My Manhattan was one of the best I've had. The wine list was extensive. We had a delicious calamari appetizer followed by excellent salads and plates of scallops and snapper. Our server was not worth the gratuity I left him. When my wife asked for recommendations, he talked down to her and was not all that helpful. Later in the meal, I couldn't find him more than once. The water attendant kept our glasses full and took care of getting more bread, etc. But our waiter dropped the ball, and I told that to the manager (Aron) as I left, who apologized and offered me a round of drinks to his credit. We didn't take him up on the offer since our daughters were ready to leave, but I always appreciate it when a manager seeks to do the right thing. Again, the food was superb and most everything else was very good. If not for the $350 price tag, I'd give the Sea Fire a 5 even with the substandard service. But if Aron hadn't nearly insisted on a consolation, the rating would be even less.",3,1,0,Jim M.,"Sarasota, FL",32,208,71
5.0,3/14/2015,"Though the food was excellent, the service was exemplary. Besfort attended to our every need without prompt and went above and beyond to ensure we had the best experience possible. I would highly recommend this restaurant to locals and visitors alike. Morgan and Ryan love you, Besfort.",0,0,0,Ryan N.,"Mobile, AL",220,3,0
3.0,3/14/2015,"I came here with my boss for a Friday lunch. We made reservations but it wasn't necessary. Crowd is a very old and professional crowd. Overall, food was solid but it didn't wow me. Moreover, customer service is slooooowwwwwwww. Once we were seated, our waiter didn't show up for maybe 5-10 minutes. This sucked because were STARVING. When he did show up, he didn't introduce himself and he seemed distracted. I felt that his service skills were overall lacking, which is a vast difference from the service I've experienced over at Benjamin's (owned by the same person). Anyway, he brought bread and a delicious garlicy butter spread until our food was ready. We ordered: a dozen east oystersscallops - only 2 pieces FYItuna entree (me) - was good but only 4 bite-sized pieces doesn't justify that price. Comes with bok choy. swordfish entree (boss) - tried a piece and it was delicious. cream of spinach - loved it. Made for a great dip for our fries.cabernet sauvignoncheesecake - YUMMM. Like another Yelper said, food was solid, service was lacking.",3,3,2,Darya S.,"Manhattan, NY",978,2060,1393
5.0,3/10/2015,I went to the sea fire grill for a special birthday dinner for my Hubby it was great we had a great time the food was amazing! for appetizers we ordered the calamari which was great and the lobster salad the best Salad we ever had and for dinner the New York strip steak was the best steak I ever had then we had some lobster mac and cheese with the Yukon Gold mashed potatoes everything was great the service was fantastic and the atmosphere was beautiful I would definitely go back and I recommend anyone to go for special evening!,1,0,0,Sabine S.,"Brooklyn, NY",6,3,2
4.0,3/6/2015,The food was great. I didn't like how close the 2 tops were to each other. It makes it hard to have a private conversation.,0,0,0,Derek H.,"Belmont, NC",22,6,0
5.0,3/5/2015,"The Sea Fire Grill makes dining in midtown east almost bearable. The dining room is elegant, the service is sharp, and the catch is fresh.  It comes at a price, but you get what you pay for: top-notch seafood.  My only regret is that we didn't order the lobster mac and cheese.The service at Sea Fire is borderline obsessive (in a good way). Our water glasses were topped off seemingly every 30 seconds and the bread basket that we shamelessly devoured was refilled without question. You may judge me now, but you, too, will devour the bread once you taste the insanely flavorful whitefish spread. I started with the Madagascar Garlic Prawns which were juicy, but not too oily, and followed it up with the Blackened Montauk Swordfish, a great one-two punch. It was cooked perfectly and accentuated nicely by the  avocado slice garnish. Mom also loved her #1 Yellowfin Tuna entree.Essentially, if you're in midtown and in the mood for seafood, The Sea Fire Grill is the place to go, particularly when dining on a corporate card.",3,0,1,Alex S.,"New York, NY",20,91,54
4.0,3/1/2015,"Pretty place with lots of space for NYC. Unfortunately, the food wasn't as luxurious as I'd hoped. I had the halibut which was cooked perfectly but served haphazardly on some chewy gnocchi and greens. With ""herb fries"" as a side for $10, I expected them to be...crispy, at the very least. Lesson learned. Make the trip downtown for some wow-worthy food!",0,1,0,Nadia B.,"New York, NY",8,25,6
3.0,2/28/2015,"I came here with my boyfriend for Valentine's Day this year. Now, I understand that restaurants are busy on Valentine's Day, but that shouldn't result in a lack of care and service. I felt like we were served before we even ordered. This is obviously not true, we had to have ordered, but the rush was definitely felt and it was as if the meals had been pre-prepared and had been sitting around waiting for us to get there.We were given some bread to have before our appetizers arrived. Literally, as I picked up a piece of bread not one minute later, our appetizers arrived. The waiter noticed my confusion and told me in some words not to eat the bread because I was about to eat dinner. So, why serve the bread? Nobody tells ME not to eat bread. It was incredibly rude, and I love bread. Additionally, we were looking forward to ordering a bottle of wine to have throughout our meal. We weren't given a wine list until our main entrees arrived, so we each ended up ordering a glass. We felt like we had to beg for the wine list!Also, we were looking forward to having the red velvet dessert, which we saw on the online Valentine's Day special menu. But, it wasn't available upon our arrival.I felt like the waiters were hovering to instantly deliver our next course once we were done with each course. It was just so ridiculous. The food was good, the service was not.",2,1,0,Amanda G.,"Brooklyn, NY",2,39,1
4.0,2/25/2015,"This was the perfect place for a business lunch especially when your not the one paying, muwahahaha.The atmosphere is lovely, no one was too loud, the service was exceptional. The seafood was even better. I started with some oysters and finished with a salmon burger. Boss got the bouillabaisse soup and a sandwich as well.Couple this with good news over lunch and you've got a perfect spot. I hope to return!",1,0,1,Lena L.,"Manhattan, NY",35,446,36
3.0,2/24/2015,"Crab Cakes were great!  The Lobster stuffed with Crab Meat was delicious as well.  However, the Macaroni and Cheese appetizer did not meet expections, nor did the fish.  Although the fish (my family tried various fish in the menu) was well cooked, The dishes lacked salt and seasoning.  So, during our dinner, my sister proceeded to add salt (and also requested vinegar) to her dish.Regarding the atmosphere, the price is reasonable.  However, the lack of seasoning on the food makes it difficult to justify the price.  Just make sure you get the crab dishes and avoid the fish.",0,0,0,Roman S.,"Rosedale, Austin, TX",661,44,5
4.0,2/22/2015,Came at 430 and there's no people. Ordered salmon and fillet. Food is good with right portion. Good service. But I don't really like the creamy sauce with salmon. Good overall.,0,0,0,Mike W.,"Manhattan, NY",13,11,5
4.0,2/22/2015,"Came here on Easter (2014). Food was good albeit expensive (not crazy though, just in the high end) Restaurant was quiet. Service was good. Would return.",0,0,0,Christopher B.,"Manhattan, NY",0,15,9
5.0,2/21/2015,"Outstanding evening at Sea Fire.  Absolutely excellent food, and impeccable service.  I took my Dad there while we were on a once-in-a-lifetime visit to the Big apple from California and the Double Tree at Times Square's concierge got us into this fabulous place.  We wanted to dress for dinner and have a leisurely dining experience in the city.   The ambiance was nice, maybe a little loud, but they put us back at a corner table with white linen and dimly lit, very elegant but current and alive.  I was a little worried that we would be forgotten but I couldn't have been more wrong.  The wait and table staff were so attentive and courteous, we wanted for nothing!  The food was wonderful, excellent, and we ate everything from starters to dessert loving every single bite.  To top off the night, they knew that this was a special night for dad & daughter and we were treated to some excellent port after dinner by a very charming maitre d.  Highly highly recommend The Sea Fire Grill.",0,0,0,Kathy H.,"Napa, CA",0,8,0
4.0,2/21/2015,Great swordfish With avocado! The linguine was okay. Nice atmosphere and service. Would definitely recommend the swordfish. Half off wine and beer during happy hour. Would definitely recommend for a romantic dinner or dinner with friends.,0,0,0,Jenice C.,"Westbury, NY",17,20,6
5.0,2/19/2015,"I came here with 4 family members for my 21st birthday & had the best time.There's a parking garage right across the street. We walked in for 8:45 reservations. We were 3 minutes late. I was told to check our coats & that our table would be ready in a few minutes. But right when they took the last coat, we were escorted to the table right by the fire place. The food was amazing. We had shrimp, calamari & crab cakes for appetizers. All were very delicious. For our entrées 3 of us had filet mignon (juicy & tender) with herb fries/whipped potatoes both were good. My mother had lamb & my father had scallops. The sauce the lamb came in was amazing. For drinks we had love potions, white wine and Long Island ice teas. The love potion was so good. After dinner, they bought out my birthday cake that my parents brought followed by a complimentary glass of a red port wine for each of us. Needless to say the service was amazing! Very nice staff. The bill with all of our drinks, appetizers & entrees came to a little over $400, but with all we ordered we thought it would be a lot more. It was definitely worth it! The only complaint from the time we walked in until we left is my dad said his ginger ale tasted watered down. They quickly got him something else to drink though so I would really say the restaurant is perfection.",1,0,0,Shakeya O.,"SoHo, Manhattan, NY",14,14,26
5.0,2/11/2015,"Apparently the superb raw bar is not the only thing that is making this restaurant a go to destination. The ambiance is that perfect combination of elegance meets tastefully chic. Soft lighting, White linen, as the interior walls of the restaurant are lined with bottles of their abundant selection of wines displayed in dark wooden, built in wine trestles.   We were immediately greeted by a very nice front of the house staff and our waiter named Bessfort was wonderful, charming and knowledgeable of the restaurant.-Super attentive and accommodating staff.The nice managers name is Alex. Right away we were delighted to be served a basket of warm fresh foccacia bread and flat bread accompanied with a rich, savory, and comforting spread of reduced, buttery white fish stock, mascarpone cheese, with fresh herbs.I started with Bibb lettuce salad, the lettuce was clean and crisp,the balsamic dressing was just perfect,and not tangy. The salad had a crunch from the candied pecans, the chew of the  dried cranberries and real chunks of crumbled blue cheese.I tried The blackened swordfish, which was perfectly done with just the right amount of spice- not overkill. The fish was flaky and juicy. The accoutrement's sided with the swordfish were an avocado spread and a creamy tartar.One person at our table raved about how fresh and delicious her shellfish-Linguine Fra Diavolo was, as she commented a few times on how fresh the calamari and seafood in her dish was.We all shared a few of the sides. One was the Baby Kale, fingerling's and goat cheese side. The flavor of this side powed you in an awesome way, as did the roasted brussel sprouts with bacon (The bacon was more like yummy thick cut pieces of pork belly bacon.For desert we loved the Molten chocolate cake, served with red velvet ice cream -there are almost no words for decadent dessert-we also shared their classic Creme Brulee-You Can Not Go Wrong with this, we loved it........As a matter of fact-we just loved everything!I suppose we simply did not know, first hand how amazing the Sea Fire Grill was until we were lucky enough to have dinner there.I was chatting with a local customer at the bar, that told me how awesome their steaks were as well.Note to self: Go back to this restaurant!I'm not even one to write on yelp, but We had such a great experience- between the atmosphere, the awesome food, and the friendliness of the staff, I am happy to spread the word!",1,0,1,Cherub N.,"Nyack, NY",0,4,1
5.0,2/11/2015,Super Bowl Sunday - Dinner at the Bar.Starters:Steak Tartar -- *****Bib Lettuce with Maytag Blue + -- *****Cornmeal Crusted Calamari --  ****  - just slightly over cooked and needed some flavor.Main Courses:12oz Filet - M/MR -- *****Maine Lobster w/Crab -- *****Herb Fries -- **** - needed more herb - doesn't everybody!Service:Bartenders -- *****Ambiance  -- *****,1,0,0,Scott W.,"Birmingham, MI",8,55,19
5.0,2/8/2015,"The seafood here its delicious, a little pricy but really worth it. Our waiter is Milton, a really nice, pleasant and patient guy. Will come here again!",0,0,0,Mingdong L.,"Boston, MA",0,7,24
4.0,2/3/2015,"Good, pricey food. Waiters are super helpful. Nice bar area for happy hour snacks. I had double order of shrimp appetizer for main course. Huge shrimp with veg. Head had roe but not super fresh. The body was great.",0,0,0,Harry C.,"Santa Clara, CA",12,80,3
5.0,2/3/2015,"Great food, fantastic service, reasonably priced good wine. This is an upmarket restaurant with upmarket prices but worth it.",0,0,0,Jim L.,"Ponteland, United Kingdom",0,1,0
2.0,1/31/2015,"I've been here a couple times and am not impressed. The service was odd this last time -- they tried to take our starters away while we were still eating them, then apologized and left, but then came back a few seconds later with our entrees and tried to squeeze them onto our table while we ate our starters. We scarfed down the rest of our apps so we could clear those plates. Then they asked to clear our entree plates even though my friend still had half her lobster meat left to go. We felt pressured into bagging the leftovers so they could clear those plates too. If the restaurant was overbooked or something, I wish they would have just told us. Minus one star.The food is nothing special. I found the combination of flavors in the crab/pear/goat cheese salad off putting. The lobster mac-n-cheese was dry. Skip dessert here -- the server recommended the apple dessert but it had a very odd slimy texture and I didn't like the cinnamon ice cream that came with it. My friend wasn't crazy about her tiramisu either. Minus a second star. The restaurant gets VERY loud. We would have ordered some coffee/tea at the end and kept chatting, but by the end of our meal we couldn't hear each other at all, even though we were seated away from the main crowd, against a window. Minus another star. My entree (seafood risotto) was good though, and my friend enjoyed her lobster.",0,0,0,amie b.,"Manhattan, NY",2,84,2
4.0,1/28/2015,"One of the few fish centric spots in the city that gets it right all the way around. Relaxing and inviting decor. Attentive but not overbearing service. And the reason for being there, the seafood, on point.  Go with the Madagascar prawns or crab cakes to start and roll into the Wild Striped Bass for an entree for a great oceanic experience.",0,0,0,Ben D.,"South Orange, NJ",85,224,1447
5.0,1/28/2015,"Beautiful Atmosphere, great service, amazing food, outstanding cocktails!!! Took my besty visitng from Los Angeles here for her Birthday Celebration and she was impressed and happy. I think I finally found a place that I can continue to go to celebrate milestones",1,0,0,Rebekah B.,"Brooklyn, NY",4,15,0
5.0,1/19/2015,"Honestly, I usually come here for the steak, but they have good seafood, too. Their whitefish spread with the bread is amazing. Their lobster bisque is top notch. I usually get the bone-in ribeye and have never been disappointed. My wife has usually gotten fish dishes and always been happy. The whiskey selection is solidly above average. On top of all that, the service has always been great.",0,0,0,Daniel S.,"Manhattan, NY",4,28,0
5.0,1/19/2015,"A great place to relax and unwind.  Dave and Leena were terrific bartenders.  We had good food, nice drinks, a pleasant atmosphere, and the service was well done.If your are the East side of mid-town, check this place out!",0,0,0,Kevin M.,"Westborough, MA",1,5,0
5.0,1/16/2015,"If you are a fan of seafood and foccacia bread, this place is a must try!! The bread is served fresh and warm with a lovely smoked fish & mascarpone spread. Yum! The ambience is very nice but be warned that the prices are on the expensive end. We paid around $60 pp, with oyster apps to share and an entree pp.We brought a cake for our friend and the waiter was very kind and offered a dessert wine to go with the cake. I had a lovely experience and would love to go again for a special occasion. The ambience was just right!",0,0,0,Courtney Z.,"Brooklyn, NY",112,81,73
3.0,1/14/2015,"Rounding down from three and a half stars. The service was decent, the food was pretty good, but the whole experience was incredibly underwhelming. The atmosphere just left me unsatisfied especially for the prices. Also to add- lots of tourists and even some super rambunctous drunk (??) patrons at the bar when i was there",1,0,0,Kyna C.,"New York, NY",32,121,24
