rating,time_created,text,useful,funny,cool,username,user_loc,user_friends,user_reviews,user_photos
3.0,10/13/2016,"I picked this restaurant as the reviews on yelp was good. However; I was actually a little disappointed after dining here. We came here won a Saturday night, I called 3 hours earlier to add one person on my reservation and found they didn't have my booking. The lady who answered the call managed to give me a table eventually, which was not bad. We had seafood platter, lobster& crab cake, steak, grilled tuna, cold soup and some desserts. Grilled tuna was pretty dry and not seasoning enough. Other dishes were not bad; however, I expected more as it is a fine dining restaurant. (The stuff and Manager were general and friendly).",5,2,2,Angie C.,"New York, NY",214,176,1894
2.0,10/13/2016,Came here for a business lunch and ordered a lobster roll. I have never seen such small lobster rolls; they were practically bite size. It came in one of those hot dog buns that you can get from any supermarket and there were so little lobster meat than they didn't even pop out of the bun. It was definitely not worth the $23 for the roll. Very disappointing. Do not trust the pictures of the lobster rolls you see here and DO NOT ORDER A LOBSTER ROLL.,0,0,0,Mandy C.,"New York, NY",198,13,0
1.0,10/13/2016,"Bad service, over- and under-cooked food, high prices.  Went last night--swordfish was awful; quarter inch slice overcooked to perfection and showered in pepper; friend had pretty but underwhelming, bland dish. Kitchen loves pretty food, but the food isn't pretty to eat. Service non-existent. Not even a stop by to say ""how is it?""  It wasn't good.  Mango sorbet was good, but why wouldn't be.  Should stay away from swordfish--always hard to do without being dry and this chef doesn't know the secret.  High price not worth it. Friendly people--typically loud NYC restaurant that quieted down because of holiday.  Would be a nightmare if full. Echo chamber.",2,0,0,Raul D.,"New York, NY",0,3,5
4.0,10/12/2016,"Great seafood place in Midtown East! Came here with a few co-workers after work. I started with the Spanish octopus, which was perfectly cooked and seasoned. Paired well with Romesco, potatoes and tomatoes on the side. Serving was more generous than I expected. For my entree, I went with the Halibut (our waiter recommended the Halibut, Bronzino, and Swordfish). I was very pleased with my choice. The Halibut was so tender and fresh - it practically melted in my mouth. The kale chimichurri was a perfect complement to the fish. Fish also came with fava beans and lemon gnocchi. The lemon gnocchi was a bit more lemony than I expected, but still very good. Ended the meal with a molten lava cake and side of ice-cream, which was to die for! The cake came out warm, soft, and delicious. It wasn't as sweet as most lava cakes I've had, which I loved!Will definitely return in the future!",0,0,0,Sharon Y.,"New York, NY",387,93,12
5.0,10/12/2016,"Came here for lunch on a weekday. The restaurant has a nice layout and holds a lot of diners without feeling cramped. The service is attentive but not to the extent that its bothersome. I shared a lobster bisque as well as the grilled calamari for an appetizer. Both were very good. The bisque is quite heavy so keep that in mind if you order a large entree. The grilled calamari was perfectly cooked and seasoned with garlic, herbs and olive oil. I also shared the ribeye with whipped potatoes and the salmon with black rice with my dining companion. The salmon was just okay for me - not bad, just very simple. I enjoyed the ribeye. The whipped potatoes were buttery and fluffy- I've never met a starch I didn't like - a great side!For dessert, I had the molten lava cake which was rich, warm, and all the things one would love about a molten lava cake. A great experience and I would definitely come back.",3,2,2,Monique R.,"Brooklyn, NY",912,912,541
5.0,10/8/2016,The bartender was magnificent! Great drinks and style! The food was fabulous and the entire waiter staff was top notch.  Everyone here was real class act.  Thank you for a great evening.,0,0,0,Xiangning Z.,"Montclair, NJ",0,3,0
4.0,10/2/2016,the food is soo oooo delicious  and served nicely and the restaurant  is beautiful  they're pricey so prepare to spend,0,0,0,Sunshinr L.,"Elmont, NY",75,4,2
5.0,9/25/2016,"Great place with nice Lobster and Steak and very nice waiters. Suffering jet leg, not order too much. But the food are impressive",0,0,0,Snoozy L.,"New York City, NY",17,1,3
4.0,9/22/2016,"Good food, a little over priced. Very tentative staff. Strong cocktails. Red snapper is very delicious.",0,0,0,Sarah Z.,"Portland, OR",10,32,4
5.0,9/20/2016,"The Seafire Frill dining experience made our NYC trip exquisite. We reserved last minute on a Monday night when it was busy and they accommodated a change when I realized how a NY Minute worked. The Surf and Turf and Crab Meat stuffed 2Lb Lobster was mouth watering and one of the best meals we've ever had. The server (Arber) was amazing from the start. He was pleasant, funny and took very good care of any allergy requirements. He finished our date night with an ""on the house"" shot.  If you are in the area and can make it to TSG, it's a must for your experience. Thanks to everyone who made the experience wonderful, from the hosts and hostesses, wait staff, servers and management who saw us out and left us with a handshake. It was truly a great evening. Thanks from Canada.",1,0,0,Chris C.,"Richmond Hill, Canada",1,3,0
5.0,9/10/2016,Had a wonderful dinner here a few years ago so we stopped in for happy hour and enjoyed the bar.  Olga was our bartender and she was super friendly and helpful.  Great place to relax and meet great folks!,0,0,0,Kristen T.,"Quakertown, PA",1,8,0
3.0,9/9/2016,"Outstanding Service...however, the food was pedestrian. We ordered the lobster, calamari and a fish dish. They all were over cooked and just above bland in taste.  The wine and cocktails were superior maybe that's why the cheese cake was outstanding.  At $300.00 including tips in Midtown the price was right but I would not eat here again.  I'm sure New York has way better to offer so I'm going to find it!",0,0,0,Bruce M.,"Dayton, OH",6,11,0
5.0,9/6/2016,"This was my first experience with The Seafire Grill, and it will certainly not be my last! A restaurant should focus on the entire dining experience of their guests, and Seafire nailed it! I was greeted at the bar, by not one, but both of the bartenders! Ben and Ad (short for Adriatic) were attentive and knowledgable. Ben recommended the Dorado special and I was not disappointed! Additionally, their generous happy hour (4-7) for oysters, wine and beer is second to none! If you find yourself anywhere near Midtown, make sure you stop in to The Seafire Grill!",0,0,0,Heather B.,"New York, NY",2,7,3
5.0,9/5/2016,"Such a happy unexpected adventure at Seafire Grill. My friend and I wanted to stop for a quick round of oysters (raw and Rockefeller...inspired by an episode of MasterChef). We tried somewhere more touristy...just to make it quick...but alas (and thankfully) that place was closed for Labor Day. We searched Yelp and called ahead and ran to Seafire. We sat at the bar and immediately felt like we were guests at Ben's house. He was the super friendly bartender. He really took care of us. We loved, loved, loved the oysters!! Great wine!! Amazing deal for happy hour!! Make sure to check in!!",0,0,0,Amber B.,"Derby, CT",0,1,0
4.0,9/5/2016,"Another hectic week, but able to arrange one night as a date night.Called ahead to restaurant and they said there were no slots left for reservations, but the wait would only be a few minutes.Arrived 5 minutes later and the place was packed. We decided to just grab a drink at the bar, but very little room and only could grab one seat. While seated, I checked opentable and saw there was a reservation in 30 minutes. So, the race was on, would we would be seated within 30 minutes?  Actual time? 25 minutes.However, once seated, our server was fantastic and we thoroughly enjoyed our dinner. Note: we had good spacing between tables, but it is still rather loud in the restaurant.Drinks? Ordered a great bottle of Loire Valley Sancerre.Food? Fresh bread w/oil, butter and spread to try.Bibb Lettuce Salad-Fresh Ingredients and Quality Maytag cheeseSpecial of the Day was Grouper w/Lobster Risotto. Delicious.Side of Cauliflower w/jalapenos which were average.Also had an additional appetizer, some sort of shrimp/prawn that was deliciousDessert?We were full and had to head to watch a hockey game, so server recommended a couple shots of vodka. Haha! We indulged.Thoroughly enjoyed our dinner.",6,6,5,Melissa L.,"Portland, OR",1588,1238,1087
3.0,8/31/2016,"Not for New Yorkers!! If I was from Ohio with little experience with fine dining I would've thought this was a great place. The fish was fresh and the oysters and lobster appetizers were very high quality. The whole thing was just a bit outdated, not modern. The service was good, everything was clean and all that. The entrees were just over worked. When you have top quality fish, you don't need to pile a bunch of crap on the plate. I had a grouper that was swimming in a heavy sauce with some weird stuffed (supposedly with lobster although it was undetectable) pepper that added nothing to the dish. I have no problem paying good money for a lovely dining experience but for these exorbitant prices we should've been blown away. Definitely not. Overall totally overpriced and underwhelming.",0,0,0,Brenna M.,"Forest Hills, Queens, NY",0,11,0
5.0,8/31/2016,"Hands down one of the finest restaurants I've ever been to. Everything about this place is upscale and pristine. Excellent service, an exquisite menu and the food was beyond delicious.",0,0,0,Anthony L.,"West Bronx, NY",475,4,0
5.0,8/30/2016,"Came here to celebrate my girlfriends birthday. We ordered a dozen oysters and black caviar to start along with a bottle of champagne  (it's on the pricey side, but it was her birthday)For the main course we both went all out and got the 2lb lobster stuffed with crab.... OMG that was something unbelievable, not sure how they stuffed so much crab into the lobster, and the taste was out of this world. Definitely the best stuffed lobster I have ever tried. I highly suggest you go for it, it's huge btw so you can easily share one for two people.The server was very attentive, and by the time it came to dessert we were both so stuffed that we decided to skip dessert, but they knew it was her birthday  (I'm assuming from the reservation that I made, because I didn't mention it to him specifically) and brought out a nice dessert with a candle... which is beyond nice.Highly recommend this place, for any special occasion or dinner in general, nothing I love more then great service and amazing tasting food, but when the restaurant is on the pricer side it's almost expected, and they deliver and then some.",2,0,0,Ma R.,"Brooklyn, NY",25,30,3
5.0,8/30/2016,"Loved the halibut.  Insanely good.  The wine selection is top end.  I thought the service was also very good.  Not pushy.  Not much of a bar scene,  but they did show the US Open tennis tournament so I was happy",0,0,0,Sonia V.,"Reston, VA",23,5,0
5.0,8/26/2016,Tony was an excellent server and the food was perfect!! Surf and turf with the Brussels sprouts was the highlight!,0,0,0,Nick A.,"McCammon, ID",0,1,0
5.0,8/25/2016,"I could not have been more pleased with my first experience at The Seafire Grill this evening. I started with the lobster bisque and bread. The main course, a 12-ounce filet, was remarkably tender, its flavor exquisite. Chef Jesus's mashed potatoes were an excellent side for this steak, and my server Tony recommended a fabulous Sangiovese. I finished the evening with a cappuccino and chocolate cake, and was delighted when Tony offered me a port wine to go with dessert. This port was as smooth and sweet as you'd want it to be -- the perfect companion to the bold flavor of the cake. I was as grateful for the staff as I was for the cuisine. The hosts were kind and engaging, Alex was on the floor nonstop to ensure his guests -- including me, a solo diner -- were enjoying their evening, and Tony's attendance felt like family. The Seafire Grill just became my go-to place in Midtown, whether I'm traveling alone, with my wife, or with clients. Check it out.",0,0,0,David F.,"Highlands Ranch, CO",0,5,0
5.0,8/25/2016,Awesome ribeye! Nice salad as well. The service is wonderful. The meal is fabulous with out Lovely server Tom. He was so patient to explain the menu to us.,0,0,0,Anna D.,"Manhattan, NY",0,2,0
5.0,8/24/2016,"I took a chance based on Yelp Reviews and proximity to our hotel.  I brought 6 people here for a business dinner.  The host help us find a table in the bar to wait for our party and even took our drink order.  We had good service, got some great help from the sommelier, and the food was terrific - Seafood and Steak, Solid American fare.  Plan on $150 a person for a business dinner, which includes a round of cocktails and a couple of nice bottles of wine.  .",0,1,1,Debi A.,"Gibsonia, PA",35,22,1
4.0,8/23/2016,"This was my second time at Sea Fire Grill.  The only 2 things that changed from my initial visit when they first opened was 1) the expanded menu (bueno) & 2) the higher prices (not so bueno).  And I was happy to see that the exceptional food didn't change....it actually improved!  We started with some east coast oysters, the special gazpacho made with yellow tomatoes which was incredible, the scallops which were also scrumptious.  We ordered the ribeye and seared tuna as our entrées...both dishes were superb.  And we had the pecan pie a la mode for dessert which I would highly recommend....it was awesome!The only minor issue we had was one of the grey goose martinis we ordered was only half full....not sure if the waiter spilled some on his way over to us or if it evaporated on it's own??Anyhow, when we brought it to his attention, he apologized and asked if there was anything he could do. We asked if he could comp us a new drink due to the error, and he nodded, smiled and brought us a new drink.  But when we got our bill at the end of the dinner, we saw that he charged us for both of them.  We were under the impression the second drink was on the house but instead we got banged twice for $17.  We didn't want to make a big deal about it but it certainly left a bad taste in our mouths after having such a lovely time and meal.  And it's just the principle...ya know?",2,2,0,Jessica B.,"Astoria, Queens, NY",39,47,101
4.0,8/21/2016,"One of the nicer seafood restaurants, to me. A great atmosphere and an even better wine list.",0,0,0,Matthew E.,"Manhattan, NY",0,43,5
5.0,8/20/2016,"Very very very good food. The service is very good too. Their grilled calamari is very well made. I had the blue snapper special and it was very well prepared. If you are looking for a high quality seafood restaurant, then look no further. Nice quite atmosphere.",0,0,0,Nina S.,"Allentown, PA",1,19,0
5.0,8/19/2016,"Delicious meal. Bronzino, Halibut and Swordfish were exquisite. Brussels sprouts are phenomenal. Best ever. Service was very attentive. Ask for Arben. We were apprehensive about taking mom here on her first NYC visit and it was a big hit.",0,0,0,Russ K.,"Saint Louis, MO",84,1,0
5.0,8/18/2016,"I love this place! I had the 2 lb. lobster with stuffed crab meat and it was absolutely divine. I couldn't finish it because the serving was more than enough for one person. The price is definitely worth the food and the service. The service was absolutely impeccable and they are there to assist with anything you need. Jaime took care of us. He was absolutely great, entertaining, funny and very pleasant. I will definitely come back. For the lobster and the service!",0,0,0,Tsarina B.,"Manhattan, New York, NY",0,2,1
5.0,8/18/2016,Excellent dirty martini's with blue cheese olives and awesome Shishito peppers for contain hour. Extremely fast and friendly bartenders. Definitely going to be my place for after work drinks and next time I m gonna try it for dinner.,0,0,0,Hitesh G.,"Manhattan, NY",34,4,0
4.0,8/17/2016,"Came here for a work lunch and was completely satisfied. We started off with the crab cakes, which were more filling than expected. I'm a lobster fanatic and I thought both the Chilled Lobster (1 1/4 lbs) and the Lobster Roll were delicious. Our waiter, Arber, was very accommodating and helpful. He helped us unshell the chilled lobster, answered our questions regarding the menu items, and constantly checked up on us. Lastly, remember to check in for a free molten cake with a scoop of vanilla ice cream - great way to end the meal.",0,0,0,Chloe L.,"Flushing, NY",1,3,0
4.0,8/16/2016,Great dinner and overall great service from Milton and Arbor. The octopus and calamari was fantastic along with the molten cake dessert.,0,0,0,Rommel F.,"San Marcos, CA",3,14,2
4.0,8/16/2016,"Incredibly fresh, light yet filling, delicious sides! Halibut and Salmon were so fresh, they must have been caught that morning. Lobster Mac and Cheese side dish was the perfect size for 3 people to share. Average prices for food this well done.",0,0,0,Jessica G.,"Jupiter, FL",0,15,0
5.0,8/14/2016,"Came here for Happy Hour, staying in town from Morocco. Tom was our server and was so attentive with our dishes. My husband and me had dinner here a few days back and had a good time,  so we knew the food was good. However Tom help me make a great selection with the Beef tartar and the caviar as well as my dinner which was the past. I had the Cod last time. Both dishes were great and the dessert was just as delishes! would come here as often as I can when in Manhattan!! Thank you Tom, he was the best waiter thus far.  Will ask for him next time !!!!!",0,0,0,Sandra B.,"Downtown, Los Angeles, CA",4,40,74
3.0,8/14/2016,Let's start with the pluses. Fantastic food. My surf and turf was fabulous. Scallops for appetizer were great. Wife's oysters were excellent as was her tuna. Upscale atmosphere. Impeccable service. Now the minuses. For $350 we had to go back to the room and eat popcorn before bed. It didn't help that we had Aquagrill two nights before; it was cheaper and better food in a more casual atmosphere.Save some money and go somewhere else unless you're trying to impress your new snooty ditzy girlfriend.,2,1,1,Andy H.,"Nashville, TN",3,36,83
5.0,8/12/2016,Offers a great selection of both food and drinks. It's a great atompshere to hold have a conversation. Tom was our server and he's very fun and made plenty of good recommendation,0,0,0,Suki H.,"Brooklyn, NY",88,5,0
5.0,8/10/2016,"Came here with colleagues for lunch and it was amazing.  Our server, Tom, was great and so attentive. He knew the menu very well and gave us some great suggestions!",1,0,0,May M.,"Mineola, NY",43,2,0
5.0,8/8/2016,"Had the SFG Filets medium with asparagus and a salad.  Friends had lamb and the special - a pan seared bass.  Arben was our server and was very nice.  Recommended a few things and entertaining.  Atmosphere was nice, a bit loud at first but it calmed down some later.  Overall good.",0,0,0,Sakura S.,"Fairfield, CA",47,1,0
5.0,8/7/2016,"Without a doubt 5 stars... High quality food, service and ambience. We had the surf and turf, bone in ribeye, lobster mac and cheese, brussels sprouts, stuffed squash, mussels, cheesecake, molten chocolate cake, cappuccino and several cocktails. Our waiter even offered us a complimentary limoncello to complete our meal. Thank You for an excellent night!!",0,0,0,Samantha C.,"Simpsonville, SC",2,22,481
5.0,8/6/2016,Tom Tom tom was a wonderful waiter! The lobster and salmon were amazing. The ambiance is so wonderful. The staff were amazing as well wuick to clean up and very attentive.  We will be coming back again.,0,0,0,Cindy M.,"Maitland, FL",0,10,7
4.0,8/6/2016,"Excellent Meal and our waiter Arber was fabulous! So nice, not rushed and great food and service. Upscale place without the upscale snob...perfect! Steak was amazing and the halibut was the best ive ever had. Served with great sides. The fried zucchini blossom was fabulous and finishing up with the molten cake was really perfection.",0,0,0,Angela R.,"Leesburg, VA",12,75,221
5.0,8/3/2016,"My sweetie and I came here for our 30th wedding anniversary--soooo glad we did! From start to finish, it was the perfect evening!Our server, Bes, was a charming young man who helped make our evening memorable. He was friendly and personable.The ambiance is low lighting, set up for tables of business dinners, but we had a table along the wall which had a view of the fountain in the courtyard next door. As the tables filled up, the noise level increased, but hey, that's NYC--lots of noise.The sommelier picked out a buttery, full bodied Chardonnay for us.The food was delicious: the cold lobster salad was beautifully presented and had 2 large pieces of flavorful lobster atop a bed of cucumbers, hearts of palm and avocado. The heirloom tomato salad consisted of a variety of heirloom tomatoes with bits of really tasty goat cheese.The Branzino was moist and buttery with a light lemon and caper sauce, cooked to perfection. The halibut was firm, moist and flavorful.Since it was a special occasion, we asked Bes for his recommendation for dessert--his description of the key lime tart was mouthwatering, so we went with that. What a beautiful presentation! The tart had a delicious graham crumble crust and a tangy lime custard filling. It was topped with a scalloped line of whipped cream and mint and blood oranges. And they gave us complimentary brandy since it was our anniversary!Seafire certainly lived up to our expectations and more!",0,0,0,Nory B.,"San Diego, CA",18,423,102
5.0,8/2/2016,"The best seafood restaurant in town, calamari and halibut were amazing, definitely try lobster mac and cheese.  loved it and i will be back, the service was excellent, ask for Bes.",0,0,1,Bekim M.,"Manhattan, NY",38,3,1
1.0,8/1/2016,"Took my girlfriend here for her birthday. Made an 8pm reservation, didn't get seated until almost 9pm. Ambience was stale, wasn't even any background music being played. Food was sub-par for a ""fine dining"" experience... They sure didn't have a problem charging fine dining prices though!!! VERY OVERPRICED!!!",2,0,0,Tom H.,"Brooklyn, NY",0,20,0
5.0,7/31/2016,"Wow!!!! This place was amazing! My boyfriend and I had a tough time picking a restaurant we wanted to eat at for our night in the city. We ended up choosing Seafire Grill based on the yelp reviews and it did not disappoint. We arrived early and waited at the nice bar in the front of the restaurant. When we were seated we were served some bread which was good, which my boyfriend really liked. We also got a nice bottle of champagne that our wonderful waiter Jaime made sure to pour in our glasses throughout the night. It was the best champagne I have ever had, but I don't know what it was called. They also had an extensive menu of wines which sounded amazing too. For dinner my boyfriend got the yellow fin tuna and was in love with it. He said it was the best he's had in a while and tasted fresh and wild caught. I got the surf and turf which came with a 9 Oz piece of filet mignon, a piece of lobster, a piece of crab, and a piece of shrimp. It was amazing and everything was so tasty. As a side we got the lobster mac and cheese and it was too die for. I would definitely recommend that. While the portion look small I think it's important to note how filling they were. We were worried we would still be hungry after this but we were so wrong. I couldn't finish my dinner and we had to bring that and the lobster mac and cheese home. All in all, this is now our new spot and we will definitely be back. The decor and lighting is perfect and romantic. The service was outstanding. Our waiter Jaime was so funny and friendly it may the experience even better. I would definitely say you should give this place a try.",0,0,0,Colleen S.,"Englishtown, NJ",0,1,3
2.0,7/31/2016,"Remember, this is midtown at a touristy restaurant. You will be paying a lot for mediocre food. Also, it feels like a cruise dining room and tastes like cruise food. If you like these things, then you'll be fine.Came for dinner for a friend's birthday, so I had no say in which restaurant we were going to. I wasn't expecting much based on the pictures, and good thing I set my expectations low.Our server had a dry, deadpan sense of humor which was actually tough to decipher if he was being an asshole or just joking. I think it was the latter. It was hard to get the attention of the servers at times, but there are a lot of bussers running around, and managers standing around.We had the following dishes:-Crab cake - full of shell pieces and bland ($23)-Lobster bisque - salty and more shrimpy than lobster flavor ($15)-Porterhouse - tough and chewy ($104)-Cod - overcooked, not memorable ($38)-Lobster mac and cheese - overcooked, mostly cheese ($16)-Brussels sprouts - nicely charred and tender, well-seasoned, probably the best food of the meal and I don't even like Brussels sprouts ($11)-Mushrooms - I think they forgot to season this because it was bland and undressed ($13)-Molten cake - the cake was rubbery, but the Molten was there so maybe it was undercooked (free with check-in)-Cheesecake - not dense enough to be called NY cheesecake ($12)-Creme brulee - it was ok but I think the texture was a bit off, too gooey ($12)Overall, it's not terrible, but I would prefer to never come back. They have nice matches though.",3,1,0,Diane Z.,"Brooklyn, NY",247,1155,126
