rating,time_created,text,useful,funny,cool,username,user_loc,user_friends,user_reviews,user_photos
4.0,12/27/2017,"Our waiter Jaime made up for the complete lack of ambiance offered in the ""wine cellar"" room.  If making Christmas reservations, insist that you are either seated in the main dining room or that you will have him as your waiter.  Note to management ... if you are going to seat people in the side room for Christmas, please do something to make it warm and inviting ... flowers, decorations, candles, anything to make it feel more like the holiday that it is.   The positive to being seated there was that it was quiet, so it was easy to have a nice conversation, but it was just white.  White walls, white table cloths, and from memory, no candles ... almost like it was the overflow room despite me having made reservations well (more than a month) in advance.One more complaint.  The bread basket was a bit of a joke.  Almost like they ran out of the good stuff, so grabbed sliced bread and flat bread crackers from whatever store was open on Christmas day.  It wasn't even warm.  The offset was the whitefish spread, which could have been spread on a saltine cracker and still been impressive.OK, enough complaining because all of the above was more than compensated for by the fact that Jaime (our waiter) was spectacular.  He made it a memorable Christmas and stood in stark contrast to the room.  Warm, kind, and inviting. Moreover, the food (outside of the bread) was excellent.  Everyone enjoyed what they ordered, and no two people orderd the same thing, which says a lot.  If you go, order a side of the Lobster Mac and Cheese.  It was so good, it should be illegal.",0,0,0,A M.,"Wellesley, MA",0,11,0
5.0,12/26/2017,"This is classic New York dining.The dining room provides a great atmosphere for relaxation. The restaurant is very well staffed so you don't have to wait long for any element of service.The food was very well prepared and presented. We built our own seafood tower and the ingredients were superb.Also, the wine list is expansive so get help from their sommalier.",0,0,0,Kevin B.,"Lubbock, TX",67,28,1
5.0,12/25/2017,"We came for Christmas evening and had a wonderful experience. Their christmas menu was great, and our server Tom gave us such a nice service.",0,0,0,Wanho L.,"Manhattan, NY",13,2,0
5.0,12/23/2017,"We happened to find this place out of pure luck. We were staying at a nearby hotel. We asked for quick service and they obliged! I couldn't believe how fast our meal came to us. The seafood is to die for. Scallops were tender and cooked to perfection. The accompany sauce matched well with the scallops.Wife had the surf and turf. Truthfully, I wouldn't order meat here. Don't get me wrong, it wasn't bad but it wasn't compared to a top end steakhouse (in my opinion). The seafood for the ""surf"" was perfectly prepared. I could have ate more of it. We had Brussels for a side. Loved them. They are rich in flavor and cooked slightly crispy. I could have ate two orders.Service is beyond impeccable. Ambiance is perforce for us- quiet and romantic. Overall, great meal. I would eat here again and try the fish. I suspect the beef is on the menu for the carnivores who don't like seafood. They cater to seafood lovers and do it well.",0,0,0,Ryan H.,"Virginia Beach, VA",0,7,5
5.0,12/22/2017,"Enjoyed a romantic birthday dinner with my wife here, food was fabulous our sever Milton was excellent and knowledgeable on the menu. Check them out",0,1,1,Maclaud V.,"White Plains, NY",0,23,30
5.0,12/21/2017,Came for my birthday dinner last night with my husband and two daughters. The food and service was phenomenal. Our waiters were so nice and attentive. Food was FANTASTIC. The manager Scott made sure our 5 year old was treated like a VIP Princess all night. Such a pleasure!,0,0,0,Jessica N.,"Westbury, NY",0,2,0
5.0,12/20/2017,"Such a great spot! I had lunch at the bar by myself and enjoyed a glass of Pinot noir and a shrimp salad. The bartender was so kind, chatted with me now and then, but also continued doing her job. She recommended different wines that would go well with my meal which was really nice. The food was delicious. It's hard to find healthy, but delicious food and they hit the nail on the head. The complimentary sesame crackers are really good too. Highly recommend.",0,0,0,Jessica K.,"New York, NY",13,19,2
5.0,12/19/2017,"This restaurant was recommended to us by our hotel.From the moment we stepped in the door, until the moment we left, everything and everyone was very professional and polite. We had a wonderful waiter by the name of Benson who had wonderful wine and entree recommendations. Benson was extremely knowledgeable, professional, attentive and accommodating. He was a delight! The ambience at this restaurant is lovely as well. The food and the wine were delicious. I highly recommend the Organic Scottish Salmon...it was delectable. This restaurant is 5 stars in every way! We look forward to dining here again on our next visit to NYC!",0,0,0,Kathy B.,"Beverly Hills, CA",1,12,9
5.0,12/17/2017,"Great place to eat in New York! The ambience is excellent and the wait staff was extremely attentive (especially Nick, our waiter). The food comes in large portions, so come here hungry. Definitely recommend.",0,0,0,Elizabeth E.,"Atlanta, GA",136,3,1
5.0,12/16/2017,"This choice was a last minute one, after coming to Manhattan during the height of preChristmas season. It was highly recommended by our hotel (Lexington) and it did not disappoint!We were tired after a long, cold day of touring museums and taking in the holiday decorations - it was 7pm, they were full but they made room for us close to the bar, as being referred by our hotel.Our server, Ari, met us with a welcoming smile and made us feel at home. We were too hungry to dabble with appetizers and ordered our mains and sides- roasted chicken and filet. Both were prepared to perfection - extremely tasty and flavorful. The wines - Chardonnay and Burgundy were the perfect pairing.I highly recommend The Seafire Grill to anyone looking for an excellent dining experience. Many thanks to Ari for making this visit a memorable one...",0,0,0,Larry G.,"San Clemente, CA",24,15,1
5.0,12/15/2017,"Wonderful service, great food, definitely recommend for a special occasion! Nick, our waiter, was very attentive. Thank you!",0,0,0,Caroline F.,"Lexington, MA",0,5,0
5.0,12/15/2017,I had a really good experience w a large group. Milot was our server and was very attentive and great. Would come back again,0,0,0,Caitlyn C.,"Tacoma, WA",556,12,21
5.0,12/15/2017,"Tom was a great waiter who was incredibly attentive for the duration of our stay. The specials that he suggested were delicious. Though all of the dishes were great, the best were the Mac and cheese side and creme brulee for dessert!",0,0,0,Amanda S.,"Manhattan, New York, NY",0,1,0
5.0,12/15/2017,"I love this place! I have been here multiple times, but Tom is an amazing server and pretty good looking!  Hopefully Tom can continue being my server when I come here for lunch again!",0,0,0,Kim N.,"Manhattan, New York, NY",0,5,0
1.0,12/13/2017,"I made reservations a month ago. Confirmed my reservations last night. As usual, the traffic was horrible. It's freezing cold. We were a few minutes late and they gave our table away. We were bundled up walking and didn't realize we were a few minutes late. Otherwise, we would have called. Never want to be disrespectful of other people's time.",2,1,0,Melisaa M.,"Copley, OH",0,1,0
5.0,12/10/2017,"Just went here for my boyfriend's birthday and we are so glad we did! We ordered a bottle of sparkling rosé that was delicious. With your bread at the beginning of the meal, in addition to the typical olive oil and balsamic and butter, there is also a lovely whitefish spread. Highlights of the meal were definitely the oysters, the pan roasted scallops, and the truffle burrata. He loved the halibut he ordered and the creme brûlée was also delicious. Hoping to come back some time soon!",1,0,0,Gabi H.,"Back Bay, Boston, MA",6,12,26
5.0,12/7/2017,"I went last night with co workers and I must say it was a great evening! The cozy warm ambiance, the friendly waiter Ari and especially the delicious food. I will definitely recommend this restaurant and come back. Lovely city evening!",0,0,0,Jennifer M.,"Bronx, NY",36,2,0
4.0,12/3/2017,"Just arrived in midtown following flight from San Diego and impossibly long taxi ride from JFK. Dropped bags at hotel room and checked Yelp for nearby places to eat. Sea Fire Grill looked good so I called right away for early 6 PM dinner res. Hostess said that we're completely booked but if we came over quickly bar seating was available and full menu could be ordered at bar. We snagged a really nice high table in the bar and had a fantastic meal. Butternut squash soup, wedge salad, and a 2 lb lobster stuffed with crabmeat. Cocktails and a glass of wine. Very pleasant server - thank you Madison. Place actually was jam packed so the hostess gave us a good bit of advice about bar seating. The doctor ( Notorious MD) is now a fan of the Sea Fire Grill.",1,0,0,Andrew R.,"La Jolla, CA",16,160,67
5.0,12/2/2017,"Incredible food.   Gesti is an amazing server who guided us through a wonderful culinary experience.   The caviar and champagne were exceptional, as were the lobster bisque and Bibb salad.   The truffle mashed potatoes were delicious and the filet literally melted in my mouth.  Highly, highly recommended.  My new favorite restaurant in NYC.",1,0,0,Nona L.,"Phoenix, AZ",0,2,0
3.0,11/29/2017,"I was a bit nervous when my coworker picked this place as I'm not a fan of seafood, but I was pleasantly surprised! The restaurant is dark and classy; we came in jeans and felt a tad under dressed. The bread, I have to start off, was excellent. We had calamari and crab cakes. I didn't expect the calamari to be grilled instead of fried (it was my first time having it this way) so that was a little tough, but I thought the crab cakes were pretty good. Normally I don't like seafood, and so there are a few steak and one chicken option. However, I was curious about the squid ink pasta and decided to try it. As mentioned above, I was pleasantly surprised! It tasted pretty much like normal pasta just with a lobster sauce. I split half with my coworker and it was plenty of food. We then finished off with the free Yelp creme bruele. Overall a pretty good experience for someone who doesn't normally like seafood!",0,0,0,Michelle M.,"Dublin, OH",256,163,233
5.0,11/29/2017,"Romantic & delightful! Scott welcomed us, ""Who's got it better in New York than you two?!"" Milot negotiated the menu, splitting our Branzino & Halibut into two portions.  Presentation was excellent! We unexpectedly ordered the comfort food Lobster Mac & Cheese as an appetizer. Delicious!",0,0,0,Roger S.,"Los Gatos, CA",30,20,1
3.0,11/28/2017,"The appetizers were amazing, calamari and crab cake. The ambiance was very nice, a little too loud for dinner though. Will be coming back!",0,0,1,Allison S.,"Mishawaka, IN",370,3,6
5.0,11/28/2017,"When you come, ask for Arben. He's a superb server, very friendly and knows the menu very well. The Calamari and breaded Clams for appetizer were excellent. For main dish, get the Porterhouse steak for 2. Steak  was tender and mouth watering.When you checked in at Yelp you will get a  free cream brûlée dessert. Excellent!",1,1,0,Jun R.,"Valencia, CA",120,182,600
5.0,11/27/2017,"Food: I got the Roasted Nova Scotia Halibut as my entree and it was so good!! The fish was fresh and cooked well. It was flakey and flavorful. I really enjoyed my dish. I also ordered the scallops as an appetizer. They were one of the best scallops I've ever tasted. Super fresh and flavored well. Price: Pricey. Be prepared to pay at least $15+ per dish. Service: Great! I went there for my anniversary and upon request, they brought out or dessert and the waiters came up to our table one at a time to wish us happy anniversary. My boyfriend did ask for happy anniversary to be written on the dessert itself, but it was not done. Not sure if they didn't allow it or if there was miscommunication. Overall, it was a good dining experience. I was pleased with the food and the service. I would recommend it to anyone who is looking for a nice restaurant for a celebration or just for a nice meal.",4,1,4,Enya G.,"Edison, NJ",621,112,120
5.0,11/23/2017,"Ari from Kosovo, great service, handsome young man, makes this dining a fantastic experience",0,1,0,君浩,"New York, NY",0,1,0
5.0,11/21/2017,Jaime is great! Really good food and bloody marry was excellent! place is clean and service is great!!!!,0,0,0,Lana T.,"New York, NY",13,6,0
3.0,11/18/2017,We went for our anniversary dinner which I booked more than a month in advance. The dinner was quite lovely but they did not do any effort to make anything special. I was a little disappointed on the lack of service. We usually travel around the country for our anniversary and this has been so far the least memorable date ever. Food was good but if you want the extra mile this is not your place.,0,1,0,Adriana B.,"Houston, TX",17,12,1
5.0,11/18/2017,"Great restaurant.  Classy decor, great service and amazing food.  The crab cake was outstanding!  Also, filet mignon was on point; perfectly seasoned and cooked.",0,0,0,Tyler P.,"Apopka, FL",1,65,14
5.0,11/17/2017,"Amazing from the moment u r welcomed the attention to quality n detail s amazing beautiful location n impeccable top to bottom , our waiter ORI  was top of the line, explained all the specials n offer great recommendations, our food was the best meal I ve ever had delicious n presented like a work of art , the oisters, lobster,red snapper, tuna n salmon tartare was not only fresh but perfectly prepared, the desserts again delicious n beautiful. ORI made our nite extra special by helping us commemorate our anniversary when presenting our desserts... Great food , service our new special place hope u make it yours...",1,0,0,Nelson S.,"Staten Island, NY",68,19,0
5.0,11/14/2017,"Amazing meal, octopus and smoke fish for starters were fabulous! Had the red snapper special and it was incredible! The molten chocolate cake to die for! Ori was our server, he's was wonderful! All of his suggestions were on point! Thank you Ori for an amazing night!!!",1,0,0,Miggy F.,"Miami, FL",21,80,148
5.0,11/14/2017,"I wish I could give our dining experience at Sea Fire Grill 6 stars!  It was THAT GOOD- again!  This was my second time dining at Sea Fire.  And I think the 2nd time was even better than the 1st!  Our server Jamie was amazing.  He went out of his way to make sure our dinner was perfect!  And it was!  Jamie really did a wonderful job making our dinner special.  His positive attitude and attentiveness really was awesome!  Now for the food -   We had the steak and halibut!   Both were unbelievable!  Cooked perfectly!  We devoured the brussel sprouts and mushrooms!  Oh soooo good! Finally, we ended dinner with the chocolate lava cake!  Do not skip dessert!  Amazing!  If you are in New York and looking for a memorable restaurant with amazing food and service, you MUST dine at Sea Fire Grill!  I know we will be back the next time we are in town!",0,0,0,Rebecca S.,"Ellington, CT",0,4,0
3.0,11/13/2017,"For the price, I should've gone some where else.  The food was good, not exceptional.  Our waiter was very busy, but did the best job he could at being attentive. (Beson) He was kind and you could tell a hard worker.  He tried to make our 2 hour meal pleasant while we waited a LONG time for our food. Due to the prices, a friend and I split the surf and turf.  The food was good, but what was funny was, while it was so nice they split the meal for us, they literally cut a shrimp in half.  I would've been happy to pay for a shrimp   had I known.  The rest was 2 inches of lobster each and 2 inches of crab and a steak. We had the lobster bisque.  It was good, but I wouldn't have it again, especially for the price. The dessert was the BEST part of the meal. The molten cake was dark chocolate.  And the creme brûlée was really good. I expect high prices in New York City. However, this was outlandish in my opinion.  $70 for the surf and turf and $13 for the soup.  Dessert was around the same price. Other entrees ranged from $30-40.  If I'm going to pay those prices, it needs to be amazing, for me, it just wasn't. There are a lot of choices in NYC. I will choose differently next time.",0,1,0,Angela R.,"Humble, TX",3,114,26
2.0,11/11/2017,"I never thought a restaurant could be too attentive!! While eating here waiters watched ever bite and sip we took . Hands were constantly reaching across our plates as we tried to eat the over cooked food!I asked for medium lamb, got fatty piece with a tiny sliver of bone. Not appealing first bite! We spent $200 for throw away food, equivalent to Long horn steak house!!!",0,0,0,Cheryl K.,"Everett, MA",8,1,0
5.0,11/11/2017,"he food was top notch with next level service. The freshness of their seafood sets them apart- you can literally taste it. This was as trendy upscale as it gets and its classy outcome  that is very impressive. These guys are pros, everyone was on top of their game. They even called us out for being late on the reservation. they were professional about it - but our hands were tied, and they were pretty cool about it -- you can tell they don't like messing up reservations - its a good thing. The bartenders made great drinks, seem like they had a few regulars at the bar with cocktails, just based on the conversation. The waitstaff was on point we didn't wait for anything and they were one step ahead of us the whole meal, making sure we had ever thing we wanted before we even knew we even needed it. The seafood is as fresh as it gets and they nailed every dish. They fish of the day was sea bass served whole fish  - they cut the fillet at the table. The sauce they put on was a masterpiece; it really enhanced the dish. Even the asparagus was  on point. The 3 pound lobster was the best I have had in Manhattan, nothing against Benjamin Steakhouse, but the flavor of the lobster was sweeter. And the shelled for me at the table. The truffle oil they use on calamari sets it apart from any other Calamari dish I have had; highly recommend it. Its cooked to tender perfection. The aged fish was surprisingly good, pancakes go well with it. We were too full to tackle desert but there is always next time. BTW,The expresso was top notch every restaurant has good expresso, but this was a little better than the rest.",0,0,0,Milton Y.,"South Glens Falls, NY",77,46,331
5.0,11/9/2017,"Seafire was way better than I expected! We shared the swordfish and the branzino for mains. Perfect together. And the octopus appetizer was amazing--we are inspired to try grilling it at home. Service was a team effort. First we had Gesti, then Tom. Gesti was super-attentive, and then Tom, from Cosovo, was a gem, and friendly, to boot. Why can't service be this good at every restaurant? The molten lava cake was a magnificent ending.",0,0,0,Bookingood H.,"Berkeley, CA",0,16,1
5.0,11/6/2017,The steak was phenomenal! My wife and I split the bone in ribeye and she had to sneak and pick up the bone to get all the meat off of the bone. Our waiters were AWESOME (Tom and Milot). They took good care of us! The lobster Mac & Cheese was great as well. Loved it!,0,0,0,GREG G.,"Murfreesboro, TN",24,5,4
5.0,11/5/2017,"The waiter,  Jamie, was amazing. We had delicious surf and turf. The molten lava cake was perfect. The squid ink paste and steak tartar was executed flawlessly.  Great for dinner.",0,0,0,Terry H.,"Denver, CO",32,10,4
5.0,11/5/2017,"My dad and I were in town for his birthday and were looking for a great seafood restaurant.....we found it! Our entire experience was perfect. The atmosphere, service and food was world class. We ordered the shrimp cocktail appetizer, wedge salad, and each had lobster. Each dish was better than the next. Our waiter, Milot (not sure if spelling) was wonderful. All the staff were great. I've eaten at multiple one and two Michelin star restaurants and never had service like this. This restaurant is expensive but worth it. Sea fire grill has to be the best pure seafood restaurant in NYC. Highly recommend!!",3,0,0,Michael G.,"Pompano Beach, FL",30,92,417
5.0,11/5/2017,"Chose this place because proximity to our hotel and Yelp reviews- and what a treat it was.  Same day reservations were a nice added treat, nice bar area, outstanding service with very knowledgeable Sommelier.  There were 3 of us and we shared the risotto with duck confit app and also the orecchiette with mild mushrooms- this came with the option to add table side shaved truffles.  Disclaimer, and the waiter shared this upfront, the truffles were a $55 add on- we went for it anyway and WOW, 10 generous shavings, what an incredible treat and enhancement to the dish.  Friend and I both had the bone in ribeye which was generous portion and outstanding, wife had the trout off the menu which was also done wonderfully with good flavor.  The wine list was excellent- plenty offerings at nice price points between $60-$140  and up to the highest end wines at thousands per bottle.  Sommelier helped us find an excellent bottle at $105.  Way to full for dessert, and the special end to the night was them offering complimentary after dinner drinks.  The topper was on the way out we came to learn it is part of the Benjamins family of restaurants which we have really come to enjoy.  High end dinner with prices, quality and service to match.  Will definitely come back and highly recommend.",0,0,0,Matthew H.,"Valhalla, NY",6,32,13
3.0,11/4/2017,"The Sea Fire Grill:We chose this spot for a special occasion dinner. Thinking that this spot will satisfy both criteria of Seafood & Steak for the gentlemen and ladies. Dropped by a tad early but was not seated as hostess stated that all party must be there before we can get our seats. We were told to sit at the bar as we wait for our last guest. We were guided to our seats, and was told that he reserved the best table for us. Our table was all the way in the back. I feel like our table will get more attention if we were to sit in the middle section but don't tell us that this is the best table in the house. I guess since the restaurant was packed we waited longer than usual to get our waiter's attention. Complimentary bread is always a plus. It came out warm, fluffy and crisp. We ordered the: Lobster Bisque: $17, not enough meat in the soup, hence soup lose the flavor. Oyster Rockefeller: $21 This taste ok but maybe bits of bacon will add some sparks to each oyster. I rather eat raw oyster with some lemon juice on top. Porterhouse for Two: $110 We asked for steakhouse sauce but what came out was a small sauce dish of cream mix. Maybe that is their home made sauce? but i expect steak sauce to be brown or orange in color. I will pass on the sauce. The steak tasted okay on both side. No wow factor to it. Bone in Ribeye: $59, much more flavor in this steak. Kind of melt in your mouth feeling. Halibut: $45, Salmon: $39, both fish were juicy and flavorful. Lobster Mac & Cheese: $17 again but enough meats in the dish but this was very cheesy and creamy. Cream of Spinach: $12, too salty. We weren't really serve the best to our attention, probably because of the amount of people dining on that day. Service can be better.",9,1,1,Carmen L.,"New York, NY",8,235,2458
5.0,11/4/2017,All of dinner menus are wonderful and delicious. Kind services! Tom was a nice server:),0,0,0,Rachel K.,"Manhattan, New York, NY",5,1,0
5.0,11/1/2017,"Great food and presentation, wine selection was good, and the service was attentive without being overbearing. Cost was inline with a good New York restaurant",0,0,0,Emery R.,"Santa Rosa, CA",0,8,0
5.0,10/30/2017,"From the moment we walked it, it was perfection! The bartender was friendly and knowledgeable and met a wonderful woman who lived upstairs and enjoyed a wonderful conversation, The hostess was warm and kind, waiter knew the menu and was very helpful! The food was exquisite! Worth every penny and I want to go back!! Truly was a foodies dream experience! Thank you!!",1,0,2,Clint S.,"Manhattan, New York, NY",4,2,0
5.0,10/29/2017,My husband and I came here for our anniversary and from beginning to end the service was great. Food was phenomenal. It can be a little dark depending on where you are sitting however it is a very romantic place. I definitely would recommend the lobster Mac & Cheese. It was soooo good. We are already talking about coming back. It Definitely was a great choice for our Anniversary.,0,0,0,Sadi M.,"Blackwood, NJ",0,6,0
5.0,10/13/2017,Delicious swordfish and sea scallops!!!  Lobster !!!! Also their steaks are great.  My favorite desert is the chocolate soufflé cake delciois !!!   Nice classy restaurant. Great service love their menu frequently visited,0,0,0,Michelle T.,"Flushing, NY",127,8,27
5.0,10/12/2017,"Normally we are skeptical of hotel recommendations, but this was a winner! Bustling bar scene, vibrant dining room. Service was excellent and they were fantastic with our dairy allergy. Nice wine selection, including by the glass. Highly recommend!",0,0,0,amy b.,"Pacifica, CA",39,192,25
5.0,10/11/2017,Wonderful experience. Packed place but service definitely did not suffer. The food was amazing and the manager at the door. Tall good looking gent really made us feel welcome. Will be back very soon to explore more options,0,0,0,Surendra T.,"White Plains, NY",1,3,54
