rating,time_created,text,useful,funny,cool,username,user_loc,user_friends,user_reviews,user_photos
4.0,1/16/2012,"Cocktails with one of the hotest girl i've ever met, and asking me on a date! Coming back..",0,2,0,anthony r.,"Manhattan, NY",48,99,4
3.0,1/11/2012,"Very nice decor, been here a couple times for drinks, today was my first sit down lunch, food was good and service was on par, I had the lobster bisque to start and a lamb shank as entree, it was good... Classy joint and lots of suits doing their thing.. not an everyday spot to visit for lunch, for me anyway, but if you have time to kill and want to treat yourself, this is a good place to go if you're in the neighborhood. .",1,0,0,Steve L.,"Queens, NY",5,60,0
4.0,1/10/2012,"Had a great meal here with family and friends the week before Christmas.  The food was exceptional and I loved the atmosphere.  I had a scallops appetizer which apparently is no longer on the menu and the halibut with hearts of palm, chorizo, and squid.  I really liked that the menu is adventurous without being too avant garde.  When they say your fish comes with hearts of palm, chorizo, and squid, they actually mean a nice salsa of diced hearts of palm, chorizo, and squid, not hearts of palm oil, one slice of chorizo, and squid foam.  The desserts could have been a little better, but overall I really enjoyed my meal at Monkey Bar.",0,1,0,Michael S.,"Manhattan, NY",35,147,51
2.0,12/29/2011,"i wanted to go to this place after reading eric asimov's review.  it was not really what i expected.  the ambiance was pretty cool - like an old school jazz club but it happened to be pretty empty the night we went.  the food was hit and miss.  i got the pork belly with fried oysters and kimchee.  it was an interesting mix although i'm not really sure how the components went together.  the pork belly and oysters were great and while i enjoyed the kimchee it was so incredibly salty.  i tried everything together and it was like eating rock salt.  could've done without the kimchee.  as for my date's salad...there was a fly in it!  it was very very tiny but it was still there.  the waitress took it back and said the manager would come over.  but this never happened.  our entrees were actually pretty good but not especially large for the price (i got the beef, she got the salmon).  the review said to not skimp out on the dessert and we didn't  we got the chocolate hazelnut bomb which was actually very good.  the salad ended up being taken off the bill which was fine but i was a little put off by how the manager never bothered to come and apologize.  and also to comp a dessert at least would've been a nice touch.  i've been inconvenienced a lot less and offered a lot more as compensation.  food was good, not worth the price.  probably won't go back.",2,0,0,craig c.,"New York, NY",2,60,0
5.0,12/7/2011,"Truly had a wonderful time here. Thank you to all the staff!Cocktails were great. They also have krug BTG, a nice touch.Pretty much as Eric Asimov described it -- the pork belly and fried oyster appetizer, a play on bo ssam, was the star of our dinner -- One of the best dishes I have had in a while. Skip the hamachi but the entrees were delicious as well. Uni pasta (so succulent but cant really taste the uni) had amazing caviar and the pork two ways had that interested shiitake ravioli.I will be back --- the ambiance is lovely whether you are at the bar or the main dining room. This is a great place to get a drink after work or dinner with friends.",0,0,0,Justin T.,"New York, NY",25,188,3
2.0,11/30/2011,"I should start off by giving credit where it's due. The clubby, historically-rich ambiance at Monkey Bar transports diners to a different era, and in a good way. It's the kind of restaurant you see in classics; a place where Greta Garbo would have lit up a cigarette as Benny Goodman poured out a swing tune. Even better, the menu brims with exotic, brilliantly paired ingredients. The whole place makes you want to fall in love. We visited mid-week. Upon entering, the host and servers were warm and inviting. We had resolved to take our time, so initially it didn't bother us that the service was somewhat inattentive. As time progressed, however, our efforts to order a second round of drinks were stifled by our inability to get the attention of any server, all of whom were concentrated intently on larger parties. Eventually we got the drinks. By this point, quite some time had passed since our arrival so we asked the runner to get our waiter to take our food order. Another twenty minutes ticked by, and our concern turned to frustration. It was only after we flagged down several passing wait staff that we were finally able to order. I opted for sea bass and my date got the lamb. When the food finally showed up after what felt like several more hours, I was encouraged by its thoughtful plating. It could easily have contended for the cover of a foodie magazine. Adornments of celery leaves and razor-thin sourdough crostini suggested the long wait had been worthwhile. As we started eating, however, it quickly became apparent that everything had been sitting out at room tempurature for quite some time. My fish was a solid piece of rubber and I struggled to cut it apart. The accompanying cockles were sandy and exuded a strong fishy taste and odor. The menu had promised guanciale but it was nowhere to be seen. In fairness, perhaps it had been liquefied and therefore accounted for the briny, lukewarm dishwater concoction the fish was soaking in. My companion's Colorado lamb was gamy and overcooked. It was surrounded, purportedly, by ""heirloom"" beans that bore a striking resemblance to garden variety cannellini. Summarily, all of the food we consumed was awful, but we dared not send any of it back for fear that we would end up sitting around for several more hours. Sadly, the food and service at Monkey Bar are no match for the wonderful environment. And even by Manhattan standards, it's not exactly a cheap night out.I will not return until the ineveitable kitchen overhall.",7,0,0,Bradford O.,"Santa Monica, CA",17,30,2
4.0,11/25/2011,"A ""Killer Entrée"" away from 5 starsWhile staying at the Elysee Hotel  a 5pm reservation for the special Thanksgiving set menu for $115 per person = World Class Service.Staying  at the Hotel, all you  have to do is walk down and you are there.  My plan was to eat early and go down to Rockefeller Center to see an event at 7pm. And knowing New Yorkers eat late.  This plan worked out well.  Every dish finished,  was taken away within seconds.  Anytime I looked up, someone would be there asking if I needed anything.  5 stars on Service.The ""Bread""  is great!   If you are from Hawaii ... think,  Bravo's  Garlic Balls , with a little sweetness of Leonard's   Madasadas  , with  a bit of saltyness on top.  Wonderful  combination.  I ate way too much of these. The specialty $17 Monkey Bar martini had a familiar Hawaii flavor to it. Reminded me of  a Li Hi Mui Martini.   So, I Loved it.   Problem was I had two(2).  It was sweet and VERY Strong.  So, strong that when  back in my room (after dinner) I fell asleep and missed the night events at Rockefeller Center LOL.  But, woke up 6 hours later I felt refreshed.  :)   Next,  Winter Chicory Salad, Warm Pears, and  liked the Argan Vinaigrette.  The Duck and Foie Gras Terrine, Stewed Fruits  nice   ...   a very good start.The Entrée is there weakness imho.   My view on this is, if you are a  active yelp-er  going to all the New Hot Trendy  Restaurants with Creative TOP Chefs  there Entrée choices will not blow you away.    look at it this way ...  It's like you are watching  American Idol ,  two performers  singing a old classic   ... * One does a great job, true to the original and sounds just like it  ... * the OTHER will take that classic and makes it there own, creates something completely fresh and contemporary.    I favor this, above the other.  (and is why in Hawaii I am more of a Roy's  and Allen Wong's kind of guy)    ...  The Monkey Bar Entrée  tried  (Dry Aged Sirloin , Salmon)  though good, did not impress.    (could have also ordered Organic Eberly Farm Turkey)Now, the combo of sides that was served family style  was very Good ... Sweet Potato Puree, Oyster and Pork Belly Stuffing, Brussels Sprouts Toasted Walnuts and Bacon,   and my favorite roasted Winter Vegetables.As was the Desserts ...  Seasonal Fruit Crisp Brandy Anglaise,  and a selection of Ice Creams and Sorbets was my fav  ... the mini cheese cake and Pumpkin Pie just ok.IF,   the Entrée  could only wow me  ... this night would be 5 stars  ...  but the Entrée  failed to impress or even attempt something different.   So, as they say on American Idol , how  will you stand out?4 stars  for the restaurant  ...   5 stars for the Expensive Cocktail and  Bread.   And for the great night sleep in one of my fav NYC hotels. :)p.s.  yes it's kinda a Brooks Brothers suit place",1,0,0,Ross H.,"Ewa Beach, HI",175,66,176
3.0,11/5/2011,"I haven't eaten here!  But I've stopped for drinks several times.  Lots of well dressed business men....lots of girls that may or may not resemble hookers.  Just sayin.  Usually you stand in a cramped bar, sizing everyone up over an overpriced drink....the bartenders are cool.  Its an ok spot to meet for a drink before dinner.....may try food eventually.",2,1,1,Caroline K.,"Manhattan, NY",46,34,10
4.0,11/4/2011,"I went for a private event so this may be a little skewed but this is a great place to have a drink. it's everything you want a Manhattan bar to be - dark, mural-ed, cozy, red banquettes, champagne, face lifts.",0,1,0,Miranda R.,"KNICKERBOCKER, NY",13,313,4
4.0,9/23/2011,"This is definitely a 40+ crowd scene. Ambiance was great, food was divine and wine flows. Maybe if I go back after I turn 40, I'll give it 5 stars.",2,0,0,Morin O.,"Manhattan, NY",198,142,2
5.0,9/21/2011,"I love this place! We were a table of 10 on Thanksgiving night and everything was perfect! The attentive staff, the perfectly broiled lamb chops, the to-die-for popovers, elegant surroundings, oh-so-comfortable seating, everything! ""To eat is neat, but to dine is divine"" should be their motto.",0,0,0,Penny S.,"Picayune, MS",12,85,0
1.0,9/9/2011,"Went to Monkey Bar last night and had high expectations of a great meal. Started out with incredibly slow service with us chasing him down most of the meal. Started with the crudite which was good, sauce was watery. Then our appetizers came...my shrimp cocktail was rubbery beyond belief. I ordered the omlette special which was tasteless. My friend had to send his meal back twice and the kitchen still couldn't get it right. I felt like the chefs were on their first day of work. The only highlight was the monkey bread and having the Strip Steak taken off the bill. Would never go back.",0,1,0,Lynette B.,"New York, NY",3,36,3
2.0,9/2/2011,Needed a place to meet out-of-town friends for lunch in Midtown and liked what I read about the history of this place. The monkey murals in the bar were interesting and we had lots of time to look at them since service was so slow. The menu offerings were nothing special and did I mention it took forever to get a couple sandwiches and salads? Plus no refills offered on water/ice tea - we had to flag a waiter/busboy down for more water. And they simply removed the ice tea glasses when they were empty so we had to request more during the interminable wait for food.,0,1,0,Jetlagged S.,"San Francisco, CA",0,37,0
4.0,8/16/2011,"I went to The Monkey Bar on a Saturday night for dinner with my parents (yes I'm maximizing my time with them by going out to eat at fabulous restaurants! We're foodies!) We actually came here for a reason, they serve both Clams Casino and Oysters Rockefeller--dishes my parents love. When we first sat down, our served brought us crudites and ranch dip. I love me some crunchy veggies! Then once we placed our order, our server brought us over a pan of monkey bread! Wow. Just wow. This bread might have been better than the bread I had at One if by Land, Two if by Sea. It was so delicious--buttery deliciousness. Loved it.Then our appetizers came out (and we only ordered appetizers to start because my parents wanted to see how good the clams and oysters were before they ordered an entree). My Dad loved his Clams Casino and my Mom really enjoyed her Oysters Rockefeller. We had a heavy lunch earlier that day, so I went with their Chopped Salad which was very yummy--and a generous size! After we finished those, my Mom wanted another order of Oysters Rockefeller, but my Dad wanted to try the Lobster Thermidor. However, he was extremely disappointed. First, the lobster was too tough and chewy and second, the dish was covered in too much melted cheese. The restaurant manager was extremely nice though and took the lobster off of our bill and replaced it with an additional order of Clams Casino. My Dad was a very happy camper. We also got a side of steamed asparagus which I dominated--I love asparagus!As if we weren't full enough, we of course got some dessert, the Eton Mess--homemade whipped cream with chopped berries. It was nice a fresh and light.The service here was wonderful, our waiter was very attentive, knowledgeable, and just plain pleasant! We had a GREAT time!",1,0,0,Cindy H.,"San Francisco, CA",9,47,37
2.0,8/15/2011,"Sadly, the best things in this meal were the freebies. I was so excited to try Monkey Bar after finding out that they are one of the only restaurants in the city to serve Lobster Thermidor. My hopes were high and I didn't let the tacky pizza shop tablecloths in the bar area discourage me. The meal started off nice with some of the freshest vegetable crudites that I have had. The dip was a bit on the watery side, but these vegetables were a hit. Then the monkey bread...oh the monkey bread. It was a cross between a donut and a dinner roll and I loved it. It was dense but in that oh so good way. Monkey Bread makes me happy. Now on to the paid courses. We shared the highly recommended oysters rockefeller and I am not a fan. I haven't had it before but I don't think they were supposed to be as watery as they were. The flavor was meh and I barely finished two before letting my friend take the third one. I thought, hey maybe it was just some bad oysters...but then the lobster came. It looked ok, nicely presented in the shell, but after further inspection it seemed dry. In a nutshell it tasted like dry overcooked lobster with some cheese melted on top. Even if it was cheaper I wouldnt have been a fan. What little sauce it had was thin and watery and the flavor overall was just bad. Also, it was obvious that they prepared our two entrees at the same time in one pan, because upon splitting it into our two lobster shells, my friend got stuck with 90% mushrooms and hardly any lobster. Sloppy. At the end of the meal we wanted the peach melba (even though the meal was so disappointing we did want to end with something sweet) and at 830pm we were told they had run out. Ummm, lets just call it what it was and say that they didnt have it at all today. Disappointed we just asked for the check. We did receive some yummy chocolates that were a cross between an andes mint and a whopper candy and they were delish. Not recommended, unless you are just going there for the freebies.",1,1,1,Cynthia M.,"Manhattan, NY",351,1226,25
5.0,8/5/2011,"Monkeys falling from the sky!!!!Not really, but they obviously have mokey decor all over the place. From the walls to the light fixtures nothing but monkey business going on.In all seriousness this is a nice, classy joint located within/connected to the Hotel Elysee. I was excited to be here as it was my birthday dinner and I heard Sex & The City shot a couple of episodes here (yeah I watched the show). Our waiter definitely took care of us and made sure he went over all of the good stuff on the menu. I had a chance to check out the menu before I went so I already had my eye on the Scottish Salmon. It was really good and came with fingerling potatoes and a little spinach. Very delicious! My appetizer was the Grilled Market Vegetables which were grilled and seasoned to perfection (asparagus, broccoli and carrots included). We were so stuffed that there was no room for dessert...maybe next time.The drinks were definitely on point. One of their popular drinks is the monkey-tini, but they were out of it so I went for the next best thing....some gin drink (cant remember the name) that was off the charts taste-wise. It went down so fast taht I had to knock down another one. Definitely a good place to try if you are in Midtown Manhattan. A little pricey, but still worth the try. Note: Make a reservation (it is NY) and they dont have their main dining room open on the weekends so space is limited",2,3,3,Andre W.,"Chicago, IL",455,1766,429
5.0,8/3/2011,The Monkey bar is always a lively scene and fun place to have drinks. One of NYC's best bars.,0,0,0,Mory B.,"Manhattan, NY",2,13,0
5.0,8/2/2011,"The staff here is some of the best.  They accommodated our entire party of 12 people even though we were there WAY past closing time.The sautéed mushrooms and chicken breast are wonderful as is the bread they bring to the table.It's full of booths, so it's a great place to bring a group of friends and get cozy.",0,0,1,Dan K.,"Chicago, IL",48,192,8
5.0,6/27/2011,"This is really a 4.5, but if I have to choose I'm giving Monkey Bar a 5. We came here for my husband's birthday, and it was a fantastic choice! We definitely go for that old New York charm (think Cafe des Artistes) and traditional but excellently prepared cuisine, and Monkey Bar fits that bill.  The decor is quite interesting -- while sitting at the bar waiting for our party to arrive, we learned from a very friendly bartender that the murals in the barroom are original from the early 40s.  The mural in the main dining room is pretty awesome as well, and you can spend a fair amount of time trying to guess who's who on the walls. I also loved the setup of the main dining room -- the individual round tables makes it feel very private even when the place starts to fill up.Now onto the most important stuff -- the food! The monkey bread they bring out is warm, moist, and just plain delicious. My mom and I shared the fried green tomatoes with feta and the grilled veggies with crispy polenta to start; both were good but the fried tomatoes really stood out.  The birthday boy had steak tartar and thought it was well-executed.  For my main course I went with the chicken paillard, accompanied by a lovely arugula salad with lemon and a side of creamed spinach (a personal fave, and done nicely here).  My husband had the lobster thermidor, and is still drooling over it days later. I don't eat seafood, but if you do, this is clearly the way to go. Dessert was also pretty excellent -- the Eton Mess was a mash of berries and meringue and the apricot-peach sorbet was a refreshing way to end the meal.All in all, this was just a completely pleasant dinner: great food, great service, great atmosphere.",1,0,1,Marisa F.,"Mamaroneck, NY",96,452,50
2.0,6/16/2011,"Nice decor but in the famous words of Shania Twain - that don't impress me much. Came here for work lunch and started promisingly with the bread and butter which just melted as soon as I put it in my mouth. Delicious no doubt but unfortunately it got pretty bad from there. Ordered the lobster roll which didn't taste fresh or good.  The fries were just bland. Even after I put a fair amount of crushed pepper, I couldn't get much flavor out of them. Thank goodness my lunch was being paid for otherwise I would be extremely angry about pissing away $26 on a crappy lobster roll platter.",1,1,2,Wahed K.,"Astoria, NY",680,778,1618
5.0,6/13/2011,"My tummy is still singing from memories of this place.  I like sweet drinks so the waiter suggested the monkeytini, which was fabulous!  I highly recommend.    A host dressed impeccably in a nice black suit appeared to discuss wines with us.  He recommended a few to go with our meals and suggested we sample and decide when our main course came, which we did.  Monkey bread was brought out as an appetizer.  Yum yum.  Warm, sweet, hot rolls with butter.  I  had the lobster thermador.  It was huge, succulent, and delicious.  Hands down, the best lobster I've ever had. My friend had the steak delmonico with fries.  We both polished off our plates.  For dessert, we had the recommended sticky toffee pudding.  Loves. it had a fantastic taste and textures to it.  Soft in the middle, a little crunch to the top,  and Ooey gooey goodness on the bottom.  Two thumbs up.  The atmosphere was lovely as well, with dim lighting and soft jazz music playing throughout.  I felt as if I were in a time warp and should be wearing a long slinky red dress.  The walls were painted throughout of musicians and inspirational characters of the jazz era.  All in all, a fabulous and memorable experience.",2,0,0,Jennifer H.,"Los Angeles, CA",165,73,2
5.0,4/4/2011,"the entrance is really tricky. you can either come in from the hotel or the door next to the hotel door.went here meeting some friends and the decoration looks sooo beautiful, especially those roses and candles~~~lovelysome cocktails are pretty strong, for like Manhattan. be careful if you don't link dry stuff.",0,0,0,Grace G.,"Manhattan, NY",0,46,0
2.0,2/28/2011,"Though Patricia Yeo's menu makeover at this city institution received some of harshest reviews of the year, we actually liked it a bit. The real problem here was the service, so bungled that you wanted to sic Gordon Ramsay on them. We counted 10 different servers working our table, and none of them did it well.",0,1,0,Maison L.,"Manhattan, NY",0,28,0
5.0,1/3/2011,"Superb food, Excellent service.  You cant go wrong here.",0,0,0,Virginia M.,"Charlotte, NC",93,72,6
3.0,12/17/2010,I went to the Monkey twice in one week! The food was good but needed a little more seasoning for my taste maybe a spice or two.  The tuna and the steak tartare was excellent and the Lobster was delicious! I was treated amazing the first night and the second night not so much due to a waiter who seemed as if he couldn't handle the pressure. But he was kind. Michael the maitre D was Friendly and made sure that you had the best experience in his control. Overall I would recommend this place to any and ALL who are looking for a wonderful upscale but not too upscale restaurant,0,0,0,CECE S.,"Brooklyn, NY",0,5,0
5.0,12/8/2010,"I've been too busy meeting with clients and watching them pound back beers at the Perfect Pint to eat dinner. Now it's 10 o'clock and I take the E train back to my hotel. Walking down 54th Ave., I have an epiphany...Oh yeah, Lobster Roll at the Monkey Bar!Christina, a great bartender, always remembers me, even though I'm only in town a few times a year. The $4 Diet Coke is always pricey, but it does come in these cute little bottles. I bring them back each time to my kid who fills them with vinegar and peppers for Holiday gifts.OK, Lobster Roll. Hugh chunks of meat filled into a perfectly light toasted roll with just a bit of mayo and topped with Bacon! Fries, a really tasty Red Cabbage Slaw, and two classic Dill Pickles make a great supper snack!I considered the Sticky Toffee Pudding or the Coconut Cake, but decided to save that thought for another time. Now that I'm writing this Yelp, I know I fu*ked up and shoulda ordered a desert!Next month.",2,1,1,David N.,"Berkeley, CA",191,1316,1529
3.0,11/2/2010,"Seems to be more trend then quality.  I got the special of the day, pasta and meat sauce.  Wasn't bad at all.  My friend got the salmon which he said was tasty but too small of a portion.",0,0,0,Christopher J.,"Baldwin, NY",30,13,6
3.0,10/11/2010,"I miss Divine Bar West, but this is cute. Good wine selection for a sports bar.",0,0,1,Lorelei D.,"New York, NY",61,1184,1172
4.0,9/19/2010,"We just wanted to talk and have a bite to eat. I had heard Monkey Bar was a good place and we lucked out by walking in at 7:00 pm to find an open table. We sat, asked questions, placed the order and waited for food and drinks. I should add, while you are waiting look around and find how many ways monkeys are portrayed: lots of fun. Anyway, our food arrived and it was just as described and tasted great. If you have room for dessert, try one, it was a nice size for us to share.",0,1,0,Stephen C.,"New York, NY",127,339,1
