rating,time_created,text,useful,funny,cool,username,user_loc,user_friends,user_reviews,user_photos
2.0,9/3/2014,Service left a lot to be desired. The guy who came in after me got served before me. Maybe cause he ordered a drink. It's taken me over an hour to have an appetizer and a main course on a weeknight. That's absurd! I wonder how long it will take to deal with the check.I enjoyed the food but the service is killing me. Check just arrived!,0,0,0,Marty E.,"Brooklyn, NY",45,17,2
4.0,8/27/2014,"This is a great place to come with friends. Great décor, nice bar(seating limited for bar),multiple restrooms up and down. Food is pricey but decent. Its got a good vibe and has multiple levels.",0,0,0,Douglas R.,"Raleigh, NC",81,7,0
1.0,8/20/2014,"Went here with clients tonight.. The service was terrible and the food was lousy.Two of us returned our steaks 3 times for it being ice cold, wasn't asked if we wanted another drink and was ignored most of the night..  I guess my money wasn't good here. $200 bill and lousy experience.  I won't be going here ever again.",0,0,0,Brian I.,"Manhattan, NY",82,7,0
4.0,8/11/2014,"Came here for restaurant week and got duped (by my stomach) into trying other non restaurant week menu items instead. Stuck to small plates so I could try more things and did not regret that decision. The tuna tacos and yellowtail appetizer were by far my favorite- I probably could have eaten 40 tacos if they had been in front of me. Sadly, even after reading reviews for watery drinks- I panicked when the waiter came and ordered some sangria. If you like fruit infused water with a splash of wine then this is for you, if you like something a little fuller, go for a wine. I thoroughly embarrassed my dinner date with a birthday surprise and the staff was so great about being sneaky so it went off smooth as glass. Chocolate and churros on the house + happy birthday written in chocolate on the plate = me looking like I really outdid myself on the birthday front. Bottom line: great food, stick to wine, birthdays here are fab.",2,0,1,Christi Y.,"Reno, NV",32,74,11
4.0,8/7/2014,"Came here for Restaurant week. This place is huge and seemed popular considering it was packed at 7:00pm on a Friday night. Didn't see the actual menu but the restaurant week menu was interesting. I had Crudo for the first course and it was nice. Branzino (Roasted Sea-Bass) for the second course was just ok. My friend had Crispy Tofu and was raving about it. I had an acai berry cocktail which was definitely strong (which is good), but was so sweet that it gave me a headache. Should've stuck with Sangria.The basement has a huge bar and seems like a nice place to hang out casually with friends. But then again, who would want to be stuck in the basement in summer when you should be soaking in the light on a NYC rooftop. Overall, I'd say it's worth it.",0,0,0,Fido D.,"New York, NY",0,25,0
3.0,8/6/2014,"Came here for lunch during restaurant week.  Staff was friendly, restaurant is HUGE and beautiful.   We had the Thai chicken empanadas, salmon crudo, Branzino, and Peruvian roasted chicken.  The appetizers were absolutely delicious.  They. Pulverized kept the empanadas and salmon coming and I would've been content.  The main courses were just ok.  I've personally never been wowed by Peruvian roasted chicken.  Had it at Pio Pio, and I was like the wayans brothers from In Living Color: "" hated it!""  I'm  Hispanic and the roasted chicken from Caridad tastes better (don't judge me!).   Hell, I make a better one.  Anyway, their regular menu looked yummy so we may come back and try some of the other stuff.  I mean, achiote hoisin pork stuffed arepas?  Now you are messin' with my emotions.",0,0,0,Olga H.,"Bronx, NY",12,128,74
3.0,7/31/2014,"RW 2014 weekday dinner:Got an 8pm reservation for two pretty easily at the last minute on Opentable. Expect to see droves of suits here as it's located in midtown. There's a cool library bar downstairs. Ambiance is suitable for a date, groups or just friends! We saw all types here.The appetizers were the best part of the meal; we had the very fresh crudo and toasty thai chicken empanadas. The chicken and branzino were huge entrees and good, but not as impressive. I enjoyed my dessert of peaches & cream tres leches, very moist and light.The drinks were tasty too; my friend's tamarind margarita made me feel like I was vacationing on a tropical island. Service was spot on and attentive!",1,0,0,Melissa C.,"Seattle, WA",110,622,331
3.0,7/31/2014,"The food was ok and the ambience was excellent. If the food was any better would have given a four star . I got a tofu dish and salad as an appetizer both were average ,  the tofu was bit too soft. Good for a group of people.",0,0,0,Jay R.,"ASTORIA, NY",14,66,4
3.0,7/29/2014,"Experienced zengo during restaurant week --As far as the food, it was actually great with good choices for the rest. Week menu. For an appetizer I chose the Thai chicken empanadas which was DELICIOUS. Good coconut curry flavor and good portion of two pieces. The entree was okay - I had the hangar steak. It was a bit tough and sweet but the mashed potatoes it came with were really creamy which I liked. For dessert, I tried both the miso mousse and the peaches and cream tres leches. Both were baked well.  A bit sweet if you are a sweet tooth. Drinks were on point. I suggest the white sangria. Decor of the restaurant was amazing with a beautiful inside out chandelier and high ceilings. What sucks is ... When we went to pay the check and split it EVENLY amongst 8 credit cards, who seemed to be the manager, insisted that two was the max and gave immediate attitude saying it would override the system. I've never heard of this esp for an established restaurant and he finally agreed and said it would take ten mins. He was rude and unnecessary.",2,0,1,Danielle T.,"Port Washington, NY",446,405,113
3.0,7/27/2014,"It was restaurant week, but I did not take advantage of the restaurant week menu (although the other 3 in my party did, so I got to taste everything). The CHICHARRON DE CAMARON was the best appetizer. I personally ordered the Zengo Roll to start which was very tasty, but seemed a little small to me. As for the entree, the Korean Fried Chicken was surprisingly AWESOME. It was so tasty, tender, crunchy and had a nice spicy flavorful kick. The entrees that my friends had were all average. We got the Peach Tres Leche's for dessert and it dissolved in my mouth with each bite. Delicious! I left wanting more. I would definitely say this is more of an ideal place for drinks/apps/dessert in a hip ambience, so you may want to skip the entree, unless its the Korean Fried Chicken :-p",0,0,0,Yasmine T.,"Union City, NJ",29,18,17
2.0,7/18/2014,"After a few drinks downstairs at Biblioteca, my friends and I wanted to grab a bite to eat.The waitress informed us that there were no tables for another hour. Meanwhile, there were TONS of tables open. She was not nice about it or accommodating at all. I highly doubt all those tables were reserved and even if they were, she could have been nicer about it.",2,0,1,Michelle B.,"Huntington Station, NY",816,1320,3063
4.0,7/16/2014,"Great place for drinks and appetizers after work.  White sangria was really good, as were the chicken empanadas, the arepas with pork, and the duck confit tacos.  The crab guac was just alright, in my opinion.Got 4 appetizers for the two of us and it was more than enough food to fill us up.The decor and service were both pretty good, and it wasn't too crowded right after work, so we were seated immediately at a big comfortable booth.Overall a fun and delicious experience.",1,0,0,Ainsley B.,"New York, NY",95,139,115
5.0,7/12/2014,I came to this restaurant with a bunch of my colleagues just to check out the scene. I was highly impressed with the staff and food that they served. The hostess who attended us was very hospitable and kind. Our server was also very accommodating and patient. I will definitely come back again for the short rib flatbread and churrasco steak!!! (Highly recommend it),0,0,0,Steven H.,"New York, NY",0,3,0
3.0,7/7/2014,"The service is worth two stars, thank god their food is good! I've been here for drinks with coworkers in the past and we've always sat upstairs or downstairs, never the main dining room. We wanted to do a quick dinner so figured this would be a decent option since it's next to work. The food and service was soooo slow that an appetizer + two entrees + dessert turned into a two-hour ordeal. It was also pretty packed for 7pm and the only tables that were left require you to be super skinny to navigate. Prices are expensive. I would not have come if it weren't for the Travelzoo deal that is going on (or happy hour specials). Maybe we'll stick to apps only next time.Food wise, the edamame was good. I love cheese bread, so the shrimp buns were pretty good. The tagalong style churrasco steak was pretty good. The included sweet potato was nice and crispy on the edges. The deconstructed key lime pie was not bad. They quickly brought a change of plates and utensils for the dessert. Had they not, I would've double guessed whether I did order dessert yet since it took forever to arrive.",0,0,0,Irene H.,"New York, NY",207,1190,366
3.0,7/7/2014,The food is not so great as you might expect from that place. Drinks are nice but watery.,0,0,0,Kiera G.,"Manhattan, NY",3,29,3
4.0,7/1/2014,"Went with a friend on a Tuesday night...very easy to get a table without resos. We started off with some drinks (the white sangria was great)As for the food:The charred tuna tacos- great!Crab guacamole- excellent, the best item of the night!Chicken empanadas: okay",1,0,1,Anjali P.,"San Francisco, CA",54,100,128
5.0,7/1/2014,"It was an amazing place. It's a great place just to enjoy a meal and relax after a hard days of work! We got the angry zengo Sushi roll which was good. Next we got spicy crab guacamole,tuna tacos and the chicken empanadas. These items were amazing! I really liked the guacamole and the tuna tacos! The margaritas are amazing especially the tamarind and the white sangria was good.definitely a place i would recommend !!",0,0,0,Chandni P.,"Chambersburg, PA",18,21,2
5.0,7/1/2014,"Awesome experience. Very comfortable and unique decor. Great service, great drinks and great food! What else would you want..... I will definitely return very soon. If you're in midtown NYC, give it a try, you won't be disappointed.",0,0,0,Jeff S.,"Englishtown, NJ",0,4,2
5.0,6/21/2014,"Holy beautifulness ... the ambiance of this restaurant is uniquely gorgeous! The husband and I got into New York a little earlier than expected, which we hadn't had any dinner places planned in case our flight was delayed. We went back and forth on where to eat and eventually decided on Zengo. It was the best selection we made!This place is a ""share your food with friends/family member/date"" sort of place - portions are smaller compared to other places, which we didn't mind at all (who wants to haul leftovers along when you've got a ton of other cafes/food trucks/coffee shops/restaurants that you want to try?)! Our server was so friendly and made our first experience in New York and absolute pleasure.We'll definitely be coming here the next time we make our way back to the city!",0,0,1,Dianna D.,"Bridgeton, MO",7,17,2
4.0,6/20/2014,"Great tasting food, friendly waitress, awesome cocktails and beer choices. Came for lunch and enjoyed the experience. Would definitely come back.",0,0,0,Amanda R.,"Winter Park, FL",9,5,10
2.0,6/18/2014,"So we came back for the third and last time...the hostess said we cannot sit at a particular table( nobody sat there the whole time) and the completely indifferent server did not help. Ceviche and sushi rolls are not great, my husband's steak was well done (he asked for medium). The scallop dish was okay, but left my sister hungry. All this for $250+, no thanks, not again.",0,0,0,Victoria B.,"Dobbs Ferry, NY",65,36,5
2.0,6/16/2014,We had outstanding service here from a waitress who could not have been nicer.  The decor is fine but could be better.  The food was the real disappointment.  The fish tacos and sushi rolls did not have fish that seemed as fresh as I would like.  The shrimp dumplings were fine.  I though the food should have been better.,0,0,0,Melissa C.,"Manhattan, NY",14,117,50
5.0,6/14/2014,"This restaurant is simply amazing. The ambiance, the service, and food are all over the top! The server was very attentive. The runners were very nice as well. My gf had the Korean fried chicken which came with a very tasty potato salad and slaw that was cut to look like Chinese noodles which was very good as well. We had sushi (Volcano) which was so nice we had to have it twice! I had the steak, which was cooked to perfection and had some type of sauce on it that was mucho tasty. It came with a delectable salad and what they call sweet potato tostonaes, which was actually sweet potatoes shaped like fried plantains. Everything on the plate was delicious. We ended it with Churros, which came with an excellent chocolate sauce. Now, we had Japanese (Sushi), Korean, (chicken), Cuban (I believe) (steak) and Mexican (Churros) all at the same restaurant! Excellent Asian & Latin cuisine without leaving NYC! Three floors with bars on each, ok I'm done. Just go already! Buen provecho!",0,0,0,D H.,"Bronx, NY",1,5,0
4.0,5/30/2014,"Have been to Zengo several times, most recently for dinner.  First impression is positive if you expect a fun, lively restaurant.  The space is huge - with large, open main room and dark, festive, loud atmosphere.  The food is generally very good and recommend trying more small plates.  Specifically,- Angry Zengo roll was great and we wanted more- fluke ceviche was fairly good but small and wish more seasoned- tuna taco was delicious- duck taco was flavorful and unique dish- Chicken pad Thai, varying opinion as noodles had untraditional flavor.- mixed views of drinks as some were too sweet.  Best was the spicy Margarita.Biggest negative was the exceptionally, rude hostess but wait staff and bartenders were friendly",0,0,0,Bill C.,"New York, NY",0,57,8
1.0,5/30/2014,"The space is super-interesting and enormous inside, but the food tasted like we were eating at a fast-food place and the service was awful.  Will not be back.",0,0,0,Adam L.,"New York, NY",1,13,2
1.0,5/20/2014,"This place sucks. Nothing like the one in Santa Monica. Happy Hour only at the bar, which has maybe 10 seats, if that. No standing allowed. No air conditioning. Just all around not good. Decor is nice. But I will never come back and won't recommend it to anyone - I thought it would be like the one in Santa Monica.",0,0,0,L K.,"Los Angeles, CA",1,67,1
1.0,5/19/2014,"Salty, processed food. Not much different than PF Chang's. Don't waste your money or appetite :(",0,0,0,Visitor F.,"Manhattan, NY",0,2,0
4.0,5/15/2014,"Place is beautiful , top floor is amazing and food is great .La Biblioteca room so nice and they have so many Tequila )))The food was better than I expected!",1,0,0,Leila M.,"Edgewater, NJ",871,27,41
3.0,5/13/2014,"My friends and I originally intended to go to La Biblioteca for happy hour but they were closed for a private event. So we ended up at the upstairs bar. Eventually we got a table downstairs. The margaritas are just as good and there are a few more food options than downstairs. The flatbreads are really good and I liked the churros a lot. But the atmosphere is definitely better downstairs. So I suppose if you're coming with a date, go downstairs but if you're looking for happy hour with coworkers or friends then try to nab a table at Zengo.",0,0,0,Ryna D.,"New York, NY",227,1549,2438
3.0,5/13/2014,"The food was better than I expected! But the service sucked..my friend ordered a salad and mentioned to the waiter that there was no dressing and he glanced at it and replied ""yes there is.""  Clearly there wasn't. He could have apologized or offered to add dressing in the kitchen and just bring it back out.  That would've solved the problem. So easy and simple. Too bad I forgot his name.",0,0,0,Joanna K.,"Manhattan, NY",169,23,23
1.0,4/19/2014,"I went to Zengo back in January with 3 friends. Fortunately, I mean unfortunately, everything is very fresh in my mind as if this meal had taken place this week. The place was freezing and we had to keep our heavy coats on the whole time. It was happy hour and we reminded the waiter of that fact. He would not honor it because he said that we had to stand by the bar area. I can see how that would normally make sense but on a day when the whole huge restaurant was quasi empty and the place was below 50 degrees, I would have recommended some flexibility. Two of us asked for our soups first I.E before the appetizers, so as to warm up. We both received them after the appetizers. Nothing was great. Most was mediocre at best: the empanadas, the various tacos, the various flatbreads, which were lukewarm.  Our main waiter was not engaged. He paid no attention to what we said. He seemed depressed. One of my worst restaurant experiences.",0,0,0,Patale M.,"Berkeley, CA",1,128,0
5.0,4/16/2014,"This place is AMAZING. They change the food every few months to keep it fresh and change the ""fusion"" part. Great bar downstairs for after work.",1,0,0,Rebeka B.,"New York, NY",28,24,0
3.0,4/10/2014,"The food was delicious, but I would only return for the apps and specialty margaritas.  The entres are way over priced for the portion that you receive.",0,0,0,Jarrett S.,"Town of Smithtown, Long Island, NY",0,5,0
2.0,4/8/2014,"Zengo occupies one of Midtown's best spaces, from the cavernous and dimly lit Tequlia Library to the cast iron windows, unfinished pine and bonsai trees that fill the main dining room. It looks wonderful more than five a decade after opening. Food culture moves faster than any interior design, and what is served in this wonderful space now seems tired. This place opened too late for the height of Asian-Latin American fusion and unfortunately hasn't been able to revive this largely forgotten cuisine category. Let's start with the sushi, with is always a risky proposition at a place without a dedicated sushi chef. These are essentially Japanese-American creations, with the Angry Zengo a spin on a tuna roll, the vegetariano a California roll and the volcano mostly salmon. All three a covered with a thick, heavy Chipotle aioli (read that 'spicy mayo' you get at any Chinese-run neighborhood sushi spot). They are heavy and seem to be using the strong sauce to hide less-than-ideal ingredients.Ceviches also fail to pass muster. The scallop ceviche is actively quite bad, a mix of flavors that manages to recall dish soap more than flavor of Peru or Vietnam. The fluke is merely mediocre.The menu is better away from the sea. Potstickers have a thin, slippery skin and come with a red chile sauce. Duck confit tacos let the moist meat do most of the work. And best of all, a thai chicken empanada takes a pretty authentic green curry and pairs it with some salty Oaxaca cheese.The food might not be notable, but I did recently host an event here for around 150 people, and the staff did a really bang up job with the arrangements. The bartenders, especially those downstairs, really know their tequilas and mescals. This would be a great place for an after work drink or two, maybe even a well selected appetizer on these side.But sorry - there's just no reason to come a fusion restaurant in the year 2014 and order a $34 piece of cod unless it's on the Las Vegas Strip.",0,0,0,Jon S.,"Brooklyn, NY",128,647,1
4.0,4/8/2014,Came in for drinks a couple of weeks ago and loved it! My friend and I started upstairs on the main bar and then finish at the Bibloteca. The staff is friendly and the food was great! Will return.,0,0,0,Leslie L.,"New York, NY",2,6,0
4.0,4/4/2014,"I came here with my girlfriend for dinner and was very pleased. When we got to the restaurant the hostess was very kind and sat us within minutes of our arrival. We had never been here before and were pleased that the menu was a combo of Asian and Latin --- very good combo. We started off with a pitcher of their white sangria which tasted like a combination of fruit juices and had barely any alcohol. We did get 3-4 glasses each which was nice but would've been nicer if we got the little extra alcohol we'd asked for. We ordered several appetizers so we could taste a little but if everything. Crab guacamole, volcano sushi roll, short rib flatbread, pork arepas, and wonton tuna tacos. All were great! Our waiter was also extremely well versed with the menu and very Helpful when we were deciding what to order.",1,0,1,Matthew D.,"Newark, DE",466,5,10
5.0,3/31/2014,"Went there three years ago, and couldn't help thinking of going back sometime. A very chic restaurant and love the high ceiling lofty feel. Food & drinks were very creative and delish too. Awesome restaurant. One of my fav.",0,0,0,Sammi G.,"West New York, NJ",3,45,2
4.0,3/29/2014,totally delicious tamarind margaritas...come here for happy hour and try all the lovely bites.,0,0,0,Jeanette R.,"Mercer Island, WA",123,183,65
4.0,3/28/2014,"Delicious food, amazing drinks, beautiful ambience and friendly staff. Expensive but for once in a while it's fine. Place is huge!!!",0,0,0,Gina A.,"Manhattan, NY",182,278,1
5.0,3/22/2014,"Had a great dinner here last night for a friend's birthday. The appetizers were really the best part of the meal, all very unique and delicious. We shared the pork belly sliders, thai chicken empanadas, duck confit daikon tacos and spicy jumbo lump crab guacamole. I would also highly recommend the Zengo fried rice. In terms of the space, the interior is beautiful and accommodates a lot of people so it's great for groups.",0,0,0,Melisa K.,"Alhambra, CA",10,28,21
5.0,3/16/2014,"Epic!  Since I am the worlds only producer of Thai Chicken Pierogis (Asian and Polish) Zengo tempted me with a fusion concept I couldn't resist; Asian and Latin.  Was grateful to be on the road with the boy as well as the bride so the dinner voting bloc swung in my favor. In honor of their outstanding deconstructed  key lime pie, I'll approach the review from a reductionist perspective.  Ambience:  Simple dark wood tones in the seating and overhead structures contrasted with wrought iron window panels and light fixtures provide a setting that is light enough for business, yet dark enough for a romantic dinner.  Serving dishes were suited to the environment as well.Service:  Excellent, attentive and helpful without being overbearing.  Suggestions and recommendations were well thought out.  Food was served with a sense of timing, allowing enough space for conversation but so much as to have to search for topics.Appetizers:  only had the Thai Chicken Empenadas.  A complex filling of chicken and vegetables  minced with fresh cilantro, inside a flaky but substantive crust drizzled with a peanut sauce.  Even the bride who normally does not partake of such things tried a bite (and ten two more)Entrees:  Easy one first, the bride had the Give 'n Take Chicken Salad as it was deemed the safest item on the menu in terms of spice and surprises. The real surprise though is that even this simple concept was unique and delicious.  The walnut and ginger treatments were awesome.  Highly recommend.The Boy had the Tagalog Style Churrasco Steak which came with sweet potato bites. Steak was excellently prepared and flavor fully spiced and exceedingly tender.  All else was good as well, but if u ever come back, this is the dish in my sights.I ordered the Korean Fried Chicken; it was really good but not as over-the-top outstanding as the other two entrees.  Crisp, juicy with subtle spicing in the breaking when I was expecting (and hoping for) a bit more.  The unique tangy pickled chayote slaw that came with his was awesome as was the corn potato salad.  Really enjoyed their pairings.Dessert:  between us three, we sampled the  aforementioned key lime pie and the Borrachito.  If you order only one thing, make it the deconstructed pie; subtle twists and a unique presentation make this a must have.  The Borrachito is recommended for those familiar with Mexican chocolate cakes, looking for their fix and still want to be surprised by additions like the white chocolate cappuccino mouse.  Excellent presentation and almost a shame to start smearing the contents around to catch the syrup, but you got to do what you've got to do.Sake bar upstairs, tequila bar downstairs and excellent dining on the main floor.  Don't miss it.",0,0,0,Bob S.,"Grand Blanc, MI",39,210,36
4.0,3/14/2014,The food is very tasty but the portions are small.  I was there with a friend and we had to order 5 of the small plates to feel satisfied; equivalent to a $35 dollar plate each.  The ambience was very nice and our server was excellent.,0,0,0,Lucy A.,"New York, NY",0,21,0
4.0,3/12/2014,"Came here for restaurant week with friends and the menu was very interesting! The fusion dishes look really cool and the Tagalog style steak was delicious! The sorbets were really sour, but my friend got the rice pudding, which was really delicious! Definitely a must-go to try out the diverse and interesting menu!",0,0,0,Erina W.,"Brooklyn, NY",165,343,188
