rating,time_created,text,useful,funny,cool,username,user_loc,user_friends,user_reviews,user_photos
4.0,4/30/2019,"SUCH great food and such a creative innovative menu. I wanted to try it all, but I'd have to particularly recommend the hoisin pork arepas, Thai chicken empanadas, and the asparagus tempura roll. My only complaint is while the drinks were creative and delicious, they were a bit weak. It's definitely a little pricey, but worth it for a special occasion. More on instagram @hangryinthecity",0,0,0,Molly B.,"New York, NY",112,68,53
5.0,4/27/2019,We were a table of 11 for brunch on a Saturday in the 2nd floor. We got there late but David and Adrian were beyond amazing. We got unlimited booze and food for 2 hours. They helped us pick and made sure we had both booze and food at all times. Best brunch ever truly a great experience with Amazing service. If you're coming in a Group come here and let David & Adrian take care of you!!! You will not regret it !!!,0,0,0,Brigitte T.,"DC, DC",227,1,0
5.0,4/27/2019,"Great atmosphere, delicious food and friendly service. Adrian was our server and he really made us feel welcomed! Thank you!! 5/5",0,0,0,Catherine V.,"Cleveland, OH",170,3,0
4.0,4/25/2019,The admin staff went here for lunch (my 1st time) and the service and food was good. The ambiance was excellent.,0,0,0,Kwala M.,"New York, NY",0,1,1
5.0,4/23/2019,"Came here with my girls for Sunday brunch. amazing service - ""Andrew"" was our waiter. The tapas were also amazing; we were able to try a little bit of everything. A great brunch spot for bottomless brunches! I would definitely come back here again. The atmosphere was absolutely stunning as well; I love the decor!",0,0,0,Joey R.,"New York, NY",92,139,895
3.0,4/22/2019,"This review is for weekend brunch. The hostess were amazing in adjusting my reservation at the last minute, my party was less than 2 people I originally reserved for.Service was good given the brunch unlimited food and drinks brunch sitch. He was able to check in with us from time to time to see if we want to order additional items and refill our drinks. Athough, we have to re-order some of the items that did not come out from previous order, its an oversight that my party did not mind.Onto the food. Oh boy, most them comes out 2 mins after ordering them. Yes, they were efficient, but none of the food came out hot. None of the brunch item came out stellar. Everything was just ok. And for the drinks, was just ok too. not too bad but not good either. They refill drinks from a huge pitcher which is sitting from the server's stations, not stirred so you either get mostly juice or alcohol.The concept of unlimited boozy brunch was good bec who doesn't love a brunch in NYC? But I hope they will reconsider some of the reviews and improve on certain situation before I consider going back or referring other patrons.",0,0,0,Jordan C.,"Meatpacking District, Manhattan, NY",95,6,0
4.0,4/18/2019,A little pricey but food tastes pretty good. Great date spot. Get the mango mai tai and Thai chicken empanadas. I was blown away by the salmon!! Short rib noodles were also good albeit portion was a little small. Bill came out to be about $100 for two people with drinks and app and mains.,0,0,0,Catherina L.,"New York, NY",715,115,218
5.0,4/15/2019,"Go Adrian! Best bartender in town. The flatbreads are especially delicious, just a heads up ;)",0,0,0,Samantha C.,"Washington, DC",394,9,0
5.0,4/15/2019,"Came here for happy hour and had the best service! Good deals for good drinks and yummy appetizers. Great atmosphere, but what made this place amazing was the bartender - Adrian was so accommodative and friendly, really recommend coming here!",1,0,0,Oriana B.,"Bronx, Bronx, NY",0,3,0
3.0,4/8/2019,"I am not sure what type of brunch situation you are looking for but I will share what type of experience Zengo provides.  It's a bottomless food and drink spot and their bottomless duration is 2 hours.  I will say that I have been here before a couple of years ago and I have noticed have been some changes on the menu in terms of portions (like the Korean Fried Chicken).  The first round of food was luke warm but I am assume some is the food is already prepared.  There was a time I requested hot food such as for my dumplings and my server did meet my request.  The bread pudding that was on the menu was cold and I am not use to cold bread pudding.  I will say this is the perfect place for group brunch and I highly encourage recommendations.  My server, Natalie, was the bomb. Right when I thought my glass was getting empty Natalie was on top of it. The reason I gave them a 3 instead of a 5 is because I feel like a lot of the food was luke warm.  I understand this was out of the control of the server but no one wants luke warm food.  I understand when bottomless comes into play of brunch experience sometimes things have to compromised If I could rate my server alone she would of got 5 for her service and for the restaurant it would of been a 3.",4,2,1,Dominek T.,"New York, NY",562,339,583
4.0,4/7/2019,"Food is delicious. Could play better music though. I went with a few girlfriends for brunch. Everything taste great, the drinks are good but won't get you buzzed.",0,0,0,Tiffy S.,"New York, NY",36,16,8
5.0,4/7/2019,"This was an amazing experience. David was THE BEST server I've ever had. I will definitely return as soon as possible. The food was tasty, the ambiance was calm, the drinks were DELICIOUS, and the customer service was top of the line. Can't wait to return.",0,0,0,Shaquawn P.,"Staten Island, NY",0,5,3
5.0,4/7/2019,"We came for my sister's birthday! Our server David was very friendly and accommodating! When I let him know about my food allergy, he made sure there was food that I could eat!",0,0,0,Chelsea C.,"Brooklyn, NY",192,2,0
5.0,4/7/2019,Went here for a birthday brunch and my experience was great. Our server David was so attentive and explained everything before we ordered. Did the two hours bottomless and I have to say we left feeling phenomenal! The food was great (family style which I love because I got to try a little bit of everything) and there was SO much of it. Drinks were strong (and kept coming!) Will definitely be back!,0,0,0,Shaniece M.,"Brooklyn, NY",34,13,2
5.0,4/6/2019,I had fun in this place. The food is amazing. The service is impeccable especially if you're served by Maria. She handled our table well and make everyone happy.,0,0,0,Andrew M.,"Clifton, NJ",1,1,0
5.0,4/6/2019,Always a great experience coming here. Food is fantastic! Service? Awesome!!!! Maria today is the best. She's like she know what we want. She is awesome!! Can I give more than 5 star? Hahaha coz i will,0,0,0,Eunick A.,"New York, NY",0,2,0
5.0,4/6/2019,This is my second time here for brunch. Bottomless food and drink for 2 hours is a great deal. Food is yummy and drinks are on point. Our waiter Alberto was the absolute best! Can't wait to come back,0,0,0,Victoria P.,"New York, NY",9,11,33
5.0,4/6/2019,Just left brunch today.  Drink and food were dope.  Can't get enough of the guava mimosa.  Even though they were super busy the service was on point.  Natalie was our server and our glasses were never empty.  All the staff were super accommodating especially the managers Stephanie and Amauris.  Definitely will be back.  Can't wait to check out happy hour.,0,0,0,Monica L.,"New York, NY",133,1,0
5.0,4/5/2019,"First time I checked it out , loved the vibe inside and great drinks. Staff was very friendly and would come back again .",0,0,0,Danny S.,"Union, NJ",26,6,1
5.0,4/5/2019,"I have come here for happy hour after work multiple times. Love the venue and their menu, 3 different floors and atmospheres. The margaritas and the food are great. Adrian at the Zengo main floor bar is awesome, friendly, terrific service and makes really good drinks. Biblioteca downstairs is also really cool, depending on the vie you want. Highly recommend all around",0,0,0,Javier O.,"Manhattan, New York, NY",0,2,1
5.0,4/4/2019,"Zengo, meaning ""give and take"" in Japanese, is a fusion of Latin-Asian styles and flavored dishes. I tried the Chili ShortRib Empanada which was Malaysian puff pastry filled with beef short ribs, chili coconut & ginger served with cilantro sauce & pickled vegetables & Balinese Chicken with grilled corn salsa, pickled chayote & coconut broth.Everything was Absolutely delicious!  The chicken was tender & flavorful Everything paired so well together & was a great portion",0,0,0,SamBam C.,"East Elmhurst, Queens, NY",2,47,115
5.0,3/30/2019,Had a birthday party here for my friend and David and Julio were amazing!!! Thanks guys!,0,0,0,Nina 9.,"Los Angeles, CA",8,4,1
5.0,3/30/2019,"Adrian was very helpful and his personality was the best.  He took his time to explain the menu to us and his recommendations were on point. His service was great, he always made sure we were ok Or checked if we needed assistance. I will definitely return just because of him. If you ever stop by, ask for him.",0,0,0,Justin M.,"Sun Bay South, Tampa, FL",546,1,0
5.0,3/30/2019,David and Julio are very nice . I love their attitude they are so cool !!! Best service,0,0,0,Earvina E.,"Brooklyn, NY",25,1,0
5.0,3/30/2019,My experience at Zengo has been great from the entry. David and Julio were attentive to our needs even when our group was not here yet. We love the plush environment and friendly attitudes. Amazing experience.,0,0,0,Dequan J.,"Manhattan, New York, NY",0,1,0
4.0,3/29/2019,"Beautiful restaurant, a super eclectic range of options for environments. I love the concept of the Latin-Asian fusion, however the dishes are super hit or super miss. The Thai chicken empanadas are probably one of my favorites, but the Japanese chicken meatballs were hard, lukewarm at best, undercooked and salty. Portion sizes are a bit on the light side. Service is not overly attentive or helpful, normally have to flag down waitstaff when here. At the end of the day it's great ambiance, but is overpriced and the food can be hit or miss. I'll continue coming back here but it has room to improve.",1,0,0,Andrew F.,"New York, NY",234,74,85
5.0,3/29/2019,We've been here today for lunch and we had the very same server as the other day for dinner. Her name is Maria and we're so amazed by her energy and kindness. Always a smile on her face and providing the best service for her guests. We were really happy that she happened to be our server again for today and can't wait to come back. Food and drinks were as always very delicious.,0,0,0,Ma Ri J.,"Manhattan, New York, NY",14,3,0
5.0,3/27/2019,"Come here for happy hour, you won't regret it! Our server, Natalie, the most amazing thing ever! Will return specifically for her customer service. It's hard to find a genuinely sweet person when going out to NYC restaurants! (Especially with my hard to deal with after work crowd, shh) keep up the good work guys! -M",2,0,0,M P.,"Manhattan, New York, NY",0,2,0
5.0,3/23/2019,David was our waiter and he was awesome! Our drinks were always on point and delicious! If you go here ask for David! Great place!,0,0,0,Micah B.,"Long Beach, NY",123,1,0
5.0,3/23/2019,our boy david the waiter was the man .... great service very attentive great food . great drinks great atmosphere,0,0,0,Marco S.,"Queens, Queens, NY",57,8,0
5.0,3/23/2019,David was the most amazing server and was constantly attentive and kind! The food and drinks were amazing and the atmosphere was so fun.,0,0,0,Claudia T.,"Brighton, Brighton, MA",0,12,0
5.0,3/23/2019,"Came here for brunch on a Saturday and it was amazing!!!Bottomless food and drinks for this price in midtown manhattan is unheard of.Service was excellent, never without an empty drink!! Definitely glad I opted out of wearing tight jeans as the bottomless food is no joke!!!Would recommend to anyone thinking of brunch :)",0,0,0,Christina M.,"Manhattan, New York, NY",29,2,0
5.0,3/23/2019,"their arepas are to die for!! david served us and he was super helpful, friendly and attentive! i will def come back to have brunch!",0,0,0,Solange N.,"Flushing, NY",0,2,0
4.0,3/22/2019,Great spot near the office. Natalie is a fantastic server in the lounge upstairs. Very caring and hardworking!,0,0,0,Amanda R.,"Manhattan, NY",0,7,0
5.0,3/22/2019,Natalie is the best!!! Such great service. And adorable. Mix of Mexican and Japanese (a sake list?!) was unexpected but a delightful surprise.,1,0,0,Sheila S.,"Manhattan, NY",0,6,0
5.0,3/21/2019,"Came here last week with some friends and everything was wonderful but the best was our server David wow the best services ever, he was delightful, so  patient, he recomend the best from the menu, I'm sure coming back, 5 stars because of David.",0,0,0,Steven A.,"Queens, Queens, NY",3,1,0
5.0,3/20/2019,"I was here this past Sunday with a group of my girlfriends for my friends birthday and it was amazing! The food, the drinks, the desserts so many choices!!! Our server made the experience that much better as well. We cannot remember his name but I do remember him saying he came to manhattan about two years ago. He had his septum pierced. He originally lived in South America or Central America I want to say? He recommended us to order the most popular brunch items which we devoured. Again the brunch was amazing and such a great place to go for a girls day. The only thing I would have changed was the music. I wish that it was a bit louder and dance music but other than that we were all completely satisfied. Hope to come back soon!",0,0,0,Nicole G.,"Massapequa, NY",0,2,0
4.0,3/18/2019,"Great ambience, easy to make reservations but the portion sizes are a bit small for the price. Definitely get the meatballs, chicken empanadas and chocolate tres leches! Also the lychee Bellini is sweet and refreshing.",9,2,8,Anvita S.,"Manhattan, NY",403,286,788
5.0,3/13/2019,Thanks to David for his service in that place everything was very fun good service and the food was delicious ‍,0,0,0,Cristian G.,"Bronx, New York, NY",0,1,0
5.0,3/13/2019,"Great place! Went for lunch with a friend from work and had the pris-fix suggested by the waiter David. Food was delicious, service was worth writing a five star review and I'm glad we found a new place for lunch. Definitely going back and highly recommend!",0,0,0,Alejandro A.,"Tuxedo Park, NY",0,1,0
5.0,3/12/2019,"I really enjoyed my experience at zengo, David and Chanelle were so nice with me, really enjoyed the food, the place and the ambiance. Keeping improving better guys!",1,0,0,Ale C.,"Manhattan, New York, NY",28,2,0
5.0,3/12/2019,"Had a sampling of the entire app menu and everything was delicious! David and Chanelle were awesome! Mind readers, refreshed my drink with perfect timing!",0,0,0,DJ N.,"ASTORIA, NY",2,6,0
5.0,3/12/2019,"I was at a work event tonight and Chanelle and David were our servers- they were incredible!  Friendly, professional and all around great.Looking forward to coming back!",0,0,0,John D.,"New York, NY",134,2,0
5.0,3/11/2019,"After this disappointing experience, the management reached out to me and invited myself and 3 guests back for dinner. We had the opportunity to try different drinks and plates while experiencing a 150% improvement in service. I am much more satisfied with this Zengo trip and will be more than happy to recommend this spot for dinner for groups or date night!",0,0,1,Michelle H.,"Ledgewood, NJ",152,8,3
4.0,3/10/2019,"Shout out and thank you to our server David for making it a special bday! He was very attentive and hospitable! Also, the bottomless brunch margaritas were so yummy! There were so many food items included in the bottomless brunch; that we did not get to try all of them. Definitely coming back!",0,0,0,Lauren A.,"New York, NY",0,1,0
4.0,3/10/2019,"Came here for brunch with my friends and had a meal with some highs and lows. Overall, it's a great deal for bottomless food AND drinks for $49. However, I found that we either really loved the dishes or drinks or really disliked them. The ambiance is great-- it's a beautiful restaurant with a stunning staircase and gorgeous lighting. It's very easy to come here with large groups given how much seating there is. We started off with drinks and ordered every mimosa-- the blood orange, mango, and lychee. The mango and blood orange flavors were NOT good. It either was artificial fruit flavoring or bad champagne. However, the lychee mimosa was a home run (even from someone who doesn't love lychee!).For food, we ordered several dishes: Thai chicken empanadas, Peking duck and egg steam buns, Achiote hoisin pork arepas, chicken chilaquiles, kimchi fried rice, and salmon Benedict. The arepas was SO good that we ordered two of them-- definitely the highlight of the meal. The empanadas and chilaquiles were a close second and very flavorful. The steam buns were a little weird-- the duck and scrambled eggs didn't go well together. I had hope for the salmon Benedict but my egg wasn't poached at all and completely cooked through rather than runny. For dessert, we ordered the plantains, Mexican chocolate waffle, and pineapple bread pudding. The plantains were a little disappointing because they weren't crispy at all and had a savory creama on them rather than a sweet one. The chocolate waffle was pretty good but could have used more sauce. The bread pudding was pretty decent but definitely not a typical bread pudding texture wise. Overall, definitely worth coming here if you like Latin-Asian fusion. One big plus is that you have two hours for food and drinks and you don't have to finish all the food if you don't like it.",1,0,1,Megan K.,"San Francisco, CA",710,343,410
5.0,3/10/2019,"Our waiter, David was THE BEST! Perfect birthday  brunch for my daughter! Get the arepas and the Peking duck buns!",0,0,0,Emily B.,"Manhattan, New York, NY",0,1,0
5.0,3/7/2019,I went for lunch with friends last Wednesday and loooooved the food! Our server José suggested the bento box and angry sengo roll.. We're looking forward to do brunch next!,0,0,0,Leticia S.,"MASPETH, NY",13,24,10
5.0,3/7/2019,Great experience! Andres was the most amazing waiter. He was attentive and relatable. Made me feel as I was part of the Zengo family although this was my first experience here . 5 stars for the service and the atmosphere!!,0,0,0,Kevin C.,"Bronx, NY",645,3,0
5.0,3/4/2019,"Always a pleasure coming to Zengo when I can! Their brunch is an experience, something to look forward to. Brunch in New York has a pretty high standard, and the staff at Zengo know how to do it in the most seamless way possible. I especially like the Thai chicken empanadas, and the Cochinita arepas, my compliments to the chef! The fusion between Asian and Latin American staples is genius, and the flavors blend so well together. Our server David was consistently checking in on us, asking us how we were doing. He was so kind! It's always a great time coming here, and I can't wait to be back!",0,0,0,Ivanna M.,"Winston-Salem, NC",0,1,2
1.0,3/3/2019,"What a disappointment! We've had a really great brunch here before, so expectations were high. Unfortunately, the food this time was sub-par. I don't know what's happening in the kitchen or if management has changed, but all of our dishes came out all at once, immediately after ordering them. It was obvious that they had been prepared well in advance, assembled and served. I can easily imagine a lineup of food sitting piled high in a steam table waiting for order tickets to come in. The place was barely a third full at noon on a Sunday...which should have been a telling sign right from the start.Poached eggs were completely cooked through with rock solid yolks. Tasteless ceviche, a handful of tiny shrimp swimming in fruit juice with some melon was spooned into a bowl. Kimchi rice was a mess of old rice and diced up something that was unidentifiable. Almost every dish has the same spicy mayo on it and ends up all tasting the same. Korean fried chicken was sticky sweet, but better. The first order of scrambled egg baos was OK. The second order had undercooked, almost raw buns and the eggs were not right. Chicken chilaquiles had soggy chips, were cold and had shreds of chicken that were tasteless. the fried egg on top was clearly old and, again, had a broken yolk that was cooked to death. They charge a premium for the bottomless brunch ($49/person for two hours of eating and drinking). Unfortunately, they cheaped out on the cocktails too. Who serves a bloody Mary ( or Maria if you prefer tequila) without as much as a stick of celery. Just bloody mix over ice with a stir stick. No lime. No fruit. No celery. Nothing. It's barely drinkable. Again, we used to love this place. They used to take such pride in their food and how it was presented. I will say that the service is still very good. The atmosphere and design of the room is still great. The food, however is a mess and the bill ($175/3 with tip/tax) was way too much for what we got. Hope they can turn it around.",0,0,0,Miles W.,"Westport, CT",0,4,1
4.0,3/2/2019,"Best bottomless brunch of ever had in terms of value and sophisticated atmosphere. This is not a place you would go to to get eggs Benedict, but rather a good lunch food spot with bottomless food and drinks. We sat upstairs which was key, moving forward I would request this when going back. I was blown away by the extensive drink menu, and the menu period, that was included in the bottomless brunch. It was a whole menu to choose from! The food was hit or miss, I went with a table of 10 and we did a first round of food and found the dishes we liked and ordered a second even third round of those. Dessert was good, we had the chocolate waffles. I'd say biggest critique is that the food sometimes wasn't hot, and if it were hot then it would have been so much better! But, that's what you get at a bottomless brunch spot. Service was great and compared to all others I've been do this was the best. I'd highly recommend to anyone of all ages!",0,0,0,Lauren S.,"Hoboken, NJ",204,19,25
5.0,2/28/2019,"Natalie was a bomb as fuck waitress. Nailed our drinks, super attentive, took our picture for us landscape portrait flash no flash close up and not, super cool",0,0,0,Travis V.,"Somerset, NJ",0,1,0
5.0,2/28/2019,"Atmosphere: best in midtown(casual but at the same time very classy and well kept)Drinks: put simply, they'll get you drunk when you don't realize itPrices: not bad. If you're in nyc this is affordable. Highlight of the week: Natalie was our waitress and made our night from a simple Thursday to an honorable happy hour. We tried going to Donks but it was too busy and full of oldies...Thanks Natalie. You made our night and we will be back again.",0,0,0,Anthony J.,"Manhattan, New York, NY",0,1,0
5.0,2/28/2019,"Our waitress, NATALIE, was absolutely amazing. She was so attentive to our needs. She even took the extra mile and took amazing photos. Because of her alone, my friend group and I are coming back. Such a wonderful experience, thank you so much Natalie",0,0,0,Gabriella B.,"New York, NY",890,3,0
5.0,2/25/2019,"So happy to find this place in the city. Is absolutely phenomenal, drinks are really good and the bartender Adrian is so nice, very attentive and knowledgeable. Highly recommend.",0,0,0,Juan Carlos H.,"Hawthorne, NJ",8,16,1
5.0,2/20/2019,"The three floors have a setup reminiscent of a nightclub more so than a restaurant, I loved the decor and setup.  It was a hair crowded when I visited, but my server Maria suggested I try the Korean fried chicken (being Korean, I can be a snob when it comes to the stuff).  It was excellent, piping hot, and served surprisingly quickly!  Did not try the alcoholic beverages (I will go back during all-you-can-drink on the weekend) but I felt I got what I paid for!  Definitely will go back!",0,0,0,Ben K.,"Queens, NY",20,12,0
5.0,2/16/2019,"I was visiting from out of town and decided to go to Zengo when a local friend recommended it. We started with the Thai chicken empanadas, spicy crab guacamole, and duck confit tacos. Then we had the strip steak and short rib special for our entrees and the chocolate cake for dessert. Everything was really good, especially the vibe and service. I would highly recommend a trip to Zengo when visiting NYC.",0,0,0,Leo R.,"Baltimore, MD",0,1,0
3.0,2/16/2019,"First off, really beautiful restaurant with a great ambiance. It's dimly lit, with high ceilings and a nice mix of tables with candles, booths and bar space. The menu is certainly interesting, and nearly every item will be a fusion of latin american and asian elements, as advertised. How elegantly these elements are intertwined is up for debate though. For example, the thai chicken empanadas are basically chicken empanadas that come with a curry dipping sauce. The thai shrimp lettuce wraps simply have chorizo added to the mix. Nevertheless, I was actually a big fan of the appetizers. My favorite was the hoisin pork arepa! However, shanghai strip steak (our main entree we ordered) was a huge disappointment. The steak itself was well done instead of medium as we requested and it was WAY too salty. Broccolini was too soggy and again too salty. The taro fries were so oiled you couldn't appreciate any taro taste. I would come back, but only for drinks + apps.",0,0,0,Matt H.,"New York, NY",273,264,748
4.0,2/15/2019,"Great place for Happy Hour near Grand Central! I stopped here last night for some drinks with friends and sat at the top floor bar. I've previously had happy hour drinks at the lower level bar which is called La Biblioteca on a few occasions and have had a great time. Both offer the same menu with $9 cocktails, $8 wines and a few small bites that are very fairly priced for the area! There was plenty of seating at the bar upstairs and the bartender was quick and friendly, it's definitely one of the better happy hours near midtown - will definitely be back!",1,0,0,Danielle W.,"East Meadow, NY",234,30,21
