rating,time_created,text,useful,funny,cool,username,user_loc,user_friends,user_reviews,user_photos
1.0,2/26/2012,"Returned (OK was dragged) for drinks and light bites recently. We were seated in the basement room, which is nicer than it sounds, with ""bookcase"" cabinets filled with liquor lining the walls. Service was poor -- it took 20 minutes for our drinks to arrive after ordering, and one, a negroni, was not included as they were ""out of"" Campari. The requested alternative cocktail took another 10 minutes to arrive. Appetizer-sized snacks sported tiny portions served on awkward-sized dishes too large for the small tables, and we had to ask for plates and napkins. I remain pretty unimpressed with this place.",1,0,0,J. P.,"New York, NY",22,204,1
4.0,2/23/2012,"Went for a wedding and can't wait to go back and try nearly everything. If you're looking for a memorable night, or a worthy happy hour spot, this is the place.Ambiance - open, romantic, old world meets new feel with a hot upper sake and sushi lounge and a sultry lower tequila library/lounge that transports you out of nycFood - amazing, absolutely amazing latin-asian fusion. I still think about the churros and the lemon grass panacotta.",1,0,0,Vina A.,"Honolulu, HI",37,224,58
5.0,2/22/2012,"Some friends of mine suggested we get together at Zengo for a mid-week dinner. I walked in and was immediately enchanted by the atmosphere. It's definitely an interesting twist on combining genres of food with latin and asian fusion but it totally works! I think the menu called it an ""artful blend.""The restaurant is huge. It has two floors and several smaller areas that are blocked off. They also have a ""library"" in the basement that houses over 400 tequilas so they're known for their specialty margaritas. For. Sure. We had an order of the spicy crab guacamole. Finished it. Then ordered another. It was THAT good! I love the menu because it definitely offered a mix of something for everyone. One of my friends ordered the thai chicken coconut soup and another ordered the pan roasted mahi-mahi and I chose the skirt steak that was topped with tempura scallion, mushroom chimichurri and chipotle egg sauce. WOW. It was plate-licking good. We were all so very satisfied that we did not want to leave after our meal so we ordered another margartia. I had a blood orange one that definitely topped the charts for drinks that night. Prices were mid-range. Entrees did not exceed $30 but neared it. Drinks were on the pricy end (about $10/drink). I saw their happy hour menu and want my next visit to be at that time. The place is great for couples dining romantically or a group of girlfriends enjoying a nice night out.",1,0,0,L D.,"Winter Garden, FL",10,45,0
1.0,2/19/2012,This is the most awful restaurant I have ever been to in Manhattan.  Anyone who values good food should avoid it at at all costs.  For good Mexican food try El Paso Taqueria or La Esquina.,0,0,0,Anne B.,"Sonoma, CA",0,9,0
4.0,2/16/2012,"This place was awesome!  My coworker and I tried a bunch of apps and sushi and all were great!  The Chipotle Tuna sushi role was fantastic, great tuna with a little kick.  The wonton tuna tacos were so good we ordered a second round.  The serrano ham and melon flatbread was really good although a little small.  And the empanadas were spicy and yummy.  I'm from out of town but visit nyc often so I'll definitely be back!",0,0,0,Ashley H.,"Charlotte, NC",82,55,3
4.0,2/15/2012,"Came here one night with a couple of girlfriends, and was delighted with the food and service here. Fair warning though, since the food is tapas-style, the servings are very small, and ordering a lot can run a pretty hefty bill.We ordered the mahi-mahi ceviche, peking duck-daikon tacos, spicy crab guacamole, and wagyu skirt steak churrasco. All were extremely delicious.Would definitely be back. Their happy hour menu look pretty appealing as well.",0,0,1,K D.,"New York, NY",3,172,6
3.0,2/12/2012,"I went to Zengo's with high hopes based on co-workers recommendations and finding the menu very interesting.  I eat a lot of sushi so my visit was to eat more Latin inspired food with an Asian influence and to have a romantic dinner with my husband.  We made reservations through Open Table and we were very happy with the booth they seated us at.  It ws designed for 4 people so we were lucky to get it.   The restaurant was doing a brisk business so we were suprised they didn't seat us at a smaller table.  We started with two highly recommend appetizers, the Thai Empanadas and the pork and chorizo gyoza.  While both were good neither was outstanding nor would I order again on a second visit.  The empanadas were a tad too spicy and the dumplings were on the cold side along.   The texture of the chorizos did not ""marry"" well with the delicate dumpling.We both enjoyed our main courses and I would order them again.  Husband had the Wagyu skirt steak served with the most amazing smashed fried potatoes.  At first they looked like Tostones but they were potatoes with a slight orange flavor.  The steak was melt in your mouth. Thankfully the portion of potatoes was hearty because the portion of steak was on the small size.  I had the pork carnitas rice noodles with a soft egg.  Sounds weird but it worked and I was looking for an Asian Latin fusion and found it with the two flavors.  The coddled/soft boiled egg might be off putting to some but I enjoyed it.  We had a glass of house Pinot Noir and declined dessert as we were stuffed.  Staff was friendly and knowledgable and the decor was sexy and seating comfortable.  Service between appetizer and entree was slow.  Enough time had elapsed where we started to question where our food was.I'd be more inclines to return during happy hour or for lunch because the prices are high and there weren't many  more entrees that peaked my interest.  The entrée selection is small.  If I could I'd probably give Zengo's a truer rating of 2.5 to 2.75 starts and not 3.  It was more than a 2 star experience but less than 3.",1,0,0,Louise F.,"New York, NY",3,129,54
4.0,2/8/2012,"I've always passed by this restaurant without one clue that it's so amazing inside. Talk about a restaurant with a great theme, this place has it! Saki bar PLUS tequila bar?! Seriously, this place is amazing. Try the different mojitos AND the small dishes, you really can't go wrong.",2,0,0,Tiffany S.,"Manhattan, NY",32,102,66
2.0,1/31/2012,"A great thing about restaurant week is that it gives you the chance to experience restaurants at a discounted price.  Often you can discover a real gem.  In the case of Zengo it gave me the opportunity to learn I don't want to go back.I stopped in this afternoon for lunch.  The place was far from filled (many empty tables).  We sat down and ordered from the restaurant week menu.  25 minutes later my wife's salad and my sushi roll (our apps) arrive.  It was another 30 minutes before our entrees arrived.Now maybe I'm crazy but if you don't have a large crowd and people are ordering from the 3 items on your uncomplicated restaurant week menu, you should be able to turn that shit around pretty quickly.Furthermore, I'd like to point out that my wife's lunch was a spicy noodle concoction gone terribly wrong.  The noodles must have been left to sit in their spicy sauce too long because they were WAY over spiced and mushy.Zengo proves the point that just because you have a fancy interior doesn't make you a good restaurant.  Won't be back.",2,1,1,Randy W.,"Suffolk, NY",39,160,0
4.0,1/26/2012,"I went there for restaurant week and it was delicious! I started with the salad, followed by the salmon, and the lemongrass panna cotta (with passionfruit sorbet and passionfruit caramel). The cocktails were wonderful as well. I loved the Passion Caipirinha!!!! Definitely a must try! However, the server must have thought I was done with my drink so took it away without asking. No worries! After I told him he took my drink away too soon, he gave me another drink on the house! The whole atmosphere was very upscale and classy. Also, a great place for old friends to meet up and have a few drinks if you aren't feeling very hungry!",0,0,0,Tiffany L.,"FLUSHING, NY",404,58,8
1.0,1/26/2012,"i have never been so disrespected in my life at a restaurant then I was last night by one of the hostess's. I had an 8:15 reservation and was meeting my sister at the restaurant. My sister was there and told me the wait was 20 minutes. I went up to the hostess to tell her we were there. She looked at me + said ""Your friend already checked in already - you have to wait 20 minutes. There are 5 tables in front of you."" She was not the least bit sympathetic to us having to wait after having a reservation at a specific time. My sister and I began discussing if we should go elsewhere + she chimed in ""Would you like me to cancel your reservation?"". I was so appalled - she was not in our conversation nor should she have commented on our conversation at all. I simply asked her why she needed to take this tone with me - typically when restaurants are backed up they apologize or at least are kind to the people waiting. She replied with ""You are bringing forth aggression so I am giving aggression back to you. Your friend gave me aggression as well."" Even if I was bringing forth ""aggression"" (which I wasn't) this is no way to speak to a paying customer at your restaurant. Can't tell you how the food is because didn't get to try it - my sister said it was saucy anyway and ended up going to a great restaurant down the street with great food + great service. I honestly do not think someone like that she would representing any restaurant that wants to do well in New York. I for one will never eat there and will never advise anyone to eat there as the service when you walk in the door is the worst I have seen in all of New York City in the past 4 years of living here.",1,0,0,Nicole S.,"Manhattan, NY",0,1,0
4.0,1/25/2012,"Very enjoyable evening at Zengo.  Our waitress Emily was excellent.  Got the impression that the management has read these reviews and tightened the ship.  Everybody was very attentive, food came out quickly, water was constantly refilled, plates/glasses removed promptly...etc.  Service was A+.  Love the space - beautiful atmosphere.  Tables are widely spaced making for pleasant conversation.  Food was very tasty.  Particularly enjoyed the duck tacos and miso cod.  The cod was on par with Nobu.  Did think, though, that for $31 the cod should have come with rice (I paid $6 more to get some).  Other than that, would definitely recommend this restaurant to my friends.  It's a great space for a group, with several communal tables, as well as the lounge downstairs.  I'm told that happy hour is honored on all three levels from 5-7, which looks like a good deal.  Will be back soon for drinks and tacos after work.",0,0,0,Liz W.,"Manhattan, NY",0,8,2
4.0,1/25/2012,"It was good to great food! I went there for restaurant week. Not crowded at all and the ambiance was fantastically cool and trendy. Very impressed by the bar/lounge area downstairs, and their cocktails selection. Their Sangria is not that good!! Go for the pisco or others.Loved their desserts, fusion-style dishes, pleasant experience (although the coat-check lady forgot to give me back my bag and I was too tipsy to notice)B+/A-",2,2,0,Terry B.,"New York, NY",431,210,27
3.0,1/24/2012,"The place has very nice decor. It's a good place to bring a date or a laid back lunch with a buddy. The food wasn't bad. The menu is pretty interesting, it was Asian-Cuban fusion. I ordered the Cuban sandwich which was pretty good but it was kind of thin and had less meat compared to other Cuban sandwiches I've had.",0,0,0,Wenky W.,"Manhattan, NY",91,64,3800
3.0,1/24/2012,Came here for Restaurant week with some girlfriends. I ordered the pork arepas appetizer which really was two small bites worth. I was starving so I was hoping the rest of my food was filling and I wouldn't still be hungry afterwards. The pork was seasoned well and the arepas were crispy. Then I ordered the soy chicken dish with pancetta which was flavorful and filling. For dessert I had the lemongrass panna cotta which was light and sweet. Good ending to a meal where you don't feel like you have a rock in your gut.,0,0,0,Michelle T.,"Brooklyn, NY",1,46,0
4.0,1/24/2012,"Zengo is a beautiful restaurant space that works for a couple of friends or a large group looking for a lively and unique dinner option.  The cocktail lounge in the basement is great for a pre or post-dinner cocktail.  I personally enjoyed the tamarind margarita with a spicy salt rim for $12.  For dinner we opted for a tapas-style meal and ordered the pork noodles for $13, Hiramasa Tiradito for $15, and Thai chicken empanadas (3 per order) for $12.  This was just enough food for two girls not super hungry.  Our favorite was the pork noodles, and then the empanadas.",1,1,1,Sheila S.,"Dallas, TX",211,154,55
4.0,1/21/2012,"Was here with another couple and we ordered a bunch of different items to share. All of them were awesome-spicy crab guac-tuna wonton tacos-thai chicken empianadas -some short ribs dishWe may have ordered other stuff, I don't really remember. But I will say the food was great, and the waiter was friendly and always checking to see if we wanted to order more food or drinks, but not in a pushy way.If you're looking for a cool spot to hangout after work, I'd probably suggest giving this a go. While the bar on the main floor is small and crowded, downstairs is a nice big bar and open room to just hangout, drink and socialize. There is also an upstairs where they do different drink tastings, unfortunately it was closed for a private party the night I was there, but my friend has been there before and said it was really nice.So there you have it, if you like asian fusion food, this is probably the place for you. While it is a little expensive, the stuff is really delicious and there is a lot of variety on the menu, so if you're going with a picky eater, I'm sure they'll find something to their liking.",3,0,1,Ryan B.,"Philadelphia, PA",7,111,15
4.0,1/17/2012,"Nice decor, great service, and very delicious food!  We ordered a few small plates and the portions seemed small at first but it was actually perfect and very filling! We love the nice, unique taste to each dish.. definitely enjoyed it very much!",0,0,0,Karen K.,"Manhattan, NY",0,5,0
4.0,1/4/2012,"My friends and I stumbled upon Zengo last week and we had no idea how amazing this place is! Service, food, and drinks were top notch. The design of the restaurant is breathtaking and they have a freaking tequila librarian downstairs... who has that?!I wasn't very hungry so I only ordered the Thai Chicken Empanadas (amazing) and sipped a simple traditional margarita. Both were lovely and I can't wait to go back for a full meal. Seriously, this restaurant is perfect to bring visitors or locals. You must try it!",0,0,1,Blaire W.,"Manhattan, NY",0,5,0
4.0,12/30/2011,"Really enjoyed this meal, and will return soon.  Had a selection of appetizers, including the duck tacos, chicken empandas, as well as the duck/shrimp/etc fried rice and even the noodles. The desserts were equally as good.  Looking forward to my next visit!",0,0,0,John o.,"Norwich, CT",0,13,0
3.0,12/21/2011,"Big and spacious interior, yet small and intimate enough for a party of 12 to share a lovely meal over delicious tapas and yummy drinks!I had only ever been to La Biblioteqa - the tequila bar that is housed downstairs in Zengo, but recently came here for a birthday dinner and was really impressed by their food!A few of my friends ordered the churrasacia (skirt steak) - which looked delicious. A couple of others pooled together resources and ordered 3 -4 tapas to share amongst themselves. I had the ahi tuna salad which I had to say was probably one of the bigger meal portions out of everyone's orders! The dressing was sweet, tangy, and light - just the way I like 'em. With added gratuity and paying for the 2 birthday girls, we all put down about $45 for a delicious meal!",1,0,0,Valerie C.,"New York, NY",307,754,227
4.0,12/14/2011,"Yum, Yum, YUMMMM!I went here for my friend's 21st and wasn't it amazing! I had their special drink that day which was a mango mojito and I can't recall the other one.In the huge table we had we sampled almost everything! The thai shrimp lettuce wraps and roasted chicken was outstanding! I would also highly recommend the thai papaya salad. We ordered a bunch of other vegetarian items that were available and those were great too.Very nice decor, great for groups.",1,0,0,Priyanka P.,"Manhattan, NY",122,173,26
1.0,12/14/2011,"My colleagues and friends have recommended me this restaurant to me before as a great spot midtown for afterwork dinner or client lunches, so I assume the food is food. However, I cannot comment on the food since we were not seated. We arrived (party of four) on a tuesday evening and was told that our reservation was not in the system. The hostess (Laura Donna) was incredibly rude, spoke slowly to us as if we were unable to comprehend, and insinuated that we were lyng about making a reservation. We even showed her the outgoing call to the restaurant that we made a few days earlier to show that we definitely contacted the restaurant. Even if we were lying about having a reservation, her stance should not have been that we were wrong/lying and simply apologize for not having the reservation in the system. Instead her tone was rude and condescending. I will certainly be relaying my experience with Zengo to my colleagues and friends.",1,0,0,Kamiu L.,"Manhattan, NY",10,54,1
3.0,12/13/2011,"I'm a bit ambivalent about this place. While the food is undeniably good, it's also portioned on the small side. Similarly, the servers and hostess are all fairly friendly, but sometimes there is an inexplicable wait to grab the check or even get your server's attention, period. Case in point: came here to celebrate a friend's birthday 2 weeks ago. We ordered 4 apps for 3 people and there was just enough food for each of us to try (e.g. 1 piece of gyoza, 1 mini taco, 1 tsp of ceviche per person). Felt compelled to order entrees to make it a legit 'meal.' My dining companions had high praise for their skirt steak, though, and my bass was lovely as well, so I'd say the entrees are better value than the apps. When we were about 3/4 of the way through our meal, I went to inform our waitress that we'd be ready for the cake in another 10 minutes or so. Well, the time came and went, and our waitress passed by at least a half dz times while bringing orders to the tables around us, or checking on them to see if they needed their drinks refilled. I tried to catch her eye, unsuccessfully, on 4 of those trips...and nothing. By this time, my dining companions were getting a lil' antsy (they're guys; eating and skedaddling is a way of life for them) and the birthday boy was definitely in danger of catching on. Finally, the cake arrives, 25 minutes after our plates were cleared. Can you say, cake #fail?",0,0,0,Jenny C.,"New York, NY",6,74,6
4.0,12/11/2011,Nice atmosphere....good place to take a date or hang with friends.Will definitely be back to check out the sake bar!,1,0,0,Christina Q.,"Manhattan, NY",194,73,6
5.0,12/4/2011,"Do yourself and your guest(s)...(boyfriend, girlfriend, colleagues, family members, best friends) a favor and GO HERE! And do your mouth a favor and order that delicious crab topped guacamole!Sooooo super cute!",0,0,0,shadoe m.,"Manhattan, NY",47,19,29
5.0,12/1/2011,"This is the third time I've been to Zengo for dinner and I've never gotten into the main entrees.  The Tapas are too good and too unusual not to gorge on.   I have dreams about the seared tuna wonton taco; it is SO amazing.  I love the Thai chicken empanadas and the shrimp pot stickers.  We just kept asking the waitress to keep bringing us her favorite selections and each was fantastic.  Some day I will get through all of the options, but I keep needing to order these three.Which brings me to the wait staff:  On all three occasions I had different servers and each one gave us impeccable service.  The staff is outstanding!! Friendly efficient and knowledgeable.  A great wine selection.  And tequilla beyond your wildest imagination. It can get a bit noisy here, but if you go early you can avoid the clamor.I highly recommend a night out here.",0,0,0,Miriam F.,"Stamford, CT",0,1,0
4.0,11/17/2011,"FIrst thing you'll notice is that the space is gorgeous, with dark, elegant chestnut wood, buffeted by bold, warm colored paintings, glowing lamps hanging low from exposed wooden beams, surrounded all around by lofty windows with artistic detail. It's sprawling, it's grand. It has yummy drinks. Cucumber martini, prickly pear caipirinhas, all potently potable. They serve ceviche, sushi, noodles, dim sum, lobster gyoza, hoisin pork arepas, peking duck-daikion tacos (AMAZING), braised beef short-ribs (the best)...I had a grand ol' time. My friends will agree with me. Loved the fusion, the rich flavors and creative combination of latin-asian influences. Terrible service apparently, but what do I know? My nose was buried in the purple potato puree.",0,0,0,Nancy Y.,"San Francisco, CA",234,130,7
4.0,11/16/2011,"I've been to this restaurant 3X now and it's quickly becoming one of my faves. I'm very much into ambiance, and this place is modern, spacious, and aesthetically pleasing. It's great for a date, dinner with close friends, or even a social gathering. Now to the most important part, the food:1. Ceviche: Excellent (I've only tried the rainbow one, which was on an autumn menu).2. Green papaya salad: It's sweet, salty, and sour and tastes crispy to the palette, I likes.3.  Volcano roll: Good, but I'd rather stick with the more Latin flavors at this particular restaurant bc of its uniqueness.3. Spicy crab guacamole: Mmm, yum. It's a good finger food, while sipping on your mojito, and waiting for more dish.4. Thai chicken empanadas: Great. A must try for the first time, and since I know what it tastes like now, I'll order it sometimes and skip it other times.***5. Charred tuna wonton tacos: This is my fave dish. This is the dish that I craved after I left the first time and ordered again and again. Honestly the 3rd time wasn't up-to-par but I know why, I'm a sauce lover, and they just needed to give me more of that yummy mango salsa sauce to top off the wonderful flavor blend.***6. Lobster gyoza: It was just okay for me, but I'm Asian, I can find yummy dumplings pretty much anywhere. 7. Chocolate souffle: Soooo good, and let me just mention, I'm not usually into chocolate. I like my chocolate flavor subtle. I was already full, but I'm so glad I ordered it.  Btw, I didn't try all the above in one sitting. In one sitting, I'd rec the #1, 3, 4, and 5, with a cucumber martini, mMmm. And don't forget to top it off with #7 ;)",2,0,0,Sara L.,"Manhattan, NY",8,11,0
3.0,11/13/2011,"Came here several Friday nights ago.  A few friends and I were upstairs at the SAKE & SHOCHU LOUNGE.  Like others have mentioned, the service left MUCH to be desired.  We often had to seek out or flag down our waitress which was crazy because it's not like the top floor is so expansive and she had a lot of tables to attend to.  In fact, it was the complete opposite  - there's only a few tables upstairs.  And when she did show, she was far from apologetic.  In fact, she very well seemed annoyed as if it wasn't her job.  (Trust when I  say my displeasure was reflected in her tip).  As for the portion size, it was on the small size relative to most restaurants of American standards but I didn't mind the portion size at all.  I felt like it was just right.  Eating till you feel stuff is actually not the proper way to dine.  (Not judging, it's just a fact).  Anyhow, the quality of the food was spot on... for the most part. The Spicy Crab Guacamole and Wok Fried Rice were salty.  On the other hand, the Lobster Gyoza and Duck Tacos were delicioso.   What topped it all off was a bucket of sparkling sake - YUM.  Overall, it was a good experience.  The vibe is chill and the food was good.  Since my friends and I were often engrossed in storytelling and laughter, the lack of attentive service didn't completely dampen the experience.",0,0,0,Jane J.,"Brooklyn, NY",20,27,1
5.0,11/12/2011,"I'm surprised by some of the negative reviews on Yelp.  I had a great group dinner last night and I thought the food, service, ambiance was excellent.  It is great to come here in a group and sample their vast appetizer menu.  I think the food showcases what Richard Sandoval is all about with his creativity and ability to elevate regular dishes.  Almost every plate was spot on.  Some of my favorites are:- Edamame xo style with lime - Shrimp Ceviche - Bluefin Tuna tradito - Thai chicken empanadas - Charred tuna wonton tacos - Peking duck-daikon tacos - Chipotle yellowfin tuna roll - Braised beef short ribs flat bread  For desert, lemon grass panna cotta was absolutely superb.  Tres leches was also delicious.  We ended up ordering 2 each.  Needless to say, the tequila based cocktails are very good.  I liked cucumber martini and tamarind margarita.  The wait staff was very attentive and professional.",2,1,1,Akira O.,"New York, NY",74,401,73
5.0,11/10/2011,"I have now been to Zengo a few times and I love everything about it. I am pretty picky when it comes to going out to dinner, but this place has everything.  The atmosphere is great, the food is amazing.  I had sushi which was good, but they had great black cod and skirt steak.  All of the appetizers were amazing especially the tuna tacos.  Downstairs has a tequila library with amazing drinks.",0,0,0,Will K.,"Manhattan, NY",0,9,0
