rating,time_created,text,useful,funny,cool,username,user_loc,user_friends,user_reviews,user_photos
2.0,1/23/2017,"My friend had her birthday dinner here so we were a big group. They sat us right in front of the entrance although the place was fairly empty so we were freezing. The food took awhile which is reasonable because we each ordered appetizers and entrees. The service was meh. Not too friendly or fast. They were very strict with checking ID's, both at the bar and the table. The atmosphere was good, suitable for large groups with high ceiling and nice decor. The food was mediocre at best. Some of the better ones were the crab guacamole, lettuce wrap, miso cod and steak. The sashimi platter was NOT great. Tasted like something you'd get from your cheap local sushi restaurants, wagyu beef was one of the worst I've tasted. Foie gras pork dumplings were not great either. There are way too many good restaurants around here so probably won't be back :(",1,0,0,Kristina P.,"BEECHHURST, NY",149,136,66
3.0,1/9/2017,"We chose to celebrate my mother's birthday here, the service was great. Our waiter made superb tapas suggestions and the variety was awesome. Dessert was also great!There was one concerning observation.. as we left we noticed the party two tables over reacting to a cockroach that seemed to randomly appear. The waiters quickly took care of it, but maybe it's time to hire new exterminators..",0,0,1,Richard N.,"Manhattan, NY",62,22,6
4.0,1/3/2017,Good food and ambience and convenient that La Biblioteca is just downstairs. Large dining room.,0,0,0,Shivani C.,"Austin, TX",566,32,0
5.0,12/31/2016,"I had a wonderful experience last night dining there with my best friend.  Our server Will was delightful and did a fantastic job of really selling the menu and explaining the different items on there. I love the mix of Asian and Latin American flavors.  We started at the bar for happy hour and ordered the short ribs flatbread (delicious!) and the Korean fried chicken (Yummy!) The happy hour flavored margaritas were also not bad for house mags, very tasty! Then we sat down for dinner and ordered the Angry Zengo roll and the Arepas which were also tasty and filling. I plan to return for their weekend brunch whenever I have a weekend off since I work in retail but nonetheless I plan to return!",0,0,0,Jessica M.,"Astoria, NY",78,14,21
2.0,12/25/2016,"I go there periodically because it is conveniently located and always has open tables. That must be for a reason. Service is uncoordinated, inexperienced and generally not making you fee good. Food is ok but some entrees came at random times and main course (miso black cod) was cold. Some parts of the fish were Below room temperature. Which means it was cooked before and warmed up later. Restaurant was completely empty. We wanted a larger table but the waitress told us it was ""reserved"" and then manager came and said that too. They lied. We were there for a while and nobody showed up. So to summarize - liars, cold food, awkward service.",0,0,0,Igor S.,"Manhattan, NY",0,11,0
2.0,12/23/2016,"Came here for a lunch. The food is actually pretty good but the service is terrible. We got a waiter that just didn't care at all nor did he know the menu. This was still a business lunch and I only blocked out 90 minutes for it. We order 7 apps for the table and some lunch boxes. End to end and always having to ask someone to find our waiter constantly the meal took about 2 hours and 30 minutes. If you care about service, this is not a good local spot. If you're a tourist with some time to kill and want a latin - Asian fusion menu go for it but there are better spots especially if you're already in NYC.",1,0,1,Scott W.,"New York, NY",32,27,3
5.0,12/14/2016,"I planned a birthday brunch at Zengo because I was really impressed with their menu, especially the unlimited food and drinks, and they had great reviews. Making a reservation for my group of 18 was easy, and they were very accommodating when I called to switch the number of people. Although some people arrived late, they did not rush us and had our table ready. The waitress took everyone's order for what their first drink would be, and you were allowed to switch throughout. I do think putting pitchers on the table, as opposed to one glass at a time may be a better option for larger groups, as some people have to constantly wait and then flag down the waitress to get their next drink. I showed the waitress the main things on the menu that we wanted and they brought out multiple of each for everyone. We had the wings, empanadas, lobster grits, waffles, plantains, ceviche, and a bunch of other things. As the brunch went on, we were able to ask for more of a certain dish or request to bring out something different. I loved how quick and efficient service went in regards to food. I absolutely loved the shrimp ceviche. My friends loved pretty much everything else. Overall, I am so please that I chose Zengo for my birthday brunch, it was such a success!",1,0,0,Robin T.,"New York, NY",294,321,668
5.0,12/12/2016,"This place is highly underrated! My friends and I are all about boozy brunches and this place stole the show. When I first found out we were going here for brunch, I was skeptical but fine with it since I'd get to hang out with a big group of friends. I remained skeptical when the waitress told us she would bring out all the popular items on the menu. Boy oh boy was I wrong. The drinks were amazing and even more so the food was fantastic. We are all big on food and have tried practically every boozy brunch spot in the city and were pleasantly surprised by this place. My only regret is that I didn't know about this place sooner!",0,0,0,Avneet M.,"Jersey City, NJ",8,38,6
5.0,12/12/2016,"Loved everything about their brunch. They give you a tour of their menu and the food just keeps on coming. I am a vegetarian and the waitress (Cindy) was great about it. Certain things on the menu had chicken or steak and she sent two orders to the table, one with meat and one without. When we arrived, we had to wait a couple of minutes and the manager gave is free Drinks for having to wait. We loved it! The whole experience was amazing !",0,0,0,Isamar S.,"South Richmond Hill, NY",0,1,0
4.0,11/27/2016,"The restaurant itself is very nice and huge, the service is excellent, and presentation is elegant and beautiful.  For those I would give it 5 stars.  I was actually debating whether to give them 3 or 4 stars on food.  Reason being, is that I'm not sure what the hype is with eccentric foods, it's just not my thing I guess.  The main dishes weren't bad but wasn't something that makes me wanna crave it or jump up and down for it either.  For instance, I had the pork carnita noodles, the portion was huge and although had lots of flavor, if I were to order it again, would be minus the poached egg and minus the cashews.  Also, the BBQ salmon, was just ok for me.  At least it wasn't overcooked.  I liked more the pickled onions on top though.  I did however, love, love, love the shishito peppers and the shrimp-veggie potstickers!!  The Thai shrimp lettuce wraps (was a freebie due to a mix up) & Thai chicken empanadas were great too.  Lastly, we also had the snapper ceviche, very good flavor but mostly fruits and liquid...would've loved more substance though. To be fair, I gave this place 4 sparkling stars!",1,0,0,Nina R.,"Weston, FL",54,120,1697
3.0,11/27/2016,"Not a great experience here.  Great looking space, Richard Sandoval is a favorite, so I believe that's one reason this place could get a lot better. I've been meaning to come to dinner for a while, once came for an event in the bar downstairs...ambience of the room is fantastic modern upstairs and chill downstairs.Food and drinks were very good, so the place has some serious potential. If you do end up going here or just come for drinks do not miss the guacamole with the crab!    Ribeye tacos were very nice, too. miso cod was pretty good.My problem may have been I brought a group of 14, on a relatively quiet Saturday night and though the restaurant wasn't busy, and of course we planned in advance, perhaps they just could not handle it. Our first round of drinks at the table took forever to come out, our appetizers took forever to come out, then came with some entrées, and those of us who want to did not have time to order third drinks because the staff was letting us enjoy our meals and not keeping an eye on the table.My father, who had two martinis before meeting us, actually ended up getting sick from it taking so long to get our food.  In my 39 years, I have never seen that happen to him before. He is Mr. iron stomach! LOL!!Though our waiter was responsive and a sweet person, neither he nor the other staff were particularly attentive. later, after speaking with him and the manager, not too much changed, and therefore I believe it to be a systemic issue.  If the room was rearranged a bit, I believe most of their problems would take care of themselves.",1,1,1,Harris B.,"FOREST HILLS, NY",32,74,11
3.0,11/26/2016,"Came here for a brunch with coworkers. It's a great space that is able to accommodate a large party and eliminates the mess of deciding how to share plates among large parties, not to mention unlimited plates and drinks!The waiter was very nice and came back often to refill our drinks. The options included in the unlimited brunch had a lot of variety (margaritas, multiple mimosas, sake sangria, and Bloody Mary). The waiter also automatically put through orders of the entire menu for us so that we did not have to go through the trouble of ordering for the table. However, there were some options that we should have opted out of since no one ended up touching them (including the veggie sushi dish). Some notable dishes include the empanadas, dumplings, edamame, arepas and all desserts, which I highly recommend.Food is probably better during other service times, but the service definitely made the experience much more enjoyable.",0,0,0,Wei P.,"New York, NY",24,63,41
4.0,11/9/2016,"Had a wonderful dinner at Zengo this past Saturday for my girlfriend's birthday. Thought the interior looked great. The host & waiter were super nice. Waiter was full of laughs & suggestions on what to eat/drink. Had the thai chicken empanadas for appetizers which was delicious. I ordered the pork carnitas noodles while my girlfriend had the salmon. Both cook very well although both meals weren't really filling. We did ordered the traditional margaritas which were real good & had a nice ""spice"" after taste. Had the croissant bread pudding with a candle on top. The waiter himself sung her happy birthday which I thought was pretty funny. It was clear he was working for that tip! Overall this was a great experience & a great spot to take a date or celebrate an occasion at.",0,0,0,Angel S.,"Manhattan, NY",132,95,34
5.0,11/6/2016,"Of the many many boozy brunches I've been to, this one prob goes to the top of the list! Service started off a little slow but picked up real quick and then the drinks and food kept flowing nonstop!Ambience is great and the staff was awesome! Was the perfect place to have a big group brunch!The crispy tofu and salmon benedict were delicious! So many drink choices as well! We all left very very full and happy!",0,0,0,Nisha P.,"Bloomfield, NJ",1,14,0
4.0,11/6/2016,Second time here for Brunch.  The food is always interesting.  The drinks are fantastic for a free flowing brunch of 42 dollars.The wait staff tries to keep you entertained and your drinks going.  If you like Asian food with a twist go here on a weekend !,0,0,0,Alain N.,"Manhattan, NY",346,78,28
4.0,11/6/2016,"Zengo has the potential to be the best brunch spot in NYC hands down. And that's because of those menu. Their brunch menu is unmatched by any place I've been to for brunch in NYC. It's tapas style so you can literally have a huge variety of foods and cuisines while you brunch. Also, their drink menus. Most brunch spots offer mimosas but Zengo you can choose from a list of 5-6 different drinks for the two hours you brunch. The only thing missing is music. Zengo is a beautiful restaurant the food is amazing, but it's not a party brunch at all. If they had a Dj or just played a good playlist it would take their brunch to another level and would have them competing with ps450 etc because those menu is top notch.",2,0,1,Tiouba P.,"New York, NY",347,35,4
5.0,11/5/2016,"Most amazing service! Our server was a beautiful young lady called Alondra, very prompt, great attitude. Couldn't ask for anything more! Highly recommend just because of her! She has a great booty too! Amen",0,0,0,Matt H.,"Brooklyn, NY",73,5,1
4.0,10/30/2016,"Came here for a birthday party after hearing unlimited food and booze for 2 hours! The waitstaff was super accomdating and they decided to bring out one of everything on the menu for us in family style. The food was good and the drinks were good but the overall atmosphere, polite staff, and decent food makes for an enjoyable brunching experience.",1,0,1,Brian H.,"Flushing, NY",217,30,2
4.0,10/29/2016,"I'm a fan of most Richard Sandoval restaurants, including ones across seas in Dubai.  Zengo's concept of Asian-Latin Fusion is one of my favorites (although I wish they'd put the Salmon Roll on all menus).  However, their New York location just doesn't really compare with their Denver location as it relates to beverage and service.In Denver, the management team appreciated large parties and almost used them as a way to attract loyalty for future visits.  So much so that I constantly brought groups to Zengo Denver... not private dining and of course without expectation, but more so because I knew we'd be taken care of. Wheras, the New York location seems to only care about serving WEAK drinks in a short 3hr period, getting your money, and sending you on your way.  Their food is equally as yummy, its just their beverage options and service isn't as good as other locations I've had the pleasure of dining at. In short, its going to take you at least six margaritas before feeling tipsy!  And I would never expect to get drunk at bottomless brunch.   Their drinks are some of the weakest in the city.",3,1,0,Ann F.,"New York, NY",224,276,538
3.0,10/22/2016,"I want to give more stars for the foods but for the overall experience I am stopping at three. Extremely overpriced. You are paying for the location and experience but it is not meeting the prices that they charge. There isn't any wow factors except my good friends pay over $80 bucks for two simplest lunch with tea.... A good place for a business if you are taking the clients and using the company card if you work around the area. Otherwise, you can afford to skip it",0,0,0,Bitmi B.,"New York, NY",39,35,1
5.0,10/16/2016,"Loved having brunch here. If I could give more stars I would. First of the place is beautiful loved the wood on metal detailing. Next, the drinks were delicious and fit the bill for boozy brunch. My favorite was the Guava mimosa. Go ahead try them all one at a time. Manny was amazing with his critic and descriptions.Now the food is absolutely delicious, it's non stop. We had so much delicious food yet not even half the menu. Just going to list what stood out. Shrimp ceviche (omg), porkbelly hash (loved), the plantains (AMAZING, I need this recipe), chocolate waffles, fish chicharrón (Yum), tofu. I'm not a tofu eater but this was pretty good. Glutton free options too. Again Manny was great and Anna was a doll. Definitely coming back.",1,0,0,Juangrys V T.,"Manhattan, NY",86,60,35
3.0,10/10/2016,"Great place for work lunch but dinners can be a bit too loud, music wise if not the overall acoustics can be somewhat distracting. Overall, classy vibe though and cocktails are well prepared. Food dishes are also ok if you're a fan of americanised asian. Nothing wrong to crave once in a while but an asian comfort food place might be a better fix.",0,0,0,Diplomat's S.,"Manhattan, NY",0,3,0
3.0,10/8/2016,Had a decent lunch here. Duck tacos and Reisling. The service was steady and the food was decent. Will come in again.,0,0,0,Sen-Pei H.,"New York, NY",316,420,316
2.0,10/3/2016,"So I've been to the Zengo in DC many times for brunch and decided to check this one out. First thing i noticed the seats are very worn but I'm there to eat right? The waitress was nice. Food came our pretty quickly, but mid meal My fiance saw a roach crawling behind my seat. I let the waitress know and she did NOTHING. Finally my fiance killed it. NO manager came over to address the issue. As I looked around I noticed alot of dust on the side tables so maybe this place just isn't clean. I really wanted to make this a brunch staple but I dont think I will return.",0,2,0,Ashley H.,"Washington, DC",17,96,1
2.0,10/2/2016,I came for the unlimited Brunch with friends. Seating was quick and the decor is beautiful but the food was not good. The rice was dry and seemed reheated. I'm not sure what the sliders were made from but also a microwaved toughness to it. Maybe coming in at 2:45pm when last brunch call is at 3:45p was a bad decision. My friend did enjoy the tofu. The brunch would be a great deal if the food was good and made fresh.,1,0,0,Che F.,"Manhattan, NY",0,20,11
3.0,9/30/2016,"Ever heard of an angry sushi roll? No, I haven't. I had my first angry sushi roll at Zengo! Too bad they didn't have sad or happy sushi rolls, or even romantic sushi rolls.For lunch, this place has a mix of Japanese, Filipino, Latin American, American food. The good news is that there is something for everyone. The bad news is that you wonder if this place has an identity crisis, and how on earth they can specialize in so many types of cuisines. There is chicken Adobo (Filipino), sushi (Japanese), empanadas (Latin American), chicken sandwich (American) etc.I decided to go with the bento box opti n for lunch- there were 2 kinds, one with ice cream, the other with papaya salad instead. I had the bento box with the angry sushi roll, papaya salad, and salmon.The angry sushi was good, but it was a little small. They also put a lot of dressing on top of the sushi, perhaps the chef was angry and decided to put a lot of dressing? The papaya salad was not very good, it was a bit soggy and really wasn't that tasty at all. Papaya salad is supposed to be nice and crunch, with delicious sour dressing on it. This one was a limp papaya salad that lacked flavor. The salmon was good, and rice was ok. You also get a small portion of green vegetables, which were ok.Overall, not a bad lunch spot. They take reservations for lunch too.",0,1,0,Stephanie Q.,"Boston, MA",498,1621,1538
5.0,9/18/2016,"I wish I could give Zengo an extra star, It is the best!  I absolutely love this place, brunch is the best. The food is amazing, and you can't beat unlimited drinks. I would recommend the bacon fried rice, the lobster chipotle grits, and the empanadas. To be honest everything on the menu is really good, you can't go wrong. The waiter we had was friendly and so helpful, and did not look at us funny when we kept ordering everything on the menu lol. The restaurant itself is beautiful, I love their huge chandelier in the middle. We went on a Sunday for lunch and surprisingly it was not busy at all, so we received our food and drinks really fast. I would not change a thing about this place.",2,0,0,Johanne D.,"Atlanta, GA",43,69,39
4.0,9/15/2016,"If you're in the area, the happy hour menu includes food and drinks. $8 cocktails, $7 house wines (I got the house white and it was pretty good. It's a really nice place inside compared to darker, grungy pubs that have happy hour food specials. They have $6 sushi rolls and flatbreads but the portions are very small. Perfect spot to catch up with friends and grab a glass of wine and a snack.",2,0,0,Nicole R.,"San Diego, CA",487,46,51
4.0,9/9/2016,"I love me some boozy brunches. (FYI, NYC brunches start around 12-1pm!)I've frequented the Zengo back home in DC once before, but the drinks weren't nearly as strong as the one in NYC. We went with the unlimited 2 hour brunch (the time starts as soon as the first person sits down) for $42/pp. You can switch out any of their cocktail options at any time, but you can only have one (1) drink for yourself at one time.Everything is family style, so if there are 4 people in your party, there will be 4 pieces coming out. Memorable dishes: Lobster chipotle grits, crispy tofu, Asian pear salad, Peking duck and scrambled egg buns, bacon fried rice, and shrimp ceviche.There's a friendly reminder when you're reaching your 2 hour time limit, which is much appreciated. I had a great experience here and it's worth trying out at least once since NYC has tons of boozy brunches to choose from.",6,3,6,Annie P.,"Fairfax, VA",1848,1051,990
3.0,8/31/2016,"I had made a reservation for 17 people for their Bottomless Brunch for my husband's birthday. Initially, the would not seat us because we were told that the 2 hours would start as soon as we were seated. I thought this was fair. We hung out at the bar and waited for more of our party to arrive. Once we had about 10 people, I asked them to seat us. Since we were a large party, the waiter offered to bring us everything from their brunch menu and we all agreed. They brought out sushi and edamame almost immediately. And then we sat and waited for the next round of food for over 30 minutes. I was extremely upset because we had a large group of hungry people and the restaurant puts a time constraint on the brunch. Additionally, we were told that we could not substitute non-alcoholic beverages (orange or tomato juice) for the brunch cocktails and that we would be charged extra. This makes no sense to me because alcohol is more expensive. We had several people at there who do not drink alcohol. It seemed absurd that they could not accommodate such a simple request. We did enjoy most of the food, once they actually started bringing it out. However, it was not everything from their brunch menu as the waiter initially said it would be. Additionally, several of the guests noted that the brunch cocktails were warm.",0,0,0,Rita K.,"Norwalk, CT",8,10,5
4.0,8/22/2016,Nice location and nice menu.  I have wanted to try the location  that closed in Santa Monica.   Came for brunch $42 per person unlimited plates and unlimited  beverages.   The have a nice selection of foods.  The empanadas  were  delish and the arepas also a must have.  The blood orange  mimosa  also a must have.  Our server Will was the bomb.  He was knowledgeable  about menu and offered some good and tasty suggestions.   Will was attentive and kept the food and drinks coming at the right pace.  The interior was nice and space is roomy.  The have happy hour location downstairs  called the biblioteca.  This is a definite  must visit for happy hour or dinner.  There is a 2 hour limit per party.,24,17,25,Michelle B.,"Long Beach, CA",434,488,681
2.0,8/17/2016,How can a meal with delicious food and well crafted cocktails get just 2 stars?  Well....It starts with a table that was uncomfortable.  It was a tight fit at the table with a rounded banquette.  I'm not skinny but I never had this problem.  While the AC was nice and cold at the entrance there seemed to be none at all at our table. It was suggested we hold onto the menu to use as a fan.Next problem was that our group of 4 was totally ignored.  Eventually we asked for a server and one materialized.  He asked about drink orders but given that we were seeing someone for the first time after sitting for 15 minutes we ordered everything for our meal as well as drinks.We were sitting at the table for an hour before the first bit of food showed up at the table.  One guest ordered just an entree which was now served to him while the rest of us were served our appetizers. We asked for the rest of our food and our entrees showed up but not our sides.  The meal was completely out of sync and taking forever.The waiter saw the unhappiness and offered free drinks.  The drinks went down easily but did not wash away my unhappiness.,3,1,1,Phil C.,"Manhattan, NY",4,37,11
4.0,8/13/2016,"I'm rating this restaurant based on the Restaurant Week dinner menu. Some friend and I decided on this place after being intrigued by the cuisine and menu. We ordered a sushi roll off the menu and some cocktails to start. They have a tequila lounge in the basement, so I suggest ordering a drink with tequila (it's their specialty!). I ordered the chicken meatballs, salmon, and peaches and cream cheesecake. I really enjoyed the meatballs and cheesecake. The salmon was good too, but the sauce was a little too spicy for my liking. Ambiance is cool and warm. The first floor with most of the dining tables has a rustic feel with interesting wall decor and chandeliers. There's a bar upstairs and lounge downstairs, that look equally as warm and inviting. Our service was the best part! Our waiter was incredibly friendly and recommended some great options to us. He checked in frequently and shared some laughs with us. Overall, I enjoyed this place! I'm interested in coming back to try some of the Latin/Asian fusion off the normal menu.",0,0,0,Marelle C.,"Manhattan, NY",192,154,0
