rating,time_created,text,useful,funny,cool,username,user_loc,user_friends,user_reviews,user_photos
2.0,4/29/2019,Came for Sunday brunch. Slow to be waited on (even though it wasn't actually that busy?). Food was edible but subpar. Only positives are the environment and modern American restaurant vibe.,0,0,0,Michele L.,"Manhattan, NY",0,10,0
4.0,4/27/2019,"Not kidding y'all but I think I found one of the best burger places everrrr!! I got the Bedford Burger, it was so bomb. Like The bomb dot com! The patty was so very juicy, the pork belly was a yummy addition to the amazing burger! The fries that came with the burger was also so very delicious! BUT~ the service was not great. We were made to wait for forever for pretty much everything. For food (which was worth it), asking for the bill, waiting for change. Like it was waiting, waiting and just when you thought the waiting is done, they surprise you with more waiting. Maybe the fanny pack I was wearing turned them away. But tbh, I thought I was rocking it. Who knows.But after all, the food was really really delicious. Y'all should come!!",2,0,1,William N.,"Westwood, Los Angeles, CA",175,34,10
4.0,4/22/2019,"Had a party of 8 for brunch on a Sunday at 1:30pm. The food is good and the price aligns with it. Cool ambiance, good for groups, was simple enough to setup a reservation through their website. Kitchen was very accommodating for some minor substitutions/edits to the order to account for some dietary restrictions of the party. Overall, would definitely go back with a group, for 1-2 people though may just try the bar area next time. I'm a fan.",0,0,0,Luis S.,"Manhattan, NY",87,172,2
5.0,4/21/2019,Love this place. Came for brunch on Sunday and sat at the bar with Aziah. Great service and awesome drinks. Keep up the good work!,0,0,0,Jamie B.,"Staten Island, Staten Island, NY",0,8,0
5.0,4/20/2019,"We went here for brunch on a random Sunday and we loved it! I had bought a pulsd deal for 90 minutes of unlimited bubbles and 2 entrees.  We both got the sausage griddle sandwich, which was delicious! It was the right balance of sweet and savory. Instead of buns, they use pancakes.  It comes with chicken sausage, cheddar cheese and runny eggs. The perfect combination. They definitely don't play around with their boozy brunch.  We finished one bottle of prosecco and they just so casually replaced it with another since we were still under the 90 minutes.  You also get three different fruit juices- mango, guava, and passion fruit-  to mix it with and to make your own bellinis.  Before our meal was over, we knew we were going back.",0,0,0,Y G.,"Queens, NY",2,11,27
5.0,4/19/2019,"Best Brunch Ever!!!!!!! I always order salmon benedict. It was so delicious and the salmon was mega fresh. The Bottomless Bubbles obviously made it a toast afternoon. Honestly what makes this place superior to other brunch spots is the service...I've been three times so this review is overdue. Yancis is the manager and she really makes you feel like you are family and I'm her home. She's initially why I returned, plus the bubbles. We've had Shai as our waiter twice and he's so professional, warm, friendly and on point! Even when he's crazy busy he pops by to check that you have all you need. I recommend Bedford & Co ALLLL the time! Can't wait to go back....",0,0,0,Jolyn B.,"Manhattan, NY",218,84,123
4.0,4/17/2019,"I only stopped in to have quick cocktail before meeting a friend and was pleased with not only the rather toned down entrance, but also the staff was relaxed yet attentive. I look forward to having dinner here again.",0,0,0,Subilak K.,"Little Falls, NJ",27,60,110
5.0,4/14/2019,"This was the first time I came here for brunch. It was an awesome spot for brunch. I highly recommend getting their deal on the Pulsd app. They give you a big bottle of champagne with 3 different juices for you to add on. You get guava, passion fruit and mango. My favorite was the mango and guava. But the service was great. The waitress was very nice and answered all of our questions and was very attentive. Their Bedford burger one of the most amazing burgers I've had in a long time. It comes with pork belly and it is all so flavorful and delicious. The chicken and waffles are cooked to perfection. The waffles are nice and crispy and have a great vanilla taste. The chicken was also nice and crispy but also juicy when you bite into it. I highly recommend coming here for brunch.",0,0,0,Gus R.,"Mamaroneck, NY",78,187,332
4.0,4/14/2019,"Food was ok, vibe was very Industrial Williamsburg, kind of Millennial chic..  Service was very random, even though we ordered the bottomless brunch, the waiter wouldnt serve me til my friend showed up,  and a few other slip-ups as well.    i am giving an extra star due to Yancis, who is one of the managers and single -handedly made up for the the 3 or 4 errors they had in service. i would go back  again if my made my reservation thru her, and was assured she would be there, otherwise, there are way to many brunch options in NYC",0,0,0,Neil F.,"Manhattan, NY",3,38,0
2.0,4/8/2019,"I think bottomless drink boozy brunch is code for ""we hope you get drunk enough to not notice that our food kinda sucks.""  First off -  midtown east tourist trap.  It can attract all the Grand Central johnny come latelies to their mediocre brunch.  Second - much too dark.  I guess they don't want you to see what you are eating?  Third - two bathrooms for the entire damn place?  K.  Fourth - service left much to be desired.  I think we got the right entrees, but he just seemed very confused.  He was nice, but I'm guessing it was because it was too damn loud?  And yes, I am too old. Deal with it.The bubbles though, 90-minutes of sparkling wine with craft juices.  It's a good concept, just not well executed.  You want us to make mimosas and can't even give us ORANGE FREAKING JUICE?  Mango, peach and something else.  Not orange.  No cranberry or pomegranate? Come on.  No one wants a mango mimosa.  Peach maybe, but bellinis aren't my thing. May as well bring out the apple cider vinegar like the guy who ruined brunch on the internet that one time.And my food? It wasn't memorable.  Some chicken sausage breakfast sandwich.  It was pedestrian, yet another item on the menu that had a good concept that wasn't executed.  I can pretty much gather I won't be here again.  After all, I live on the west side, and I'm rarely ever on the east side.  I wouldn't be back anyway.",1,2,0,Taryn C.,"New York, NY",280,766,51
2.0,3/30/2019,"I gave two stars because the service is atrocious, I had to ask two different waiters to get a refill of water. Getting the check took way too long. The food was excellent however that's why I gave an extra star.  Will not be coming back again.",0,0,0,Duplicate D.,"Edgewater, NJ",65,14,24
3.0,3/28/2019,place is lovely and service is quick and accommodating. went there for brunch with the pulsd deal and don't think i would go back without a deal. food portions are small for the price you're paying. pretty standard food,0,0,0,Brenda J.,"Freehold, NJ",0,9,0
3.0,3/25/2019,"Food was very nice, service was spot on. Only 3 stars as this is not really a great brunch venue. (Which is why the 9 of us were there!!). It is more of a lounge/dinner venue if you ask me. It is much too dark, and for the amount of people in the establishment, the noise level was to say the least-extreme.",0,0,0,Brian S.,"Lindenhurst, NY",4,103,10
5.0,3/24/2019,"We came here for pre-dinner drinks at the bar. We stumbled upon this place as we were looking for a place near our dinner location to have a drink. It was perfect! The ambience was really lovely, the drinks were fantastic (my husband had an Old Fashioned and I had Prosecco) and the service was great. It was pricey but we really enjoyed it. We would come here again.",0,0,0,Tatiana H.,"Arlington, VA",0,23,9
5.0,3/24/2019,We had brunch there today and everything was exceptional! The food was fantastic and the service was excellent. I absolutely loved the ambiance! I'll be going back next time I'm in NYC!,0,0,0,Megan M.,"Durham, NC",0,6,7
5.0,3/24/2019,Great place with awesome service and friendly staff. Tommy the bartender is the best. Craft cocktails and excellent food I love the crispy artichokes and roast chicken. Kathryn the manager has created a great culture of service. I travel to NY often and mostly dine alone. The bar is comfortable and serves full menu. I have also heard that Brunch is great too!,0,0,0,Maureen S.,"Kennesaw, GA",0,4,1
1.0,3/15/2019,"I am not a big reviewer but I was so disappointed by this place I felt I needed to document it. I was there for brunch with a bachelorette party. We sat in the back room which was nice and private. However, the restaurant had said they would decorate the table with confetti for the occasion--they did not. Once someone mentioned it, they gave us some free dessert. Unfortunately, the dessert was on par with the rest of the food: Bad. I ordered steak and eggs, medium rare. The steak came out very rare and purple, and I asked for them to toss it back on the grill for another minute. The waiter returned with my plate and loudly announced ""Medium well!"" and then hurried away. Obviously, not what I asked for, steak was now way overcooked and honestly not worth eating. Other people in my party experienced similar problems with their own meals. Our server also came back twice to confirm everyone's orders (only 8 people!) and still messed it up. The people who ordered bottomless didn't receive their drinks until a good 20 minutes after ordering, after reminding the server. I'm not sure if these problems were due to an inexperienced waiter, a bad kitchen staff, or both. Nearly every person in the group was disappointed by the quality of their food. The breakfast potatoes were very good, everything else was bad (avocado toast, steak and eggs, burgers, breakfast sandwich). Bottom line: I would not come back here again. The service was poor, the food was not good, the plates were expensive. There are a million better brunch places in the city.",0,0,0,Elena M.,"Morristown, NJ",0,3,0
5.0,3/9/2019,"Brunch was so bomb!My friend invited me to brunch here and I'm so happy she did! I probably would've never learned about Bedford & Co. had it not been for her. I had the eggs in purgatory and an order of fries, everything was delicious. Prosecco was served with mango, orange and guava juice. So good! This recommendation was right in time for summer '19.I can't wait to come back, I know I'll be a regular!",3,0,1,Christina M.,"Saint Albans, NY",29,99,111
5.0,2/19/2019,"Poached Eggs with Avocado on top wild rice, seeds and sprouts was a healthy and tasty start to my Sunday morning! We went at 10am before the Sunday brunch crowd and were seated immediately. The restaurant has neat modern decor with a warm woody feel. Staff were attentive and food came out quickly. The portion of the California Bowl was a bit lighter than expected but it was delicious!",0,0,0,MrKing H.,"Mission Viejo, CA",3,28,46
5.0,2/17/2019,"It's been too long since I've done bottomless brunch in NYC and this spot did not disappoint. I loved the ambiance and vibe of the place with old school r&b playing in the background (not too loud), dim lighting and good vibes. The deal is they provide you the Prosecco bottle and juices until your 90 mins is up. I love that they didn't pre-make them and the juices were guava, passion fruit and mango. I'm not a huge fan of orange juice so this was perfect. Our waiter explained everything to us and was super attentive. The food itself was pretty good. I ordered the steak and eggs and although some complained about the steak portion it was perfectly fine for me. It's a great go to spot in the city for brunch. I will note for certain dishes (steak & eggs) they consider it premium so that dish was a tad more expensive than others.",3,0,0,Adrienne W.,"Philadelphia, PA",84,64,142
4.0,2/14/2019,"This was a last minute brunch decision for me & the besties but it was a great choice! Brunch menu is small but it has the brunch basics! My favorite was the mimosa selection: a choice of 3 juices ( Mango, Guava, & Passion fruit) with the Prosecco bottle brought to the table so you can pour as much as you like! Food was great, loved the fries! Burger was very flavorful! Nice ambience & the service was  good! Definitely will come back!",0,0,0,Aundrea G.,"Owings Mills, MD",0,1,3
5.0,2/4/2019,This is a hidden gem; a MUST visit. The food was delicious and the service was excellent.  This was my first time and would visit again without question.,0,0,0,K W.,"Manhattan, New York, NY",0,7,0
5.0,2/3/2019,"Super chic decor, nestled in an unexpected but great central location. Didn't know it was here but am super happy to have found it! The bottomless brunch special is absolutely worth it! The food came quickly, the California bowl was great and the juices for the bottomless mimosas were delicious. Just what I was hoping for out of this spot and will absolutely be back!",0,0,0,Andrew F.,"New York, NY",234,74,85
5.0,1/28/2019,"I went with friends for the Sunday Brunch Restaurant Week. The place is big and has lots of space. They have comfy chairs in the entrance, so you can be comfortable waiting for your table. I wish all restaurants had that. Brunch menu had decent options. And dessert was amazing. Service was friendly and attentive. I had salmon and chicken salad. Both were pretty good. Size wise, on a smaller side. But we still left pretty full.Place was not very busy, and it was pretty quiet. It was a very good Sunday afternoon.",2,0,0,Olesya P.,"Manhattan, NY",105,122,209
3.0,1/24/2019,"This is a beautiful restaurant and bar that's great to go to with a client or a date you're really feeling. The lighting is very dim and the vibe is romantic. It doesn't seem like it from the outside, but there is a lot of space, with two huge rooms full of tables in addition to the stools by the bar. The host was a very friendly guy who greeted everyone warmly. They do serve coffee, almond milk, and tea, which I really appreciated when I went in the evening. They had no problem with me not drinking, though service was a little slow to take orders that night.in terms of food, I got the octopus, artichokes, and shishito peppers small dishes. Everything was delicious and so well cooked, but the portions that you're getting for the prices for kind of a joke. I have no problem paying for food that is worth it, but I wish they gave a little bit more. I do recommend these small dishes if you're hungry and want something healthy to snack on.Overall, beautiful and artful decor, solid but sparse customer service, and lovely food, but portions were disappointing. I'd love to return for brunch one day and try some more dishes.",5,1,3,Darya S.,"Manhattan, NY",978,2060,1393
1.0,1/20/2019,This place is only getting a star because the food was pretty good. The service here was horrendous. We were sitting for about 15 minutes before a server came over. We got an email the night before saying that THEY WERE OUT OF CHAMPAGNE FOR THEIR BOTTOMLESS BRUNCH! How has a restaurant been around and they don't know how much champagne they should have?!?!? We got the deal off of pulsd so we had to come or else it was going to waste. The manager reprimanded the server in front of us which was completely unacceptable. I have worked in the service industry for years and I've never seen anything like this before. Very disappointed.,0,1,0,Jamie I.,"Smithtown, NY",356,3,0
2.0,1/20/2019,I don't understand the good reviews. We had brunch here and the food was overpriced and well below average. The service was good though,0,0,0,Sarah S.,"Washington, DC",0,4,0
5.0,1/20/2019,"I originally picked this place due to the great reviews about the bottomless brunch. It's hard to find a place that has both great food and unlimited mimosas in New York City. Time wasn't on our side so we missed brunch but decided to make reservations for dinner. It was an amazing experience. The ambiance, the service, the drinks, the food was incredible! Perfect for a date or catching up with friends. We ate talked laughed drank while RnB and Neo soul played in the background . We tried the oysters the scallops and shared a  whole fish that was presented so beautifully, a few flavors of sorbet (mango and pistachio were awesome) and tried maybe 3 of the specialty drinks our fave was diplomatic immunity. I know I'll definitely be back!",0,0,0,Dominique S.,"New York, NY",2,21,11
5.0,1/13/2019,"We loved this restaurant from the moment they greeted us! Great service, ambiance, background music, and super delicious food! We'll be back!",0,0,0,Bette H.,"San Francisco, CA",0,19,0
5.0,1/12/2019,"I haven't had bottomless brunch in a really long time and this was such a lovely experience. 90 mins for all of the Prosecco and mixers you want. It comes with guava, peach and mango and you can keep it coming! I had the burger with fries and my friend had the steak. Both were very well made, flavorful and well seasoned. I like this place because it's unassuming and chill. It didn't get busy until around lunch time but the crowd felt like a mix of tourists staying in the hotel and a few locals. I enjoyed the food, alcohol, company and vibe. TO GET: Bottomless MimosasGREAT: Ambiance, food and Prosecco TO DO: Drink everythingWOULD I GO AGAIN? Yes! It's in midtown and is super easy to get to",2,1,0,Mai H.,"Woodside, NY",390,33,326
4.0,1/9/2019,Followed advice from yelp and tried this place for breakfast. This place is really really good. We usually go to the Sofitel for breakfast at twice the price. We were shocked that the food came out so fast and yet was so perfect. The young lady chef is amazing.,0,0,0,Daniel G.,"Weston, CT",8,185,26
4.0,1/6/2019,"Food: The food was great! This is my second time coming to Bedford and Co. and it did not disappoint. My first time was during NYC restaurant week. This review is based on my second time here during   the bottomless brunch with the pulsd voucher and was definitely satisfied! I had the eggs my way and also had a taste of the steak and eggs. The steak was perfect and great quality of meat, just wished the portion was a bit bigger. The burger was probably the best bang for your buck, and the fact that it included a thick slab of bacon was a huge plus. Overall the food was absolutely delicious!Drinks: The pulsd deal included bottomless champagne with three mixers. The champagne was great by itself but the mixers were a plus. The mixers included a mango orange, cranberry and peach. All three mixers were so yummy!Service: The waitress did an amazing job at taking care of our large party. She made sure our glasses were never empty nor our tables. She was very attentive especially when our group was seating a bit outside of the main dining room. Vibe: Classy and elegant vibe but not too stuffy. Love the entrance lobby and the fur accents. Definitely recommend for large groups or even for smaller groups or date night.",0,0,0,Leng Leng Y.,"Manhattan, NY",74,41,256
4.0,1/6/2019,Great service! I was too hungover to enjoy the food or bottomless mimosas but the food smelled amazing. Maybe will try again next time I'm back in NY,0,0,0,Sarah S.,"Clonsilla, Dublin, Republic of Ireland",78,429,2441
1.0,1/1/2019,"The service was so slow also the waiter said that bottomless brunch only applied to those with ""vouchers"" when the menu clearly stated a set price of $39. Would absolutely never come back considering the wait, ESPECIALLY NOT FOR BOTTOMLESS BRUNCH- PLEASE NOTE THEY CHARGE YOU PER ""PROMO BOTTLE"" do not come here",1,1,0,Sarah G.,"Seaside Heights, NJ",0,14,2
3.0,12/28/2018,Not many places are opened  for Christmas Eve so we gave it a shot. Menu is their winter menu no specials. Have asked for low salt for our dishes. The octopus was nicely done but could do with a lot less salt. Duck breast was nicely done but also on the salty side. The dish is nicely done and that's the only main course we liked overall.,1,1,1,Cathy S.,"Manhattan, NY",0,34,13
3.0,12/26/2018,"We made reservations for Christmas Day Brunch at 10:15 am. On Christmas Eve, we had to confirm our reservations.  My sister showed up a little early (luckily) and we were still about 10 minutes away; she was told there was no brunch menu and that she should order food for the whole table because the kitchen was closing at 10:15. She did order 3 breakfast entrees and the food was decent. However, the place was dreary, no decorations for the holidays. There was no brunch for Christmas Day and the staff kept reminding us they were closing the kitchen soon because they expected to be very busy later.  Not sure why they accepted reservations for a party of four at the same time they expected to close the kitchen.  Not sure why they expected to be busy later; can't imagine why anyone would be having xmas dinner in such a dark and dreary atmosphere.  The brightly lit photo I have seen of this establishment is of the bar area, and it does not reflect the actual sad and drab dining room where you actually have to eat.  Very disappointed.",1,1,1,Brigitte M.,"Manhattan, New York, NY",0,6,1
4.0,12/18/2018,"It's a good weekday lunch option for the area. Definitely feels more like Bedford Ave than midtown Manhattan, which is a good thing for sure. Downside is that you are certainly paying midtown prices tho. The burger is ridic good and so juicy that the buns fall apart. Chase it with a bloody mary and your hangover is gone and you can return back to work like a normal contributing member of society.",0,0,0,Sia E.,"Brooklyn, NY",128,16,3
1.0,12/16/2018,Server was rude. Dropped off food and never returned to the table. Food was not good. Asked for my burger medium well and it came out with a very red center.,1,1,1,Paula L.,"Atlanta, GA",28,3,0
5.0,12/15/2018,"We were visiting the tree, and I wanted to eat some quality food -- close enough to walk over to, but far away enough from the craziness of the Rockefeller area. I also needed something kid friendly (I have a three year old) and wanted to be able to make a quick reservation on Open Table. Voila! This place checked ALL the boxes. I was so pleased with everything. Great atmosphere, friendly staff (especially to my daughter), my spicy margarita was amazing, and the food was delicious. We ordered my daughter a kids spaghetti, and ended up ordering a plate for my husband and I to share on the side -- homemade pasta! And I could lick the sauce off the plate. My steak was perfectly cooked and my husband was also very pleased with his burger. A wonderful experience after a fun day in the city.",0,0,0,Amanda V.,"Near North Side, Chicago, IL",0,8,0
5.0,12/11/2018,"Great food and atmosphere. My steak was on point, service was timely and attentive. From someone who is in hospitality over a decade I would highly recommend for a casual or business dinner.Big shout out to Clinton, this guy deserves a raise. He had an eye for details and was assistive beyond my expectations. Thank you, we'll be back!",3,0,1,Anastasia Z.,"New York, NY",7,1,0
5.0,12/10/2018,Came here on Saturday around noon for brunch with a pulsd deal.  I was a bit nervous because I didn't have a reservation and was hoping they would accommodate us. The lovely hostess was able to get us a table right away and it wasn't super busy which was another plus. The music playing in the background was on point and the food was amazing. The portions were plentiful. The pulsd deal comes with one bottle of champagne and two entrees which was perfect for my friend and I.  If you get the chance you should definitely give this place a try.  The whole staff was amazing and very helpful.,0,0,0,Jessica F.,"Brooklyn, NY",0,5,2
3.0,12/9/2018,We made reservations for a family brunch at Bedford & Co and it was pretty tasty! First I loved the open table booking it makes getting an open spot easy!The interior feels dark and romantic. Even though we had our son with us we would definitely go back for a date night. We were seated right on time in a cozy table for 4. The brunch menu offers something for everyone! I had the avocado toast and mimosa.The table shared a cinnamon bun and it was big enough for 4 and tasted phenomenal. My avocado toast arrived with one piece of toast and a side salad. I was a little disappointed that there was only one piece because the food indent inexpensive. It also was a little bland in taste. It wasn't bad it just wasn't great.However everyone else at the table loved their food. The hubby had chicken and waffles and devoured every bite. The teenager wiped out the sausage griddle sandwich faster than I could blink. Will definitely come back for another visit.,2,0,1,Lori M.,"Milwaukee, WI",268,323,297
1.0,12/8/2018,Bar closes at 10 on a Saturday night.   So disappointed and frankly angry.    Staying at the Renwick and was really looking forward to ending night here.   Ugh.,1,1,1,Ruth P.,"Brewerton, NY",0,7,0
3.0,12/2/2018,Quite average compared to other brunch spots. The service was quite slow however the place was starting to get busy.  No French fries on the day but american style potato that were very greasy and frankly not great.,1,2,1,Sean G.,"Dublin, Republic of Ireland",41,610,544
5.0,11/28/2018,I really enjoyed the bottomless brunch here. I decided to give it a shot after discovering it on the Pulsd app and so glad I did. I am not a huge fan of chicken & waffles but they put a nice spin on it and I definitely approve. I also loved the fact that they give you your own bottle of bubbly and an assortment of juices to make your brunch cocktails to your liking. The tropical fruit juice was the BOMB and so was the service.,0,0,0,Bri M.,"Brooklyn, New York, NY",381,103,184
