rating,time_created,text,useful,funny,cool,username,user_loc,user_friends,user_reviews,user_photos
5.0,11/25/2018,"Brunch Review! Great food, service and value (especially when using the pulsd deal ~$40 for two people). Bottomless prosecco with juices to mix as you pleased was an awesome option! would go back again!",0,0,0,Gurdeep S.,"London, United Kingdom",311,12,0
2.0,11/25/2018,"I was here for a brunch and had a poor experience since most of the brunch options include eggs which I have a slight allergy to.  I asked the waitress if, because of my allergy, I could order something off of the regular lunch (not brunch) menu, and she immediately responded with a ""no"".  I opted for a dish on the brunch menu (California bowl) and requested the eggs on the side.  After taking my order the waitress asked if I any allergies, which I can shared with her.  Once the entree came out, the portion was tiny (small enough to fit in the palm of my hand).  I realize that NYC portions can be smaller due to a higher quality, however, this was not the case. The quality of the food was simply average and the portions of the dishes for the others at my table were more reasonable. Also, once the entrees came, there was only a single time (if that at all) where someone came to refill our waters.  Overall, this is not a restaurant I would choose to return to.",1,1,1,B Z.,"New York, NY",0,33,0
4.0,11/24/2018,"Good brunch - fast, friendly service and really great ambiance and decor.  The fireplace makes it a great comfortable place especially during colder months.",0,0,0,Diana C.,"Manhattan, NY",16,151,144
5.0,11/19/2018,"I came here for a birthday day brunch, which we made reservations for. Because the bottomless brunch is 2 hours long from the time you are seated, they make sure your whole party is there. Once we got our group together, we were seated immediately and started off with the mimosas, which you mix yourself. Tip: there's a coupon for bottomless brunch Pulsd $39 for 2. Totally worth it, so check if the deal is still available before you go.Our party got a few things - chicken and waffles, Bedford burger, and sausage griddle sandwich. I personally got the steak and eggs. Steak was perfect and had wonderful flavor. So did the eggs, the greens, and potatoes. As a heads up, the amount of steak that comes with your plate isn't the normal 6-8 oz, it is way less then that, but the server was sure to clear that up before we ordered. As for the rest of the group who got other parts of the meal, they were also very pleased. I have to commend the service team here. They were quick to respond and took good care of us. Definitely one of the best brunch places in the city. Looking forward to coming back!",3,1,2,Toyin D.,"Edison, NJ",54,167,230
4.0,11/17/2018,My wife and I went here for dinner the other night and overall we had a great experience.  The staff was very nice and the food was great.  I had the pork chop medium rare and it was one of the best I have had in a long time.  My wife had the burger and she said it was very good.  The only disappointment  was the scallops we got for the appetizer.  It was good but not worth 19 dollars.,0,0,0,Mackenzie K.,"Camillus, NY",0,11,0
4.0,11/12/2018,"We finally got to do Sunday Brunch here yesterday and overall, despite the fact that service took really long (like waited for almost 30 mins to be attended to after being seated, I really had to ask if someone can help us), the 4 stars is really attributed to the food and the ambiance.Loved the fact that they're pretty generous and actually give you the bottle of Prosecco at the table with fresh orange juice, mango, and guava to go with it. The food was delicious! Hubby ordered the Cheeseburger and he made me try it, really good! The fries was also perfect! And as for me, I went with the Chicken & Waffles combo. Divine! The chicken was fried to perfection and the syrup was the perfect balance of spicy and sweet so it definitely won the sweet & savory combo. We were given a second bottle and was pleased that it was finally chilled this time. Made up for better drinks. Shah attended to us after I requested if anyone can help us. He was then attentive to us and was good. Thanks, Shah!This place has really good potential. Hopefully they can iron out the kinks of service. It kind of defeats the purpose of getting seated promptly when you won't be attended to for half an hour.",0,0,0,Joanne U.,"New York, NY",51,104,179
4.0,11/11/2018,"I came here for brunch with some friends on the weekend. First note, this place is busy and quite popular, make a reservation. The staff is super friendly and accommodating, which I really appreciated. What I loved about the brunch was the fact that they give you the champagne to pour at your discretion along with 3 different juices. I was in heaven!! I liked that I can control how I choose to mix my beverage. I had the steak and eggs, it came with home fries and a side salad. I enjoyed my entire experience here.",0,0,0,Melissa H.,"City of Orange, NJ",24,57,47
5.0,11/11/2018,"So I have to stop eating & say how wonderful this place is. From the staff to management, Catherine is amazing, so friendly & knew exactly what we needed she made us feel at home, I honestly don't know if I was coming back again, since I like to try different brunch places but I fell in love with this place from the staff & the food.. it was all amazing & I found my new Sunday brunch spot.",1,1,1,Lisa J.,"Queens, NY",488,30,31
2.0,11/11/2018,Second time here for brunch. Food was just as good. Service was unbelievably slow. Waited 45+min for our food to come. Water glasses were empty for over 10min and I couldn't wave down our waitress to ask for water because I couldn't find her. Waited another 10min just for our bill to come. I don't get it. We came here just around the same time as last time. Was it an off day? Was it poor staff planning? Had my first experience been like this I probably would've never come back. What a shame.,4,1,1,Lu H.,"New York, NY",294,570,1967
5.0,11/5/2018,"Had a great experience. Definitely for those who like ""foodie"" style eats. Servings are pretty small for the price. But great cocktails and ambiance. Note menu is all made in wood fire and the menu has great options to try! I loved the duck.",0,0,0,Genisa B.,"Brooklyn, NY",68,17,22
4.0,10/31/2018,"a co-worker brought back to the office  the Bedford burger with friesfor a special occasion.the burger was juicy.the fries were good.for free food, it was good.",0,0,0,Linda C.,"Queens, NY",16,765,0
5.0,10/30/2018,"Amazing place. Went there with 3 other friends for brunch and, the service was incredible. The general manager came over to check things were alright when, she saw we didn't have drinks. Our waitress, was Amber. She was amazing and accommodating. We also roped in the help of another server named Shah.Food was equally as good. I had the sausage sandwich, A friend had the steak and eggs, another the chicken and waffles ... We all agreed we'll be back here and will definitely spread the word.",0,0,0,Chinedu A.,"San Francisco, CA",214,2,0
3.0,10/24/2018,"Ate dinner there tonight. Restaurant was busy, we were seated right away for reservation. Service was very slow. We were offered water after sitting for 10 minutes and it took another 15 minutes to place drink order. Food was fair and expensive especially for the slow service. Wood oven is cool, however overpowers the room and we left smelling like smoke",0,0,0,Alex S.,"Manhattan, New York, NY",0,4,0
3.0,10/15/2018,"(3.5 star)Met up here the other day with a former colleague for a quick lunch. There were no issues coming in unannounced/without reservations and were promptly seated and attended to.Bedford's & Co's lunch menu is primarily devoted to a 3-course prix fix offering ($29 - app, entree, cookie to go - though, like restaurant week, there are some offerings that have supplemental costs - e.g., the octopus app), though they do have some al a carte offerings. We both opted for the prix fix.I started with the heirloom tomato appetizer with shaved cheese (mozzarella or perhaps sheep's milk?), and capers - which was light, lovely, and had some nice zest with the plentiful basil.For my main, I had the grilled kale salad with shaved pecorino, lemon, and pine nuts, and added some grilled chicken as well. The salad was nicely dressed with a lemon dressing and was much heartier than it looked. While I would have hoped the added grilled chicken would add up to more than just 4 pieces, the chicken itself was nicely prepared and tender.The cookie to go was a chocolate-marshmallow variety - not bad, but nothing special.All in all, a solid, prix menu lunch spot with some tasty healthy options if trying to 'be good'.",2,1,2,Steve L.,"New York, NY",157,309,1204
5.0,9/30/2018,"I came here for brunch on a Sunday afternoon & was instantly impressed. It was dimly lit, but still had enough light to where we didn't need to squint or use our phones to see the menu. I also loved that they had a good R&B playlist going on. I ordered the steak and eggs, which was cooked to perfection. My bf had the fried chicken and waffle, which was also great. I would definitely return here again!",0,0,0,Juliane H.,"Rosedale, NY",87,3,6
4.0,9/29/2018,"I loved the dark retro vibe of this restaurant and bar. Be forewarned: for midtown east this place was packed and had a legit scene. Our waiter was an adorably sweet hipster. We had a stellar beer and cocktail. (Many of which are named after literary figures.) The food that we ordered (an old school cheeseburger with bacon) and rigatoni were well prepared and pretty tasty. We certainly finished our plates with not even a crumb between us. Overall, I'm glad that I finally checked this place our and was satisfied with my dining experience. I would be most likely to come back for a drink rather than a pricey meal.",0,0,0,Meredith S.,"New York, NY",64,123,156
4.0,9/24/2018,"Breakfast was delicious, wish they were open a little later I would have liked to try some of the later dining options. Everything was cooked perfectly, I got the basics, an egg over easy, bacon and toast. The toast was more like bread, not really toasted at all, the two times I had breakfast it came like that so if you like actual toast then maybe remember to ask for it a little crispier. The orange juice was so good, probably the best OJ I've ever had, we ordered some refills of it and my coworker wanted to try it as well, however the waitress was pretty aloof and took care of other tables forgetting about us entirely until we asked for the check and then she brought us the OJ, it would have been nice to sit and enjoy it instead of having to chug it on our way out the door. Other than that it's a good place with good atmosphere.",0,0,0,Anita N.,"Avondale, AZ",36,156,96
5.0,9/9/2018,Service is superb! Everything about this place was amazing. Once you enter your greeted with a warm welcome and checked on every minute until you leave! Thanks Catherine (general manager) keep up the amazing service you and your staff are AWESOME!!,0,0,0,Sherlana C.,"Manhattan, New York, NY",0,2,0
5.0,9/9/2018,"I visited Bedford & Co for brunch today with my friend and I have nothing negative to say.  I purchased a voucher from Pulsd which allowed us to partake in the unlimited bubbles for 90 mins as well as an entree for each of us. Even without that great deal I would of loved the brunch service that B&C provides. First and foremost the fact that they open a fresh bottle of champagne and leave it at your table speaks volumes to their commitment to your brunch experience. There is no hunting and flagging down your waiter/tress for a refill. You pour your own troubles! They provide 3 different juices. I read that is was a passion fruit mint, and strawberry option somewhere else but I'm assuming that's seasonal or it just changes depending. Today we had the option of mango, pear and grapefruit. They ran out of mango, which was my favorite so our waitress brought us orange juice. I admit it was lovely not having the typical orange juice mimosa for the majority of our time. How boring is that?! Anyway, they are not stingy with bringing you more bottles once you are finish with one. However, we paced ourselves and I'm sure my liver thanks me! If you are not a drinker I still encourage you to purchase the unlimited because for $34 you have bottomless drinks and an entree as opposed to paying $35 for one bottle or single drinks which add up. Now on to the food!  They do not have a vast menu with many options but what they do have they have perfected. I cleaned my plate. I had the Frittata and my friend had the Sausage Griddle and I can say I was impressed with her dish as well. Flavorful and properly cooked! I didn't need to add salt or pepper and trust I've had to do so on many occasions elsewhere. I may have came hungry but my satisfaction had nothing to do with an empty stomach. I would surely return to have either two of those dishes again.. minus her sunny side up egg (I don't like runny yolk!)The service provided by Ember was also pretty great. She wasn't on us constantly but she was around when we needed her. She was pleasant and patient. A nice sense of humor and professionalism. The hosts possessed the same professionalism and charisma. The ambiance was enjoyable. When you walk in you see the partial span of the restaurant and the complete bar which is a nice size. To the right is a nice and comfy waiting area. You can also see into the kitchen which I always enjoy seeing. Decor is trendy and comfortable. The venue is dimly lit so can be romantic for a date but give a grown and sexy vibe for your ladies night/ group outings. If you are looking for a party brunch this is NOT it! They do have music playing in the background but the chatter from those around you will probably drown it out as was my experience today. You can surely go here and enjoy your company without talking over the bass. You may however compete with another large group if there is one. After all it's an unlimited brunch spot with amazing food! Tip: Ask you waiter/tress to bring multiple juice mixes per person or double up on your favorite because they are tiny glasses like 2 oz worth.",1,1,0,Katerra B.,"Freeport, NY",5,33,30
4.0,8/21/2018,"Quality of food is great, location was even better for anyone staying in Murray Hill it is very convenient for great breakfast lunch or dinner . I got to experience brunch but the menus for everything else sounded amazing. Love the atmosphere and decor . My service wasn't that great she took a really long time to check on us and being the check which is frustrating when you are in the city and not wanting to waste time .",0,0,0,Marianna A.,"Orange Park, FL",2,37,59
3.0,8/18/2018,"Loved the atmosphere - cute, dark, and cozy. But food, although it looked great, lacked flavor - perhaps it was my palate but I felt it needed salt. The service also left something to be desired as the waiter barely came by (and it was not too busy) so I could not actually ask for the salt. Would skip.",0,0,0,Diana F.,"Manhattan, NY",1,23,8
2.0,8/15/2018,"Not sure what the issue was last night, everyone else here seems to like the restaurant. After we were seated and ordered we must have waited nearly 40 minutes for our food. However, It wasn't just our table as only one table had their food. When the food arrived it was rushed and under or overcooked depending on the dish. The wait staff was also nowhere to be found and we had a hell of a time getting our water glasses refilled. Everyone has an off night I suppose.",0,0,0,Max B.,"New York, NY",262,2,0
4.0,8/12/2018,"Solid eatery, very trendy and actually quite loud (3pm on Sat); service could be improved slightly. We had drinks and fries at the bar on our first night followed by complimentary continental breakfast the next morning. Very small portions for the price but excellent quality, which is what we expected so no major complaints. I do think my $15 cosmo was on the exorbitant side given its small size and the cheaper price of some of the other specialty cocktails on the menu, but it's NYC - it was very tasty and I had two, and I felt them. Would probably not go here unless staying at the hotel, but we do plan to return to the hotel so I'm sure we will return. Oh, and the free glass of prossecco via yelp was a nice bonus.",0,0,0,John S.,"Red Hook, NY",0,65,6
5.0,7/23/2018,"Mic drop.   I'm having trouble coming up with words for how much I loved my dinner here. By far the best meal I've had in ages, including a ""famous chef branded"" restaurant closer to home.   Order anything you want - I had 3 starters, 1 main and 2 different drinks and *everything hit*.  Everything. Hit. That's such a rarity. Before you read further, go through and read my review history for context - that's just a good practice, right ?  I'm in it for the food, and totally don't care about ambience if the food doesn't hit.  Bedford has it all - amazing food, amazing ambience, amazing service. This restaurant is in the ground floor of a boutique hotel. I tend not to eat in hotel restaurants but I checked out their menu (hanging on the wall next to me on a leather strap) and found many great sounding pasta dishes.  Now that Bella Luna is closed (so sad) and Portalli's is (hopefully?) recovering from the flood I decided NYC is a great place to get Italian.  The hotel itself has me totally vibing, so eating downstairs in the hotel restaurant was a go. Right from the start, excellent ambience.  Dark, mood lighting, old school hip hop playing.  Ordered up a house cocktail that was exceptional - I believe it was Scotch with fig jam.  Yes, fig jam.  It was very refreshing and nice to be able to get a fruit drink that didn't end in ""crush"".  Get the octopus.  It's right inline with Samos'.  GET THE RIGATONI.  House-cured pancetta.  It bears repeating - GET THE GODDAMNED RIGATONI.  You don't consume the rigatoni, it consumes you.  It was so exceptional I couldn't even place the cheese they garnished it with.  Surprise, it was parmesan ... just the most exceptional parmesan that has ever existed.   As soon as I tasted it I knew I didn't want this ride to end, so time to strike up more conversation with ... The bartender, Tommy, is outstanding in every way.  Appreciative of the fine art of food and drink, he's wise beyond his years in his recommendations.  Bonus !  He's also the curator of their house cocktails.  Ask him about the history of the Diplomatic Immunity - it's quite clever; not just a double entendre.  Quite worthy of raising a glass or three.   My lawyer advises me I stopped at three drinks.  Anyhow, back to the food ... Tommy  recommended I try the potatoes.  Potatoes, right ?  Topped with cheese. Turns out Tommy is a pretty smart guy.   The potatoes were cooked just perfectly and the cheese ... Oh my, the cheese. What a cheese.   Get the potatoes, either before or after your main plate. Even the beets are great.  Beets are a bit of an unsung hero in the culinary world and they bring them to their deserved glory. This is the kind of restaurant where the more I type, the less effective the review.  It's a mic drop for sure.  If you're ever in the big city you have to give it a shot.   It's not aiming for cheap, it's aiming for great quality.  If you come here on a per diem be prepared to spend out of pocket, but it's exceptionally well worth it.  I eat out quite a bit at home and on the road, and am exceedingly happy I ate here despite the cost.  By comparison, I spent close to twice as much for a meal at ""famous dude's steakhouse"" and left disappointed.  Reading some of the other Yelp reviews leaves me bewildered, which is why I suggest going through my history and deciding if your preferences and tastes parallel mine or not. Matt B. it's a restaurant with a bar and fine food.  Why do you require that it fit within some industry categorization like ""wine bar"" or ""sports bar"" ?  God forbid, seriously does the world need more sports bars ?  A couple quick administrative notes: It's called Bedford & Co and is colocated with the Renwick Hotel.  The live menu isn't what's in the hotel rooms - they now have less pasta now, more meat dishes.  The kitchen closes at 10 sharp, so order before then.  Of course they let you continue with your meal, but order all your goodies before 10. Sorry I don't have any pics, I was too busy gorging.  There are plenty of pics in other people's reviews though. Let me say this too - after having an exceptional meal I'm reminded of what a food desert we live in despite our affluence location.  I'm further reminded of how fortunate we were to have Bella Luna around for so long, and Portalli's.  Portallis, I hope you reopen.  If you need volunteer help, reach out to me here - I'm completely serious and have already done volunteer help for EC shops.  The food crazed population of HoCo needs you back in our lives. Bottom line: Bedford & Co collocated with the Renwick Hotel is a mic drop.",2,1,1,First L.,"Columbia, MD",3,47,13
5.0,7/23/2018,Food was scrumptious and service was great!,0,0,0,Priscilla O.,"New York, NY",383,8,0
4.0,7/23/2018,Such a cute restaurant inside Hotel Renwick. Really good flavors in the spaghetti and in the brownie dessert!,0,0,0,Maddy L.,"Queens, NY",5,101,27
5.0,7/10/2018,"I've only been here for brunch, but we had a great experience here. We had other options of places in mind but got annoyed they didn't take reservations- so my friend luckily suggested this place that does take reservations. They reminded us through Yelp and email and call about our Saturday morning reservation, so I got really nervous when my train from queens got canceled and I was going to be a half hour late. Luckily they were SO flexible and said not a problem, and recommended to my friend who came on time to not sit until I got there so we could have the full 90 minutes of bottomless. We did the $29 entree+bottomless drinks which is a great deal considering it's in the heart of midtown/right near grand central. Our waitress was very sweet and accommodating. She brought over a champagne bottle along with 3 mixers (guava, pear, and mango) for us to mix and match ourselves- I've never seen this before! When we needed a refill, our waitress was on it. For my entree, I got the chicken and waffles which were deliciously crispy- I got the sauce (syrup mixture) on the side so I could control how much went on. There was no rush to leave and we enjoyed hanging out in their funky, dimly lit atmosphere catching up. Definitely recommending for a great brunch deal.",3,0,0,Nicole M.,"Westbury, NY",148,269,960
2.0,7/8/2018,"We were staying at the Renwick hotel and were given $10 per person voucher to use at the Bedford.We ate breakfast at the Bedford twice during our stay.Ordered the Frittata and Avocado toast with eggs.Frittata was fine, but the eggs were way underdone for over medium. The toast for the avocado was way to thick and a little dry making it hard to eat.Service was friendly yet poor. Had to ask for everything, no salt and pepper on the table. The first salt shaker did not work and had to hunt them down to get a second salt shaker while my breakfast was getting cold.Asked for a refill for my coffee which never came.",2,0,0,Gb G.,"Frederick, MD",0,13,0
5.0,7/3/2018,Great breakfast at the bar. The only thing that was better was Victor's awesome personality and customer service. We will definitely be back!!!,0,0,0,Monica Q.,"Watertown, CT",0,2,0
5.0,6/23/2018,This is hands down my favorite bougie brunch spot. Bring me bottles to re-fill the drinks myself. Serve me a plate that's affordable and friggin delicious. I've had the chicken and waffles and the sausage griddle. Perfection. Those little fingerling potatoes: yas. I love the little flavor shots they give you to mix your drink: the guava is amazing. Perfect for a one on one or a group affair.,0,0,0,Morolake T.,"Charlottesville, VA",270,33,26
4.0,6/19/2018,"My boyfriend and I came here last night for an early dinner. If you check in you get a free glass of prosecco which I think is a great offer! We arrived early for our reservation but it was no trouble sitting us early which was nice.Our waiter was super helpful and attentive throughout the entire meal. They also have a special of the day which is served family style and is $45 a person. My boyfriend and I weren't interested in the daily special so we decided to just order our own meals. I decided on the burger and my boyfriend got the chicken under a brick along with a side of broccolini , which was suggested by the waiter. I'm so glad  my boyfriend decided on the side as it was sooooo good; one of my favorite parts of the meal! I would definitely recommend the broccolini to anyone there. My boyfriend received two decent sized pieces of chicken that were perfect; not dry at all! The burger came with a nice helping of fries as well. This place is good for a date night or get together as it places some music but nothing too loud that you can't  hold a conversation. The meal came to about $75 between the two of us which wasn't too terrible for a meal in the city. Overall I might come back here as it is close to my job and I enjoyed the food and atmosphere of the restaurant.",1,0,1,Emily D.,"New York, NY",42,207,349
5.0,6/18/2018,We look forward to eating here every time we are in town. The prices are reasonable the choices are interesting and the food is delicious. The location is very convenient for us and the ambience is welcoming.This little neighborhood treasure is popular because people have tried it and liked it.,0,0,0,Kathleen H.,"Houston, TX",0,5,9
