rating,time_created,text,useful,funny,cool,username,user_loc,user_friends,user_reviews,user_photos
3.0,6/16/2018,Has such potential but needs something. It isn't a wine bar. Isn't a restaurant. Isn't a sports bar. Isn't a cocktail bar. Leaves me thinking it just isn't. But it was ok enough. I don't think I'd go back but the bar guys had some good chat. Isn't a top bar. Isn't the bottom and got that reason no chance of me going back.,0,0,0,Matt B.,"Manhattan, New York, NY",55,111,127
5.0,6/15/2018,"I love this place it has become a regular go to for me, my sister and niece. The staff is friendly warm and accomodating every time we go there. The food is great! They always have nice music playing not loud that you have to yell across the table but loud enough that you can groove and still have a great conversation at your table.",0,0,0,Thayme G.,"Manhattan, NY",35,3,0
4.0,6/12/2018,"I can't believe I've walked right by this place countless times and never tried it. This review is for lunch which is an absolute delight. The food is American but executed really, really well. The chicken club although seemingly simple was delicious.Tuck in the Renwick hotel, the decor is sophisticated, broody and dark, resembling a chic man cave or she shed. The unique oven also seems like it would add to the food. Definitely recommend if you are in the neighborhood,",0,0,1,Jennifer Y.,"New York, NY",182,619,2
4.0,6/3/2018,So I went there for a quick drink and I must say it's a cute little gem. Honestly I haven't eaten anything there and so my rating is for the ambience. Their bar area is tight and their seating area is very intimate. So a great date place and convenient since it's in midtown,0,0,0,Mel A.,"Manhattan, NY",1,63,12
2.0,5/30/2018,"Update: We were extremely disappointed with the drinks, food, and service we received on 2 occasions visiting Bedford while staying in NYC, however; Catherine (the general manager) followed up with me to express her sincere apologies and her desire to retrain their team in order to correct their service/food quality going forward. I appreciate such diligent follow up by the management and seeing them take corrective actions to prevent future disappointed customers. Best of luck to future patrons!",0,0,0,Stephanie K.,"Portland, OR",8,32,18
5.0,5/29/2018,I've been here a couple times with my girlfriend for both brunch and dinner. This is our absolute to go place in the city for a nice meal.  Definitely recommend the steak and the duck. The drinks are extremely good and strong and it's definitely worth the buck.,0,0,0,Brian Z.,"Clifton, NJ",95,1,0
3.0,5/27/2018,Food was pretty tasty but service left a lot to be desired for and the atmosphere seemed to have an identity crisis.  Fun hip hop music vs slightly stuffy decor.,0,0,0,Amy T.,"Seattle, WA",82,24,1
5.0,5/20/2018,"Food was amazing! We had the flank steak, rigatoni, with the steak tartare for an appetizer. All were cooked well and tasted great. We had several of the cocktails, which were also well crafted and delicious. We had the sorbet for dessert, and though the portion was small, also was great quality. It was a pretty small crowd on a Saturday night but I'm sure it's busier during the week.",1,0,1,Kati B.,"New York, NY",230,130,60
4.0,5/17/2018,"Bedford & Co is somewhat of a hidden gem. You can easily walk pass it without knowing it's there, right under The Renwick Hotel. Once you enter you are in a small lounge area where some of the hotel guests seemed to be having drinks. Then there is a long bar where things start to get interesting. There is a great cocktail menu and wine list as well as happy hour specials. Sliders and oysters are delicious bargains. Only thing at the bar is the music level. You can't really have a conversation unless you raise your voice which few bar patrons were utilizing their dance club voices. Pass the long bar and the main dining room opens up with the open-kitchen being the main feature of the room. Dining room is divided into two sections/levels. Lower section on the right is right next to the kitchen but both sections feature the same sound levels from the bar area. It's great if you are going for a clubby vibe but not so good to have a chat with friends.On to the menu: most of the dishes are cooked in Chef John DeLucie's wood-burning open grill, tribute to the Argentinian cuisine. Besides the main menu there is also a three-course family style option for the whole table at $45/pp. Also the pre-theater, three-course prix-fixe for $35/pp.We started our meal with the Portuguese Octopus, Wood-charred beets and the sea scallops. All very good but beets were the best and scallops were sadly overpowered in a very spicy broth. Mains included Spiro's Spaghetti, Pork Chop, Duck Breast, Leg of Lamb and Chicken under-a-brick. Again all very good but the chicken felt somewhat undercooked and lacked the usual crispy skin of a bricked chicken.We skipped the dessert in place of digestives. Nice selection of brandy, Armagnac and cognac options. Overall food certainly worth a second trip but loud sound level and rough-around-the-edges service will be the decisive factor.Enjoy!",1,0,1,Sebastian S.,"New York, NY",88,103,248
3.0,5/15/2018,"Went here with a friend to grab a bite to eat for dinner on a Monday night. Surprisingly, the place was pretty crowded, but we were able to grab a table.This review is a bit of an odd one for me because I feel like this place did a lot of things right, but the meat entrees just did not impress.We started off with an order of the burrata. The burrata was good--definitely one of those dishes that stands out on its own, and this was no exception. Though I wish it had some more crisps with it.For my main course, I went with the lamb leg. Though it was cooked perfectly and the puree it was served with was fantastic, I just felt that the meat was not nearly as flavorful as I was expecting--it really did not carry much flavor at all.My friend's dish--the duck--also again was cooked perfectly and melted in your mouth, but still lacked some serious flavor.I don't know if this kitchen doesn't believe in salt or seasoning, but it definitely did not come across in our entrees.We ordered a side of Brussels sprouts as well, and they were also very good.Overall, this place definitely has a nice energy to it and our waitress was super friendly and attentive. I felt like some of the pricing was a little heavy-handed--but that's expected from a hotel restaurant. The food--with exception to the meat--was fantastic and even so, the meat was cooked well, but just didn't hit any level of flavor for me.",3,1,2,Ryan R.,"New York, NY",746,1843,225
5.0,5/14/2018,Interesting location in Midtown as part of a modern boutique hotel. The woodfire oysters and squid ink pasta were very good. The food here is obviously good quality and delicious. Nice romantic ambiance is perfect for a date. I was quite surprised at how rich and delicious the dinner was!,0,0,0,Christine H.,"Manhattan, NY",48,142,170
5.0,5/13/2018,"What a great brunch!! Any entree and unlimited prosecco (and they brought us peach, mango, and passion fruit nectars to mix with it) for...is it $29? A dark, clubby interior was cozy and the service was attentive. And the food was delicious -- it's been a few weeks so I can't remember what I had (or maybe it was a few Bellinis that wiped my hard drive) but it was savory!",0,0,0,Ruth G.,"Princeton, NJ",0,14,0
5.0,4/20/2018,"food is superb! was a bit skeptical of the fixed price menu because most of the items were not something i would actually eat but the crispy artichokes, shishito peppers, and burrata are a must try! this place completely changed my opinion of these foods.",0,0,0,Kim D.,"New Milford, NJ",2,48,31
4.0,4/2/2018,"Came here for brunch. I enjoyed the decor, the music, the food was presented well and of quality but lacked flavor. The service was really good and the general manager even came over to my table to introduce herself which is not something that happens often & I appreciated that.",1,1,2,Tashera D.,"Brooklyn, NY",10,68,50
4.0,3/27/2018,Nice decor. Had breakfast while staying the night. Delicious avocado toast. Friendly and quick service.,1,1,1,Jenn S.,"Morristown, NJ",0,49,17
2.0,3/26/2018,"Bottomless brunch drinks where really good and on time. The food was okay, not much variety and the portions are normal. The service is kind of slow and complicated when you order the check.",1,0,0,Camila S.,"New York, NY",141,7,1
1.0,3/25/2018,"Great ambiance and decor but horrible food. We ordered two coffees and both came lukewarm. We got a chocolate croissant and it was bread and chocolate - not fluffy and crispy at all. I ordered a frittata and it was a warm omelette, which I could have easily made at home myself. My husband ordered a rotisserie chicken salad and the salad was super small. There were only a few pieces of chicken (4 small pieces) that looked like leftovers. Not worth coming to ever again.",1,0,0,Samantha H.,"Manhattan, NY",1,16,0
5.0,3/24/2018,The atmosphere was amazing. I was able to make a reservation very last minute through Yelp/OpenTable. The hostess let us know that brunch was starting within 20-30 minutes and provided both menus for us. My son got pancakes and I got the chicken and waffles. Both dishes were amazing. And the chicken was so crispy that it perfectly paired with the fluffy waffles.,1,1,2,Krysten R.,"Miami, FL",4,1,0
5.0,3/19/2018,"These guys Rocked.We set up a huge party for 30+ people for a happy hour on a Tuesday, and with a small misunderstanding, we ended up arriving en-force on a Tuesday with them thinking we were on for a Thursday. The team spring into action and had everything ready to go and set up within minutes. To make things stickier, there was a blizzard that kept all beer from being delivered, so we were working with wine-only for our event.We had a separate space set up with an open floor in minutes, and wine and food followed in a blink. The team was constantly checking on us - making sure several glasses of wine were set aside and ready for the next interested guest from our group. The sliders and fries were a hit- and several people mentioned how great the event turned out and I attribute all the work to this team.We cut the group off after our team hit a certain amount, and completing our bill and closing things out (Even while I was on a train home) was easy as pie.A hat's off to everyone on staff - this was an incredible group who did whatever it took to make their customers happy.  I whole-heartedly recommend the food, the service, the people and the ambiance - five stars!",4,1,1,Heather H.,"Jersey City, NJ",440,341,1
4.0,3/18/2018,"#200th review reserved for a special occasion hosted at Bedford & Co!Came here for a baby shower held for a dear friend. The restaurant is tucked inside the Renwick hotel. Space is large with a bar and various seating areas. It has a nice size private area where the after-brunch party was held.Pre fixe brunch menu included avocado toast, Greek yogurt and a main course. Everyone at my table chose fried chicken over waffle while one person tried the smoked salmon scramble. Not sure if orange juice, soda and coffee was included but we got plenty of those flowing. The toast was good with lots of avocado. The yogurt was not bad. While the waffle was quite good and the chicken was very tender, the chicken skin was not crunchy at all. Service was attentive. A nice venue to host a special event.",2,1,2,Teresa L.,"New York, NY",92,413,3576
4.0,3/18/2018,"Went to Bedford for the bottomless brunch. $29 for bottomless with an entree. The restaurant provided nonstop service of champagne bottles and three juice selections. Waitress was attentive and timely! Highly recommend this great deal!I ordered the California bowl which was a lot smaller than expected, but was sufficient in filling me up.",3,1,2,Jackie S.,"Roslyn, NY",21,4,1
4.0,2/27/2018,"My husband and I had cocktails at the bar at Bedford & Co a couple weekends ago when we were staying at the Hotel Renwick. We liked the atmosphere, felt the noise level was decent, and enjoyed our mixed drinks, ordered from the bar specials menu. Bartenders were attentive and efficient, and very friendly. We were only there about 30 minutes, and would have liked to stay longer, but we were just using the bar as a meeting place before heading out with a group for dinner. In the short time we were there, we saw several dishes come out from the kitchen to be served to people at the bar - the food looked amazing. So we have bookmarked them to visit on our next trip to NYC.",1,1,1,Jen P.,"Rochester, NY",61,281,680
3.0,2/24/2018,We went for dinner and I thought the food was decent but my boyfriend really loved it. His friends are also crazy about the brunch menu and their bloody Mary's. I just didn't get the hype,0,0,0,Kelsey S.,"New York, NY",491,63,0
5.0,2/23/2018,"This place is amazing. great bar, great service ,Great food, great ambiance! Will definitely be back anytime we're in NYC",1,1,1,Sara S.,"Keystone Heights, FL",0,7,5
4.0,2/18/2018,Good healthy breakfast over here.  I loved my California breakfast meal.  It was filling and only had good stuff in it!!  The place has a nice dark atmosphere and service was prompt.  The price was a bit expensive but it was a good meal.  My wife also liked her eggs and potatoes.  I would come back here again if I was nearby.,2,1,2,Abbas B.,"Rockville, MD",117,323,118
5.0,2/16/2018,Margarita very good. Food the best. Appetizer divine. The main course is delicious. Serving a waiter is different,1,1,1,Torhovytska E.,"Long Island City, New York, NY",14,9,14
5.0,2/15/2018,"Food is absolutely amazing. Every dish we had was delicious. If you're going to splurge, this is the place to do it.",0,0,0,Deb V.,"Brooklyn, NY",0,5,1
4.0,2/12/2018,"This restaurant is much better than the overall rating. I am traveling on business and found the restaurant to be very lively with a good sized crowd and noise level.  The bar is at the entrance and is secluded from the rest of the restaurant which makes it a great place for the business traveler.  The lamb was very good and the brussel sprouts as well. The lamb is cooked exactly to the temp you ask for, which may be more rare than you would normally expect given most restaurants over cook their meats. The portion size is much larger than the pictures indicate.",0,0,0,George T.,"Cleveland, OH",0,72,18
2.0,2/12/2018,"Came here recently for brunch during NYC Dining week with a friend. My rating reflects my experience: pretty meh food, nice decor, and fairly annoying service from the hostess. Re the hostess: we made reservations for 11am, and it was mildly comical just how strict they insisted on sticking to that. Because of our schedule that day, we called ahead to see if we could either move our reservation up, or later, and the response was that they were overbooked that day, and we would have to keep our existing time. On top of this, she also threw in that if we didn't show up exactly then, they would have to give up our table (interesting to toss that in after I just demonstrated I am responsible enough to call ahead and confirm a reservation). When we arrived about 15 minutes early, the place. was. practically. empty. And yet, after waiting around at the hostess stand for a few minutes while nobody came by, we finally walked further into the restaurant, found a staff member who then flagged down the AWOL hostess, at which point she came and let us know that they would not seat us until 11am EXACTLY. And so, we waited in the lobby area and made a point to wait until she got us. At 11:10.I'm not going to knock a place purely based on the performance of one employee, and our server was very nice and fairly attentive. That being said, it was annoying that for a place that when we sat down, wasn't in the weeds or anything close, they were horrible at timing bringing out our food. We would get the next course when it was clear we weren't done with the previous course, which is annoying AF. The food itself was fine, but nothing stand out, and the decor was nice. We got the fried chicken & waffles (interestingly, bone-in, which I didn't expect), the eggs in purgatory (bit like shakshuka), the California bowl, & the bread pudding (a weirdly icy cinnamon ice cream). I really just didn't get the service and when your food doesn't do much to make up for it, well, two stars.",2,0,0,Peggy C.,"Los Angeles, CA",50,295,397
1.0,2/10/2018,"Kinda the worst bar in NY.  My friend and I walked in all smiles and bartender seemed annoyed by us sitting at the bar.   It must have been in between shifts as she was counting checks and bottles.  We ordered a pimps and sazarc.  Drinks tasted off.  Moldy perhaps... was it the ice or the bartenders obnoxiously long nails that gave the drinks the fowl taste.  She never bothered to check in on us or offer another drink or even a bar napkin. In a place that charges $2.00 for ice they always place a napkin under the drink.Finally, we overheard manager and staff complaining about a poor review.... fix the problem then. Welcome your clients, provide quality service and drinks with a smile.  Done",1,0,0,Ray V.,"Purchase, NY",17,51,1
5.0,2/3/2018,"A definite brunch favorite- the pancakes and chicken sausage here are to die for! I also love how many different takes on brunch classics they offer. The Bedford Bubbles experience is awesome and I loved trying the exotic juices- blood orange, passion fruit, strawberry mint.The decor and the atmosphere here are also warm, edgy and very NYC.",1,0,2,Jessie B.,"Queens, NY",238,255,228
5.0,2/3/2018,"My friend and I both came to Bedford & Co for the first time to try out their dinner menu for restaurant week.We both checked in to get a free glass of prosecco which was light and refreshing.Here's what we ordered:Appetizer (we ordered the same dish because we love cheese):- Burrata (Savory, creamy, and delicious! It paired really well with the grilled bread and I would eat this every day if I could get away with it.)Entrees:- Slow roasted pork (This was more like pulled pork that was fried on one side to form a super crispy crust. It had the right amount of seasoning and the charred cabbage and mustard seeds balanced out the heaviness of the meat.)- Seafood stew (Light and savory broth that almost tasted like Thai curry without being spicy. Nothing was over cooked.)Dessert (ended up ordering the same thing again):- Coconut panna cotta (I honestly feel like panna cotta is pure fatty goodness, but this tasted light on its own and the thin slices of pineapple almost made this dessert taste healthy.)Overall, I was really happy with the meal and polished off plate after plate. The only critique I have is that we were checked on a bit too often which kept interrupting the flow of conversation.",3,1,3,Sylvia L.,"Manhattan, New York, NY",41,21,27
3.0,1/29/2018,"A friend and I met up for restaurant week Sunday brunch. Reservations are definitely recommended. The decor and ambiance is very nice. I ordered the California Bowl, which was absolutely delicious. My friend started off with the grilled kale salad which was also very yummy and I usually don't like kale. We both got the chicken and waffles which I was not a fan of. The waffle was great, but I found the chicken to be blah. The breading was thick and didn't have much flavor. Then when we were ready for our Vanilla Bean Bread Pudding, we were told they ran out. It was only 1:30! So we were offered a brownie which was average and oddly had quite a bit of salt on top.",0,1,0,Tray C.,"Staten Island, NY",10,10,16
4.0,1/28/2018,"NYC Restaurant Week for Sunday Brunch The brunch course was pretty good. Three courses, but the alluring bread pudding ran out and we didn't know until it was time for dessert (aka after we ordered). The kale salad with mushrooms and cheese was absolutely scrumptious and hearty. The chicken and waffles had wayyy too much breading. Waffles were soggy. Not much syrup overall so ask for extra. Since the bread pudding ran out, they offered a brownie which came out very odd. Served lukewarm. Big salt flakes on top. Candied walnuts. Vanilla ice cream scoop. Cherries (?) in a sauce on top. It seemed like they threw together whatever they could find. If that is part of their regular menu, I do not recommend the brownie. The ambiance is cool, but a little too loud when it is crowded. Very fancy feel.",1,1,1,Celeste G.,"New York, NY",155,22,141
1.0,1/28/2018,"FALSE ADVERTISING!!! The place claims to give you a free glass of wine or prosecco if you check in.  ONLY until you check in (and they make sure you do) they tell you ""Free glass ONLY if you have dinner"".I was with 4 other friends and we had several drinks, so I have to say that at the end, the bartender decided to take off a glass of prosecco out of our check. Well, that was nice, but all this could have been avoided by just honored THEIR own advertising since the beginning.",0,0,0,Maria L.,"SoHo, Manhattan, NY",1,3,2
3.0,1/26/2018,"Despite hearing mixed things about Chef John Delucie's skills, I decided to purchase his memoir from the bargain book section. I enjoyed the autobiography and decided that I wanted to sample some of his cuisine firsthand.  Many of his places, such as The Waverly Inn, had a reputation for being more about their scene than their culinary delights, so I was not sure what to expect when my friend and I visited his most recent venture, Bedford & Co.  The restaurant was located on the ground floor of the Renwick Hotel and possessed a masculine, old-school Manhattan vibe that made me feel as if I was back in the Mad Men era.  There was a small lounge area at the front of the long bar, and a large dining room lay just beyond that.  We were taken to a small, yet spacious, table in the back corner of the space, providing us with a complete view of the packed room.  We were both drawn to the same cocktail - the Zelda, a spicy and tart blend of Cimarron Blanco tequila, Cointreau, grapefruit, lime, and jalapeño.  Well, we both must have terrific taste, because we enjoyed the drink so much that we later wound up ordering a second round.  Despite our easy beverage selection, we spent a long time debating on our food strategy.  Finally, we decided to share two starters and get our own entrees.  Our first appetizer was the Wood-Charred Pennsylvania Beets, which were definitely too smoky for our liking.  The magenta beets had a slight crisp and a blackened hue on their exteriors.  The over-baked flavor was not pleasant, but the accompanying labneh yogurt and dill lightened it up a bit.  Seeds were also sprinkled over the plate for texture.  My companion and I also split the Burrata, which was served with a hazelnut crisp, coal-charred figs, and a light grape glaze.  The cheese was moist, creamy, and perfect.  The nutty crunch and sweet sauce were ideal companions, but the fig slices were way too small to provide an impact.For my main course, I selected the Market Fish, which happened to be Artic Char that evening.  It was served with chanterelles, a ginger mushroom broth, and crispy seeds and grains, giving it an Asian-flare.  The portion was not overly large, but the aromatic seasoning and rich broth further elevated the perfectly-prepared fish.  I also sampled my friend's Chicken Under a Brick, which was cooked rather well, but could have used some additional, basic seasoning.  However, I did enjoy the seasonal sides of maitake mushrooms, celery root puree, and chestnuts.  The poultry portion was also much more substantial than my seafood plate.Bedford & Co. was not flawless, but lived up to my anticipations and gave me some insight into John Delucie's culinary style.  Plus, the service was terrific, making it worthy of a 3.5-star rating.",4,0,0,Alison C.,"Hoboken, NJ",1125,1410,640
3.0,1/14/2018,"Brunch left a lot to be desired. $17 for eggs Benedict that came out missing hollandaise sauce and with a hard yoke center. Meh. I've had better at ihop. Also ordered a cinnamon bun, it was pretty good but nothing special.",2,0,0,Nikki N.,"San Francisco, CA",109,16,8
5.0,1/3/2018,"Bedford & co is a great restaurant option, especially if you live in Murray Hill, which lacks food restaurants. Ambiance is very dark leathery woody, almost like old school cigar bar, very charming. Food is great, came for lunch and dinner. Both were great. Overall solid joint, I'll be a periodic regukar.",0,0,0,Jon L.,"Brooklyn, NY",182,144,350
4.0,12/29/2017,"I liked the atmosphere of the place but I did feel that the dinning room was a little too noisy and slightly too bright to achieve a really romantic ambiance. I also had slightly mixed feelings about the food. We ordered the scallop appetizer and it was good but not exceptional and there were 3 pieces, which didn't make it easy to share. As for the main, that's where the meal shined for me. Get the Berkshire pork chop. I've never been much of a fan of pork chop but I decided to try it on a whim, and I definitely don't regret it. It had amazing and expected flavor combinations and ended up being, undoubtedly, the best pork chop I've ever had. For dessert, we got the brownie with ice cream. It says good, but once again not amazing. The brownie felt a little dry to me, but I'm a sucker for sweets so we still finished everything.Overall it was a good experience, I feel like I would incorporate the Berkshire pork chop into many future date nights but will probably opt to get drinks and appetizers elsewhere.",2,1,1,Bing G.,"Queens, NY",345,196,11
