rating,time_created,text,useful,funny,cool,username,user_loc,user_friends,user_reviews,user_photos
5.0,3/24/2017,"Great service and wheelchair accessible!Food was delicious and good for its price point. What really made me want to write a review is their service. We have a guest in a wheelchair and the two hostesses I spoke to on the phone and met in person were super friendly and helpful. We really felt welcomed and they went out of their way to help us feel comfortable with our accommodation request. They have a service elevator that can help wheelchairs/strollers from street level to lobby and to restaurant level. The elevator is well-lit, easy to operate, clean, and comfortable (no fancy decor but does the job). Remember to enter from Renwick Hotel. May need to get hotel front desk or restaurant hostess to access elevator. We ordered sea scallops for appetizer -- yummy! three pieces, good for sharing with a small party, hanger steak (medium rare) -- cooked to perfection, chicken -- loved the seasoning and all the sides that came with it, juicy & tender too. Good music, nice bar, definitely coming back!Great for mid-size group (~6 ppl) and smaller (2~4ppl).",1,0,0,Tiffany C.,"Midtown East, Manhattan, NY",6,23,2
3.0,3/22/2017,"Had a pre-Stella (most disappointing blizzard in a hot minute) feast here last week with two friends. We shared a variety of appetizers: The fresh Burratta with pomegranate seeds, speck, and a pistachio crust. Delicious (which I can say about most cheese) but the pomegranate seeds added a nice citrus burst as well as the pistachio chips that tasted like a cheese like twill. The hand-cut beef tartare - some of the best and freshest I've had in a hot minute. The bite of the horseradish makes it stand out from your average run of the mill raw beef dish. And lastly six east coast oysters that I can't really rave about or justify why they cost $21. But my friend wanted them. To be frank, I would be just fine with a $1 oyster from somewhere else because I personally can't tell the damn difference.For my entree I went with the Colorado Lamb Leg served with a quince and cognac glaze and a side of roasted brussels sprouts with walnuts. I loved the cognac glaze and it added a great amount of a subtle sweet dimension. But the lamb that I ordered Medium was very rare. I also don't order Lamb leg that often but this was borderline something that I wasn't sure if I could even make myself eat so I swapped a piece of lamb for a piece of my friend's Hanger steak that she begged for it to be borderline bleeding and freshly slaughtered. Hers was definitely more palatable. Chewy as all flank steak is but definitely cooked to a temperature I felt more comfortable with. Also, the bearnaise sauce it was accompanied with was phenomenal. My third friend ordered the squid ink spaccatelli with chilli, basil, and nduja sausage. Spaccatelli is like a very long and thick elbow noodle. It was good but not something I'd dig in for seconds or thirds to sample. Favorite portion of the evening was probably desert and the wine but even that was still just alright. The Cotes Du Rhone was great. The carrot cake was good but slightly dry. Their warm brownie with ice cream - good but not jaw dropping. For being such a pricey restaurant I wasn't completely blown away with their food but I was satiated respite not feeling too hot and having a stomach ache later in the evening. Come for the ambiance, order a drink and an app, get the fries, those were actually pretty great. They also have a $29 prix fixe that might be worth coming in for at lunch time.",2,1,1,Ingrid S.,"Brooklyn, NY",843,1384,11457
4.0,3/3/2017,"Our crew normally doesn't splurge for lunch, but with its close proximity to the office (and vegetarian options abound), we couldn't help but give this a shot! An urban meets rustic charm, with a mid-century twist. On the eating front, their seafood stew was surprisingly filling and flavorful. Accompany it with their beet salad. (Props to the waitress for fake laughing at all my beet puns throughout the meal, worth an extra star IMO)End your lunch with a warm brownie finale, it'll send you home happy (or at least, back to your tiny office cubicle mildly content)",1,1,1,Matt P.,"New York, NY",1299,395,51
2.0,3/1/2017,Really nice design concept but the food is soooo overpriced and they served me severely undercooked chicken not once but twice. Another mid town rip off.,1,0,0,Rachel M.,"Williamsburg - North Side, Brooklyn, NY",0,28,3
5.0,2/15/2017,"I was debating between 4 and 5 stars here but I think my one nitpick is not worth taking the star away.I was there for Valentine's dinner last night.  I had booked about a week ago without reading reviews and then, before we went, I decided to read them.  Needless to say, I was worried after reading all the negative comments on the service and regretted booking this restaurant.Happy to say that those worries were not warranted and the service was great.  Sort of glad I didn't read the reviews before booking, honestly.I don't doubt that the bad reviews on service actually happened, but my experience wasn't consistent with them.  I saw comments about there not being enough staff...there was a ton of staff last night.  Maybe it was because it was Valentine's day?  And my server and everyone else were super friendly, unlike what I read in other reviews.  Very nice vibe in the place.  One example - there is a little display that shows the different parts of a cow that me and my wife were discussing....our server and a chef noticed us staring and took a second to explain a little about the cow.  I thought that was a nice touch.  The service was also prompt and attentive...they brought out food and drinks at a good pace for us.The food was very good.  We had steak and lobster entrees.  The vegetables that came with the lobster were actually better than the lobster.  The foie gras appetizer was awesome.  These were all part of the valentine's day prix fixe menu.My only nitpick - the tables were a little too close to each other.  The separation was so small that I almost thought we were at a 4 seater with two other people when we got to our table.  BUT...once you are seated, it feels as if you are alone with your date so it wasn't bad.  I'm being picky.  The place has a decent level of music so it's not like you are listening to other people's conversations.Highly recommend.  Hopefully the improved service is a permanent upgrade rather than me getting lucky, but I'll definitely be back.  We were very pleased.",1,0,1,Ken P.,"Fort Lee, NJ",0,7,0
2.0,2/12/2017,"Had a chance to try this place for lunch in between meetings on a week day. The space is interesting and a little mysterious. I had the Mac and cheese - it was good, think it was made with 4 different cheeses. For dessert, I had the berry tart - had a great buttery crust and a hint of spearmint and lemon. What makes dining at John DeLucie's restaurants annoying, is their staff. I've never encountered waitstaff at any of his establishments that didn't behave like they were doing you a huge favor by bringing you your food. It's a huge turnoff and really ruins the experience. All of his other restaurants have closed - I would think they would correct this flaw in their business model since it's not terribly difficult to fix!",1,0,0,Laura R.,"New York, NY",38,34,15
3.0,2/12/2017,"Hmmmm. I realllllly wanted to give this place a good rating, I was so hopeful and excited to try something new. The place is very pleasant and cozy. Nice bar area, confortable seating. Our waitress was strange. Not sure what was going on here. Not the least bit pleasant. It felt like we were a bother, like we were something she had to tend to but she was  not the least bit happy about it ..and it showed.  Menu is verrry small. We each found something to order. Honestly, the waitress killed it for me. She wasn't helpful or suggestive of anything. I kept thinking WHY am I here if SHE doesn't even want to be here?Anyway, the food was ok. The drinks were ok. Service was terrible.  If I were in the area, I would go back, and sit at the bar. I cannot recommend highly based on my experience. This place was listed under hot and new in OpenTable.",3,1,1,Susan M.,"Narragansett, RI",74,264,330
3.0,1/26/2017,"Met at the hotel for a breakfast meeting. It's a relaxed atmosphere. There is not too much on the breakfast menu. Service was fine. But given all the great breakfast options in this area, unless you're staying at the hotel, you can do better.",0,0,0,Jess F.,"Manhattan, NY",2,47,95
4.0,1/22/2017,"I want to give it 4.5 stars it was almost perfect.  It was delicious.  A unique menu and well done over all.  The only negative was the service was a little substandard, but giving the benefit of the doubt that it was just the day.  It was odd as there was only one other person in at the time we went to eat dinner.  We were ahead of the dinner rush on a quiet day.  I have yet to try their lunch menu but definitely worth going to give it a try.",1,1,0,Robert R.,"Montreal, Canada",198,23,11
4.0,1/20/2017,"Everybody was raving about the porkchop but can't say I enjoyed it too much.  Wasn't too savory, meat was a bit tough. Might be personal differences. I did think the ink squid pasta was out of this world though.  Had the sea salt brownie for dessert which was also really good.  Overall, a great spot for happy hour and late night dinners.",2,2,0,Anna K.,"Manhattan, NY",5,20,57
5.0,1/15/2017,The spaghetti was superb. 5 stars. A must try if you're eating here. The pork chop was good. The pumpkin special pasta was good. Much better food than what the number of stars on Yelp would suggest.,1,0,0,H T.,"Manhattan, NY",0,6,0
4.0,1/13/2017,"I was skeptical about coming here after reading the reviews about the service, but ours last night, along with the food, was quite good.We had the following apps: the beets (good), the octopus (good), the scallops (good), the buratta (good) and side of mushrooms (good). We also had the burger, the spaghetti (SO good) and the squid ink pasta (also really good). But the standout was the service. The wine steward indulged all of our requests to try before we chose our wine, and our server April was warm and friendly from moment one.The only hiccup is the staff doing the clearing isn't so warm, or attentive. We still had 2 of the 5 apps on the table and they started taking plates and utensils. I had to ask them to stop, and then the constant hovering was a big turnoff.",1,0,1,Leela A.,"Bronx, NY",0,8,0
5.0,12/27/2016,"Best meal we have had this trip!  Amazing!  The strip steak was the bomb, and the whole wheat pasta was one of the best pasta dishes I have EVER had!  Even the salad was perfect!  Thank you chefs, and thank you April for fantastic service!",1,0,1,Michelle B.,"Placentia, CA",0,27,5
2.0,12/27/2016,"I was happy to find Bedford was open for a pre-fixe dinner on Christmas as my mom and brother were in town and we wanted to go out to eat. The pre fixe was $65 and had a great range of offerings, so we were excited.We had a reservation and were seated immediately, and the restaurant was quite busy as was the bar. We ordered cocktails to start - two moscow mules and an espresso martini. The moscow mules arrived and we were told the espresso martini (for my mom) would be out shortly. FIFTEEN minutes later and still no martini, even though we were the table closest to the bar and had asked our waiter twice what was going on. Finally after another 5-10 minutes my mom's martini arrived and we were able to cheers and then order our dinner. The mule was delicious, but we were now a bit put off by the wait for my mom's drink and unapologetic waiter.My brother also picked out a bottle of wine from their list - a 2012 Cabernet Sauvignon - and when the bottle arrived, it was a 2013. Instead of telling us they did not have our selection, the waiter tried to pass off the bottle as what we had ordered, until my brother asked to see the bottle. A sneaky move like this when we are paying $185 for a bottle of wine (a Christmas treat for us) is just unacceptable. Had we been told upfront our selection was not available, fine - but dishonesty is not.The food was seriously delicious and almost made the service forgivable. I recommend the beef tartare appetizer, chicken under a brick entree, and fire roasted potato side dish. The pork chop, NY strip, and burrata deserve honorable mentions. I headed to the restroom after dinner and almost collided with a server who was joking around with another server by the waiter station. She essentially jumped backwards without looking and I had to dodge her - she then continued laughing with her coworker and did not apologize for almost body slamming me. Dessert was the rye brownie which was okay (the vanilla gelato topping was better than the brownie), and when we were leaving, the hostess was nowhere to be found and after waiting five minutes we dove into the coat room ourselves to retrieve our belongings. She returned as we were doing this and laughed, saying ""We're not very good with coat check, ha ha"". Super, thanks.If there is an option for delivery/takeout for this restaurant - I recommend it. I do not think dealing with the service here would be enjoyable for anyone.",0,0,0,Chrissy D.,"Queens, NY",1,48,12
3.0,12/21/2016,"I wanted to pick a nice place for my Friend's birthday Dec 9th. It has been a long time since the two of us had gotten together. I waited at the bar because I was early. They have a good happy hour so it was crowded but it was a good group of people. The bar tender was nice as well. I did notice that the staff was a bit stressed out. I liked the 70s decor though. The Classic Rock music blasting was an odd choice though. We were seated on the upper level which was fine, the seats were very comfortable. The waitress came right away to take our drink orders. We asked her to come back, she seems a bit flighty. We ordered a bottle of Pinot. A blond woman who seemed to be the manager comes by with two glasses of wine after a bit of a wait. We thought it was weird but we were busy deciding what to order. The waitress comes back apologizing every other sentence. she seemed very nervous and hyper. We placed our order and waited quite a while for our apps. When they finally arrived I asked about our bottle. She had put it in as two glasses. She said she would take it off the bill. We are waiting for our dinner and she comes over and asks if we want dessert. I said ""We haven't even had our dinner yet."" The other diners were also saying the service was bad. The food was good. I wish there was more choice but I liked the Hangar Steak I got. When we got the bill I was shocked that there is a $30 charge for two glasses of wine. The waitress said the manager told her she couldn't take it off and to not give her a tip. I thought that was ridiculous and called her over. She starts arguing with me that we drank the wine. I said we ordered a bottle and thought it came from it. She just kept saying we got extra glasses and I was pissed. She said she'd ask her manager but she just yelled at the waitress. She then throws the fixed check on the table and huffs off. RUDE",0,0,0,Gina S.,"Brooklyn, NY",160,151,3
2.0,12/18/2016,"Nice space but the omelet was possibly the worst of all time. It looked as though carton egg substitute was used to made these monochromatic oddities.  The filling was almost nonexistent, and completely flavorless. Talked to the MOD and she comped a drink on the bill but left the uneaten omelet on the bill. Overpriced crap food.",0,0,0,Mike W.,"Washington, DC",52,513,8
4.0,12/17/2016,"Nice pastas. Small menu, only one vegetarian item. Very nice service, nice ambiance (dim). Medium loud.",0,0,0,James B.,"Benton Harbor, MI",281,20,43
4.0,12/11/2016,"I had Sunday brunch here with a group and it is an undiscovered gem. Food was delicious and diverse, and the staff were warm and super nice. A great pick in midtown,",1,0,0,J R.,"New York, NY",0,4,0
2.0,12/10/2016,Too pricey - nice food and beautiful design but the service is bad and the value for money is very low,1,0,0,Hamutal S.,"Cresskill, NJ",170,4,2
2.0,12/10/2016,"I really wanted to like this place.  We walked in for a breakfast reservation and were immediately struck by how nice the design and decor was.....that's my reason for 2 stars.  Everything else was downhill from there.  The breakfast menu was sparse - literally like 3 entree options.  They were about 25% occupied but only had like 2 servers working.  After taking our order, we did not see our waiter once until he brought the check.  I had to flag down a bus boy for some more coffee and water.  Never checked on us, never asked about the meal, nothing.  I wanted salt & pepper but waited so long that my food was getting cold so I just ate it without.  The food was meh...$15 for a small frittata that was nothing more than a open faced omelet you would get at a Holiday Inn buffet.  The potatoes were good, and the coffee was good, but that's about it.  In a city where there are hundreds of restaurants to choose from, don't waste your time here.  On a side note.....the restaurant is connected to a hotel, and the lobby door has a horrible squeak that echoes through the dining area every time someone walks in our out - I seriously can't believe no one has noticed and taken care of this easy fix.",1,0,0,Sean H.,"Fort Worth, TX",2,31,7
4.0,12/4/2016,"The food was outstanding - get the pork chop- but save room for the apple crostata ... Best dessert in NYC! Only reason I gave it 4 stars was because the service was meh. Not sure if our food server was annoyed that I was there with my 16-year old so I'd be the only one drinking, but she wasn't happy when we sat down and ignored us most of dinner.",1,0,0,Michelle W.,"Austin, TX",151,13,0
2.0,11/28/2016,"I'm not sure why I had really high hopes for this place but I did. The interior looked very nice, they had an open kitchen design, walking in they have a full bar and a nice waiting area. I booked a reservation the day before because it was super close to work. I came here with a friend to catch up so we ordered the oysters to start with. We had them served chilled but they also have the option to wood fire them. They only have one option of oysters to choose from which seems a little weird not to have both east and west coast but that was fine because the oysters seemed like regular oysters, just very over priced. I ordered the squid ink spaccatelli and my friend ordered their rib eye steak which was a special of the night. The squid ink had nduja, chili, and basil sauce. I was scared the chili's was going to make it spicy but it didn't. The squid ink didn't blow me away at all. It was a very run of the mill dish. My friends steak dish however when she asked for medium rare it came out basically burnt on all the edges and a little bloody in the center. Usually when this happens it is because the steak wasn't prepared at room temperature which seems very offsetting. I ordered the moscow mule which I really enjoyed. I would come back for their cocktails at the bar but for dinner I'll pass.",3,2,2,Ashley N.,"Manhattan, NY",426,368,749
3.0,11/27/2016,"We went here for thanksgiving dinner which was set menu, overall pretty good but they ran out of oysters before 6:30pm, also a little haggle over the kids menu which was the menu at 1/2 the price, however was told was not the same menu as advertised, after several back and forth with manager they finally agree to honor menu vs the chicken fingers for same price. Crazy huh for $35 for the kids. Wine menu was ok, appetizers and NYC were good. I would probably come back to see what a regular menu meal would be.",0,0,0,Matt L.,"Erie, CO",4,73,4
4.0,11/20/2016,"Was looking for a cozy brunch spot on a freezing day and this place delivered. I really enjoyed the space and the vibe at the tables in the back. I think next time I'd like to check out the bar as well. I had the chicken apple sausage biscuit and it was pretty savory, though came out colder than I would have liked. The homestyle potatoes on the side are to die for. All three of us agreed this is a go-to spot due to its proximity to Grand Central.",1,0,0,K M.,"Philadelphia, PA",121,32,1
4.0,11/14/2016,"This is my new favorite place for prix fixe lunch in the Grand Central area! $25 gets you 3 courses, all of which had great options. Highly recommend the burrata or pork belly for starters. We tried a homemade pasta with kale for the main, which was also very good. Dessert was a brownie with ice cream and cherry compote. Really cool ambiance, love the design.",1,0,0,Chelsey L.,"New York, NY",0,6,1
2.0,11/11/2016,"Food was great!  I can't say the same thing for the staff.  We came in for lunch (4 of us and we work right around the corner) ordered a bottle of wine, apps, main courses and dessert.  Food was wonderful but when it was nearing the end of their shift I guess.. We were very rushed and had staff wander over to our table to see if we were done and almost rush us out of the restaurant.  As soon as we got up they shut off the lights.  Very rude!  Just for the way we felt from the staff we will not be going back.  Working in sales they could of had a lot of client lunches, and events but now we will pass.",1,0,0,Nicole R.,"New York, NY",5,6,4
3.0,11/1/2016,"Went here for drinks and snacks with the team after work. It's OK. I think the ambiance is pretty nice. The service is too efficient if you know what I mean, and that detracted from the experience. Interrupting conversations, reaching over us, snatching plates... crazy town.But the food was tasty and the drinks were decent. The highlight was the sliders which were quite good. We all think they probably make a helluva burger so we would come back for that. But all-in-all, par for the course...",2,0,0,Art C.,"Brooklyn, NY",179,1167,91
5.0,10/23/2016,"Loved this place, came here for brunch on a Sunday afternoon..The food is really good, but hands down the most amazing cinnamon bun i have ever had! 5 stars for the food and service!",0,0,0,Angela K.,"New York, NY",0,3,2
4.0,9/24/2016,"This is in The Renwick Hotel. 40th Street between Lexington and Park Avenue. A lot closer to Lexington Avenue. Space- Not as big as I thought it would be. It's a pretty small space. When you walk in, the host stand is right in front and there's a nice lounge section onto the right side. They have a nice elongated bar. What I thought was a really nice touch was that beginning of the bar, close to the host stand, that bar section is for the handicap. Very thoughtful and smart. Drinks- I had their Negroni $16 I liked how their Negroni had Hendricks in it already instead of another less valued gin. Food-Ordered there grilled octopus. Recommended by the bartender, but it's also my favorite appetizer. A little salty, but still delicious. Also has the broccolini. It was very bitter and smokey. I like the smokey, but wayyy too bitter. Service- sat at the bar. Bartender was exceptional. Very attentive and informative about the menu. Crowd- everyone here seems to be in their mid 20s-40s range. Good spot to eat solo, with a friend, or on a date.Honestly- I think anyone would have a better time at the bar than an actual table. Depending what your kind of fun is. This is just from my judgment. I barely spoke to the bartender, but just from the scope of things. He was so attentive and seemed fun. Dining seemed a little too formal for my taste.",1,0,1,Jay K.,"New York, NY",36,182,143
4.0,9/11/2016,"Sexy, swanky spot in the Renwick Hotel. I have found hotel food to be an increasingly good option especially at breakfast. The food reminded me a bit of the food at the Nomad. Breakfast review only. Ate:Two egg whites scrambled $15Green juice of the day $7Decaf Americano $4The eggs come with delish little potatoes, chicken sausage & multigrain toast. Juice & coffee were on point. Full with hotel guests, there are cushioned & less cushioned banquettes.",4,1,1,Franny A.,"New York, NY",865,1323,1125
5.0,9/1/2016,"Great service, tasty cocktails, music not too loud.  The manager Dawn Blake was very friendly.  We'll be back.",0,0,0,S.E B.,"Falls Church, VA",2,27,57
5.0,8/25/2016,"One of the best meals I've had in a long time! I went to Bedford and Co. for brunch on a Sunday. The staff was incredibly helpful and, even though the room was pretty busy, my party of two was seated right away. We started with some coffee (cappuccino for her, latte for me) and avocado toast- delicious! By far the best avocado toast I've ever had. We then ordered the chicken and waffles and some eggs. Everything was seasoned perfectly and incredibly flavorful. The Bloody Mary's are made with tomatoes from the restaurants wood fired oven- a really nice touch to a well made cocktail.Five starts for an exquisite brunch!",1,0,0,Bill B.,"New York, NY",0,3,0
4.0,8/25/2016,"great addition to the neighborhood where I work;  noise level is the only negative, but for dinner, it is a big one;  will try once more for lunch to see if its better;  sometimes I don't know what architects are thinking re acoustics!",0,0,0,Paul M.,"Bedford, NY",0,5,0
5.0,8/22/2016,I stumbled upon this gem and am hesitant to write this review. I hope it's doesn't become too popular because it's SO amazing. Omar is the best bartender ever- selecting our drinks based on our food and taste. Ricardo was a phenomenal manager and made us feel like VIPs. The music was amazing and I look forward to becoming a regular here. PS- their pastas are fresh and are to die for. My favorite is the spaghetti with lamb,0,0,1,Diane R.,"Morris Plains, NJ",0,3,1
