rating,time_created,text,useful,funny,cool,username,user_loc,user_friends,user_reviews,user_photos
4.0,8/4/2015,"I love Spanish food, and paella is definitely at the top of that list. So I was excited to try this place with my dad, who's a bigger Spanish food fan than I am.We got the pulpo and the cochinillo asado, and two paella, since according to the menu one paella serves one. So OK, we order the Valenciana and the Soccarat. Let me say that my family are paella snobs because my mother makes an excellent Paella Valenciana and we compare it to every other paella.The charred pulpo was so good i could've eaten the whole thing--tender, smoky, rich in olive oil, delicate..dreamy. The cochinillo left something to be desired. Like it was tasty but not as good as it could be. The skin is the best part but it wasn't very crunchy.We liked the Soccarat paella better, with all properly cooked meat and seafood, fragrant tender rice, rich crispy crusty bottom.  The Valenciana was so-so, bland. I wanted to ask for fresh lemon and fruity olive oil to drizzle over the dish.Also? One paella dish would feed two people. Unless you'd rather not share.",1,0,0,Jillian Therese N.,"Springfield Township, NJ",0,9,17
5.0,8/4/2015,Loved this place. We went here for dinner on the night we got engaged. The staff were lovely and attentive. The food delicious and the wine well paired.,0,0,0,Ron G.,"New York, NY",14,4,0
4.0,8/4/2015,"Socarrat's signature dish is their seafood paella, or paella de arroz negro. We came here for dinner with the intent of trying it and saw that it was also featured on the Restaurant Week menu. Generally, I am skeptical of restaurant weeks because they have become synonymous with uncreative dishes and lowered quality, but Socarrat's selections seemed to be a fair representation of their normal menu. Along with the seafood paella (the two of us were required to order the same kind of paella), we chose the croquetas del dia (croquettes of the day) and huevos rotos con chistorra to start. We also got a pitcher of the red wine sangria, which is pretty much the only form of wine I will drink. The food took a while to come out - almost driving me nuts in the process - but at least every dish arrived at our table hot. The croquettes that day had been filled with spinach and were good, if not a bit boring. The huevos rotos exceeded my expectations and consisted of fries covered with sunny side up eggs, chistorra (a type of Spanish sausage), and vegetables. When the paella finally came out, we gaped at how enormous the pan was. A serving for two is really enough to feed up to four if you're ordering other dishes. I had never had arroz negro before, so I couldn't wait to try it. From what I can tell, Socarrat's rendition is the real deal, chock full of a variety of seafood and crispy at the bottom. The rice by itself was flavorful from being cooked with the seafood. Even though we were hungry, we barely finished half of the pan. For dessert, we got both the Churros Sunday Funday and the flan. The churros were served in a layered glass of chocolate pudding, coffee cream, and whipped cream. Even though I don't usually love churros, I ate most of this because the pudding and cream were so yummy together. The flan was flavored with passion fruit and was your lighter, more syrupy Spanish flan. I prefer denser Latin American flan, so I didn't have much of this.The dark, intimate atmosphere of Socarrat in Chelsea is suitable for casual group gatherings or dates. My one complaint is that all of their chairs are backless wooden stools, so it wasn't the most comfortable to sit in for hours. Perhaps this best functions as a happy hour spot. Now that I've tried the seafood paella, I would come back for more of their tapas, many of which sounded enticing.",1,0,0,C C.,"Los Angeles, CA",108,194,203
5.0,8/3/2015,"Simply, I love this place!  I tried Soccarat about 10 years ago and its just as good as I remembered. They thankfully have a restaurant weekend Brunch menu on Sundays which includes 3 courses for $25.  We had the gambas al ajillo (garlic shrimp) for appetizer.  It came out sizzling and was on the spicy side.  There was plenty of olive oil to sop up with bread.  For the entree, paella of the day (squid, seabass and shrimp).  Hands down, this was the best paella I've ever had.  It was seasoned perfectly, the fish was amazing and the soccarat (burnt rice on the bottom of the pan) was crunchy.  We shared a $16 pitcher of white sangria and finished off with 1 dessert each: churros and flan.  The restaurant was still crowded at 2:45 when we went for brunch but the service remained attentive and prompt.  I'm a huge fan of spanish cuisine and will definitely return.",3,1,1,Erin A.,"New York, NY",89,184,73
4.0,8/2/2015,"My friend and I came here for restaurant week. This is quite a nice place -- intimate and great food. There are only bar tables and that made it feel quite cramped. Our waitress rarely smiled and mistakenly ordered another drink for my friend. The restaurant week menu is fantastic. My friend and I ordered two appetizers (shrimp and croquettes), one paella for two, and two desserts (churros with chocolate, whipped cream, and mousse). We were stuffed! Everything was phenomenal and I highly recommend these dishes.",0,1,1,Cindy C.,"Brooklyn, NY",34,122,35
4.0,8/1/2015,"Paella is one of my favorite dishes! I tried out Socarrat Chelsea for NYC restaurant week, as it was one of the only paella restaurants listed as part of restaurant week. For appetizers, we ordered garlic shrimp and fries with huevos. Garlic shrimp smelled amazing - comes out sizzling in an iron skillet! With a side of the bread, this dish is great with the sangria roja (SO refreshing!). The fries with huevos -- yum! I can't believe I've never thought to try fries with eggs before - simple yet amazing dish.To order the paella - each paella has to be ordered for at least 2 people. If you want to try 2 different types, I suggest going with at least 4 people. We wanted to try the Socarrat paella and the Black Rice paella -- and opted for the Black Rice since I've never tried paella with squid ink. It was yummy. The rice is seasoned perfectly and topped with scallops, fish, calamari, and shrimp on top - it's also served with a side of garlic aioli, but I thought the paella was very flavorful so I didn't need the extra sauce. Warning: this dish is EXTREMELY filling! Pace yourself, and do not try to finish it!! lol!For dessert, we ordered the flan and the Sunday Funday churros. The churros were on the hard/crunchier side (compared to the churros I've had in the past) but it's still delicious with the chocolate pudding it's served in. The flan was my favorite between the two. A very light finish to the meal.I saw an ad for Flamenco Tuesdays Socarrat in Nolita, so I'll have to check it out!",0,0,0,Jenny P.,"Los Angeles, CA",384,288,756
3.0,7/31/2015,"Sat at the bar, had the shrimp, octopus and bacon wrapped dates. The food was great. The octopus was the best - charred and not chewy. The shrimp was  sizzling. The bartender Geoffrey  was fantastic, very friendly and he made strong drinks.  This place would've gotten 4.5 stars if not for the terrible two head hostesses. They were both so nasty and rude in their interactions. The two of them had terrible attitudes and were extremely impolite to my group of friends.",0,0,0,irina c.,"New York, NY",3,24,5
2.0,7/31/2015,"Gratuity is defined as a voluntary amount given for the exchange of customer service. In NYC it is suggested at 15-18% but when the meal is amazing it is not rare for servers to receive 20% or even more. With that said, even when they are tipped at 15%, there is no need to pester customers for that extra few dollars and ruin the entire dining experience. Since we only had 50mins to the meal, the bartender was accommodating and allowed us to order the paella before everyone seated since that alone takes 30mins to make. The server was just as accommodating and took our orders quickly and the tapas came out promptly. We ordered the Gambas Al Ajillo, Mejillones con chorizo, Pulpo a la gallega and Cochinillo asado. Our favorite was the gambas since the flavors from the salt and olive oil were fully integrated in the shrimp. The cochinillo was very tender and the meat came apart easily but it was a bit on the salty side. The arroz negro, as everyone raves about, was really amazing. The last time I had such amazing paella was at Toledo in Murray Hill and before that, Spain. In terms of food and the dining space, they are on point with Spanish vibes.At last, the check came and we split it evenly and tipped 15% since it was a quick meal and we received standard attention/service. As we were about to leave, the server questions the amount we tipped and the way he approached the situation was as if we were kids who didn't know any better. We double and tripled check the amount to be sure and were confident it was ""enough"". However, we didn't want to argue and left a few extra dollars. Needless to say, the server's offensive behavior was just unacceptable.",5,0,0,Sharon Z.,"New York, NY",550,114,158
5.0,7/30/2015,"Came here with a friend on a discounted deal for students, and had such a wonderful time! Sometimes restaurants tend to serve visitors with discount deals in a condescending manner, but the servers at Socarrat treated us with the same courtesy and sweetness.It was my first time having Spanish cuisine, so we ordered the representative Socarrat Paella. The dish came in a huge hot stone(?) pan while the contents were still deliciously sizzling. Packed generously with fresh seafood and perfectly seasoned, the paella was just amazing. When we got to the crispy rice part, the server helped us scrape down the dish to the last bit, and we left feeling unbelievably happy as we diligently gobbled down the dish. Sangria was also a perfect match for the paella.The restaurant overall has a great ambiance, but it's a bit narrow and hard to get around once you're seated. Eating at the bar area was great fun, as we could also get a small chat with the bartender from time to time. The wall that we faced had some mirror decor, and eating while facing myself was also an interesting experience... Next time I visit, I'd have to make sure that I look nice, so that I wouldn't have to keep looking away from myself in the mirror.Although it is a bit expensive, I'd say it's definitely worth the food and experience. I'll definitely come again sometime.",0,0,0,Genera L.,"New York, NY",220,11,3
4.0,7/29/2015,For appetizers we had the kale salad and garlic shrimp.  The kale salad was delicious.  The grilled garlic shrimp came in a hot pot and were still cooking when served and I felt they were overcooked but the flavor was very good.For the paella we ordered Arroz negro (seafood and squid ink rice) --- amazing!  Was a lot for two people and it was cooked perfectly.  I usually don't like the crunchy rice but this dish change my mind.For dessert we had the flan and Sunday Funday Churros.  Both were so good -& I can't decide which was better.Great service... Worth the price during restaurant week.,0,0,0,Karen X.,"Manhattan, NY",1,49,18
5.0,7/29/2015,Had lunch today 07.29.15 (Restaurant Week) and it was really goodThe tomato salad was nice for today's weather and the short rib paella was to die for Ended with the flan as dessert and also was really good Highly recommend it,0,0,0,Luswin C.,"Manhattan, NY",122,25,21
3.0,7/26/2015,"I live above this restaurant for the last 2 years and never went as the menu seemed a big pricey. Its restaurant week and they have a terrific menu. The appetizers were fabulous as one would expect from a tapas and paella bar.  There was a myriad of different tomatoes and cantaloupe and apricot with light dressing. Absolutely a must in the summer month..as its super refreshing. Then we had the cod croquetts..this was a perfect blend of crispy batter on the outside and creamy goodness on the inside. The entrees were a soupy vegetable paellas and meat paella. The soupy paella broth was not well seasoned which caused the dish to be entirely bland. The meat paella was burnt around the edges of the pan...which means it was left in the oven a little too long. The rice was a little on the dry side because it was left in the over too long...but the meats were all outstanding...actually exemplary as they were seasoned to perfection. Finally, the dessert were both very good. We had the flan..which had the perfect custard consistency and a great sauce to soup up with. Then there was the churro coffee sunday. This was spectacular as there was a perfect blend of coffee mixed with chocolate pudding, chocolate sauce and churros...what a great way finish our spanish restaurant week experience.",1,0,0,Chad R.,"New York, NY",231,505,8
4.0,7/24/2015,"I came for restaurant week dinner and we ordered the kale salad and the huevos rotos con chistora (fries and sautéed peppers and sausages topped with two eggs) for appetizers, the paella de arroz negro (squid ink paella) as the main entree and the churros and flan for dessert.The huevos rotos dish was AMAZING. I wish I could have this for breakfast everyday. The fries aren't crispy but it's more fitting for the dish that they're not. The dressing on the kale salad was savory and creamy but not overly rich. Included beets, walnuts, goat cheese (which I couldn't really taste), and dried cranberries. The paella (sized for two) was surprisingly rich. I really liked the scallops, calamari, and fish. I'm allergic to shrimp, but it was there too. The rice itself was creamy and thick, but a bit too salty. I loved the crunchy bits of rice.Someone also came to scrape it all off the pan for us which was nice.The ""Churros Sunday Funday"" were 4 mini churros stuck in a creamy mousse-like hot chocolate sauce. Couldn't really taste any coffee but it was really good. The sauce was so chocolately though we couldn't really have it after eating the churros.The flan was good - the passionfruit cream was definitely the best part.The restaurant itself was kind of small and very dark. I'm guessing it's for the ambience but it's hard to take nice pictures of the food haha.And it gets quite noisy with all the conversation. By the time we left (around 8?), it was completely packed.",1,0,0,Jen P.,"New York, NY",131,183,157
3.0,7/24/2015,"I came here because it was advertised as traditional and authentic spanish paella. Me and my girlfriend were very disappointed when the rice came out burned, not just crispy. Additionally, everything was way under-seasoned. I've had my share of barcelona paella, and this isn't it.",0,0,0,Ryan R.,"New York, NY",2,24,20
3.0,7/23/2015,Good Paelle. Seating is a little weird.,0,0,0,Ashley H.,"Washington, DC",17,96,1
4.0,7/21/2015,If you're pining for the cuisine of Spain then this is the place to make a reservation!Everything my friends and I ordered was delicious from tapas to dessert.I'd particularly recommend the Alcachofas Fritas (Fried Artichokes). They were the perfect compliment to the sangria!Cozy atmosphere. Polite hostesses and wait staff. ¡Aprovecha!,0,0,0,Rachael S.,"Brooklyn, NY",1,2,0
2.0,7/19/2015,"Dined here a few months back with 2 friends. I love the bar setting, their cocktails are on point. But the paella, so burnt. We asked the server, he said it's supposed to be like that. The rice was black and crispy. The serving size was also very small for 3 people. Towards the end of our meal, our neighbours were served the same dish, but theirs was cooked as it should be. No burnt rice. We again spoke to our server and asked him why ours was burnt to a crisp and our neighbours was not. He called the manager over who tried to argue that our dish was cooked correctly. No apology, just made us feel like we were ignorant. When our bill arrived, we were only charged for the drinks so I guess they acknowledged our dish was overcooked. Would return for cocktails, not food.",1,0,0,Kara D.,"New York, NY",40,5,1
5.0,7/16/2015,"Wonderful birthday dinner! We came with a party of 8 which is typically chaotic in NYC. I have celiac disease and eating out can be very challenging and I more frequently than not do not feel safe. The manager has celiac in his family and assured me I would be fine. All of the paella's except for one are 100% gluten free as well as many of the tapas. He checked with the kitchen on everything ordered by our entire party and held sauces on the side which contained flour so that I could sample the dish safely. I wish more places in the city were so accommodating! I felt this establishment was very celiac friendly. I was able to share with the table on almost everything ordered, a far better experience than my accustomed specially prepared ""one safe dish"". Thank you Socarrat!",0,0,0,Marisa B.,"Brooklyn, NY",0,5,0
4.0,6/29/2015,"Great paella, especially the squid ink one, absolutely love the taste and would definitely continue to come back (been 3/4 years).Expect to wait 20 mins or more for the paella as its made fresh.  Appetizers are quick but really small portions for the price.  Sangria is a must try, even for guys, its great.",0,0,0,John Z.,"New York, NY",0,15,0
4.0,6/28/2015,"I came here a few years ago and didn't remember much. Family took mom here for Mother's Day. I had never been to the original one. The venue looks pretty cool but all the seating are high tops. So, it is intimate, etc. but can get pretty uncomfortable.For appetizers:Gambas al ajillo - This has great flavor, like really great flavor. I don't think I'd do this again because the shrimp are quite small. Think, fried rice size shrimp. It is very tasty though.Patatas bravas - Exactly what you'd expect. They're nicely fluffy inside and have a delicate crisp outside. Milhohas de cordero - This was definitely the ""wow"" dish for me. The lamb is nicely cooked, it breaks apart so gracefully. The spinach, the peppers, the meat, the plating; bam. Pulpo a la gallega - The octopus is grilled quite nicely. The potatoes along with the paprika oil go really nice together. I just wish they had not forgotten this and brought it out with the entrees.For paella:Socarrat - Figured you can't go wrong with the paella that carries the establishment's name. It was good but it didn't have that edge I was looking for. There's meat/fish, a little bit of everything in this one. The garlic aioli made this better, you have to ask them for it. You may see a few tables with a small white squeeze bottle, that's what you're looking for.Carne - I typically do not order all meat paellas but I'm glad I did. The meat was tender and savory, the rice was nicely coated with all the juice. Scrape the crispy rice or ""socarrat"" off the pan, mix it up with a little bit of garlic aioli and go to town. Unbuckle your belt, then repeat.For dessert:Sunday Funday - Kind of small for what it is but really tasty. It's a glass with three churros and a mixture on the bottom chocolate, cocoa, coffee and cream. It's fun to dip through it, wish there were more churros though.All in all, solid place. Can get a bit pricey quickly.",1,0,0,Patrick W.,"New York, NY",226,178,709
4.0,6/26/2015,"Great paella, a bit expensive, but plenty of food for 3 to share. Small portions on the tapas and incredibly sweet white sangria (ask them to add more sparkling). Great service though. Not sure what everyone else was talking about. It's a small space so the waiters don't have far to go. This spot would have got a perfect score had they not misplaced my reservation made through open table. Crisis averted and a great meal was had.",0,0,0,Alex A.,"Brooklyn, NY",420,193,68
5.0,6/24/2015,I've been here once but can never forget this place.  I came here with my sister and a couple of friends. We had an amazing time here.  The food was delicious and very fresh.  we had some of the tapas and the paella negra.  They make the paella the traditional way. The paella is pricey but i guess its the price to pay for fresh delicious food. I definitely need to go back there.,1,0,0,Sabrina L.,"New York, NY",215,149,318
4.0,6/24/2015,"After living in Barcelona, my standard for paella is incredibly high, and I've been disappointed by a lot of places in New York, including the famous Boqueria and trendy Barraca. I think Socarrat has hands down the best paella I've had in NYC. A few reasons why this paella is excellent:- The abundance of stuff. It's not just a pan of rice with some toppings, the paellas are filled with seafood, meat, vegetables, whatever your poison, and the flavors are fully soaked in- Use of ACTUAL SAFFRON (it's not that difficult people)- The method of cooking - paellas actually take 40 minutes to come out because they are making it the correct way, and the rice at the bottom is perfectly crunchy and ready to be scraped up and enjoyed. The tapas here are also on point, including the patatas, the alcachofas, and the daily croquetas. What took this place from 4 stars to 5 stars for me though was the inclusion of my favorite Spanish drink - Claras. A perfect mix of beer + lemon soda is the perfect summer meal accompaniment. I highly recommend Socarrat to anyone looking for an authentic Spanish dining experience.",0,0,0,Cat S.,"Manhattan, NY",447,371,0
5.0,6/22/2015,"It's pretty tight inside but that didn't take away from our great experience. Both the tapas and paellas were full of flavor and generously sized. Our waiter was super attentive, knowledgeable and patient. The black rice seafood paella was delicious - especially the crispy, caramelized bottom layer that this place is named after! Scrape it off with no shame and eat it all up because it's amazing. Another bonus of this place: affordable. $50/person with non-alcoholic drinks, can do a prix fixe if you're more than 6 and get 5 tapas, 2 paellas, and 3 desserts for $60 and add unlimited booze for $25 a person!",0,0,0,Mo Z.,"White Plains, NY",140,77,2
4.0,6/15/2015,"Right when you walk in, you will be greeted by a great, big aromatic hug from all the seasonings wafting from the kitchen. I feel like the tapas were more impressive than the paella, but both were delicious. Definitely get the bacon wrapped dates. The beef cheeks dish was the favorite at our table. The seafood paella came with the entire ocean floor, so there's something for everyone.",0,0,0,Tuwie N.,"CA, CA",238,529,94
1.0,6/13/2015,The worst service I've ever experienced in the city. We had a reservation at 8:30pm and didn't get seated until 9:10. The host didn't even apologize and had the worst attitude ever.,2,1,1,Noño Z.,"New York, NY",164,109,169
5.0,6/12/2015,"Great tapas. Great happy hour. Great service. Oz, the manager, is particularly friendly and accommodating.",0,0,0,Kristen P.,"Los Angeles, CA",48,47,2
2.0,6/9/2015,"Five stars for food, 0 for service. After many a delicious paella at their Midtown East location, I thought this would be the perfect place for an early dinner with friends. Boy, was I wrong.After being seated in an EMPTY dining room, we ordered some sangria and tapas. About 10 minutes later, our waiter returned to ask if we were going to order paella. Due to the various dietary restrictions in the group (and the 2 person minimum for a paella order), we thought it best to stick to tapas. I mean, tapas is another major selling point for the restaurant, right? Wrong. This did not fly with the staff. Initially, they told us to move to the bar. The prospect wasn't too appealing as we were now settled in a still-empty dining room (its about 6pm at this point). Then, they asked if we could leave the table by 8pm. We agreed, at which point our waiter finally relayed our order to the kitchen. This had a domino effect of delaying our subsequent orders, which we had to place separately due to the limited table space. This had no impact on the hostess, who started clearing our plates at 7:50pm, and then coolly dropped the check. The restaurant still wasn't full.Kudos to the industrious hostess who doubles as a busser-- but you lose points for failing to address the situation properly, and for your bad attitude.If you want the experience without the pretense, go to the Socarrat on 2nd Ave. The food is the same but the ambiance and staff put this location to shame.",0,0,0,Lauren B.,"Manhattan, NY",6,212,0
4.0,5/31/2015,"Cozy and unique decor. Everything was very eye catching for the group of four I was with. We ordered the Arroz negro and pescado paella along with croquetas, mussels, and a cheeseboard. Everything tasted delightful. The mussels had a nice smell of smokey chorizo. Croquetas were very cheesey and overall nothing too special. The paellas were great. I preferred the Arroz negro more than the pescado since it was more savory. I thought the pescado was on a sweeter side, which some of the others enjoyed more. Overall nice and good amount of seafood came with everything. On the pricier side, but still an enjoyable dinner after a long day.",0,0,0,Ani Y.,"Manhattan, NY",4,245,34
3.0,5/29/2015,"Ambiance was great! Patatas bravas tapas were excellent as was the grilled shrimp - the croquettes had a strong orange flavor that was a bit over-powering. The paella was yummy, I wasn't sure if the scallops were cooked properly but the rice was perfectly baked with all of the seafood. Not having had paella very often, it was definitely the best I have ever had.",0,0,0,Allie G.,"Manhattan, NY",8,48,82
5.0,5/23/2015,Awesome food and great ambiance!! My friends from book club in  Bay Ridge came out to Chelsea and discover this wonderful restaurant... We are looking forward to another great experience ..,0,0,0,Daisy V.,"Brooklyn, NY",0,1,0
