rating,time_created,text,useful,funny,cool,username,user_loc,user_friends,user_reviews,user_photos
3.0,3/6/2011,"This place is pretty posh, which I suppose is the crowd that it caters to. We came here on a Thursday night, almost impossible to get a seat totally crowded. The paella was pretty tasty, I've tasted better (in Spain) and worse (in Spain), so its right down the middle. The seafood paella is the one we got, it had lots of great flavors in it.Their selection of tapas wasn't THAT appealing to me, but I'm not that adventurous with meats either, so maybe I'm not the best judge.The sangria was just okay. The pricing I feel was a little up there, but nothing crazy. I would come back if I was meeting a group or something, but I wouldn't select it on my own.",2,0,0,Ronjini M.,"Los Angeles, CA",373,590,187
5.0,3/2/2011,"On a gray and windy early Saturday afternoon, I took my family to Socarrat Paella Bar in Chelsea on a whim -everywhere else was booked solid, so I hoped that we could get a table being the first customers at 12 Noon.That day, Lady Luck was on our side. We arrived just as the restaurant opened for lunch, and we scored a beautiful table by the entrance window. Immediately, I started shooting pictures of the still-empty space, which is very pretty: blue velvet barstools line the long and narrow hallway, red exposed brick adds charming rustic touch, and plenty of mirrored surfaces add extra dimension and luxury. A lot of intricate attention to the decor, natural light from the entrance, and a generous smile from our server Michelle - for a moment, I was in heaven. And then the food came, and the angels sang.The superstar of the show is, of course, the paella, and Socarrat makes individual orders of paella in heavy black cast iron pans, so we ordered 4 variations to try. Each paella was luxurious with seafood (or meat), and had the perfect crust for which the restaurant in named after. We ordered the following paella, and I highly recommend them all!Arroz NegroPaella De Pescado & MariscosPaella De CarneFideua Negra De CoditosAnd the wonderful appetizers I loved most were:Croquetas del Dia (Jamon) Gambas al AjilloCazuelita De ChorizoCanelonesJamon Iberico $22 (separate visit),Shishito PeppersNote: share the paella - one order is big enough for two people!",2,0,0,Alessia E.,"New York, NY",81,167,47
4.0,3/1/2011,"Love the paella there! I was the first one to be there for a Sunday brunch. The place opens at noon and the waitress greeting us was so lovely and thoughtful. For three girls, we ordered a paella for two. That was a hell of big dish. With several tapas, you will definitely be full afterwards.I loved the featured seafood paella, particularly the crispy rice under giant shrimps. It gave me pleasure to scratch the crispy rice off the plate.",2,1,2,Ariel G.,"Redwood City, CA",128,98,1
4.0,2/27/2011,"Paellas are very unique. Best to share with friends. Squid ink paella is not to be missed. Unique selling point: nice toasted layer of rice at the bottom of the paella pan, totally intentional, totallly awesome",0,0,0,Hung L.,"Torrance, CA",16,78,6
4.0,2/25/2011,"A long wait at Westville took our group here. FYI - they do not seat you until your entire party shows up, but you can order your paella before you get to your table so it doesn't take as long. 5 of us shared a paella for 2 (the lamb sofrito special one) and a bunch of tapas. Too many tapas. I think we had 8: jamon and cheese platter, croquetas, peppers, shrimp, fried artichokes, patatas bravas, omelette, and one I can't remember. All super tasty. The highlight was definitely the crunchy rice - a little greasy due to all the lamb fat but I'm sure the seafood ones are less so. I'll definitely be back to try another one.",1,0,0,Erica Jade L.,"New York, NY",26,262,1
2.0,2/23/2011,"I really wanted to like Socarrat. I'd been meaning to go there for awhile, and full disclosure - it was the recent Scoutmob discount that finally acted as the catalyst for me ending up there one unseasonably warm recent Wednesday evening. The seafood paella we ordered was plenty enough for two, with succulent pieces of scallop, shrimp, clams and mussels, and the namesake socarrat (the crunchy layer of rice that forms on the bottom of the pan as the paella cooks) was indeed delicious. But somehow, I left this tiny Chelsea spot with a slightly sour taste in my mouth.I attribute this not to the food itself, but more to the whole process of actually being seated and fed. When we arrived, the hostess told us the wait would be up to forty five minutes and told us we could wait at the adjacent bar. She also recommended ordering our paella in advance so that it would arrive soon after we were actually seated, since it takes up to forty minutes to prepare. We decamped to a bar a few doors down after dutifully submitting a name and number so that we could be notified when the table was ready, since the bar was packed. As time passed, our discontent grew proportionately with our hunger. We were excited to leave our watery time killer beers when the call finally came and hightailed it back to the restaurant, only to wait another twenty minutes while the patrons at our spot took their sweet time paying. The hostess apologized profusely, but as we waited another twenty minutes for the paella itself to actually show up the goodwill was gone.Don't get me wrong, the food was good and it ended up being a great deal. But it still wasn't worth waiting over an hour for.",2,0,0,Crystal W.,"New York, NY",46,166,25
4.0,2/22/2011,"This place makes me wish I was a Spanish ex-pat living in America.  Stepping inside you can feel the atmosphere and appreciate a restaurant that is commited to hiring Spaniards and preserving a 'feel.'Restaurant is basically split in two, one side a long communal table catering to paella, the other side seating for tapas and including a nice (wine) bar.  The wine list is extensive and broken down by region.I've been here twice and it's been crowded with a wait both times.  With the cold weather, people on the list tend to mill around inside -- space is definitely at a premium here.Only had the paella but it's been delicious.  Wouldn't suggest this place for parties larger than four.  Really, this is a relaxing but upbeat place for two people to have some good food and drink, doesn't matter if you're just friends or on a date.In short, a standard on my NYC restaurant list.",0,0,0,Jon K.,"Brooklyn, NY",2,52,2
3.0,2/21/2011,"This place brought back memories of my days in Madrid :)We started out with wine and the patatas bravas at the bar de vinos. The wine list is to die for if you are a spanish wine fan. They have a decent selection of wines by the glass but the more interesting stuff is definitely by the bottle. My favorite Spanish white is Albarino and they had my namesake wine, Nora, so that was a plus on its own. The patatas bravas were the closest I've had to Madrid style patatas.We headed over to the paella bar at about 5:45 and there were still open seats. Seating is all communal and the decor is just beautiful. We tried a couple of more tapas, the tortilla and croquetas de chorizo and ordered the vegetarian paella. It was delicious but you could tell from the other orders on table that the mariscos or the carne is the way to go. The veggie paella just didn't have that paella flavor. The place was overwhelmingly packed on the way out. I would definitely come back for either the main dining room or the bar but before 7.",0,0,0,Nora Y.,"Manhattan, NY",14,66,0
4.0,2/18/2011,"After waiting an hour plus for our paella, we were delighted to be seated at the long able at Socarrat.  Our order came, the paella de carne, essentially the 'meat-lover's paella.  It was full of chorizo, chicken, duck, pork and mushroom sofrito.  If you are into meat as I am, it was a true treat!  Perfect for the cold wintry night we had to face once we finished.  (Yes, Socarrat will ask you to leave if you linger too long.)  That is the only downside to this place...other than that, make some arrangements for a visit!",0,0,0,Marie B.,"New York, NY",175,220,7
5.0,1/29/2011,"The tapas here are okay, but the paella and sangria are the best in the city!  Get the paella that has everything in it.  Watch out for the wait for a seat at the communal table.",0,0,0,Betty B.,"Miami, FL",0,7,0
1.0,1/29/2011,"Terrible service. We put our name on the list for the restaurant (45 min wait), and a hostess seated us in the neighboring bar to wait. We ordered drinks, but were told later by the manager that we would have to get up and stand at the bar to drink if we were not ordering tapas. We will not be returning.",1,1,0,Sunjay B.,"Manhattan, NY",17,8,0
5.0,1/19/2011,"Real paella pans, real saffron, real stock.  The Socarrat paella is as wonderful as any I've had in Spain.  The servers are very kind, bartenders knowledgeable and generous.  Community table seating.  They have tapas there, but save your tummy for the paella...you will be digging at the bottom of that pan for the crisp pieces until it's all gone!Check out the ceiling...it's made of old dining room tables!",0,0,0,Linda N.,"Washington, DC",10,123,0
5.0,1/13/2011,"So I had been wanting to try Socarrat for about a year and a half, but there was always a 2 hour wait and/or whoever I was with didn't like seafood, blah blah blah.  Then I saw it on Eater's Top 38, which hasn't yet let me down, and so one random night a friend and I walked in to a short wait and a great experience.First of all, the place is small, not unlike most NYC restaurants.  When we put our names down the hostess took down my friend's number so she could call him when our space was ready.  Holla! We parked it down the street at a bar until the phone rang.We ordered a pitcher of Sangria, which was delicious, with the perfect balance of fruit and wine flavors.  This was my first time having Paella, so I didn't really know what to expect.  We ordered the Socarrat Paella that came with beef, cuddle fish, clams, fish, and green beans.  It was delicious.  The flavors were well done, not overwhelming but just really good.  I also like scraping the Paella from the bottom of the pan.  The crunchiness was kind of addicting.Now, as this was my first time having paella, I must say that there was a misconception on my part.  Thanks to an episode of Desperate Housewives, I thought Paella was all supposed to be spicy:  ""Gabrielle Solis, who lives down the block, brought a spicy Paella.  Since her modeling days in NY, Gabrielle had developed a taste for rich food and rich men.""  It was rich, I'll say, and my misconception was set straight.  The service here was excellent, so was the food, and I will definitely go back.",3,3,2,Jonathan W.,"San Francisco, CA",137,100,1
2.0,1/7/2011,"Don't fall for the hype.While the fair is reasonably priced for NYC, with a large hype following you'll definitely run into a long wait, crowds, and minimal seating.The staff is attentive, service was excellent.BUT that doesn't excuse the quality of the food. Tapas were mediocre but that's not why you'd go here. The Paella, while having a decent selection of them, came out at a moderate sizing. The flavors were bland or very homogeneous and in one case burnt!While I get that some enjoy the crunchy/crispy rice at the end, to have the whole bottom half of a paella dish that way is ridiculous.Avoid the crowds and the hour long waits, I'm sure you can find something else in this city.",3,0,0,Chris Y.,"New York, NY",10,22,8
4.0,1/3/2011,"This is one of my go to spots for a late dinner.  Soccarat offers an extensive tapas menu along with many paella and fiduea options.  The tapas are not anything special, they do add taste and variety to the dish, but the reason to go here is absolutely the paella.  I've tried pretty much every paella they have here (haven't tried the fiduea yet) and each is prepared well.  I haven't tried any other paella in the city, nor do I want to.  This is better than many of the paellas I had while traveling Spain.My favorite is the pescado, but that's because I'm partial to seafood.  The Valenciana is great as well if you'd prefer the meat version.  The desserts are also good, I've tried the flan and one special ""churro fried chocolate balls.""  The espresso is good, however it may be colder than you'd like.",0,0,0,Limor R.,"San Francisco, CA",21,39,0
5.0,1/3/2011,"My friend raved about this place and we finally made it there for Sunday brunch. The best part about going there for brunch is there there is no wait and you can get single serving paellas.Everything about the paellas is perfect! The outside is so crunchy, it's not greasy, and the seafood on top is cooked to perfection! The portions are not huge, a 2-person serving would probably only serve 1.5 persons.So if you are looking for an experience paralleled by really great food, go to Socarrat!!!",0,0,0,Janet C.,"New York, NY",34,24,4
4.0,1/1/2011,"Most paella in NYC is not good. I lived in Madrid for a while so I'm admittedly a paella/tapas snob. But this place is a-ok. They have some really interesting paella combinations available. (Did you say duck, rabbit, snails?) And they do not play games when it comes to the all important crust that they are named after. They get it super crunchy. I also liked some of the tapas we tried. A yummy eggplant dip thingy. A decent pork belly. Patatas bravas with a real kick in the sauce. It's crazy crowded, which can be annoying. But fortunately for me, my friend did all the waiting (an hour!) and by the time I got there we were seated. The staff was really cool too. They made a small mistake in our order & comped our whole party dessert wine.",0,0,0,Camille G.,"New York, NY",18,53,10
3.0,1/1/2011,Came here a while back for a glass of wine and a small bite; and all I remember is that was very expensive.  least expensive wine by the glass was like $14... small dishes were like almost $20.   The atmosphere wasn't all bad except for the prices... not sure why so expensive if the size is so small; and I mean it all the way around.,0,0,0,Eros A.,"New York, NY",422,319,25
4.0,12/31/2010,"It was good, but I wouldn't go back between 7-9pm and deal with the wait.  It's nice they have a wine bar next door that serves the same tapas, which were tasty, but I'm not sure the paella is worth it.  For tapas, go with the calamari in ink.  And the quesos were phenomenal.",0,0,0,Jonathan G.,"New York, NY",63,15,0
1.0,12/27/2010,"One of the most disappointing meals of 2010.Socarrat had been on my list for years after traveling to Barcelona and sampling the arroz negro at Can Ros, but the small, narrow layout of the dining room and few seats conspired against walk-ins whenever I was walking by the restaurant. Finally, I got my chance during what was arguably NYC's worst snowstorm in 60 years.The tapas looked pretty forgettable, so I headed into the meat-and-potatoes -- or rather the pork-and-paella -- section of the menu. Like a good Filipino, I ordered the cochinillo (young suckling pig) for an appetizer and the arroz negro (rice with squid ink and seafood) for an entree.I was really looking forward to bringing the ruckus to the cochinillo, but after biting through a greedy forkful of rendered pig skin, shredded pig meat, potato gratin, and electric-green spinach, the taste of the dish grossly lagged my lofty expectations. The spinach was overly salted; the potatoes were a doormat of flavor; the skin didn't have that crunchy, greasy, salty bite; and the pig meat was as lifeless and bland as an overly cooked holiday turkey.When the arroz negro arrived, I hardly recognized it: instead of the seafood pieces of squid, shrimp, cuttlefish, scallops, and fish swimming in the dark, murky ocean of squid ink and rice, they were daintily airlifted onto the pan. The entire reason to incorporate the rice and the seafood together, as a chef once lasciviously told me, is to ensure ""one big seafood orgy"" in the pan, with the juices and flavors of each of the ingredients ""grinding and writhing"" against each other, and leaving a ""glorious mess"" at the bottom of the pan. After biting into a heaping forkful of rice and seafood, I definitely wasn't turned on; I tasted no glory, but rather a complete mess of a dish. The squid was gummy; the shrimp and scallops drier and less flavorful than the previous cochinillo; and the rice lacking any moisture, texture, or residual flavor from the squid ink or the other seafood bits in the dish. Also anointing this bastard child of arroz negro were slices of red bell peppers and lima beans, which have absolutely no place in the traditional dish.  There is too much starch in the dish already to have random Jack-the-Beanstalkers sprouting in the pan, and a lemon wedge (rather than peppers) traditionally gives an herbal, citrus flavor that cuts through the full-bodied squid-ink infused rice.Socarrat is a great concept, and has been proven so by their recent expansion into Nolita. However, the food is simply embarrassing and doesn't deserve to stand up against better executed Spanish concepts like Boqueria, Casa Mono, El Quinto Pino, and Tia Pol.",12,3,8,Jonas M.,"Brooklyn, NY",6,166,0
5.0,12/27/2010,"It was a peaceful Sunday morning in December, and merry little snowflakes danced down saucily from the sky.  It was a day of possibilities, and we were treated to a truly miraculous experience at Socarrat.Against all odds, there was no wait that Sunday afternoon at 12:30pm.  We had been repeatedly warned by friends and yelpers about the brutal 45+ minute wait in the unforgiving cold, but this day, we were spared, and we took that to mean that we should order extra starters.There were actually quite a few lovely surprises which helped to elevate an already great meal to truly exceptional food and value:- During lunch, the tapas are all $7 vs. $7-$10 at dinner- During lunch, Socarrat offers paella for 1, so we got to try different kinds- Lunch paella is priced lower at $18-$19 per person vs. $22-$24 at dinner- The service was wonderful: knowledgeable, extremely patient and helpful- The music, heavy on the Spanish guitars, was rather romanticWe tried 3 starters based on recommendations from yelpers and Frank Bruni:1. Gambas al Ajillo ($7) - this little pan of sizzling shrimps, garlic, and guindilla peppers floated into the room in a fragrant cloud of garlic oil, and as soon as I bit into a shrimp and dipped my bread into the oil, I was tempted to get another order.  This was the best starter.  We got 8 medium sized shrimp and everything was tasty, including the garlic, oil and peppers.  Proceed with caution with the guindilla peppers.  Some are very, very spicy!2. Croquetas Cabrales ($7) - filled with a Spanish blue cheese, fried to a wonderful crisp and then placed on a bed of more amazingly buttery cheese, these croquetas were a rather hedonistic indulgence.  We had 4 in our order.  Highly recommended!3. Canelones ($7) - These were rather small but tasty.  4 pasta rolls (about 1.5"" long) filled with spinach and little tidbits of shrimp were covered in melted manchego and topped with a tasty red sauceWe took full advantage of paella for 1 and ordered 1 each.  Post 3 delicious starters, the 2 minute wait for socarrat to form was not as tortuous as I had imagined:1. Arroz Negro ($19) - with ample seafood and strikingly green fava beans against the inky black rice, this was gorgeously presented in a surprisingly large pan with a side of garlic aioli2. Paella Socarrat ($18) - as the house paella, we knew this would be good, but it still exceeded out expectations.  Between the two delicious paellas, I preferred this one because of the visible socarrat and the variety of land and sea.  We liberally applied the aioli from the Arroz Negro to this paella with delicious resultsThough we were full, we had to try the ""Greixonera"" cheesecake, which came in a little pan with a dab of icing sprinkled with nutmeg.  It was pretty tasty, and pretty soon, despite our plans to ""just try a bite"", it was decimated.All in all, this was a fantastic experience with some awesome Spanish hospitality and blows all of the other paella I've tried out of the water.  I'll definitely be back!PARTING THOUGHT: While we ordered quite a bit and cleared all the plates (sweet holiday gluttony), we probably would have been fully satisfied with 2 starters, 1 paella and 1 dessert for lunch, which would have been ~$40 total (for 2 people) before tax and tip.  That's quite a bargain for the best paella in NYC!!!",4,1,4,Ida C.,"Singapore, Singapore",329,437,852
5.0,12/24/2010,"Best paella in NYC, probably the U.S. The paella de carne is to die for, and so is the arroz negro. Start with pincho moruno and croquetas del dia... and don't forget a pitcher of sangria. The service is always great, though it gets really crowded between 8 and 10 PM on the weekend.On Friday/Saturday, expect a long wait as they don't take reservations for groups smaller than six (last time I checked). You can always order your paella ahead of time, since it takes awhile to get made.",1,0,0,Nicolay S.,"Boston, MA",60,124,19
5.0,12/22/2010,"I consider myself a restaurant snob.. Very proud to be a foodie and I always liked Paella but i never gave it  a second thought ESP in NYC because it's just avg across the board.Also , I NEVER post  reviews on line....until tonight.....  My fiancé and I just had the best meal EVER in NYC!!!!! The restaurant pretty much only serves one dish..  Paella.. About 10 different kinds.. We ordered the meat one. Like a fine wine It got better and better and better. The restaurant celebrates the national dish of Spain by making sure every order is made with love and passion . At the end of the day , they proved you don't need white table cloths and all the fluff ..Bravo !!!!",0,0,0,Marty J.,"Manhattan, NY",1,4,0
2.0,12/21/2010,"I came here with friends after reading good reviews on yelp. We were surprised to have waited 45 minutes for a table on a random Wednesday evening. While we waited we had 2 pitchers of sangria. It was very watery and had no kick to it.My husband and I ordered the carne paella. It was very crispy on the bottom and stuck to the pan. Let's admit it, it was burnt! The meat was dry and over done, and it was just not good. The other couple that we were with and ordered the Socarrat Paella and they liked it a lot. Maybe we just ordered the wrong thing (though I don't know how you can go wrong at a Paella restaurant ordering paella!)",1,1,0,karen s.,"Pittsburgh, PA",25,66,3
4.0,12/18/2010,"Very good choices of paella. My friends and I were like little kids again while we were here.Calamar a ala Plancha, tocino, brandada de bacalao, gambas al ajillo, paella socarrat and paella de pescado & mariscos are all very good.The place is loungy though... it has a ""date"" feel to it. Not like for families.If there's one thing that I recommend, go for the paella. It's kind a bland but it's good.",1,1,1,Thigh C.,"Seattle, WA",73,337,7
