rating,time_created,text,useful,funny,cool,username,user_loc,user_friends,user_reviews,user_photos
3.0,10/19/2012,"Having lived in Spain for 3 years I can say is that this paella is not very authentic. I had the Socarrat paella and it was enjoyable but tasted way too different from what I'm used to. Also, there was very little rice for the huge quantity of seafood. For appetizer I had a special, the suckling pig, and again, it was OK, but far below the standard set by Segovia's restaurants. All in all, it was a nice meal but pretty forgettable.",0,0,0,Melissa B.,"Manhattan, NY",0,16,0
3.0,10/18/2012,"Not bad, not amazing. But certainly not the greatest paella, as I was expecting.My friend and I same here on a lovely Tuesday evening, and it soon became completely packed. I'll start with the good - the atmosphere is lovely. Narrow bar in the front, communal tables in a room to the side, and some individual tables to the rear. The colors are darker and it's quite a sexy space.Next to the bad. Unfortunately, like most Spanish restaurants, this place lacks any form of noise control, and the noise, with loud tables around us, became rather unbearable at some point later in the evening. Service also was not very good. We felt a bit neglected, seated toward the back.Now for the food - we had a lovely little berenjena (eggplant) appetizer that was very nice, but for $10, they served one tiny eggplant (quartered into four pieces), which is pretty damn overpriced.The paella is a bit more ""bang for the buck."" A huge heaping of paella comes for two, and they are generous with the fish. While the paella was pretty good, and it had a nice crust on the bottom - my favorite part of the paella - it was a bit lacking in flavor. Both my friend and I were thinking that we needed some sort of spicy sauce in order to make up for the lack of flavor in the paella. The seafood on top was mixed in terms of how tasty it was. The little cockles and shrimps were nice, but the scallops had virtually no flavor and didn't even taste very fresh.Overall, I might stop back in here for a glass of wine, but I wouldn't go back for dinner.",1,0,0,Rebecca A.,"Brooklyn, NY",101,218,4
3.0,10/17/2012,My company of 4 people for dinner on a weekend at 4 pm.  Since the kitchen did not open till 5pm we had drinks at the bar.  We were hurry and a bit disappointed that the bar only had three appetizer choices to accompany the delicious happy hour drink selection.  We did order the croquets which were light and very delicious.  The bartender was a quite but friendly type which was great.  We sat down at 5 and ordered a few appetizers and two paellas.  The service was great.  Biggest complaint was that the appetizers were just ok but ridiculely small for the price!!!  When the bill came I regretted ordering the apps bc they were not even worth the sampling but really racked up the bill.,0,0,0,julia s.,"Brooklyn, NY",1,46,5
3.0,10/13/2012,"The four small plate starters we ordered -- the zucchini, shrimp, dates and artichokes -- were all very tasty and enjoyable. The capper were the two, paellas we had -- the Soccarat and the Negro -- both of which were excellent...different from any paellas we've had here or abroad.The drawback was the hostess and her attitude...enough of an attitude to make me not want to come back. We had N early reservation on a Saturday night (6:00PM), and they gave us the chilly table near the door. When I asked if there was another table, the response -- delivered with an attitude -- was that ""we have lots of big parties coming in tonight.""Maybe it was true, but the indifference and attitude bothered me. The food makes this a Kere...that type of attitude tells me to find you paella elsewhere.",2,2,0,Craig R.,"SHORT HILLS, NJ",0,1,0
5.0,10/10/2012,"I can't say enough nice things about socarrat. (My mouth is slightly watering as I type). I went there with a group of friends for my birthday. First of all, even though the place is slightly small, the hostess was sooooo hospitable and accommodating to our group. Secondly, THE FOOD. We got several appetizers and they were all soooo good. The sangria was refreshingly delicious. The paella takes a while to cook in the kitchen but the appetizers and sangria were all so good, we didn't even realize. The PAELLA. OH MAN OH MAN. We got the vegetarian, the carne, and the seafood. THEY WERE ALL SO DELICIOUS. The carne is succulent and dark and everything you want in a meat dish. The seafood paella was sooo fresh. The shrimp I had was unbelievable, I felt like you can actually taste the freshness. Even the vegetarian (I am a big meat eater and I hardly go for vegetarian) was really delicious and fresh. I saw a lot of complaints about the rice being burnt but honestly, we didn't get any of that in our 3 huge paella dishes. A bunch of people also seem to say ""oh, you only get the best paella in Spain ""and bla bla. Well, we're not in Spain, unfortunately, but Socarrat really delivers quality Spanish food to New York. I CANNOT WAIT TO GO BACK!",0,0,0,Elizabeth H.,"LONG ISLAND CITY, NY",0,21,0
1.0,10/9/2012,"Socarrat Chelsea deserves One Star because the food and our waiter were fine, but the snooty hostess ruined our experience.Went with a few friends for dinner here on 10/4/12. We had made a reservation and showed up on time. When we got to the restaurant the place was 90% empty, yet the hostess tried to seat the 5 of us in a TINY round table right NEXT to the hostess desk by the front door. That table can barely fit 4 people. When we complained, the hostess asked us to wait while she ""go check"". Check for what? The restaurant was 90% empty and I highly doubt it was fully booked on a week night. She finally let us sit somewhere else.The dinner went fine, the food was okay and our waiter was nice. However, towards the end of our dinner, we overheard the same hostess tell our waiter that ""a lot of people are waiting for those seats"". What a rude comment. My party ordered a lot of food and we weren't just sitting around. We were still eating and ordering more drinks. I don't understand the hostess' poor attitude towards us. Socarrat, you just lost 5 customers.",2,1,3,David H.,"Manhattan, NY",0,12,0
5.0,10/8/2012,"A-mazing paella. I usually don't like paella, but will could eat the squid ink paella here all day, every day. Don't miss the red wine sangria, too. Some of the best sangria I've ever tasted!",0,0,0,Irene K.,"New York, NY",31,3,0
3.0,10/5/2012,"Restaurant atmosphere was nice, service was good. Before you order they alert you that it will take about 20 min to make the paella. The paella with squid ink was delicious. However the portion was rather small for two persons and the prices are quite high.",0,0,0,Jason L.,"New York, NY",0,4,0
4.0,10/3/2012,"Finally tried the paella and it was very good.  A bit pricey at $22 per person, but you are served enough for 3 and can take home the left overs.",0,0,0,Jenny M.,"Brooklyn, NY",39,224,90
4.0,10/3/2012,"I must say, by far, this place delivers one of THE best Paella's I've ever tasted!Give it a shot! You won't be dissapointed!",1,0,0,Janette G.,"New York, NY",0,3,0
5.0,9/29/2012,My boyfriend had been raving about this place since we started dating and we finally had a chance to check it out with a couple friends. Wow. Just wow. Great paella. Very fun place - good decor and hip. We were seated next to another party of 2 (table for 6) and we exchanged brief plesantries - nothing intrusive but definitely friendly. Loved the atmosphere and the food. Will definitely come back! The red sangria was also very yummy!,0,0,0,Diem L.,"Broomall, PA",38,125,78
4.0,9/26/2012,"I once came here with friends and was really impressed by their paella so I made a reservation and took my mom here. They didn't let me down.This place is very small and given it was a friday night, we got seated by the bar area. A little cramped but cozy and intimate. Their tapas were very delicately made. We ordered the vegetarian paella since my mom's friend is vegan. I was kinda skeptical at first but it turned out to be just as good as the one I had before. The chickpeas add to a special aroma and flavor. The burned rice on the bottom made the process of chewing slow and interesting. And the portion is huge. I would recommend that if you are going to order a few tapas, make your paella order 1 person portion smaller. Their desserts are to go for as well and the menu changed since last time I went. We got the hot donuts with warm chocolate filling. Amazing delicious!! This is definitely becoming one of my favorite spots in chelsea",1,0,0,Weiying W.,"Morristown, NJ",242,69,50
5.0,9/25/2012,"Excellent. We hit up Socarrat starving since we waited for over an hour at Westville only to be snubbed for not looking like poor hipsters. Our party of four was seated immediately and our server was very attentive. We ordered an assortment of delicious appetizers (omg the dates are to die for),  and two different paella plates (seafood and meat). We also had a lovely red wine that paired very well with everything. The plates were very reasonable for the price and the restroom was immaculate. Definitely would eat here again, and even wait.",1,0,0,JT K.,"Miami, FL",5,8,0
3.0,9/23/2012,"We've wanted to try this highly rated restaurant for quite awhile. I have friends who have mixed feelings about the inconsistency of food here, but I needed to find out for myself. My wife and I who are well known in our small circle of friends as foodies...Set out for an amazing night of see Patty Lu pone at her last night in NYC, and enjoying one of our favorite dishes Paella. I enjoy cooking and we both have an incredible palate for good, and not so good ingredients... Walking into Socarrat is funWith its long bar, very pleasant hostess and host,  bartender  helpful, and also pleasant , made suggestion for wine, and dinner options . We were quickly moved to the fun communal table in the dining area, where hungry patrons were being servedExtra large paella pans on stands filled with assorted seafood, and other proteins.I looked at some of the paella being served and it just didn't look like paella I've made, or eaten else where.. I didn't express my concerns at this time, because it could of just been a different way of making it, and since it always gets great review, I decided to dismiss any negative thoughts.....okay I'll cut through the chance .... We ordered 3 tapas, and 1 all Seafood Paella for 2..... The tapas were a date stuffed with Spanish blue cheese, almonds, and wrapped in bacon...excellent, a special ..suckling pig with spinach, and a puree of chestnut, excellent....mushrooms with truffle oil... No big deal, if I have to rate it.....okay here it is.....the Paella arrives, the seafood looks steamed, and the rice a odd color.....still open to giving this dish a chance.... We plated our food, and both took our first bite, totally disappointed from texture to flavor.....fish completely mealy, no flavor, mussels and cockles 1/4 opened... NoSaffron to be found... Honestly this was below, any expectations.... My wife whoLoves paella, just said this is so bad, it taste like rice with soy sauce on it.... I 150%Agreed... There is no way the fish was cooked in the rice.....the rice is cooked and in the end, they put the boiled, or steamed fish on top..... I can't compare this to anything else except.... Just bad cooking..... I believe large portions make peopleEat with there eyes not their palate......Sorry... This is just a big disappointment.",0,0,0,L A.,"Nyack, NY",0,13,0
3.0,9/22/2012,"Food is a solid 4 and possibly 5. Everyone already knows the Paella here is amazing. Possibly my favorite in the city. I'd have to go back and try more of them.The communal seating is a cool idea but unless you have great posture, it started to hurt my back. I'm also a big guy and sitting next to another big guy was definitely not optimal for a good eating experience. Price for paella was good but I'd say some of the appetizers might be a little over priced for what they were?Service was good for most of the night but near the end of our meal, it took us fifteen minutes to find our waiter and get our check. That was kind of sucky near the end. I'd definitely recommend coming here and getting the paella, but not if you're starving and low on cash haha. Also, not great for groups more than 4 or 5 cause the seating isn't conducive to conversations amongst groups.",2,1,0,Wells H.,"Manhattan, NY",68,41,0
5.0,9/12/2012,"Right after I had my first bite, I knew right then that I had to come back and try every single paella dish that they served. 30 minutes of waiting as they are cooked to order... but totally worth the wait for this flavor packed dish that comes out piping hot. I love how this paella dish allows the rice to have those crispy burnt pieces that add a nice texture to each bite. we ordered the seafood paella, it was bomb-diggity-licious! I really want to go back and try the carne and squid ink paella. we shall meet again Socarrat...!btw... bacon wrapped dates (i always order this item when i see it on a menu) it was good however i found that the sweetness of the date was a bit overpowering. Not enough savory to balance out the extreme sweetness... if i order this again, i think i may do so as a dessert.",1,0,3,Esther K.,"New York, NY",202,365,81
5.0,9/3/2012,"Stumbled on this place by accident , and I am so happy we did.  The host was so accomodating given we did not have a reservation and the place was busy. Have been back at least 3 times since and loved it every time. The vegetarian Paella is awesome! First time  we were seated at the communal table and eventhough we were  not sure about it at first , it ended up being so much fun. Met some great people and we ended up closing the place. The sangria rocks!!!!",1,0,1,Tina M.,"Manhattan, NY",38,34,3
5.0,9/2/2012,Ill keep it short and sweet. This is the best food in NYC HANDS DOWN!!!,0,0,0,Justin S.,"Jersey City, NJ",0,6,0
3.0,8/30/2012,"5 stars for the food. 2 stars for the service - twice. 5 stars for the East Village location. I'd go there instead.  There is something wrong with the hosts in the front desk. Twice I've been there and both times they managed to piss me off. I understand that, because of prep time for the paella, ordering 30mins ahead helps with the flow of turnover and that they want your whole party to be present before being seated- I have absolutely no problem with that. What's completely annoying is how they deal with seating and the 2nd time was the worst: they tried to seat a party of 3+ at the end of the long table at an L-shape formation where two of us will end up staring at a wall or strain to talk to the other two. And there were two other four tops available. They moved us when requested, but not w/out a strained look and some hesitation. OKAY...I've been a hostess, I never got hurt when trying to shift patrons around. And then our server didn't ask us if we wanted dessert. Just said he's NOT trying to rush us and gave us the bill. Alright alright, we GOT THE CLUE. Socarrat really does make the BEST paella I've ever had. Their Spanish tortilla reminds me of Barcelona. Great sangria. But, the service left a bad taste in our mouths. So unfortunate.",1,1,1,Huong V.,"Oakland, CA",227,219,150
5.0,8/29/2012,"Every so often my equally food loving friend and I crave paella, and for a year now we have been trying to find the most perfect Paella in NYC because nothing is more disappointing then spending a ton of money and getting the paella and realizing that it was cooked in a way that does not allow the perfectly crisped edges to form around the sides and bottom of the pan, which results in not enjoying the most perfect paella.  Our search ended here.  Socarrat serves the best paella hands down.  100% comparable to the best paella I had in Spain.  Aside from the perfect crispness around the sides, the dish was bursting with flavor, we had the seafood one, forgot the technical name, but the shrimp, scallops, clams, mussels and fish were cooked and seasoned perfectly and I loved the roasted sweet red peppers on top as well.  Dangerous good here.",1,0,0,Vanessa E.,"New York, NY",164,21,6
4.0,8/28/2012,Pork belly appetizer. Yum.Also the paella and the sangria were delish.Definitely would go back. Lovely.,0,0,0,Evelyn S.,"New York, NY",17,350,182
4.0,8/17/2012,"There's a happy hour on sangria and couple tapas until 7 but only at the bar. Is this the best paella I ve ever had? Hard to say since it's been a while. But given that I did live in Spain before, and I say this in the most obnoxious and pretentious way possible given that it was ages ago and I doubt I had a paella there but rather only recall a loaf of French bread my host family gave me and put a Hershey bar in for lunch, nevertheless this paella tasted excellent. If you get the paella for two, id really say its large enough for three. The sangria was fine, nothing wrong w it, tho at 9 bucks a glass it ain't a value drink that is for sure, or should I say ""seguro"", since, after all, I did ""used to live in Spain"".",3,2,1,Kevin W.,"Manhattan, NY",45,548,18
4.0,8/15/2012,"FOOD: 4 starsWINE: 3 starsSERVICE: 2 starsThis was my first time going to Socarrat in Chelsea. I've been to the Nolita location twice so there was a lot to compare.Wine-*rose sangria- tasted water downed. did not taste the wine nor the fruit. :(Tapas-*tomato toast- tasted good but nothing special about it. would not order again.*grilled squid- very good as usual.*shrimp with garlic- delicious, a must-try. don't forget to dip the bread in the sauce for an extreme garlic explosion in your mouth, that's if you are a garlic lover.*bacon wrapped dates- I would love this dish if there wasn't goat cheese in it. *scallop ceviche with avacado- one of the specials that night. thinly sliced raw scallops and avacado with a very interesting sauce. my favorite out of all tapas.Paella-*black paella (with squid ink)- so delicious!! I liked it better than the Soccarat Paella (their signature, i think) the seafood on top was so fresh and the rice was very flavorful. however, the rice turned rather salty after it cooled down. I would definitely order it again.Service-our waiter was not attentive nor friendly. When ordering, he kept pushing us to order the paella for 3 when we clearly stated we only wanted it for 2.  I had to say No to his face to finally shut him up.  During our meal, he came by to fill the water once and then he was gone.  He did not come by to scrap the bottom of the paella dish for the crusty bits of rice (hence the ""socarrat"").  Come on, that is the best part of the whole dish!!  He only came back to give us the bill.Honestly, socarrat's tapas was just okay to me, but they really do have the best paella.  My overall dining experience at Socarrat Nolita was much better. I will stick to that location from now on.",3,0,2,Alexia G.,"New York, NY",85,68,12
5.0,8/14/2012,"I had an amazing dinner here with my gf.. We walked in to a dimly lit bar/restaurant. We waited about 10 minutes to be seated, shortly after we ordered to glasses of red recommended by the waiter. app:  garlic shrimp- excellent full of flavor and fresh,--- must tryquesos -forgot which onepaella : socorrate - $ 22.00 a person keep in mind, worth it because they give you your moneys worth.ask for the Spanish hot sauce for condiment extremely hot and flavorful.food is excellent service is great and drinks were awesome highly recommended.",1,1,1,Sim D.,"Fresh Meadows, NY",8,37,4
5.0,8/11/2012,"Oh my GOD I LOVE Soccarrat. From the disorganized front desk and unclear reservation 'system' to the crazy-in-an-awesome-way owner who will scoop out your paella and insist you eat ALL of it ""Because it is so healthy for you young lady!!!"".... I love Soccarrat. I lived in Spain for a year (and not as some poor undergrad who ate kebabs the whole time). I go back to Spain almost every year, so it's fair to say I LOVE tapas and have eaten probably too many in my lifetime. I would recommend:Starters:-Gazpacho. To die for. Do not share. Get your own, or else you will fight for it with your friends. They only serve this in the summer.-Garlic Shrimp. Delicious, hot, garlicky baby shrimp. Eat with bread. NOM.-Patatas Bravas. Just the right amount of spice and a reasonable portion.-Serrano y Manchego. Ham and Cheese. Can't go wrong. Good selections here.Paellas:1) Seafood. Fantastic if you love seafood. Everything tasted so fresh. Surprisingly light for Paella. 2) Black Rice. Rich and salty. This felt a bit heavy, but I love it for a treat now and then.Try the Fideos if you are feeling adventurous or lean towards pasta over rice.Know before you go:-You can try to snag a seat at the bar, but they go fast-They dont do white sangria by the glass, only red (Wahhh!) -You can only make a reservation for a table if you're going to order paella (-1 star)-Because of the above, it can be better to go with friends. The paella is BIG!-Don't skimp on the apps, they are all standouts!",1,0,0,Kels P.,"Manhattan, NY",10,54,5
4.0,8/8/2012,"Get the squid ink paella and try their tapas. Strong, delicious Sangria. Seating was a bitch despite the fact that we had a reservation. We were offered complimentary Sangrias to make up for the long wait. Me likey. Arrive early if you can. Cozy atmosphere. I will be back to try different dishes for sure :)",0,0,0,Celine G.,"Manhattan, NY",21,18,4
5.0,8/6/2012,"They need to bring Socarrat to Los Angeles, PLEASE! It has been over week since I dined here and I am still thinking about it!I'm usually a bit hesitant about tapas places, as my past experiences have always been mediocre. I lived in Spain for half a year so I know my tapas, and I haven't been able to find a legit tapas place in Los Angeles. Well, to my luck and sadness, I found a great one in New York! You must try the arroz negro (black rice) paella. The rice is black because of the squid ink, and the pieces of seafood on top are cooked to perfection. Seriously, this dish is legit! My company at dinner are locals and they have all said the best paella here is the arroz negro. GET IT! Also, if you like it spicy, and why wouldn't you, ask them for their homemade chili oil. OH MY GOODNESS. This hot sauce is amazing. It's not too crazy, but it totally gives your dish a kick. Sriracha, you got competition! Lastly, the paella is served with a side of garlic alioli. Can I just die now? As for tapas, please order the shishito peppers (I think these were a special that night). These were sooooo good, like chips and salsa -- you can't stop eating them! The patatas bravas here are mediocre. Once you try patatas bravas in Spain, nothing else compares.Side notes:-Service here is excellent!-Ambiance here is great for a date. Not the best for big groups. -One part of the restaurant has a long, thin communal table, right next to the bar. We sat here and I liked it.",1,1,1,Lindsey K.,"Los Angeles, CA",102,198,116
5.0,8/3/2012,"Squid ink paella was incredible! Sangria great. We also had the tortilla, fried artichoke and a few others. The atmosphere was cozy and nice! I will definitely be back!!!",0,0,0,Elizabeth C.,"Brooklyn, NY",11,11,0
5.0,7/31/2012,"Best paella you'll get this side of the ocean!Special mention for the squid ink paella, although I was anxious at first to try it, it is just delicious.Tends to get busy so make sure you are ready to wait for your table, although there are worst things than waiting with a plate of jamon iberico!",0,0,0,Benoit B.,"Manhattan, NY",1,49,0
4.0,7/29/2012,"Pretty rockin Paella and authentic as well. I have been to Spain a number of times and this is ""la verdadera"". Communal tables as well if you want to rub elbows with ""la gente"" or just get a regular table.  Good wine selection and service was pretty good too.",0,0,0,Max D.,"Brooklyn, NY",0,15,0
4.0,7/23/2012,"Awesome paella (about 9 different choices) and tapas. Great sangria. Nice atmosphere - cozy and intimate.  The staff explain how the paella is made, served, and even how/when to order everything for optimal dining. Our waitress was especially helpful. She suggested which sangria was her favorite and we thought it was delicious (white sangria made with sparkling wine). The paella is priced per person, and our waitress told us that for our party of 3, a 2-person paella would be appropriate because we were also ordering tapas.  We ordered the signature Socarrat Paella ($22/person), plus two tapas: the amazing mushrooms with truffle oil, and the dates wrapped in bacon (and stuffed with blue cheese and an almond).  For a 2-person paella, 2 tapas, and a pitcher of sangria it came to $105 without tip. We split the bill 3 ways and with tip it came to $42 each.It's a tiny place, so you need to get there early or go at a less busy time. I went on a Monday at 7 and it was pretty quiet until 8:30, at which point it got packed.  It's a little pricier, but you get what you pay for. Fresh fish, mussels, shrimp, great meats and perfectly aldente cooked rice!",1,0,0,Kimberly D.,"Yorktown Heights, NY",111,356,1582
