rating,time_created,text,useful,funny,cool,username,user_loc,user_friends,user_reviews,user_photos
1.0,12/3/2015,"Sat down at the bar today (12/3/15 @ 1030am), hoping for a bite and a double espresso.  Two employees - a short-bearded short guy with an Italian accent and young brunette gal - were discussing the staff schedule.   So I patiently waited.  The guy looked over and made eye contact with me, so I thought that meant he was about come get my order.   But I was wrong.  So I waited.  And after 5 minutes of not even being greeted, I walked out.  Lots of other restaurants in the neighborhood who will happily serve me!  Ciao Tarallucci E Vino!",3,2,0,Patrick F.,"New York, NY",92,47,46
5.0,11/10/2015,Tarallucci E Vino is an amazing tapas spot.  You can order a full meal but I recommend sitting at the bar and enjoying the vast selection of Italian wines here.  From Barolo to Arneis they have have it all.  Ask for Chris the bartender and you will have exceptional service as well,1,0,0,John C.,"Island Park, NY",117,2,0
3.0,9/14/2015,"I really enjoyed my meal here.  I had the raviolis (which came in a wine and speck sauce).  The olive bread was pretty good, and the service was good as well.",0,1,0,Lisa D.,"Glen Cove, NY",84,403,0
3.0,9/3/2015,"The carpaccio salad was impressive, yet didn't offer unique flavors that would entise me to repeat.  The complementary bread and olive oil with a cream of black olives,  was a good pair with the salad.The wine prices seemed a bit pricey for a restaurant which does not have an upscale staff or decor.  Violetta the bar-tender appeared antentive and approachable. None the less, when she refilled my water, she may have forgotten that I originally said yes, when she asked if I wanted ice with my water, and the ice was now melted.I wouldn't mind returning, on a date or with friends.  The open doors and outside seating is quiet inviting for this season.  Would just go for wine.",0,0,0,Rosanna V.,"New York, NY",19,149,34
4.0,5/27/2015,"Delicious, interesting, and well-executed food and a great place to sit outside. We've gotten the prosciutto , bresaola and salmon paninis as well as seared scallops and risotto. All good and would get again.I think the prices are too high for the casualness of the restaurant. Since when did $25+ per plate become the norm?",1,0,0,Susie B.,"Levittown, NY",48,90,8
1.0,3/12/2015,"I came here twice.The first time I came, the food was ok.I wouldn't say that it was pretty good, it was just acceptable. But I had really liked atmosphere, and that's why I came again today, for lunch.This time, the food was terribble!!First, I had some carpaccio. It was really just discusting!! I eat carpaccio at other restaurants all the time, and almost always, I am satisfied. I never felt discusted by this dish before. So congratulations to the chef, you have made me experience a ""first""!After the terrible starter, I had the spaghetti with tomato and basil. And it was the worst spaghetti I have ever eaten in my life! There was no salt, like zero salt, and the spaghetti was basically ""swimming"" in excess tomato sauce!!! I don't understand why anyone would put so much tomato sauce, you don't have to be a master chef to see that it was too much, you can basically see that it was too much just by looking at it! But apparently, this chef doesn't really give a damn about it, so he/she just accepted to serve this ridiculous dish.It was so terrible, I couldn't even finish it, and I left the restaurant hungry.I strongly discourage you from coming here for food. You can, however, come here for drinks. It has a nice atmosphere. But food, please don't do this to yourself.",0,1,0,Gokalp A.,"New York, NY",0,7,7
5.0,3/10/2015,"I just had the most wonderful lunch while sitting at the bar here. The squash risotto with prosciutto is delicious and you have to try the tiramisu. If you're in the area, it is definitely worth your while to stop in for a quick bite and a glass of wine. Great service and a wonderful atmosphere, enhanced by a nice choice of music. I'll definitely be back!",1,0,0,Vincent E.,"Crown Heights, Brooklyn, NY",13,1,0
4.0,1/12/2015,Excellent expressos and food. Rita is wonderful.,0,0,0,Single Man N.,"New York, NY",0,3,2
1.0,11/18/2014,The atmosphere and wait staff is very nice but the food was unseasoned.  I mean really unseasoned-undressed salads and the expensive steak had no seasoning at all-I don't think i ever tasted unseasoned meat-it tastes like COW. Maybe the busboy was cooking but they lost our business (and all friends) for ever-note to restaurants on not so busy nights...not having a chef is never a good idea.,1,0,0,Sascha S.,"New York, NY",0,11,1
4.0,11/7/2014,"Summary: authentic Italian comfort food and friendly service in a romantic low-key space.Coming in out of the rain on a mid-October weeknight, the hostess's warm welcome helped set a good tone.  Tasty breads arrived quickly at the table. We shared a yummy arugula salad.  GF ordered a plate of grilled scallops (capesante) and I had rabbit ragout on pasta (fregnacce).  Decent  Italian wines paired well with the food.  Service was pleasant and attentive. Tab was reasonable.Worth a return visit!",0,0,0,Andrew P.,"青森県, Japan",0,53,0
4.0,10/11/2014,Came here for a glass of wine and sat at the bar. Ordered the meatballs and they were delicious along with the wine! The bartenders gave me great suggestions and the place is super cute. A great date place or if you just want to enjoya glass of vino solo!,0,0,0,Leilani L.,"New York, NY",24,87,38
4.0,9/7/2014,"We decided to try this place on a whim, walking around the UWS doing errands. Boy are we glad we stopped in! Everything as super fresh, service was friendly and very European (no rushing, ask for the check, etc.). Also, the space is clean  and cozy at the same time - clean lines, little shelves lined with small plants.The bread basket has three types of bread - rosemary focaccia, whole wheat and baguette, and is served with a small pot of oil and olive paste. Delish!Our brunch consisted of the Asparagi and poached eggs with pink peppercorn over potatoes. Amazing tasting, very filling, lovely flavors. The asparagus was cooked just right - still crisp but not stiff. The other dish was the soup and half panini. I'd never heard of Beet Soup but decided it was interesting enough to try. It was so delicious - it had the sweetness of beet but also tasted like fall due to a spicy edge and earthiness to it. I couldn't believe it was vegan! The half pannini was chicken, greens, and the olive pate. It was great, though the chicken was a little on the dry side. The sandwich seemed more like a whole versus a ""half."" Totally stuffed after.The OJ here is fresh squeezed and tastes like the very essence of an orange.$30 for two, no booze, tax included = a great deal. We'll be back.Amazing beet soup!",1,0,0,Tyler S.,"New York, NY",218,203,108
4.0,7/30/2014,"This is a great place for pasta, charcuterie, cheese, and wine at a fair price. This is my favorite italian in the UWS. I love the cheese assortment option, it comes with nice toppings. They have a tiny dining room, but some outside tables. It's on a nice block, with Congregation Rodeph Sholom right down the block.",0,0,0,Sophia S.,"Manhattan, NY",7,155,61
3.0,7/15/2014,"Immediately after walking in a Friday night my party of 3 thought we would love this place. It is clean, intimate and it has outdoor seating (which I LOVE, on hot summer days in NYC). However the food had no taste which made our dinner extramural boring (taste vise). We will most likely not be returning for dinner.The staff was friendly enough, they followed up with drinks, answered our questions about the food in a nice way before we ordered, but we were overall disappointed by the food in the end. I have a strict policy of not sending food back unless it is something wrong with it, or if it was not what I ordered so we all just stuck it out. Both my friends had the Tagliatelle, and I had the Vegetable Lasagna .Like I said, the place look great, it has an ideal location and the staff is friendly. We might come back just to brows through their wine list on a late afternoon. I can imagine this being an ideal spot for a drink after work especially if you get to sit outside.",1,1,0,Ida Iselin E.,"Oslo, Norway",229,211,126
3.0,6/27/2014,"Got there at 7:30am and was disappointed to find that breakfast didn't start until 8am. But this actually worked out because I was able to have both breakfasted and pastries.We ordered a sugar donut, a cinnamon role, and cornetti. I really liked everything but my sister and mom didn't really care for the cornetti because of the zingy taste that most Italian breads have. So if you don't really like that flavor I would recommended this place. For breakfast we ordered french toast and vegetable frittata. Again the french toast had a zingy taste that some people don't like, but I don't really mind it. I though it was really good. The frittata was also pretty good and the ice coffee was the best part of the whole meal.Only complaint: such slow service, like unbearably slow. No one came to our table to check on us and there were no chances of getting refills.",0,0,0,Elizabeth C.,"Lexington, MA",33,40,32
4.0,5/19/2014,"Very pleasant spot for weekend brunch. The PLT sandwich is great, poached eggs on polenta were a bit heavy for my taste.",0,0,0,Albert S.,"Brooklyn, NY",6,19,6
4.0,5/12/2014,"I was skeptical to try this spot on a Sunday afternoon (Mother's Day with my husband and MIL) because of the 3.5 stars and because nobody was sitting outside although it was beautiful. However, I'm very glad we came here. The service was efficient and extremely friendly and the food was very good. We had the calamari, which was OK -- not the best we've ever had, but good. Our lobster ravioli was very good, and my MIL's chicken piccata was delicious. The salad was good, too. Also, the wine prices were very reasonable. The atmosphere inside seemed really nice, and the patio was great.",0,0,0,Shannon L.,"Versailles, KY",3,24,0
5.0,4/5/2014,The best place in the neighborhood !Thank God they decided to open one near us!!!I feel very lucky!,0,0,0,Marina S.,"New York, NY",0,11,6
4.0,2/8/2014,This is a great place for coffees and pastriesin the morning. All the staff is extremely polite and helpful !,0,0,0,Toti D.,"Manhattan, NY",0,4,0
4.0,11/22/2013,"Went to a wine bar, didn't order wine. Sounds like a meme in the making.The ambiance and location of this place are supreme, but the food isn't memorable. Still a good time though!Our group of six started off with complimentary bread, oil, and olive paste (yelp.com/biz_photos/tara…), which was the perfect appetite stimulant.My friends ordered a QUICHE, $9 (yelp.com/biz_photos/tara…); the TOAST ALLA FRANCESE, which is brioche French toast, bananas, mascarpone cream, $10 (yelp.com/biz_photos/tara…); and some white wines.I chose the UOVA E PORCHETTA, which is poached eggs, grilled porchetta, soft polenta for $10 (yelp.com/biz_photos/tara…). The yolk from the pierced poached eggs fused well with the creamy polenta topped with grated Parmesan cheese. The porchetta was decently salty, a welcome component to this enjoyable, modestly filling dish. It wouldn't fill up large appetites, though.Okay, admission time. Wanna know the real reason why I didn't order wine? I glow like crazy, and as much as I like coordinating outfits, I didn't find it necessary to match the red fall colors in Central Park. Hmph.",0,1,1,Adele F.,"San Francisco, CA",253,558,1992
4.0,11/22/2013,"Excited to have a place with a downtown feel in the neighborhood.  Delicious wine, delicious tagliatelle, delicious scallops, excellent service, but horrible bruschetta...like bland baby food horrible.  Other than that, love love!",0,0,0,Em S.,"New York, NY",18,108,8
3.0,11/11/2013,"5 star coffee4 star croissant1 star barista attitudewas refered by a regular of this place who told me to stop there since i was staying in UWSgreat lattè, flacky croissant, but still can't get over the ""shitty"" attitude of u Mrs behind the counter... u don't like tourists? u didn't like my Canada hat? was it too hard to say goodbye? i know, smiling is not for everyone :)i wanted to try this place out also for dinner but tkx to U, i went somewhere else!!grazie millearrivederci",3,2,1,Marc C.,"Montreal, Canada",2,34,0
5.0,10/16/2013,"Such a neighborhood gem!  Great food and drink, but above all, the service is exceptional.  After two visits, I was asked if I was having my ""usual"" (The panini Urano) I feel so well taken care of every time I visit.  I relish every opportunity to enjoy this neighborhood favorite!",0,0,0,Carrie C.,"New York, NY",55,37,4
4.0,9/20/2013,"Stopped in a quick lunch today. I have to say, this is definitely to place to be on a nice day in the afternoon. It was so pleasant to sit at one of the tables by the window, have a relaxing lunch and watch the world go by. I loved the atmosphere - it was the perfect café setting. Their lunch menus have paninis for $12 which is a pretty good deal. I ordered the rosemary chicken, arugula and black olive spread one. It was delicious. The flavors balanced nicely, the rosemary was not overpowering which it sometimes can be. It was a good sized sandwich for lunch. The bread was delicious, however it was alittle too crunchy for my taste - like cut the inside of your mouth crunchy Who knows, maybe I just have a weirdly sensitive mouth? The bread was tasty though despite texture. Service was good and not rushed. The espresso to finish the meal was tasty and only 2 dollars. Overall a great experience. Seems like a nice neighborhood joint.",0,0,0,Joseph F.,"New York, NY",51,183,5
5.0,9/12/2013,Great placeLike been in Italy with friendsGrande Rita e i suoi superbi cappuccini!Love it!Thank you for choosing the UWS we feel lucky !,0,0,0,Marina S.,"New York, NY",1,19,15
3.0,8/18/2013,"Ok , nothing special, I guess given the name I expected something more authentic.But decent anyway.",1,0,0,andrea p.,"New York, NY",350,483,951
2.0,8/5/2013,"People are always here, sitting outside, luring you in because they seem to be really enjoying themselves.  BUT this can only be because of the wine.  Went here for dinner and tried two entrees.  I had the steak.  It was not delicious.  Not at all.  Sit outside, maybe drink a glass. Maybe light snacks? That is all.",2,2,1,Jennie G.,"Los Angeles, CA",0,29,2
5.0,7/27/2013,"Wow! Great wine list, terrifically delicious octopus carpaccio, yummy duck ragu with freshly made pasta, and tender, tasty rib eye with arugula, tomatoes (not confit), pine nuts, and vinagarette. Finished with tiramisu and coffee. Overpriced? Only before you eat it it and realize it was made fresh to serve and the ingredients are above average. Sour mozzarella? I think not. Could have been your wine or lack of experience with true fresh mozzarella. We will be coming back for great service and delicious food. PS The ambience was lovely!",0,0,0,Lola N.,"Albuquerque, NM",166,65,28
4.0,7/12/2013,I love this place. I love the fact that both Rita and Angela know my coffee preference before I even walk in the door. It's just a wonderful place and the occasional Matt Dillon sighting is an added bonus!,1,1,0,Katy H.,"Upper West Side, Manhattan, NY",80,10,0
5.0,6/25/2013,"I have found my new favorite lunch spot! The food is amazing, wine is very good, and service is friendly. I will be coming here often.",0,0,0,Sarah S.,"Upper West Side, Manhattan, NY",0,6,0
1.0,6/14/2013,"The restaurant is stylish and cute, but too bad the food is awful.  For an app, we had the mozzarella salad;  the cheese had a sour taste to it.  The scallops also tasted off--could only eat one on the four--and the lasagna should be named something like a small plate of inedible vegetables with a few noodles in between.  The menu is very limited and very overpriced.   The only positives are that there are always tables available outside, even on the nicest of NYC nights, and there's a great bread basket that helps to take away the taste of anything else that you are served.   Waitress was sweet and helpful and served the (terrible) food very quickly, but likely because the restaurant was empty.",0,0,0,Annie D.,"New York, NY",0,18,0
4.0,5/28/2013,"While I am not yet in the position to offer commentary on the food, I can on the experience as a habitué of the wine bar, and it was indeed enjoyable.This area of Manhattan largely offers a number of sophisticated, alcohol-infused, hideaways, and Tarallucci E Vino is no different; however what drew us in from the beginning were the large windows boasting a well-lit inerior that gazed out on to Columbus Avenue and its passerbys on this rainy evening.The wine-list by the glass is unique, but at the sametime limiting, or perhaps it is my own flawed-paradigm that believes a glass of malbec or a grenache has reached the ""taken for granted"" heights of off-color staples on the wine list in major cities.  That being said, it forced (ha, ""forced"") me to try the Argiano non-confuditor (blend); a widely well received and reviewed red with a unique flavor and rich tannins.  I think chianti drinkers would appreciate it, since chianti is not on the menu.The experience at Tarallucci E Vino is worth returning for.  The atmosphere is convivial and casual, and it allowed for ""easy to have (and hear)"" conversation between my proofreader and I.  The prices by the glass range from $8.00 to $18.00.  Though I did not sample any of the food, those eating around us seemed to be enjoying it and it was all well presented.",0,0,0,Tom O.,"Brooklyn, NY",198,545,67
5.0,5/19/2013,"Completely love this place. We found this place last summer- perfect location on UWS to sit outside, people watch, nibble and enjoy incredible wine. We recently revisited and it was even better than we remembered. The huge windows were all open so even sitting inside at the bar felt like being outside. The ambiance was so welcoming and open, we stayed much longer than we should have!We weren't familiar with the wines on list but the bartender guided us to the perfect selections. We simply gave a description of what wines we usually drink and they presented us with both red and white that we totally enjoyed. The food menu is simple but varied. We ordered a cheese plate to start and I love that we got to choose which ones we wanted- huge selection! We opted to order all apps so after cheese we had the pollipo and scallops. The pollipo was amazing but the scallops are beyond words- delicious doesn't even begin to describe. They get 5 stars for outstanding service, melt in your mouth food and hands down, the best wine selection in the city.",0,0,1,Mykal M.,"Manhattan, NY",0,15,0
3.0,5/8/2013,"Cute little restaurant/wine bar, with attentive service. I ordered a glass of sauvinon blanc, which was good. They serve a little basket of bread (foccacia, some kind of sweet raisin bread, and a white bread) with olive oil and a black olive tapanade, which ended up becoming my meal because it was significantly better than the entree I ordered. I ordered the butternut squash risotto, and I wish I hadn't. It came out a few minutes after I ordered it so I should have guessed, at literally the same time when I got the bread. The risotto was bland, and had 4 slices of the cheese placed on top of it. I attempted to stir it into the risotto thinking that it would melt, but no such luck. Perhaps the risotto wasn't hot enough? I would probably return here to try more of the wines, but not for the food.",1,0,1,Susan C.,"New York, NY",19,29,0
2.0,4/11/2013,"Sorry to say, but this place was somewhat disappointing for two reasons:1) The wine -  Unsure of what to drink, our waiter very graciously let us sample a couple, neither of which did we like.  No big deal, we decided to pony up for an $18/glass barolo which we are certain to like.  I'm not sure how any Sommelier could have put this wine on their menu, let alone charge $18 for it -- it was so dull and underwhelming, it may as well have been a pinot noir (no offense to pinot noir).  Also, I don't know what the pricing formula is for charging by-the-glass, but after researching the wine on the internet, it seemed disproportionate.2) The food - I won't go as far to say it was bad, but there was really nothing special about it.  We ordered the spinach salad with raspberry dressing - the only thing raspberry about it was the garnish and it was so heavily salted that it was crunching in my teeth.  I'll give them the benefit of the doubt, that it could be a one-off issue, I've done that myself.  We also ordered mozarella di bufala that I was assured was very fresh but it was definitely some store-bought mozarella -- which is fine, I just found it to be disparate with an $18 Barolo.  I will credit them that the roasted veggies that came with it were very good.  This is kind of a small sample to judge the entire menu but we decided not to order anything else after being underwhelmed with our first two choices.  Yelp equates 2 stars with ""meh"" and that pretty much hit the nail on the head.",0,0,0,Lea L.,"New York, NY",0,2,0
4.0,1/9/2013,"Great spot for a low key, leisurely brunch in the Upper West Side. The food is by no means ""life changing"" and there are certainly tastier options in the neighborhood, but it was solid brunch fare at a really reasonable price without egregious wait times. We sat at the bar/counter in the middle of the restaurant and was given excellent, attentive, friendly service by the barista. We didn't feel hurried or pressured at all, which definitely added to the good experience.",0,0,0,Grace L.,"New York, NY",14,69,7
3.0,12/17/2012,Stopped in one evening on my way home from the office and enjoyed some lovely plates at the bar and had an excellent conversation with the knowledgable maitre d'. Delicious wine and friendly staff made for an enjoyable evening.,0,0,0,Andre S.,"Manhattan, NY",71,226,23
5.0,10/28/2012,"This is a review for their breakfast..... It's a great cute spot with delicious coffee, pastries and cheap tasty breakfast items ($5 for ham and cheese croissant). We ate outside but I saw that they also had a pastry counter/fridge upfront inside. Glad that they decided to include breakfast in their usual wine bar/dinner routine - would have eventually stopped by for that, but with a no line brunch on the UWS, I've already been here 2 weekends in a row! Friendly service as well.",0,0,0,Maria Y.,"San Francisco, CA",0,94,12
3.0,9/15/2012,"Apparently there are several Tarallucci locations, and this one happens to be a wine bar.  I came here for breakfast (and didn't drink wine), so perhaps I did get to have the best they have to offer.  With my love for salmon, I went for the Smoked Salmon Breakfast Panini (photo: yelp.com/biz_photos/tara…).  The panini was pretty toasty and crunchy, moreso than I would have liked, and the salmon portion seemed a bit small.  Pair that with a salad portion that may have been a bit larger than the sandwiches, and you have an okay breakfast.",0,0,0,Anthony M.,"Las Vegas, NV",498,242,692
1.0,9/1/2012,"The wine selection is pretty outstanding, as is the cheese list (if just looking to nosh...as my friend and I were when we happened upon this place).  The service was terrible.  It took a very long time for our waitress, Kamaran, to do any sort of follow-up, table maintenance, take a dessert order, etc....",0,0,0,B B.,"ASTORIA, NY",0,1,0
3.0,7/21/2012,"The food at this awesome wine bar is amazing, and the wine selection is also great, I had a veal Fregnache that looked like a crepe made out of pasta and shredded veal, it was quite good...and the cheese's were also good.  The bartender was a very nice gentlemen, except for when he yelled at the waitress that was standing by the bar, I felt bad for the poor girl, bad manners aside it was a great dinning experience on the upper west side",0,0,0,Sanjit K.,"Washington Heights, Manhattan, NY",0,1,0
4.0,4/29/2012,"My son and I stopped in for a Saturday lunch, and it was exactly what I wanted. At first I was skeptical because I only saw pastries at the counter, and there weren't any open tables (it's tiny). We took seats at the bar, and were immediately served. My son has a favorite barista who made him the perfect cafe Americano, and she brought us a bread tray with dipping oil and crushed Kalamata olives. My son ordered a sandwich, but I asked if they had any hot soups (a cold soup was on the menu, but it was chilly outside). The server told me about a fresh asparagus soup which was made with chicken stock instead of (the usual) cream, and it was about the most delicious asparagus soup I've ever had. For dessert I splurged with a coconut macaroon---not too big, not too sweet, half of it coated in chocolate. Perfect.",0,0,0,Yvonne C.,"Arlington, VA",0,26,0
2.0,4/15/2012,"We went here for brunch because we wanted to sit outside and it's always so busy we assumed it was good. The service was pretty bad, no one checked to see how our food was or if we needed more coffee and we had to wait forever for our check. We ordered the PLT and French toast. The French toast was fine. The egg on the PLT was severely over cooked and I had to remove it from my sandwich. I do not plan on returning, there a too many good brunches to be had on the UWS.",0,0,0,Jamie J.,"Manhattan, NY",1,3,0
4.0,4/4/2012,"I love the location on East 18th Street although it can get noisy, and I'm super pleased there is a location now in the UWS.  I've been here for breakfast, lunch, afternoon espresso, and all the time very pleased with the pastries and panini.  Very friendly staff, clean, good light.",0,0,0,m b.,"New York, NY",0,26,0
