rating,time_created,text,useful,funny,cool,username,user_loc,user_friends,user_reviews,user_photos
4.0,4/18/2019,my favorite west side go to excellent bolognese when they offer it on special...nice staff,0,0,0,Trish G.,"Lagrangeville, NY",0,17,0
3.0,4/7/2019,"Very average overly price food. I personally found the food just ok, portion are small and overprice. I love a fine italian restaurant but this one was barely ok. Service was just okay too, waiter did not expand any specific recommendations! Not worth it",0,0,0,Marie Laure D.,"Manhattan, New York, NY",0,21,0
3.0,3/31/2019,"Tarallucci E Vino is a great spot to have a early morning, low-key brunch. I enjoyed the eggs and polenta dish (polenta squares topped with poached eggs, mushrooms and parm), while my friend enjoyed her salmon and egg dish (salmon, kale, and poached eggs on toast).  The toast with butter and jam was also scrumptious.  We didn't try them, but the pastries looked excellent.  Sadly for me, they don't serve cold brew - and iced coffee is just not the same.",0,0,1,Jennifer S.,"New York, NY",16,692,0
5.0,2/27/2019,"Gosh, where to start?!?! This establishment is low-key, yet warm, welcoming and elegant!!! I was in NYC for a work conference and my husband and I were exploring the nieghborhood when we found Tarallucci E Vino. As a birthday treat, my husband suggested that we eat here.The atmosphere is quiet with sensual yet relaxing music in the background. There is a U-shaped bar in the middle with small sit down tables surrounding it. The staff was subdued yet warm and friendly. The dim lights created a romantic feel for our dinner.I am currently pregnant so kept to water for my drink, but my husband ordered the Pink Pepper Italian Beer. He really enjoyed the flavor!! the wine list is extensive, which is really nice!To start we ordered the meatballs. They were perfectly cooked and served with plenty of marinara sauce. Perfect for dips your bread in. The order came with approximately four meatballs. We split an order of the lasagna, which was the perfect size for us to share. If you are hungry, this  better suited for one person. Overall, we had a wonderful time and I would high suggest stopping by!",0,0,0,Vanessa C.,"Atlanta, GA",116,102,58
5.0,2/24/2019,"Was recommended by a friend of mine to dine in this location for brunch and I am VERY pleased. From the moment I walked in I was greeted by the hostess who searched for a table for my partner and myself quickly. After being seated Victoria approached the table and was very accommodating when it came to my allergies; she extremely knowledgeable on food items. My partner also has a particular taste in wine and both barista's were at such great help with finding the right wine for him. Over all, wonderful experience and I'm looking forward to coming back.",0,0,0,Jennifer L.,"Manhattan, New York, NY",0,1,0
5.0,2/12/2019,Lovely small place. Had a great time with the kids. Wonderful service. The lasagna and the tagliata  were both great. We enjoy our time here. Thanks,0,0,0,Oren S.,"New York, NY",13,1,0
5.0,1/28/2019,"This restaurant/wine bar is very low-key yet elegant and impeccably clean. The music selection is often sensual and relaxing. I always come here to meditate over a bowl of fresh pasta after my monthly facial at Savor Spa, which is right across the street. I dated an Italian (Torinese) for three years, and trust me, this is as authentic as it gets in Manhattan!  I am not sure if they make the spaghetti from scratch, but every time I finish my bowl I want to cry (and am one glass of wine away from ordering another bowl). The only thing that keeps me disciplined is knowing that I will be back again in four weeks. Enjoy my spaghetti shoot below.",0,0,0,Kathleen F.,"Queens, NY",197,18,30
5.0,12/30/2018,Portions are small but everything is so good. Wait staff was very friendly. Wine list was extensive.,0,0,0,Becca D.,"New York, NY",26,73,9
5.0,12/20/2018,"I can't believe that I missed this gem for the past year even though I live quite close by! It has a beautiful layout. U shaped bar surrounded by sit down tables. For happy hour 5-7 pm, you can order oysters for $1.50 each and spritzers and wines for $9 and below. We ordered 2 dozen oysters and they were deliciously fresh! Went really well with the white house wine.For main, my dad ordered the risotto and I ordered the spaghetti. I love ordering spaghetti at Italian restaurants as I find it the purest Italian dish to judge how well the food is prepared. It was scrumptious; had that bouncy quality that only homemade spaghetti can have. The risotto was rich and delicious too- came with butternut squash and sausage mixed within the creamy sauce.For dessert, we split the tiramisu (as we always do when eating Italian.) So gooood!  I will be back for sure",0,0,0,Christine X.,"Manhattan, NY",385,110,51
4.0,12/10/2018,Great place for a quiet drink in the middle of the day. I've been to their other locations downtown for food but I've only come here for midday drinks. It's a nice quiet spot to have a glass of wine solo or with a friend.,1,0,0,Ryna D.,"New York, NY",227,1549,2438
5.0,11/22/2018,"Quaint spot in Upper West Side. We went here for a quick brunch on Thanksgiving day (and hence got a place to sit immediately). The ambiance, service and most importantly food is amazing. Their Uova E Salmone and French Toast are delicious and are a must have.",0,0,0,Amit R.,"Chicago, IL",421,15,15
5.0,10/19/2018,What a gem! We stopped for lunch after walking in Central Park and it was fantastic. The lentil soup was to die for! And Rita was so sweet. Bravo!,0,0,0,Nathalie K.,"Silver Spring, MD",0,11,0
5.0,10/7/2018,"Delicious and atmospheric yet casual. Really great wine Brunello di something. And amazing, simple spaghetti. Lovely.",0,0,0,Deborah M.,"Brooklyn, NY",1,29,0
4.0,10/2/2018,"We came here for lunch after visiting the Natural History Museum. There are tables outside and inside plus at the bar. We picked a table inside.The server was friendly and knowledgeable, but he was the only one working the floor so it took a while for him to get back around to the table. The different wines we had were good quality. The food we had was great. The tomato/pea soup was creamy and thick, definitely filling enough with some bread for dipping. The meat/cheese plate options are great quality. And the spaghetti was as it should be.We also had dessert. The tiramisu was the classic recipe and was up to standard. The berry sorbet was delicious, would definitely recommend this one!All in all we had a great experience here and would definitely recommend this place!",0,0,0,Ilse V.,"Murrieta, CA",96,259,496
5.0,8/19/2018,Great breakfast and service. Incredibly friendly and fast services. We had a quick brunch there and it was very tasty. Excellent egg dishes and drinks. The staff was fantastic. We will be back!,0,0,0,Patrick M.,"San Juan, Puerto Rico",0,9,0
2.0,6/30/2018,"My girlfriend and I stopped by on a nice Friday summer evening and sat outside.  From the beginning, it was obvious that the waitstaff was aloof and seemingly untrained.  Our actual waitress didn't seem to care about our existence.  When our plates came, we both were surprised by the tiny portion sizes.  My girlfriend had the Octopus Gnocchi.  At $24, she expected more than a tiny plate of pasta.  I had the scallops which was worse - for $32 I was served four small scallops and five short stems of asparagus.  To be fair, everything was delicious.Tarallucci needs to train their staff better to warrant their high prices and small portion sizes.  At the end of our meal, our waitress brought us the dessert menus.  She then brought us the check without asking if we wanted dessert.We promptly settled our bill and picked up a sushi roll down the street since we both were still hungry.I will not be back to Tarallucci.",0,0,0,Jamie K.,"New York, NY",0,25,0
4.0,6/15/2018,"I had the chance to try this popular restaurants location in the Upper West Side on a breezy Thursday morning. I've been to their spot in NoMad for dinner, so I was curious to see what they'd be cooking up on their breakfast menu. Needless to say, it was just as good as my dinner experience! It definitely should be an option for anyone looking for a quaint & relaxing breakfast experience in the neighborhood.We arrived to the restaurant around 10 AM on a Thursday morning. We hadn't made a reservation, but it didn't seem like we needed to. There were a lot of table options both inside and outside at this time and they allowed us to pick where we wanted to sit.The space itself is really great! They have tables outside in a sectioned off area on their front sidewalk, as well as indoor seating. On this particularly nice day they had opened the windows which allowed a cool breeze to flow throughout the space. So nice!When it came time to order I went with the Ouva Al Tartufo ($15). Think of is as a well dressed breakfast sandwich with the addition of Truffle Aioli. So freaking good. I came in hungry and this definitely hit the spot. It also comes with a side of home fries, which honestly are just potato bits...The service here was great! The staff was attentive and gave us ample time to look over the menu. They were quick to fill our water glasses and happy to answer any questions we had about the menu.This restaurant is a great option for a low key breakfast in the UWS. Quick and good service, along with a variety of traditional options will undoubtedly leave you satisfied after dining here.",0,0,0,Nicholas C.,"Upper West Side, Manhattan, NY",240,247,698
5.0,5/23/2018,"Great food. Even better service! Big thank you to my server, bartender and wonderful server assistant, Freddy. Made my night perfect. Just a wonderful atmosphere. Will always come back.",0,0,0,Ryan B.,"New York, NY",0,1,0
5.0,4/21/2018,"My bf and I were in the UWS looking for apartments, and decided that I wouldn't make it back to the east village alive without eating something first. This place looked good (read: had pasta) so we popped in for impromptu dinner and wine I a Wednesday evening. We were seated immediately by the window where I proceeded to spy on all the dogs walking by. I ordered the spaghetti and Pinot Grigio and the bear had the duck ragu dish and a Cabernet while sharing the broccolini side dish. The portions were perfect, the spaghetti was delicious in the way where the tomato sauce was not even remotely acidic but perfectly balanced between sweet and tangy. My bf didn't speak at all during the meal which I took to mean he enjoyed himself immensely. The broccolini was lightly and simply cooked so that it was crunchy and a great foil to the rich pasta. Between the food and the delicious wine, we were totally blissed out and wanted to move to the neighbourhood just to be closer to this spot. The environment was relaxed, cute and natural. A bit small so I could see there being a wait during busy hours.",0,0,0,Emily R.,"Manhattan, NY",8,60,108
5.0,3/30/2018,"Super cute, convenient. Just wanted aGlass of wine before heading tot the museumOn a Sunday. Saw it on yelp, it's close by so headed over. Sat at the bar, quick service, the wine menu is great, had a glass of algianico (earthy but mild) was delicious. After my museum trip we need a caffeine kick so came over for some americanos, delicious coffee too. Would recommend",1,0,0,MK M.,"Jackson Heights, NY",285,367,119
5.0,2/4/2018,Tarallucci has always been a favourite of ours -!I love coming here with my family and am here way too often. The food is fabulous and service never fails. Matias especially was so willing to help and was there whenever we needed him. Five stars all around!!,0,0,1,Isabel A.,"Manhattan, New York, NY",149,1,0
2.0,11/12/2017,The service here is bad if you eat in. It seems like staff are very frustrated or disinterested or both and they don't make any effort to hide it. Makes for a bad vibe. We go out to eat on weekends for breakfast and was hoping this could be one of our regular spots since the pastries are good. But the experience was frustrating and not worth the time or money. I could recommend it for quick takeout orders of pastries though since you don't have to be there for the bad vibe.,1,0,0,Rose B.,"New York, NY",4,34,12
5.0,11/5/2017,"I went to this restaurant with my two daughters, and they loved it! It is small, but has nice outdoor seating. The pastas are amazing and if you are going there, would definitely recommend. Has a nice atmosphere with friendly servers. If you enjoy Italian food and are in the area, this is the restaurant to go!",0,0,0,Josh S.,"Manhattan, NY",1,18,0
5.0,10/12/2017,"This place is the definitely the BEST in the Upper West! They've got very good coffee, pastries are incredibly delicious so is the food and the atmosphere is welcoming!",0,0,0,Lina C.,"New York, NY",0,5,0
5.0,9/14/2017,"Great place for a light bite and coffee/wine.    Nice vibe and excellent outdoor sorting on the avenue (weather permitting of course)I had the eggs and polenta with ham while stopping by for breakfast - which was superbService was top notch from Anna and WilliamNext time I am in town, will stop by again !!",0,0,0,Steve L.,"New York, NY",7,52,7
5.0,8/19/2017,"I have always admired the outdoor seating at this restaurant and decided to finally pay a visit. This morning, I ordered the poached eggs with asparagus and potatoes and it was delicious! The waiter was also exceptionally kind and helpful. Looking forward to returning.",0,0,0,Laura G.,"Manhattan, NY",0,102,18
5.0,7/12/2017,"I have been going to Tarallucchi since it first opened on 18th street 16 years ago. It now covers a lot of ground in the city (literally) with 5 restaurants . On my way to an event at the Naumburg Bandshell last night was an excellent opportunity to stop at the UWS location for salumi e formaggi, which was amazing as usual. The outdoor seating here is more plentiful and better, but my regular haunt on 18th street has a far more inviting dining room. The menus are identical as far as can tell, except the additional lunch and dinner prefix at the Union Square location. The waiters at both places are super knowledgeable about the food and the wine list, which of course is 100% Italian and worth exploring. Our waiter was really nice and got us several wine samples. I settled for Pallagrello Bianco '13 which I wouldn't necessarily have picked out myself, clean and minerally with a touch of fruit.",0,0,0,Hege M.,"Manhattan, NY",3,127,307
5.0,6/18/2017,"This is my favorite breakfast/brunch place in NYC. I love it. Delicate pastries, wonderful coffee, and pretty much everything on the menu is fantastic. And we love sitting outside on the patio. Lovely, lovely place.",0,0,0,Chris B.,"Germantown, Memphis, TN",2,11,0
5.0,6/14/2017,"Just stopped by the cozy spot recently for some oysters and a drink. The oysters were good but I wish they served it with more various sauces. The condiment served with the oyster seemed to be some sort of shallot vinegar. Since the oysters were already served with lemon, I personally thought there could be more body than acid added to the dish. But overall, it was a pleasant experience and will head back to check out their other stuff.",0,0,0,Joon R.,"Wayne, NJ",307,14,23
2.0,5/5/2017,I didnt like the service. Seems like they rushed us to eat because somebody is waiting for a table.,0,0,0,Amanda O.,"Manhattan, New York, NY",0,1,0
2.0,4/29/2017,"My omelette was rubbery. I asked for ketchup but they didn't have any. I understand wanting to be more sophisticated than a burger joint with bottles out, but at least give me some in a little cup to save my rubbery omelette. Not planning to come back any time soon.",0,0,0,Lauren C.,"Port Chester, NY",0,30,3
5.0,2/2/2017,"The service in this excellent cafe is impeccable, the food is delicious, and the cappuccinos are the best in NY.  Sara stands out as a superb waitress: she is attentive to details, remembers the usual choices of the regulars, and scans the room when the cafe is busy, in order to meet her customers' needs.  All of the staff are to be commended.Nancy, Ph.D.",1,0,0,Nancy l.,"Manhattan, NY",0,3,0
5.0,1/19/2017,"European style cafe/restaurant in good taste, with a good wine selection. Authentic Italian dishes served by a friendly staff.  A sufficiently broad menu with good choices in an attractive space for breakfast, lunch or dinner. They make it into more of a wine bar/lively restaurant in the evening. Good vibe. The Barista Rita is charming and makes a superb cappuccino!  A good value and nothing quite like it the UWS.",0,0,0,H M.,"Manhattan, New York, NY",0,1,0
5.0,12/7/2016,"We had just finished wandering around the American Museum of Natural History and decided to look around the neighborhood for a quick bite to eat.  So we walked two blocks up and came across this diamond.  It so happened to be the perfect food for our last meal in New York.  It is on the corner with floor to ceiling windows making it nice light and open inside even though the size is a little quaint.  The hostess was very friendly and accommodating.  We choose to sit at the bar because all the tables where full and we had time restraints with our departing flights closely approaching.  The barista waited on us and were very attentive.  We had the gnocchi and the meatballs that were on the menu at that time, it appears that the menu has changed since then so I am not sure what the items were called on the menu.  We had a Bellini and mimosa as our appetizer, a lovely glass of red with our meal and an excellent cappuccino to accompany our Italian cookies.  It was a very delightful experience.  If I lived here I would come here often and it is nice to see that they change up the menu for the seasons. Overall the service was excellent the food delivery was prompt the pricing did not break the bank.",0,0,0,Heather R.,"Austin, TX",30,38,88
4.0,11/5/2016,Excellent authentic Italian food and very nice place overall. I live nearby and this is our to-go spot for breakfast and brunch. Espresso and cappuccino just like in Italy. And very good Aperol Spritz too.,1,0,0,Davide P.,"Manhattan, NY",26,4,0
3.0,10/23/2016,"Came here and had a fine experience.  The place was pretty empty (outside, inside and bar combined).  After sitting at a table for several minutes with no service, we moved up to the bar.  The wines we ordered (rose, sauvignon blanc) were fine.  However, the service was aloof at best.  I had been wanting to try this place for a while - it's so cute!  But I will not be coming back unless a friend specifically asks me to.",2,1,1,Dione D.,"Atlanta, GA",104,606,455
4.0,10/2/2016,"Wandering up Columbus Avenue looking for dinner, we stumbled upon this amongst a block of dining choices. What a great choice! The place was pretty full but we were given good attention from our waiter. We had the insalata, gnocchi w pesto, capesante, with a side of asparagus. The best gnocchi I've had in a very long time!!! Great service. Can't wait to return!",0,0,0,Suzee Q.,"Baltimore, MD",7,1188,691
3.0,9/5/2016,The almond croissant was awesome! But weren't enough for all three of us (only two left and we were there just shortly after noon). The service was great though and I really liked the layout of the place.,0,0,0,Rick And Jemmy B.,"Vancouver, Canada",3,15,19
1.0,8/22/2016,"we will never know...not very busy Saturday night at about 930 ;.four of us walk by and decide that this seems to be a nice place for some pasta and  wine...wonderful hostess sets up table for us outside on a beautiful summer night and we think, hey , maybe we found a gem...waitress hands us menus and wine list...mumbles about a ravoioli/gnoochi special ( i'm not sure); I ask if there is a house wine...there isn't; a low end montepuciano for $54 and a lower end italian chardonnay for $64... gripes...i say, give us a few minutes.....the four of us decide on apps, pastas and wine....the waitress never returns....she was busy in conversation at the bar....no bread , no water refill...no chance to even order...I say why brother...we get up and leave...they couldn't care less.....so why should we...there are plenty of places within a 2 minute walk from here....we went up the street to bellini had a great meal and a fine time....",3,0,0,Jay R.,"New York, NY",1,1,0
3.0,8/9/2016,"Okay food. Not a lot of vegetarian options. Spaghetti was fine, dessert was really good though!!",0,0,0,Anna J.,"Apex, NC",15,13,2
3.0,7/11/2016,"This is one of the most pleasant places to lollygag on the Upper West Side. As the years go by, the constancy of the local team becomes a comfort. Local or not, the restaurant's casual, yet modern, bistro design is a delight. The atmosphere here is almost always bright and festive. While the food has come a long way, it still has a way to go. The caprese and burrata salad was excellent. The bread selection was good, but a little hard (with no butter). Our waiter was friendly and efficient. His rolling Italianesque accent made canned tuna with mayo, surrounded by pork cold cuts, sound like a good choice. Salads, charcuterie and cheese continue to be your best bets here.",1,0,0,Anna L.,"New York, NY",113,238,702
3.0,6/6/2016,"This was a nice spot and the wine list was fantastic. Service was a little slow and although the pasta was cooked to perfection, it was a little salty. Overall a nice place but nothing to write home about.",0,0,0,Krysty W.,"Manhattan, NY",0,3,0
4.0,4/29/2016,"Lovely place to stop by on a blustery, cold morning!  Although M and I didn't take advantage of its brunch offerings, the waitstaff were super gracious. We sat at the bar, drank hot coffee and sampled a biscotti and a cookie from their many carby offerings.I'd love to come by and eat some time.  Lovely, cozy, bright place!",0,0,0,Jun K.,"Alameda, CA",526,518,28
3.0,4/16/2016,"Ok so we had other plans we wanted to originally go to Jacobs Pickles a whole other bag of tricks.  Well it was nuts a line out the door.  So we wandered from place to place.  We were starving so we chose this place.  We couldn't even read the menu and didn't check the Yelp.  Well it ended up being really nice! We got a nice window seat, a great bottle of wine and great food! My hubs got the  gnocchi with pesto and I got the spaghetti. It  was the perfect amount.  It was fresh  and delicious.  Great desserts too!  I had a romantic meal with my babe.  Try it out for yourself!!",0,0,0,Bubbs M.,"Paramus, NJ",110,50,69
1.0,3/31/2016,"Went here for lunch today with a coworker who ordered the spaghetti and I had the lasagna.  Food was alright but service was lacking.  Portions were pretty small for a $17 bowl of spaghetti and $18 lasagna.  The food took awhile (presumably because the lasagna is baked), but they never brought us bread.  Another table which appeared to be an Italian family with kids were brought bread and oil.  My coworker found a thin piece of metal, possibly from one of those pot scrubbers, and instead of asking her what she wanted done about it, they whisked away the dish and remade it.  Nothing taken off the bill.  Just a short apology.  Won't be back.",1,0,0,Ada K.,"New York, NY",4,29,1
3.0,3/15/2016,Nice environment. Would say it's good for a date night. Just had drinks with a friend which I thought was a bit expensive. 13$ for a glass of red wine. Didn't try the food. Bartender was nice enough to give me a sample but wouldn't say she was particularly friendly.,0,0,0,Grace W.,"Cornelius, NC",0,49,0
1.0,2/22/2016,"I had a really rude waitress when I had breakfast there. She ignored me most of the time and only paid me attention when the busboy told her to. She shoved the croissant on the edge of the table without even looking at me, and then didn't bother to bring a plate or knife or anything (I had to ask the busboy for everything). I was really surprised by the whole experience. The only reason I left a tip was in the hope that the busboy got most of it. I suggest you train and monitor your wait staff - and you might have a more appealing and welcoming place for your customers. Until then, I've no reason to return. I can't remember feeling so unwelcome in a restaurant - ever.",2,0,0,Louise K.,"Manhattan, NY",0,1,0
2.0,1/31/2016,"After four visits, today's experience inspired a review. Two breakfasts, one dinner and one lunch have left me questioning. There's an attempt here to be cafe, bistro and wine bar; none of them are working, leaving an ambivalent feeling about the ambiance. Morning service has been friendly, but on the other occasions, dismissive or disinterested comes to mind.Today, I ordered a pasta and waited about 25 minutes before interrupting the staff meeting taking place next to me at the bar. Not a real meeting, just servers and a possible manager having private conversation, seemingly unaware of my presence. When I finally asked about my order (no one asked me) the server asked the manager how long Gnocchi takes, he looked at me and said 10 minutes. When I said I had been there 25, he just turned and went back to his conversation with the other server.My order was never put in, my server had disappeared and the one left startedto put my order in, when I said 'No, thanks.' and walked out. She did tryto apologize as I grabbed my coat. Manager, nothing.Two stars because the food is good.",3,1,1,The Feisty Bulldog I.,"Manhattan, NY",11,76,75
5.0,1/9/2016,Nice bistro cafe on The upper west side. Perfect place for brunch. The food is on point.,0,0,0,Joe M.,"Manhattan, NY",20,34,4
