rating,time_created,text,useful,funny,cool,username,user_loc,user_friends,user_reviews,user_photos
4.0,7/11/2017,"The place has great lighting and atmosphere.  My wife and I had a relaxing evening together here.  I'm a fan.  The only thing was, I wish there was a wider selection of salads and appetizers.",0,0,1,Stephen G.,"Fountain Valley, CA",4,105,14
1.0,6/10/2017,"Worst service I have ever experienced in NYC. Lost my reservation, couldn't order of the menu they assured me on the phone. Put us by the kitchen with a bunch of screaming teenagers. Waited 30 minutes to order before walking out. Never again",0,1,0,Leanne B.,"New York, NY",4,8,0
5.0,5/28/2017,"Amazing food, great ambience. Fast and good service. Not sure why Yelp has 3 stars. Have been dining at many Italian restaurants in New York from $$$$$ to $ and this one is memorable. Food is very good. Highly recommend.",1,0,0,Inna S.,"Midtown West, Manhattan, NY",9,9,2
2.0,5/22/2017,"Oh man, I really don't know if I have anything good to say about my experience here. Not only was service terribly slow (even for a time where there were at max 10 tables in such a huge space), but the food did not satisfy at all.You get complimentary poppy seed muffins to start out. Not fresh, kinda old. Comes with those orange marmalade in plastic containers. Looks like something you'd buy from a discounted grocery store, to be harsh. These muffins took a while to come, and so did the water. After it took about 15/20 minutes of getting seated for us to get water, they were a bit more diligent about refilling our glasses.The calamari was probably the best part of the meal. It comes with fried zucchini noodles, but the zucchini is sliced soooo thin, it crumbles because it's fried and doesn't really taste like anything. The marinara sauce is watery also. I went for Sunday brunch and a lot of the menu comes with fries. And I love fries, so I got excited for that. Unfortunately, the fries tasted like they had been fried early in the morning and simply got reheated in the microwave prior to serving. They were very hot to taste, but pretty soggy.The panini I ordered came with eggplant, tomatoes, pesto, and some other vegetables I believe. The vegetables were sooo greasy, and the pesto barely had any flavor in it. Almost no garlic, I really felt like I was eating a sandwich with an insane amount of grease in it. Because of this, the bread also came out extremely soggy. The bread also tasted a bit stale, not toasted. It's quite sad because the interior is beautiful and there is also outdoor seating. I think most people who come to dine there do so because of the aesthetics, not for the quality of the actual food.",5,2,1,Hannah C.,"New York, NY",661,433,1108
5.0,4/15/2017,Was there yesterday with an out of town friend. I had the salmon with green beans and my friend had the branzino with spinach.Both dishes were cooked to perfection. A superb meal.The wait service was warm and professional.Highly recommend and will definitely put this on my list as a place to plan a repeat visit.,1,0,1,Sharon K.,"Hicksville, NY",0,55,3
1.0,4/8/2017,"We came to this restaurant for glasses of wine for happy hour and found it to be overpriced. When we received the bill, the barman stated that this was not included in happy hour. We were very disappointed. At the price We paid, I will not go back again. If you go there for happy hour, you need to assume that nothing is included in happy hour. This should have been explained by server prior to him serving us",2,0,0,Michael C.,"Manhattan, New York, NY",0,1,0
2.0,3/24/2017,Food is comparatively expensive but not that good. Linguini was not fresh. Service bad. We were three some on a Friday night. Gave handsome tips but on the way out our servant passed by not even bothered to say thank you. Super noisy. Will never go again.,0,0,0,Spencer L.,"曼哈頓, New York, NY",0,3,0
1.0,2/5/2017,"This was one of the worst restaurant experiences I've ever had in my life. I went to the Chelsea Bocca di Bacco with a friend from out of town that I studied abroad with in Italy.One of the main reasons I picked this restaurant was because it has lots of Sicilian dishes on the menu featured on their website. We had 8:30 reservations and checked in promptly with the hostess. She led us to a table that wasn't yet set and she said someone would set it shortly. As we were taking off our jackets, a nearby waiter HURLED a menu at us as if he was playing a violent game of frisbee. The hostess looked mortified and apologized and brought us to another table, we could hear here complaining to the manager about what happened.As we sit down there are paper menus on the table with completely different options that they had on their menu online. The paper menu featured about 4 pasta dishes which neither of us wanted and completely different options than the regular menu. I assumed it was a specials menu and asked our waiter for a real menu... he said it's only one per table... what...? We get our hands on a regular menu and the waiter says no no no you can't order from there, only the paper menu. So I flat out asked him ""what is this menu?"" ""Is this some sort of special menu?"" He rolls his eyes at me and says ""what do you mean this is out menu and gives me a look like I had just killed his first born. I haven't been given a look like that or made to feel that stupid since middle school with mean girls. I told him this is not the menu I saw and there's no way this is their normal menu with 4 things on it... he grabbed the paper menus from us and I said we were going to leave. So we left...On our way out I called the hostess who had witnessed her staff flinging menus at us and she explained there was something wrong in the kitchen and it absolutely wasn't their normal menu at all... She was very gracious and very apologetic, I explained how rude our waiter was and how he rolled his eyes at me and how dumb he made me feel for being confused. The waiter should have told us from the beginning something was wrong in the kitchen and yes this is absolutely a special menu. We ended up leaving and had a great Italian meal elsewhere, no menus were thrown and no waiter rolled his eyes at me.  But shoutout to the wonderful hostess.",3,2,0,Alexandra M.,"Manhattan, NY",184,100,61
2.0,1/28/2017,"The evening's special was bronzino at $35 so I thought I was getting a deal to order it from the Restaurant Week menu at $42 which included appetizer and desert.  I was served a half-cooked filet with a cold vegetable salad that was thoroughly unappetizing.  When I complained I was brought the special, nicely done with spinach and potatoes.  I don't understand why they go out of their way to serve crappy dishes for Restaurant Week.  What good does it do them?",2,0,1,Frank C.,"Manhattan, NY",1,17,0
5.0,1/23/2017,"This place had such delicious Italian food and the Hispanic man who served our entrées was the friendliest! Gave me extra cheese on my pasta when I mentioned how much I loved cheese! However, the waiter who attended our table was not the most friendly. But the food and Moscato wine was impeccable!! Definitely recommend the roasted rosemary chicken and the mushroom sausage cavatelli!",0,0,0,Melissa L.,"Davis, CA",18,17,6
1.0,1/21/2017,"My girlfriend and I came for dinner tonight, service is okay. Food.... mediocre at best. Had blah calamari with bland marinara..pretty sure shop rite sauce is more flavorful. Ordered the special of the night, a filet with bacon.....came overcooked and no bacon, and tasted like a pot roast from waffle house. My girlfriend ordered the chicken milanese with arugala and cherry tomatoes...hardly any arugala and no cherry tomatoes.",1,1,1,Ethan S.,"Brewster, NY",87,3,1
5.0,1/8/2017,"Nothing but good things to say about this place. Though we initially didn't have reservations, the staff was quick in accommodating us as if we were regulars.The drink selection was amazing and the food was delicious. The ambiance was great and it wasn't crowded or loud. I particularly enjoyed the music selection of the place. Definitely set the mood. Also, the staff was quick with getting our orders and making sure our drinks were always full. I'm looking forward to coming here again soon.",6,3,4,Allen C.,"Miramar, FL",382,154,277
5.0,1/8/2017,"A neighborhood gem! I've been to the two other Bocca Di Bacco locations, but I love the decor and ambiance of this one. Best place for Oysters and a refreshing raw bar with shrimp cocktail and crab. The crab cakes are the best I've ever had, and the Garganelli All' Ossobuco is one of my favorite pasta dishes on the menu!",0,0,0,Kristin M.,"Manhattan, New York, NY",0,5,1
3.0,12/24/2016,"Food was okay,service was off. Waiter never mentioned the specials,was not very attentive,felt like he was just starting out.Place wasn't that busy so there is no excuse for that type of service.",0,0,0,Richard G.,"Brooklyn, NY",0,23,0
2.0,12/5/2016,"Came here for dinner with friends recently and was unimpressed. Not only did it take over HALF AN HOUR to get our food, but the prices were fairly high despite mediocre food. Fried calamari was too much batter, seafood linguine was almost all pasta, lasagna was average, chicken with masted potatoes was average, and roasted brussel sprouts came out COLD. I will not be coming back here, even if ambiance is nice.",2,1,0,Lucy C.,"New York, NY",131,1173,43
4.0,10/10/2016,"Was brought here for a client dinner (I was the client-so this was out of my hands on restaurant choice.) Pleasantly surprised! 7pm on a Saturday our party of 12 was seated in a quiet corner and enjoyed apps, entrees and desserts for a leisurely 2ish hours. My pork chop was the same size as my head- but was pleasantly good! Side of broccoli was grilled nicely. Fellow co-workers had the fish special, shrimp on Cesar salad and tortellini which all got rave reviews. The table shared a few bottles of Malbec and a variety of yummy desserts. Wait staff was very friendly and super patient with such a large group.",1,0,0,Alyssa G.,"Sandwich, MA",652,214,14
4.0,10/10/2016,"Very nice place & well worth checking out. We went to the restaurant last Saturday with a party of 12 people & they were very hospitable and put us in a quiet corner. I had a couple of glasses of a reserve Cab that was delicious & because we had just had Italian the night before I had a Mista salad that was perfect & the Rosemary chicken, with Mashed potatoes, broccoli was flavorful and cooked perfectly. I would go back in a second. Loved it.",0,0,0,William G.,"Sandwich, MA",29,269,38
4.0,10/6/2016,"Delicious food, great ambiance and drinks! Service was okay, could be better. Would definitely come back!",0,0,0,Olga Y.,"Secaucus, NJ",188,9,3
4.0,10/4/2016,"This place is SO close to being great. What it really comes down to here is the service. I felt like I had 5 people waiting on me while nothing was getting done. The lunch/dinner options on the menu are great from what I've had, although I have frequented this spot for many brunches per their $20 bottle of champagne deal and always been underwhelmed with the execution. Especially with their fruit salad and pancakes, would not recommend either. Go for eggs Benedict or the egg white omelette and frittata. I think that to really get all this place has to offer it would be best to sit at the bar. 3.5/5Wouldn't steer anyone away.",1,0,0,Tanner B.,"New York, NY",1,40,1
4.0,9/28/2016,"Dinner for 2 on a Tuesday night. Restaurant was fairly empty for a 9pm dinner but plenty of staff. Service was friendly, quick and attentive. We started with the meatballs and octopus. Octopus was well cooked but the meatballs were more on the dry side. We were both pretty full from the appetizers but ordered the cavatelli and the taglierini neri. Cavatelli was delicious with great flavors from the sausage and mushrooms. I felt the prices were fair.",0,0,0,J K.,"Manhattan, NY",0,77,0
3.0,9/8/2016,There is a lot to like about this place. Service was very friendly though not terribly efficient. And it is LOUD. We were a party of 4. We ordered 2 Caesar salads to start. Delicious but skimpy for $12 each.  The Penne with Gorgonzola was great. The fettuccine with ragu was also good. The special pasta with seafood for $33 was not so great. No one came by to see if we wanted more water or drinks. Pleasant but not a home run.,2,0,1,Finola K.,"Brooklyn, NY",9,124,45
5.0,8/18/2016,First time at this location. As always the food was delicious. The waiter and chef even accommodated preparing off the menu.,0,0,0,Pete P.,"Manhattan, NY",35,15,5
1.0,8/8/2016,"This restaurant is in my neighborhood.  I have been multiple times over the past few years.  Net-net, the food and setting were decent.  Notice that I used the past tense.  On my last dining experience, the service was pretty abysmal, and the food was off.However, this is not why I am writing this review.  The day after dining at Bocca di Bacco, I was on-line reviewing my credit card charges, and my dinner charge was over $70 more than my total with tip!  In all honesty, I do not review my credit card bills on a regular basis, so it was pure luck that I caught the error.  I was absolutely appalled.  The following day, I went into the restaurant to speak with the manager.  He reluctantly spoke with me.  At first he seemed hesitant to believe that there was an error, but after some time digging around in a back room, he ascertained that I was indeed correct.  Thank God, I saved my credit card receipt.  So now, I have been overcharged after a marginal dining experience.  I then had to spend time reporting the error to my credit card company and ultimately had to go down to restaurant on a summer Sunday afternoon to address their mistake.  I had now spent an inordinate of time dealing with this issue, and I was pretty angry about the whole situation. The server supposedly mixed up the charge amount with another customer when entering the totals into the system.  Ultimately, the manager's response to me was, ""Mistakes happen,"" with a shrug of the shoulders.  He then said that he would fix it.  Gee.....thanks. I won't be back.The lesson learned here people is watch your credit card bills.  If I had not reviewed my credit card statement, they would have gotten away with it.  From reading reviews below, it appears this restaurant might have issues related to credit cards.  For shame Bocca di Bacco,  for shame....You've Been Warned!",0,1,0,Tim S.,"New York, NY",3,100,0
4.0,8/5/2016,"Was here Wednesday night with my boyfriend. It's a gorgeous looking restaurant, had the lamb chops which were divine. The meatballs to start, the flavour was great. My boyfriend had the steak, it was good, not great. Had a signature mojito to to drink. It was okay. Service was pretty okay. Would go back again to try some more dishes.",0,0,0,Ailíse S.,"Manhattan, NY",0,11,0
5.0,8/3/2016,"It's restaurant  week so my client chose to come to this Restaurant  for  lunch. Well it turned out to be  a very good  choice. We were given the Restaurant Week menu and the regular lunch pre fixe  menu, we opted for the lunch pre fixe because of its large selection. Restaurant Week Menu looked weak.We had grilled octopus and Calimari  for starters and then for main I had the  the Branzino and my fried had the burger. Portions was good and not small.I must add that we enjoyed the music that was being played over the speakers, it was from the 60s and 70s songs and was just right for lunch time.Servers were very warm and friendly and thier recommendation was on target.Highly recommended!",0,0,0,Ray R.,"New York, NY",44,83,0
1.0,7/29/2016,"This is one of the worst meals I have had in New York. The food is terrible. The pasta tasted like It had been made last week and was microwaved upon our order. Pasta is my absolute favorite food and I never knew it could be inedible until I ate here. Had a beet salad and a crostini appetizer that were equally as bland, disappointing and unappetizing. Save yourself the money and go to literally any other Italian restaurant in the city. In a word: garbage.",0,0,0,Alice T.,"Manhattan, NY",0,7,0
4.0,6/25/2016,"Just a short review...walked by the place, so we thought...our legs are tired of walking and it was getting late. Best decision! Six different entrees, six winners. Decor was great, service was great...food was great! Next time I'm in town, I'm hitting this joint!",1,0,0,Ron A.,"Boca Raton, FL",25,161,861
4.0,6/25/2016,"Beautiful little Italian restaurant on the corner. We came in celebrating our best friends birthday and the decor and atmosphere of the place is beautiful. Low lighting, romantic but modern at the same time. Plenty of wine to choose from, and the food was delicious. The prosciutto was mouth watering. I ordered the fresh tortellini with asparagus in a butter sage sauce and I have been thinking about that entree for months now! It was the freshest, brightest most delicious tortellini I have ever encountered. Normally it's a dish I would pass up when seeing on a menu- thankfully I didn't. I can't wait to return here or one of their other locations. I just can't not share the deliciousness that is the tortellini with others.",5,4,5,Jessica N.,"Long Island City, NY",222,410,343
3.0,6/8/2016,"It was decent. We came for lunch during the week and the place was pretty empty. It was a beautiful day in Chelsea and they had the windows open so it was quite nice. They had a lunch special for $20 that included an appetizer + entree, although many of the items had an additional $2-5 cost. The appetizers were all good, I had the Caesar salad which had a nice anchovy flavor to it (beware if that's not your thing). I had the lamb ragu for my entree and it was alright, not fantastic. Some others orders the gnocchi and they really liked it. The chicken wrapped around the salad was pretty cool. Overall an ok place for lunch if you want to do a sit down lunch on a nice day in a good environment and are willing to spend $30 or so per person. Good way to get away from the craziness at Chelsea Market if you are set on eating in Chelsea.",0,0,0,Dave M.,"Brooklyn, NY",1,61,0
5.0,6/7/2016,Came here with a date this past weekend for dinner. We had the Fried Calamad and Fresh Mutz with sliced tomato and prosciutto. Excellent apps. Main courses were the Sautéed grouper with shrimp and vegetables. I had the parpadille pasta with a wild mushroom sauce with grilled steak over it all. Excellent. Glasses of wine as well. Decor inside is excellent. Plenty of space inside. Highly recommend checking these guys out if in the area.,0,0,0,Mike T.,"Carlstadt, NJ",5,165,324
3.0,5/21/2016,"By the previous reviews I think people just need to come for dinner (but who knows). I enjoyed my time here, the waiter was very attentive and we even had the owner/manager come over to our table and ask how everything was. He got really down-to-earth and even helped to serve us. We had the Quaglia E Polenta and, although I don't like polenta, loved everything else. My boyfriend ordered the Taglierini Neri Con Grancho (ordered it because we thought it would be a cool thing to try the squid ink pasta name and all). We both thought it was pretty good, a bit on the salty side but not a big problem with the amount of bread we got. I got the Costoletta D'Agnello which is probably on of the best things, very juicy and tender. The Profiteroles are probably the BEST things I have ever had in my entire life. Get that if not anything else. Okay so, good points:Ambiance is really nice, kind of fancy (eh) but you could get away with a button-down. Great location, great staff but something just wasn't AMAZING for a five-star review but I am definitely a fan.",0,0,0,Shelby C.,"Manhattan, NY",235,10,17
4.0,5/15/2016,Love to grab a quick meal at the bar at this local place.  Despite quite high turnover behind the bar the service is uniformly accommodating.   Favorites include the grilled octopus and lamb pasta. Doors / Windows opening onto 9th Avenue is a nice touch.,0,0,0,Sam C.,"New York, NY",30,27,3
3.0,4/17/2016,"Our waiter was the type of Italian who had slick-backed hair, spent extra time doting on the women in our party and occasionally added an extra vowel to the end of words. He had the chiseled chin of someone moonlighting in a Hell's Kitchen restaurant while waiting for an acting career to take off. He took us through Bocca Di Bacco's specials, including a seafood pasta that would up being by entree. We did make our way through some appetizers and a bit of wine during the meal as well. I appreciated the restaurant letting us sit minus one member of our party, as it was Thursday evening and there was plenty of people in the restaurant. For the restaurant, this led to us more ordering for food, for us it meant with didn't have spend 10 minutes outside in the rain.The food was solid, dependable Italian fare. The flavors were a bit dull, there was a bit too little seasoning on my pasta, and it lacked the lightness that comes from the city's best pasta joints. In a neighborhood that frequently emphasizes decor over cuisine, flash over substance, it was a step above the norm, but still just average.",0,0,0,Jon S.,"Brooklyn, NY",128,647,1
1.0,4/7/2016,"We had brunch here last Sunday. DO NOT order the eggs benedict!! These are the worst eggs benedict I have ever had in NYC. Not one single aspect of the 5 things that went into this dish were any good. The English muffins were not cripsy, the potato hash was just horrible and cold, the salad was wilted and soggy, the Hollandaise was just awful (the wrong color, the wrong amount, the wrong flavor - if I closed my eyes there is no way I would know that this is Hollandaise), and finally..... the poached eggs themselves: HARD boiled!!! DO NOT eat Sunday brunch here!",1,0,0,J Z.,"New York, NY",0,9,0
2.0,3/15/2016,"We stopped by on a Saturday night. The kitchen was already closed, so we decided to have a drink because we loved the atmosphere at the establishment. There were 4-5 tables still dining. I cant say anything about their food but the service was horrible: our waiter was rude and showed us an attitude, i guess because we came late. The look at his face and the tone of his voice spoke for himself. Before we even finished our drinks, they put check on our table and started cleaning the restaurant  (while other people were still finishing their food and drinks). I think that was very rude and unprofessional.",1,1,0,Marina L.,"Brooklyn, NY",8,33,13
1.0,11/18/2015,"The food was amazing......The bartender ""Antonio"" provided some of the best service that I have ever had......The staff was courteous.....The only thing that makes this a NO is the atmosphere and general unfriendly demeanor by its horrible and unprofessional manager who's name is, ""Aliocia""!  I have written very few negative reviews in my time, but oh dear! ""Aliocia"" could possibly be the absolute worse excuse for a manager/employee within the customer service industry!  He is the direct cause of what makes this otherwise good restaurant sub-standard.  I have experienced better customer service at a KFC and Burger King.  ""Aliocia"" was once manager at ""IL Bastardo"" on 21st street and 7th ave where he did an equally horrible job until he was transferred to his current location.  I strongly urge the owners of this establishment to terminate ""Aliocia"" asap because he is quite simply ruining what would otherwise be an enjoyable dining experience.Sincerely,NYC Food Critic",0,1,0,Francois P.,"New York, NY",0,1,0
2.0,11/7/2015,"Well I see that my reviews are going down a star at a time. At least this restaurant is consistent in its decline! Brunch again. This time mine was ok. I had the Eggs Benedict, with spinach and salmon (yes, you can do that). Not much to go wrong with that. My brunch partners didn't fare as well. One had asked for eggs, fried, not runny. Well done. And potatoes, bacon well done, salad. No bread please, needs to be gluten-free. They brought her some kind of not-sure-what. Sort of like a roll of scrambled eggs wrapped around something with bacon and mushrooms. And of course, white toast on top of it all. Sent it back. The waiter then returned with what appeared to be a plain egg white omelette (imagine how that looked), with bacon on the side. Rather than return it again, we just had that meal deducted from the bill. She ate the bacon. And our third bruncher today ordered the spaghetti alla carbonara. Seemed to be made with fresh pasta, which was nice, but it wasn't seasoned. Maybe they're trying to be careful with salt, but something like this has to have taste! So at this point, I guess we're down to two stars. It's just, again, that there doesn't seem to be a ""foodie"" involved anywhere here. There's no evidence of anyone who cares about food, at least not for the early part of the day. Haven't been for dinner in a while, I'll probably give that another try before I write it off completely. Hopefully they get that right!",0,0,0,Keith G.,"New York, NY",31,26,149
2.0,10/11/2015,"Do not come here for brunch. It's uninspired, insipid fare. I'm starting to notice a trend in these restaurants. When it comes to quality, they will give it provided that it won't cost them much seeing as they have to pay an obscene amount of rent. This goes for other semi-formal establishments. I used to work at restaurant that in its heyday was providing quality at a reasonable price. Nowadays, it's this kind of mentality that business owners have that will be there undoing. Another thing: why hire a DJ?  You know,Spotify and Soundcloud can do the job of a DJ very well. That money could have been used on a better chef.",0,1,0,Luis T.,"New York, NY",25,25,4
