rating,time_created,text,useful,funny,cool,username,user_loc,user_friends,user_reviews,user_photos
4.0,2/16/2019,"Ended up at Bocca Di Bacco after our reservations at Pastai could not be honored (will not go back there).  Food was very good....the staff totally professional, and easy on the eyes and the atmosphere was homey and not stuffy.  I am going back to this restaurant and soon.",0,0,0,Nicholas P.,"Manhattan, NY",0,17,0
1.0,2/15/2019,Came here for Valentine's Day+ they had a pre fixed menu but also allowed you to order from the regular menu - slowest service ever. Such a turn off. Had to ask for bread 4 times. It finally came after our entrees were served (we even got an app). The table next to us had very timely service (I observed it) so.... beware - food didn't agree with me. I felt terrible the rest of the night and following day. - sure says sparking water is complimentary by the pelligrino was $8 - I can't get over the terrible service. Waitress never checked in on us. I would never recommend this place or go back.,0,0,0,Jessica E.,"New York, NY",0,10,2
5.0,2/1/2019,The staff was very nice! Amazing food the calamari was great. I would definitely go back again whether its for a date or a nice get together with friends.,0,0,0,Abigail T.,"Manhattan, NY",142,6,0
4.0,1/25/2019,"Checked it out for restaurant week. The gnocchi feel (feels?) like tiny pillows in your mouth. So good! The waitstaff are also super attentive and the ambience is really nice and candlelight-y for dinner. It's pretty quiet until 7 pm and then you kinda need to start speaking up to hear the person you're with. Overall, would recommend!**knocking down a star because we went for the three course restaurant week meal but they forgot the third course and so did we - guess it was our fault too for not saying anything. Still yummy though.",0,0,1,Jasmine Z.,"Dix Hills, NY",0,4,0
3.0,1/12/2019,The food is generic American Italian. The menu had some major mistakes in it so I didn't expect the food to be authentic  it's not a bad restaurant but it's just nothing special . The service was excellent and the setup is nice and cozy.,2,0,1,andrea p.,"New York, NY",350,483,951
1.0,12/29/2018,One waitress asked me and my friends (table mostly of Asian race) what the origin of our race is as soon as she greets us. How is this question related to dining and why is it so important to know what your customers' race is?,0,0,0,Dorothy K.,"Flushing, NY",419,7,3
5.0,12/29/2018,Spent Christmas Eve 2018 at this wonderful restaurant in the Chelsea section of Manhattan. Extraodinary service complimented with extraordinary food. I highly recommend this fabulous business establishment to all that are planning a wonderful dining experience in Manhattan.,0,0,0,John S.,"Staten Island, NY",39,8,0
2.0,12/25/2018,"Went on Sunday afternoon for brunch.Food:  good portion.Service:   No drink menu was provided.  The waitress asked if we wanted to order prefix type and get some alcohol drink - we said no but just coffee.  Then she said they have espresso or americano.  So we both ordered americano.  Then I realized why don't they have regular coffee?  When she came around with our food, I asked about coffee.  The waitress then only offered us coffee after we asked for it.  Weird.  I felt like she didn't study the menu well.  or wasn't even ready to accept customers.  Weird.",0,0,0,Arte C.,"Manhattan, NY",0,21,2
3.0,12/9/2018,"The waiter showed up with a greeting in Italian tailored to suggest authenticity. Yet the pasta was gummy and greasy, the fried calamari rubbery and sub par by most standards. Honestly most pasta is better at Asian noodle shops than at Italian restaurants, who have crafted a bad record for themselves through sloppy cooking.",0,0,0,Peter B.,"FOREST HILLS, NY",30,178,96
4.0,11/18/2018,"Great Italian. Especially good for large parties. But I sat alone at the bar and had excellent service and food. It's always buzzing. This is, after all. Hell's kitchen!",0,0,0,Richard G.,"Saint Marys, GA",3,189,7
5.0,10/6/2018,"Whether it's lamb chops or fresh pasta, there's always a delicious dish waiting to be served by a friendly staff at this consistently comfortable and friendly neighborhood restau",0,0,0,Jennifer H.,"Manhattan, NY",79,60,3700
5.0,10/4/2018,I just had a nice prix fix menu here. I was walking and looking for a nice place to eat and not inside Chelsea Market. The food was very good and the price and service where amazing! If you are ever around this area please try it!,0,0,0,veronica v.,"La Jolla, CA",1,45,23
4.0,9/29/2018,"We randomly passed by this restaurant while exploring the area on our first day in New York. They only opened at noon sharp and we could only get the brunch menu (not lunch). Bit of a turn off to start with but we gave it a shot.We had the Prosciutto E Melone, Linguine ai Gamberi and Eggs Benedict. All three dishes were wonderful. Ample portions and nicely presented. Staff also made sure our drinks were refilled in time. Prices were very fair for what we received.The restaurant itself is modernly decorated. The windows can be opened up so the indoor restaurant area connects to the outdoors. The street that they are located on is pretty quiet and surrounded by typical oldschool buildings, so we enjoyed the view very much.",1,0,0,Ilse V.,"Murrieta, CA",96,259,496
3.0,9/25/2018,"I think management should take a hard look at this restaurant to make it an ""average OK' place to a great place. It has that potential. The ambiance in the Chelsea (9th Ave) location is quite good - it's cozy, romantic, and good for large groups. However for a large group, we had an overwhelming consensus that the food was (i) over-salted and (ii) over-oiled.  The veggies, fishes, pastas, drenched in oil.  I am not expecting anything Michelin, but something that you don't feel heavy after eating 1/2 a plate. The salads like the fish were over-salted -- please cut these ingredients in half.  Consider cutting the menu size in 1/2 and making truly excellent dishes. I find it interesting that someone else here on Yelp pointed out the discrepancy with the bill and the menu prices, with the bill being incorrect - we noticed that one too and diners at this location should be wary to check their bill at the end.",0,0,0,Sofia M.,"Manhattan, NY",0,20,1
4.0,9/23/2018,Great atmosphere and really good food. I had the pasta with shrimp. Fiends had the French toast and pasta carbonara. I highly recommend a visit.,0,0,0,Darnita S.,"Charlotte, NC",105,29,8
3.0,9/11/2018,"Overall not a bad experience, just not an outstanding one. For starters I'm pretty sure there was only one server the day I was there. The restaurant wasn't slammed but obviously one server to 7 or 8 tables is quite a bit. Upon first being seated we were offered still or sparkling water. After we got our water our server didn't come back to us until we asked for him which was kind of annoying, but again he was alone so we were a little more understanding. Then we ordered drinks, I asked for a Bacardi and coke, and what I got back was not that. It was really bitter, I'm not a huge drinker so I couldn't tell you what it actually was. I was so taken aback by the flavor that the bartender across the room actually saw my facial expression and waved our server to us. When I told him I ordered Bacardi he told my they didn't serve rum, bummer. So I went to for a Tito's and soda and that was fine. We ordered the rosemary chicken, and a salad. Both were great, especially the chicken. Well cooked and the sauce it was topped with was phenomenal. I could've had 8 more plates of it. We didn't stay for dessert but if it was anything like our dinner it was probably fantastic. This is a great space for a larger party as the restaurant is pretty large. Server and drink aside I will definitely be coming back!",0,0,0,Samantha G.,"Pompano Beach, FL",0,5,1
5.0,9/9/2018,"I went there for my friend's birthday, they have a wide menu, their brunch's and mimosas  are fantastic, we even had a cheesecake with a candle! And we spent a wonderful lunch there, I'll come back again",0,0,0,Vivian A.,"Manhattan, New York, NY",6,3,2
3.0,8/2/2018,"Friend and I came here for dinner on a weeknight.  Ambiance is nice, with nice spacing between the tables.   Food was good with generous portions.  HOWEVER, the service was inattentive (even though they were not full/busy).  Great effort to get our waiter's attention.  In short, nothing special.",0,0,0,Eric K.,"Rahway, NJ",1,6,0
2.0,7/21/2018,"Beware and carefully review your check. They inflated every single item on the receipt by $1-$3 (from the menu price), hoping we would not notice. We noticed.",0,0,0,Jenna S.,"Boca Raton, FL",0,3,0
3.0,7/16/2018,"Came in on a Sunday afternoon. When asked for the prixe lunch, I was told that it was only Mondays to Friday. That's fine but it would be nice if somewhere on their website or something had that to avoid complications. My friends and I ordered linguine with shrimp and spaghetti carbonara. The linguine was highly praised by my friend. The spaghetti carbonara was good too and it's really filling. I was actually really full when I had my last bites. They do give you these muffins which look kinda cheap in all honestly... for a place in Chelsea. The service was fine. They refilled water consistently. But it was a bit weird that we got our complementary muffins and food after a table that came after us.The main reason I won't be coming again is the FLIES. When I walked in, I noticed that they got a B from the Department of Sanitation. As we sat down to eat, the flies were flying all around us because of the food. Although sunlight is nice, I think they should close their doors to prioritize cleanliness. In addition, they charged us more than the price written on the menu. I mean it's fine if your prices increase but at least change it on the menu. Every item was charged an extra $3. Overall, I wouldn't recommend. There's a lot of Italian restaurants and many other options in the area.",0,0,0,Carrie Z.,"Brooklyn, NY",123,60,63
3.0,7/15/2018,"I can to Bocca di Bacco recently for a friend's birthday brunch - we were a  group of 20, which, for a restaurant this size, seemed a bit big, but it seemed like we pretty much had the venue to ourselves.  Service was a bit slow at first - somewhat forgivable given the party size, but a cup of coffee took well over a half hour. The drink situation was also a bit iffy - we basically stuck to pitchers of mimosas, bloody mary's, and screw drivers. The bloody mary's took substantially longer to come out then any of the others. I opted to get in on a pitcher, which was served by the waiter...but the thing was not mixed...aaaaat all. So, two people basically got glasses of vodka, two people got bloody mary mix. That...was pretty disappointing. After some ad-hoc mixing, we all sort of made due and switched to plan champagne after that.The brunch menu itself is a bit limited but has something for everyone. I opted for the white egg omelet with sauteed mushrooms and goat cheese (self-admitted fiend) with a side of turkey sausage. It was actually very good, and I really enjoyed the side of potatoes, which weren't hashbrowns, but cooked potatoes with a tomato-based sauce/ratatouille. Very nice. Didn't feel super stuffed after either.All in all, I might come back to give it another shot in non-massive-group form - the food was pretty good, the service...had an odd day.",0,1,1,Steve L.,"New York, NY",157,309,1204
4.0,6/16/2018,"Had a great brunch here on a Saturday afternoon with a party of 15!  Service was excellent.  I was very disappointed in the lobster & avocado ""salad"" that I ordered...$18 for two pieces of lobster sitting on top of a scoop of guacamole.  I was expecting an actual salad with greens, and what I got was not at all worth what I paid.  I had a little bit from everyone else's plates though, and everything was delicious!",0,0,0,Lynnette K.,"New Hyde Park, NY",20,36,12
5.0,6/14/2018,Absolutely amazing food and experience! Went here with friends before a show and with a reservation we were seated immediately. I shared the salmon dish and tortellini dish with a friends and both were very well cooked and extremely flavorful. I would definitely go back! The restaurant is very cute and has a very nice ambience.,0,0,0,Shivani K.,"Holmdel, NJ",75,32,5
1.0,5/23/2018,I had the worst experience at Bocca... stopped by after work and realized there was a happy hour around 6pm...I asked if I could sit outside and order and they repeatedly told me no! Only at the bar which made no sense since the restaurant was empty!!! I asked for a manager and he was awful... no personality! I asked again and he said NO! No explanation just no!,0,0,0,Hasnija G.,"New York, NY",92,2,0
5.0,5/13/2018,"Great neighborhood restaurant. Good food, great prices, and the management and staff are awesome.",0,0,0,Joseph S.,"New York, NY",1,2,0
1.0,4/21/2018,Very disappointed. We only had one night in NYC and chose the wrong restaurant... Subpar Italian food & the waitress was very inattentive to the point of almost rude.,1,0,0,Annica H.,"Dallas, TX",41,8,0
5.0,4/10/2018,Me and my best friend had our birthday brunch here on a Sunday afternoon. Everything was great. The dining room is very clean and well laid out. The service was very good and the brunch menu options were great. Highly recommend this place.,0,0,0,Mike M.,"Jersey City, NJ",1,3,0
1.0,1/21/2018,"Main question: who is the idiot that is supposed to run this place? Better question: who is the idiot that hired that idiot that is supposed to run this place? Probably I will never know, maybe because when I asked the busboy to bring the manager at the table, I got the dessert menu instead (while I was still having my maine course). I know it's NY, I'm all up for variety, buy is it really too much to ask to have an italian waiter in an italian restaurant? Or at least someone competent enough that when I ask for the manager I don't end up with the dessert menu....speak english anyone?  Thing is that when I go out for dinner, like the majority f us I suppose, I don't eat for free, I spend money for the food I eat and for the service that I'm supposed to get. Bottom of the line is that my waiter, some guy probably from some place from North Africa, dressed like a bum, with no table serving manner at all, was too busy hugging and kissing the other waitress and making comments of how sexually aroused he was by the hostess's boobs, to actually find the time to give some sort of service to our table. He clearly didn't have any knowledge of wines and , after finding that out I was afraid to even ask for suggestions on the menu. Funny thing: he told us the specials, and then told different specials to the table next to us. The food was ok, but clearly we were not expecting much after the display of unprofessionalism we just witnessed. Too bad because the place is nice...but that's all, nothing more than that.",0,0,0,Susan R.,"New York, NY",0,11,1
3.0,12/12/2017,"The was good, but service awful.  When we arrived the reservationist was clearly on the phone with a friend and kept us waiting until she finished her conversation. The waitress was just bad. Left us with menus and disappeared. We finally flagged down a bus boy who found her.  Had to ask for bread. Had to ask for olive oil.  Everything took a long time to get to us. Thankfully the food was good. This was on a Monday night when maybe 8 tables were occupied.  Can't image what a busy night is like.",0,0,0,Mary S.,"Manhattan, NY",29,15,1
4.0,12/7/2017,"Very good the appetizers were great we had the calamari, mussels and rice balls all were good. Pasta was excellent we had the burnt wheat cavatelli  the fusilli, and the special with mixed seafood. The only negative was they ran out of expresso .",0,0,0,John Q.,"Hicksville, NY",317,40,7
5.0,11/8/2017,"If you're looking for an amazing lunch in Chelsea that won't break the bank this is it. The prix fix lunch is one of the best around. It's recently been revamped and has a number of options that would easily cost twice as much for food of lesser quality given the location . The staff is wonderful, and Bobbi the manager deserves a special shout out for being so accommodating. I'll be back.",0,0,0,Jon F.,"Midtown West, Manhattan, NY",53,29,0
5.0,11/5/2017,"Went for a quick lunch and was blown away, the $19.95 prix fix was amazing!! Staff was very attentive, the manager was very courteous she came out and greeted us and was very friendly and very knowledgeable about the menu.. first time there and will definitely be back.",0,0,0,Frank S.,"Lynbrook, NY",0,7,3
5.0,11/4/2017,"What an amazing experience we had here for dinner (actually dinner menu at lunch time by our choice)!  We had a Gilt City Voucher, which we almost regretted because they had a beautiful lunch menu at a crazy price.  So first let me explain the lunch menu-a starter and an entree for $19.95.  We saw a lot of food go by and the portions were very generous and everything looked delicious.  Great presentation.  But our voucher was for a specific dollar amount and this would actually have been too cheap.  So we ordered off the dinner menu.I had meatballs-they were served very hot, plenty of sauce the way I like, and were quite large.  I ate every drop and enjoyed it.  She had the mushroom bruschetta which was HUGE and very unique.  She enjoyed it and had some to bring home.  For the main dish I asked them to make gnocchi with bolognese which they happily did and it was delicious.  The gnocchi were light, like I have had in Italy, not little rocks like some places.  She had the roast chicken with rosemary sauce.  Again very generous portions and very tasty with mashed potatoes and broccoli.Now let's talk service.  When we first saw our waitress Denise we thought she was kind of serious.  Turns out she was just busy.  She was very helpful and friendly and made it quite a pleasant experience.  The woman who was either a manager or maybe an owner named Bobby (forgive me if I got that wrong, but I wasn't hearing that well for some reason) went above and beyond.  If she isn't an owner she certainly acted with the care and pride of someone who truly wanted the customer to have a great time and enjoy the food and ambiance.  There had been a mixup with one entree causing a delay.  She was very apologetic and brought my pasta back to the kitchen to keep it hot.  When the food came back out later I swear mine was a new dish entirely because it looked like I hadn't eaten any but I had actually had a little before it went back.  Everything was hot and fresh.  She also bought us desserts to make up for it despite knowing we were already there on a discount.  To give you an idea about the level not just of service but of kindness, she also talked with us about options to help with storing our leftovers because we had mentioned we were in the city all day and into the late night for a concert for our anniversary.  Who would be that thoughtful?  It was very much appreciated.So, with the delicious food, amazing prices, great ambiance, and awesome service you can imagine how much we can't wait to return!  We highly recommend this gem in Chelsea.",0,0,0,Susan K.,"Franklin, NJ",0,40,2
5.0,11/3/2017,This best location of the three in NYC. The staff and bartenders are outstanding....always going above and beyond in making us feel welcome! The food and drinks are excellent and delicious. We have become a regular because of the outstanding service. Recently had a birthday party catered by Bacco Di Bacco and it was a great success. Best Drinks - La Farfalla and Ginday Martini Best Foods - Rice Balls and Lamb Chops,0,0,0,John V.,"Manhattan, New York, NY",59,3,2
5.0,10/8/2017,"Three words...Get the Bruschetta. My wife and I had planned on going to another restaurant for a Saturday night dinner date but passed Bocca di Bacco and ended up going here instead. The atmosphere, waiters, and especially the food, were exquisite. My wife had ordered a drink that she ended not liking but our waiter, Giovanni, had no problem getting another one to replace it. The bruschetta was the best I've ever had. We actually would have gotten another order to go but it was late and the kitchen had ran out.  For the main course, I got the Fusilli with sausage and pink sauce which was excellent and my wife got the Spaghetti with mussels, clams, and shrimp which looked excellent. We both loved the restaurant and will be back soon.",0,0,0,Kevin W.,"Springfield Gardens, NY",210,13,3
1.0,10/8/2017,Why can't i put zero stars???The evening started with the hostess greeting us with an attitude.  Then the waitress was incredibly rude.  She brought us the wrong drink that we ordered from the bus boy and in a very snotty tone stated that was what we ordered.  She did not even take the order so how would she know?  Then she took half the table's drink orders at a time. She had no patience at all and a horrible tone to her.  She also informed us that there was no bread.  Really-no bread in an Italian restaurant on a Saturday night.  Then the manager brought a small basket of cold bread and slammed the olive oil on the table.  We paid for the drinks and left.  This is the rudest staff I have ever seen.,0,0,0,L X.,"Englewood, NJ",0,35,0
4.0,10/4/2017,Romantic ambiance. We both had the branzino and it was cooked to perfection. Too full for desperate but looked great. Would definitely come back.,0,0,0,Garima V.,"New York, NY",13,71,15
5.0,10/3/2017,"Wonderful service and delicious food.  Bunch of us came here last night for some wine and food, hosted by the restaurant. It was a great way to sample their menu and enjoyed an evening of beautiful weather and nonstop flowing wine.  Few notable dishes included the crostini, pasta, and meatball.  We will be sure to come back for dinner in the future!",0,0,0,Cindy W.,"New York, NY",42,135,113
5.0,9/24/2017,"After seeing Twyla Tharp Dance at the Joyce we came here for a meal. Prices are very reasonable for the city. I loved the Pinot Noir by the glass ($12), and the complimentary biscotti with very crusty bread. The burnt wheat homemade gnocchi with mushrooms and sausage was fantastic. With a side of broccoli rabe it was a well balanced meal. Very tasty and filling. Some apple strudel with vanilla ice cream topped it off. We had 3 servers during the course of the meal and one was nicer than the other. Go here and enjoy!",3,1,2,Harvey A.,"Lyndhurst, NJ",254,211,344
1.0,9/22/2017,Literally the slowest service I have ever had. Do not eat here unless you have 2 hours to spare. The staff is also incredibly rude and do not care for you to enjoy a true dining experience. Will never come back here,0,0,0,Rachel S.,"Englewood, CO",263,4,0
5.0,9/18/2017,"I can't begin to tell you how great this location of Bocca di Bacco is. Not only are they not as busy as the other ones, but the staff is extremely accomodating and helpful. They bend over backwards to accomodate you when something goes wrong and they are very friendly in their service as well. Your water never fully goes down, they are constantly checking if everything is alright and are always nearby. They explain the menu at your request and the waiter we had seemed very knowledgeable. Brunch here is amazing. We ran the gamut of ordering pastas to chicken dishes to paninis to eggs and bacon. They were all awesome and tastes great that I even ordered an extra dish on top of what I had already had, all because I wanted to keep trying the menu. Their pitcher of drinks is also great if you're with a group, as it satisfies the need of all without ordering individual drinks. I can't wait to go back to try their dinner drinks.",0,0,0,Nana B.,"Bronx, NY",440,167,69
4.0,8/18/2017,Excellent customer service funny is good. It is a little pricey. Strong drinks. Has 4 star because the door was open and I was fight with this one fly.,0,0,0,CA-Tour T.,"Bronx, NY",4,105,48
2.0,8/12/2017,"My friend and I came to this restaurant at noon on a Saturday and was not greeted by the hostess who did not look very pleased to be there. Upon being seated, we did not receive our waters for 10 minutes. After ordering, our entrees took about 30-40 minutes to come out. We ordered the calamari as an appetizer and it was quite bland and rubbery with a thick batter. The tomato sauce served with it was cold as if it came out of a store bought jar of salsa. Our entrees were a solid 3/5 but the wait was far too long. The wait staff was kind and helpful aside from the hostess. Overall average at best food with a lengthy wait.",2,0,0,Melissa L.,"Riverside, NJ",0,9,0
5.0,7/14/2017,"Wonderful ambiance! Amazing service and food. Very romantic spot in Chelsea. Ask for the manager, Peter, he will take care of you!",0,0,0,Rebecca C.,"PRINCE, NY",5,15,18
4.0,7/14/2017,"8pm dinner on a summer Saturday night and it was packed!  We came here with friends who were visiting from out of town.  They were staying in Time Square so this was the perfect location for them to get to, however parking was a real b*tch for my husband and I.  The food was excellent.  Garganelli ossobuco.  Need I say more?  The meat was plenty and pasta al dente.  I had this with a side of brussels sprouts pan seared with garlic.  Still had some crunch to them; the way I like it.  I had enough for lunch the next day.  This is rare for me!  I normally finish everything, but the portions were generous and the flavors were rich.  Calamari appetizer to start.  The marinara was more like a fra diavolo, which I appreciated.  The only downside was that it's quite dim inside.  We all had a little trouble reading the menu, but that, of course, did not stop us from getting delicious food.  I would for sure go again if I'm looking for a dinner spot in that area.",1,0,0,Kim W.,"FOREST HILLS, NY",4,21,7
