rating,time_created,text,useful,funny,cool,username,user_loc,user_friends,user_reviews,user_photos
5.0,5/13/2010,"Went this past Friday night with the guys. Not too crowded. Appetizers were the shrimp cocktail and 2 slice of bacon for each. Did someone say BACON????????? Wow. I am not much of a shrimp guy, but it was good. Since there were some younger guys with us who know absolutely nothing about a good steak, we ordered a 3 person porterhouse at medium -well and a 2 person at medium. Medium was still nice and red in the middle. Glad we did not get medium-rare. The filet was soooo nice. The medium-well was too cooked for me. It tasted ok, but i wasn't into the texture. Dessert for me was the key lime pie. Nice. Had way too much shlag on mine. But since it was myself who put it on, I guess I needed it. :). Great dinner. Felt as if they could have wheeled me out to my car.  Did not have breakfast next day. Lunch was just soup. Could have gone back for another steak on Saturday night, but my GF wanted Lobster.",0,0,0,Steven C.,"Brooklyn, NY",0,10,0
3.0,5/4/2010,"Having been to countless steakhouses, but never Peter Luger's, I have to say that if Peter Luger's is like Ben & Jack's then I might have to kill someone in a few weeks because this carnivore is expecting ""outta dis worl' steak"" from PL. My husband and I had our first date night since our wedding in early March. We ordered the porterhouse for 2 since everyone recommended it and it was pretty good. Not great. Not outstanding, but pretty good. We also ordered the german potatoes - I thought it needed a little more work. Creamed spinach was fine. For appetizers we had the Maryland crab cake and the calamari - dunno why we ordered appetizers when we knew we just wanted beef, but they tasted pretty good. Again. Not great. Not outstanding. I would have given B&J's 4 stars but I really, REALLY frickin' hate cold bread.",0,0,0,Yonette C.,"West Orange, NJ",0,3,0
4.0,5/3/2010,"Great food, but the staff could use an injection of personality.  Oysters, shrimp cocktail and crab cakes were dynamite (very fresh).  Two rare steaks-for-two, and the four of us left happy and heavy.  Also, I think they have a house brand of wine (chardonnay) that wasn't bad at all.",0,0,0,Christian V.,"Brooklyn, NY",9,122,0
5.0,4/29/2010,"Probably one of the best deal for steak in town, I love steak and tasted most of the famous place (S&W, Peter Luger ect...).Service: excellent, fast and very professional but still friendlyApetizer: big shrimps (but it is better to go directly to the steak as it is huge)Entrees: no doubt, porterhouse cooked rare, creamed spinach and german potatoesCons: espresso coffee is to avoid (they need to upgrade to a better quality)It is a real NY steack house, the price are really decent compare to many other place in NY.Locations: easy access in NYC and easy to parkConclusion: The place to go for meat in Manhattan",1,0,0,Laurent C.,"New York, NY",1,45,31
4.0,3/31/2010,"My husband and I were in NYC for treatment at Sloan Kettering.  My husband wanted to go to Peter Luger's for a steak and while he was in being treated I called to make a reservation.....which when Luger's answered was told the first available reservation was May 1, 2010 for Dinner.  I was determined to meet my husbands request and searched on my Iphone Yelp for some suggestions.  Now, Smith and Wolinsky's came up and that was not an option because we had been there already.  But then Ben & Jack's came up and after reading the reviews it was a no brainer for us...I called and they were so accomodating and we had our place.Once, there we had a waiter named Denny who went the distance with us...we had martinis to start and they were smooth going down!  I would have another but wanted to make sure I made it through the meal.  We ordered the Ben and Jack's salad and what made it for me was that beautiful thick Canadian Bacon....my husband enjoyed it all....I am not a raw onion girl so I just pushed those aside and ate the tomatoes, shirmp and bacon.   We order the Porterhouse for 2 which really could have fed 4 and it was done perfectly.....medium raw and cooked while still on the plate...the butter it was cooked in was beautiful it would have made Julia Child cry.  We order the onion rings and fries ....the fries are wonderful long thinly sliced potates that come out like chips rather than fries and again to my liking...the onions rings cooked perfectly and gone immediately.  We wanted to try the creamed spiniach but had not place really to put them.  We had a beautiful bottle of Cake Bread Merlot with dinner and it complimented our dinner perfectly.  We relaxed and there was not rushing from our waiter and he could see we had to rest before even considering dessert....this is a great waiter for most want to rush you into the final course with a sweeping off the table but this waiter was a professional.   Ahhhh Dessert was the tartufulo with a generous dallop of fresh whipped cream in the center and per my request a dish of hot fudge on the side.  My husband could not stop taking one more bite and I enjoyed a quarter of this with the best hot fudge sauce.  Our meal ended with a Cappacino and Expresso to which we agreed we would come back next week again to enjoy such a meal.  The meal we choose to eat was not without a price so if you are considering to get this service and this food for a bargin look else where....our bill was in the mid 3's (hundreds) with tip but we think it was worth every bit of it!",0,0,0,June L.,"Rumson, NJ",2,10,4
5.0,3/12/2010,"Seriously, I tore that cow a new hole! Possibly the best steak I have ever had, well worth every penny.Went here with 3 really good friends, we had a plan walking in, this is what it was.Steak for two - cooked rare - this was great, the strip side was really crispy with flavor and perfectly juicy inside. I really like that the plate was hot enough for us to sear the steak a little if we wanted, for some extra heat. Could have actually been a little more rare though, the beef could definitely be eaten raw and still be extremely flavorful without salt or pepper, which I didn't touch the entire evening. I will admit, I picked up that F'n bone and went to town, it was well worth it!Filet - medium rare - all I can really say, soooo tender, flavor didn't quite do it though, c'est la vie, that's the cut.Ribeye - medium rare - I have always loved this cut of meat, it has great flavor, is tender and was really great at Ben & Jacks, bone-in (would still go with Steak for Two though).Creamed Spinach - Not that creamy, very baby food like, don't think I'd ever order this again.Asparagus - very fresh, hardly steamed, could feel the healthiness radiating off of it. I would highly recommend that they sauté this with crushed red pepper, it would be so gooooood and compliment the steak so well.If you can afford it, I would definitely suggest taking the men and ladies here alike! Why should men be the only ones to eat steak? I don't think I'll ever be eating chicken in my life again, not when there's still Ben & Jacks around!",0,0,0,Gabe W.,"Brooklyn, NY",201,112,73
4.0,3/9/2010,They have great steaks with wonderful service.  I enjoyed this place much better than Wolfgangs steakhouse.,0,0,0,W L.,"New York, NY",0,20,0
5.0,3/8/2010,"Closest thing to Lugers without going to Brooklyn.  Service is top notch as well.  Of all the Lugers spinoffs, this one rates the highest.  I eat my steak rare, which most places have trouble doing.  Not here.  Quickly becoming my go to spot.",0,0,0,Craig B.,"New York, NY",0,16,0
3.0,2/21/2010,"Just your average steakhouse. Steak very good, sides below average. They should warm the bread, season German potatoes better and introduce a unique side (grilled tomato). Deserts also run of the mill. No reason to return.",1,0,0,Gary D.,"Miami, FL",0,7,0
5.0,2/8/2010,"Bf and I went here on a Saturday night, with no reservation. We were seated right away. I started out with the Seafood Platter, because I was craving lobster. It came chilled. There was nothing wrong with it; I just realized my craving was for something hot. I ate a little less than half of it before pushing it aside. The waiter came over a few minutes later and noticed the uneaten portion. He began asking me if I didn't like it, if I wanted something else. Now, I have no problem complaining. But I complain only if I feel it's justified - i.e. there's a hair in my salad, the chicken isn't fully cooked, this tastes like ass. So I just shrugged and said I was making room for the steak. He didn't seem convinced.The steak (a porterhouse) and our sides came out next. It was the Steak for Two (~$80), with a side of 1/2 steak fries, 1/2 onion strings (not actually on the menu, but the waiter said it was no problem). I was able to get my side of the steak cooked medium, and bf's side was well-done. Bf's comment on the steak: ""This is the best steak of my life!!"" He previously had declared that at Boa in Santa Monica, for a smaller steak that cost ~$80 just for him. We swapped pieces so we could determine if the way mine was cooked tasted better. We agreed that though mine was a little more tender, they were both flavorful and had a fantastic crispy outer layer.I liked the steak fries, and didn't mind the onion strings but bf wasn't fond of the flavor. When the waiter came by to ask how things were going, he noticed the uneaten onion strings and asked if we wanted something else. We were very appreciative of the fact that he was noticing our discontent with certain dishes and offering to bring replacements - that's rare.At the end of the meal, the waiter dropped off our check and told us he had taken our $30 seafood platter off the bill. Needless to say, we were very pleased with the service, and THRILLED with the steak.",1,0,1,Michelle B.,"North Hollywood, Los Angeles, CA",64,136,0
4.0,2/1/2010,"Went here on Tuesday night with friends that swore Ben & Jack's was even better than Peter Lugers. Understandably skeptical, we ordered an appetizer of bacon, the porterhouse for 3, and sides of creamed spinach and sauteed onions.I wouldn't say the steaks here are better than Peter Luger's, but they're definitely in the same ballpark. The steak was humongous - 4 25 year-old, 180-200 lbs men couldn't even finish the porterhouse for 3. The apps / sides and service were all fantastic too. All and all, given that its much more convenient than PL, takes credit cards, and generally less hassle getting a reservation, I think this is a very worthwhile (if not better) option for steak lovers in the city.",0,1,0,Nils H.,"Denver, CO",40,188,0
5.0,1/24/2010,"Wow Steaks are just as good as Lugers and what a great location in the city!  They're also very accommodating to large parties within a few days notice.  Parking isn't too difficult to find, just read the signs and don't park on the ""consult sides.""We ordered the Porterhouse steaks for the entire table, assorted appetizers, a variety of vegetables and sides, bottles of wine, and dessert.  Everything was delicious and everyone was satiated at the end of the meal.  The creamed spinach wasn't as creamy and had a slight off taste to it, but the fresh sauteed spinach with garlic was much better tasting and had no issues with it.  The Ben & Jack's salad for 2 was pretty much bacon salad.  Some of us girls had hoped for some salad greens to make us feel like we're eating healthier, so it was a bit of a surprise.Steaks are cooked to perfection and served just like Lugers.  Waiters were attentive in refilling our beverages.The decor is much nicer looking than Luger's though.  There's nice artwork on the walls and dark wood with mirrors.  Prices are also similar to Luger's.  I'd be happy to return here again but it doesn't mean I'm not going to Luger's anymore either.",4,1,2,Sandy C.,"Queens, NY",249,578,465
4.0,12/7/2009,"LOVE their steaks! Been too a lot of steakhouses and have to admit this is one of the best i had.  Their prices are high, but kindof figured it would be cuz its nyc.",0,0,0,James K.,"Aberdeen, MD",1,17,0
2.0,12/7/2009,"Noisy.  There are many very good steakhouses in New York and this is just not one of them.  It appears to be one but it really just pretends to be one.Yes, the service is very good.  Excellent.But the steak is just average.  We ordered two steaks for two for five of us.  There was enough.  One was supposed to be medium rare and the other: medium.  When the waiters delivered both of them, and each of us chose which morsels we wanted, the waiter allowed:  ""they're really the same.""  OK...that's not a big deal.  But regardless of whether the slice was medium or medium rare, it was simply good.  You wouldn't throw it out.  But it wasn't very good.  It was kind of ordinary.Oh, and did I say it was noisy?  If not, be prepared.  It's NOISY!",1,0,0,No A.,"Lebanon, KS",0,19,0
4.0,12/3/2009,"This was a pretty good steakhouse.  Coming from Texas, I just can't rate it at 5-stars.  However, it does have one thing going for it that I can't find in Texas.....the Canadian Bacon.  Whoamagosh.  I ordered it as both the appetizer AND the salad.  The salad, in addition to the thick sliced bacon, had shrimp, tomatoes, onions, and the delicious house dressing.  The CB alone puts it at four stars.  The steaks and the service are not over the top wonderful, but they don't bring the place down.",0,0,0,Lane Y.,"Austin, TX",11,29,1
2.0,11/20/2009,"Food is definitely good.  Service was disorganized.  Waiters overlooked our table for most of the evening, forgot an appetizer and were inattentive.  Seemed like bigger parties got better service.  It was a fairly busy Thursday night, but the place was crawling with staff.  Not impressed given the quality of other steakhouses in the neighborhood.",0,0,0,Josh H.,"New York, NY",0,14,0
4.0,11/16/2009,"Requirements: a restaurant near the Chrysler building that offers the possibility of a carb-conscious lunch. Yelp offered a bunch of sushi and steak spots in the neighborhood, and so we decided to go for steak...at the steakhouse with the Peter Luger association.The decor looks dated but not in an ironic or purposeful way. The waiters are all dressed in white, are not rude (a nice change from the infamously tart ones at PL), and they all bustle around with huge hot plates with heaping piles of meat on them. There were two large tables being served on either side of us, which did slow down the delivery of our third course, but the boys were moving very briskly otherwise. Ben & Jack's has a lunch prix-fixe that you cannot beat, $27 for three courses. My friend and I both ordered the filet mignon medallions. I was the one watching the carb intake so I could only look on jealously as my friend sampled the cornucopia of bread choices in our basket. Our mixed green salads were basic. And then the jealousy struck again.I took what looked like two cups of mashed potatoes off my plate and put it on a bread plate so my friend could enjoy hers and mine. She also assured me that the mushroom sauce accompanying the filets was delish, as I moved the gravy boat they brought me to the other side of the table. And when her chocolate mousse came with an obscene mound of whipped cream, she told me to get my prix-fixe dessert after all because she was pretty sure she could have both (she couldn't. and she's teeny, in case I made her sound huge!).Envy aside, it was a revelation to have steak without any kind of sauce. My steak was perfectly, and I mean perfectly, cooked medium rare. That along with 3 broccoli flowers and I was done. Ok, so MAYBE I had a spoonful of the mousse just to taste it, but if you saw the bowls of creamed spinach you would agree some amazing restraint was shown.",1,0,0,Jennifer H.,"New York, NY",74,337,33
4.0,11/16/2009,"peter lugers with class....I went about four years ago when I lived in Dobbs Ferry NY and it was recommended to me by a local restaruant in Dobbs Ferry.  I have went last weekend and it was just as good.    I have been to Lugers and both are great.  I prefer Ben and Jacks due to to the location and service,  but i do buy the peter luger sauce at the super market and is always in my fridge.",1,0,0,paul z.,"New York, NY",2,44,0
5.0,10/21/2009,"When it comes to steakhouses, I rate it based on several criteria:  flavor of the steak, quality/portion of the sides, service, and atmosphere.  Since many of the top steakhouses in the city stand on relatively even ground in terms of the service and atmosphere, I usually let the food determine whether or not I go back.  To date, Del Frisco's is still one of my favorite places to grab a steak.  Flavorful, well cooked steaks.  Their potatos au gratin and sweet mashed potatoes are awesome.  I write this to offer a bit of background about how I rated B&Js. That being said, B&Js is worth it. You'll walk out full and satisfied. Appetizers were good.  Consistent with other steakhouses.  Nothing unique or special, but what you expect.  The sides (creamed spinach and German potatoes, which are basically home fries) were good.  But again, nothing out of the ordinary, although the gf seemed to really enjoy the spinach.  Del Frisco's still has the best side dishes in my opinion.  Now the steak.  My gf and I had the porterhouse for two.  It arrived on a plate the size of Rhode Island, sizzling in its own grease and butter.  The first bite (and the last) was pure juicy meatiness.  I even cut off pieces of the fat and ate it.  The flavor was out of control, in a good way.  For dessert, the tiramasu.  Solid.  Delicious.  Always save room.  It wasn't enough to overthrow Del Frisco's, but I will definitely go back and recommend it to friends.",0,0,0,Christopher L.,"New York, NY",2,44,1
5.0,9/19/2009,"Loved it! Loved it! Loved it!Not only do they have some of the best side dishes in Manhattan, the service is really first class.  And of course it wouldn't be a great steakhouse without great steaks!  I highly recommend it for those looking for a great place to eat without having to worry about dressing up.  Low key scene but top rate food!",0,0,0,Lisa Q.,"Bronx, NY",104,3,0
5.0,8/25/2009,"OH MAN. oh man oh man oh man. This may be one of my new favorite restaurants. If you feel like dropping quite a bit of dinero into a dinner that will leave you speechless then start saving up your cash and come here!There were 5 of us--we ordered the porterhouse for 2, rack of lamb, one order of perfectly crisp and crunchy homefries, and 2 orders of creamed spinach. Please tell me how they get the spinach to taste like that? I would've been Popeye if there was spinach to be had like this when I was younger.  The meats, as well, were cooked to perfection. Great service as well. We were constantly checked up upon and made to feel very comfortable.Mm, Steak...",1,2,1,alexandra f.,"New York, NY",61,158,8
4.0,8/19/2009,"Ben & Jack's had the privilege of teaching me how to eat fine beef without A-1.  It was my 21st and I was surrounded by butties, young and old, rookie and veteran to the superior steak experience we were about to indulge in together.  And the steak!  My lawd!Still sizzling on the plate was our steak for the masses.  The waiter sliced it into pieces and glided each one around the plate to show us how fresh, how hot, how beautifully cooked it was.  A ring of smoke rose to the ceiling to the meet the glorious fumes of our fellow diners.  Paired with a lard-glorifying creamed spinach and a crisp serving of fried potatoes (not French fries, fried potatoes), this meal would not be matched easily. I was inducted into the finer ways of manly eating.  I actually lived in an apartment building on the same block but I never had the chance to try the place out.  I always walked by, wondering what the inside was like.  Middle to golden aged men strolled out with cigars in tow.  Belts loosened and seams stretched, it seemed that a good time was to be had by any who entered.  I felt like a pauper walking by.  Poor college boy.  It wasn't my fault NYU took all my money.  But now, at the gracious emptying of my friends' wallets, I was here.  Enjoying the finest cut of protein known to my 21 years.The legend goes that a rebel faction of Peter Luger's broke off and created Ben & Jack's to challenge them for porterhouse supremacy.  After this special night, I could certainly see why.",6,6,6,Paul L.,"Edgewater, NJ",595,322,107
4.0,7/28/2009,Great steak without paying a fortune. Steak not bathed in butter truley enjoy the flavor of the beef.,1,0,0,Michael M.,"Hoboken, NJ",29,9,3
3.0,7/28/2009,"Great steak, no question about it.  Perfectly charred and seasoned.  But the waiters are not particularly warm or welcoming - this may just be a function of the old-school steakhouse style of service.  Definitely got attitude for not ordering enough food.",0,0,0,Linda W.,"Brooklyn, NY",0,25,0
4.0,4/14/2009,"not sure which opened first but the steak and side dishes, even the plates and the way the food were served all reminded me of Peter Luger.our medium well steak was a little undercooked, although im not fussy about it at all. tasted good. server took some to recook and came out with extremely nice, crispy skin. actually tasted better than the first time round. spinach was ok, not as tasty as luger's. bacon was nice but not fatty enough.",0,0,0,Yeni H.,"Port Washington, NY",55,226,14
5.0,3/29/2009,"I'm having trouble ranking this place base on its Luger like porterhouse.I started off w/ Wolfgang's. Then I found out they are an off-shoot of PL. Then I went to the PL in LI, disappointed. I stuck w/ Wolfgang's until I went to the original Peter Luger's in BK. I was once again, impressed by the overall quality of their steaks. Now that I went to Ben & Jack's, another off-shoot of Peter Luger, what do I think?I have to say... this is so tough to choose. I would go to any one of them, any day of the week. I truly enjoy all three. Although this place has a really nice balance between PL and Wolfgang's. It isn't as crispy as Wolfgang's, but it was really good from the first to the last bite.Come to think of it... I might like this place better than PL. PL was a bit charred when I had it. And that's entirely a person opinion. But I'm not too down with charred meat. But PL was cheaper than this, and we even had wine last time. There's only one problem with this place. The lack of customers. We went on  a Friday night, and the restaurant is barely 1/2 packed around 9 PM. I guess they are really hit by the recession.",3,0,2,Jack N.,"Brooklyn, NY",155,352,129
4.0,3/21/2009,"This place is a Peter Lugar's copy cat.  Everything from the the way they serve it, to the bacon, to the schalg.And it's one level down from PL.  Yep it's great...but not as great as PL.The porterhouse they serve just didn't have that same butteryness that PL has.Certainly go here though...it's great.",1,0,1,Lou E.,"Astoria, Queens, NY",33,97,6
5.0,3/6/2009,"Good bye Peter Luger's, hello Ben and Jack's.A friend was craving some deliciously charred red meat so we decided to head to Ben and Jack's. We went on a Thursday evening and got a table immediately (table for 3). The waiters were very friendly and attentive. We started with Fresh Oysters on the half shell and Jumbo Lump Crabmeat. The oysters were very fresh and huge! The crabmeat was a little bland but with a little horseradish and lemon it was still good. We got a Porterhouse for 2 (dry aged on premises) and broiled Chilean Seabass. The steak was cooked to perfection (medium-rare) and was so tender and juicy. Forget Peter Luger's, this was better. I usually try to avoid over-fished fish, but the Chilean Seabass sounded too good to pass. The crust was crispy and delicious and the buttery fish just melted in my mouth. As far as sides go, my friend got a baked potato. The potato was nice and big and came with a big helping of sour cream.  I didn't try it, but he liked it. On to desserts. We got the Creme Brulee and Key Lime Pie. The creme brulee was good but could have used a thicker sugar crust. It wasn't crunchy enough. The key lime pie was nice and tart and had a graham cracker crust. There was a generous heap of homemade shlag, which went well with the pie. Bottom line, if you're looking for a place that not only has great steaks, but great seafood too, head to Ben and Jack's.",1,0,1,Joe C.,"Queens, NY",3,5,2
3.0,2/21/2009,"Been here for lunch a couple of times. I always get the burger because I don't feel like breaking the bank. My friends usually get a thick slice of bacon with it, but the bacon is so thick and fatty - too rich for me. The burger is scrumptiously delicious, though not the best I've had by a long shot. Very juicy, but i find that they have a tendency to overcook the burger - twice I've asked for medium-rare and gotten medium-well. Maybe next time I'll ask for rare - but I'm afraid I'll get a mooing burger. I haven't been for dinner, but will probably try their steaks at some point.",0,0,0,Eric B.,"New York, NY",52,36,0
1.0,2/17/2009,Good food bad service.  I've never been treated so poorly in my 10+ years of eating out at fine NY restaurants.  The waiter pratically molested one of the girls at the table and almost caused a fight with the guy she was with.  Incredible.,0,0,0,Charles F.,"New York, NY",0,4,0
