rating,time_created,text,useful,funny,cool,username,user_loc,user_friends,user_reviews,user_photos
3.0,4/25/2019,"Had the opportunity to attend an event here and after telling the front hostess, we were led into the back where there's a giant table with a lot of chairs around it. It was definitely a cramped situation in that you barely had any elbow room.There was bread and butter before the meal began which I didn't get a chance to try.First, the salads came out. I had ordered the Caesar salad and to be honest was a bit disappointed at the presentation of it, being that this place does have a high reputation. It was just pieces of cut up lettuce drenched in Caesar salad dressing with a few small pieces of croutons mixed in.Then after a while, the steaks came out. I had ordered my sirloin steak medium and it was okay. Wasn't the best I had ever had. I did notice that it was burnt to almost a crisp on one side but not on the bottom...not sure if that's how steaks are normally supposed to be served. Broccoli, mashed potatoes and spinach dip were also offered and simply tossed on the plates. It was a bit of an awkward dining experience. Finally, dessert platters came out in that there were five slices of a variety of cheesecakes and tiramisu with a mountain of whipped cream in the middle...the tiramisu was only redeeming choice on that platter. The lemon cheesecake had a weird aftertaste to it.The waiters were courteous and diligently served us during my time here and also cleared away the plates and utensils after each course was served.The bathrooms are small...only two stalls in the women's restroom...not to mention that the floor was sticky too...",0,1,0,Hui L.,"Woodside, NY",51,465,1301
5.0,4/17/2019,"We literally stumbled upon this restaurant while walking to the UN building down the street from our hotel. We had not prepared for a nice restaurant dinner in our packing of clothing for our vacation. I popped in to ask if it would be okay to dine later in the evening in spite of our lack of dress clothing. We were assured by the lady at the podium (I wish I had gotten her name) that it would be fine. we returned later and were greeted warmly by the same hostess that we had encountered previously. After being seated we were waited on by Timmy and a young man who I assume was in training. From start to finish our meal was incredible. 2 dry aged rib-eyes cooked to a perfect mid rare, German potatoes cooked crispy, and a side of sauteed mushrooms. Service was impeccable and the food was beyond reproach. If we get a chance to visit this wonderful city again, we will certainly make this a must eat destination.",0,0,0,Peg W.,"Leland, NC",19,5,0
5.0,4/17/2019,Excellent service and food. Can't recommend enough. Steak cooked perfectly. Salads were yummy. Nice quiet atmosphere.,0,0,0,Katrina S.,"Fairfax, VA",24,25,3
5.0,4/13/2019,This is the go to steak house for my husband and I. The service is amazing. Friendly knowledgable staff that are willing to offer great suggestions from the menu. The steak is delicious but so are their sides and appetizers. The ambiance is calm and the decor is beautiful. I recently visited another steakhouse nearby for Sunday brunch(Smith and Wollensky) and nothing compares to Ben and Jacks! Can't wait for a date night at Ben and Jacks soon! Thank you for being amazing!,0,0,0,Vicki N.,"Bronxville, NY",0,3,0
5.0,3/22/2019,"Great service (thank you Ecko!) and wonderful dinner. Bright spot on a very dreary, rainy evening. Can't wait to return!",0,0,0,Susan D.,"Stratford, CT",0,4,0
4.0,3/8/2019,Great meal and great service. Went on a Friday evening and had no problem getting reservations. We ordered the filet - petite for me and regular for hubby. Both were outstanding. Sides were good portions and easy to share. The bar was a bit noisy with the after work crowd but didn't detract from our enjoyment of the meal. Definitely would return.,0,0,0,Audtey C.,"Cranston, RI",1,11,1
5.0,3/3/2019,Came here for the first time on a Saturday evening around 6:30 pm without a reservation. The restaurant was busy but we were seated immediately. Excellent steaks cooked to perfection. Sides are homemade and fresh. The peas and onions are delicious. We were a party of 4 and enjoyed a platter of various desserts topped with the best homemade whipped cream ever. Manager and waiters are very welcoming and attentive. I highly recommend this steakhouse. We will be returning!,0,0,0,Rosalie R.,"Manhattan, NY",13,8,0
5.0,3/3/2019,"I just can't say enough if what a fantastic meal we had- the service was better than any restaurant I have been to in several years...personable, attentive and they made you feel like you have been coming here for years . We had the tomahawk steak special  with fixings and started with lobster bisque. The steak was phenomenal - they had champagne ready for our anniversary as well as desert. We will be back!",1,0,0,Jim M.,"Newton, NJ",162,228,128
5.0,3/1/2019,The happy hour is a real steal! Fabulous oysters for a dollar fifty each!! I had 6 and then had to order another 6! The steak is aged on the premises and is fab! I had a sirloin which was so so good! Well worth a visit!!,0,0,0,Dave T.,"Miami Beach, FL",1,41,0
5.0,2/28/2019,"1st time here , my friends always told me about this place and I'm pretty impressed with the place the food and drinks and service was great ...the ambiance was great looking to have a dinner party here in the future ..will deff come back aging",0,0,0,Kyle B.,"Queens, Queens, NY",32,31,31
5.0,2/18/2019,"A splendid time was had!We've been fans of Benjamin for many years.  Last time we went, we were seated at a cramped table and our check (for 2) crossed the $400 mark, which made us wonder if there wasn't something better...Low and behold, we checked into the Even Hotel on 44th and saw the sign for Ben and Jack's and gave it a try.Nice place and tables are NOT cramped together.  Also prices are about 20% less than Benjamin, which is nice.  Food is spectacular.  We had the crab cocktail, tuna tartar, and porterhouse for two and all were just plain top shelf.  For sides, we had creamed spinach (wow - outstanding!), roasted brussels sprouts and a big backed potato.  House steak sauce is quite nice - similar to Benjamin and without any anchovies (like Luger has - who wants that on their steak?!?!).Extensive wine list reasonably priced - less than 2X what you would pay for the bottle in the store.Service started out a little spotty but then finished up just fine.  We will definitely go back.Give these guys a try - the porterhouse is right up there with the best I've ever had.  (and I do like porterhouse!)",2,0,0,Adam S.,"Averill Park, NY",1,27,0
5.0,2/16/2019,"My husband and I came to Ben & jacks on a recommendation from a family friend. We are so glad we took his advice. They were happy to honor my request of ""onion soup no bread"" and our steaks came out perfect temperature! The staff was very polite and attentive.Cant wait to go back",1,0,0,Shpresa E.,"NY, NY",73,65,13
5.0,2/14/2019,"This is the best steakhouse in NYC. We've been combining here since last year ( more often than I'd like to admit ) and we ask for the same waiter ( although the service is impeccable) our personal favorite is Ecko! This food is 10/10 the service is 10/10, vibe is always 110%. If you're a steak lover, come here ASAP! :)",0,0,0,Victoria K.,"Brooklyn, NY",222,83,76
5.0,2/9/2019,"Wow! What a time I had here! It was just Restaurant Week here in New York and I thought it would be cool to use the opportunity to explore a new restaurant. I decided on Ben & Jack's Steakhouse on East 44th and I'm so glad that I did. My Wife & I arrived to a nearly empty restaurant (how we like it) when we came for our 3PM Lunch Restaurant. We were sat by the kin Hostess then greeted by the very warm server Timmi. He made us feel right at home. We looked over the menu and ordered our food. I've had steak at over 50 different steakhouses in my life and as I told Timmi, the steak I had here HAD to be the BEST steak I've ever had. The Caesar salad was perfect, the mash & broccoli was delicious and I had a few glasses of the desert wine.The bill came up to about $100 for 2 and I can't wait to return although I know it'll be more next time around, it'll be well worth it.",2,0,0,Heaven G.,"New York, NY",157,100,164
1.0,2/6/2019,"Horrible service by the rude hostess and manager. Small bar. Slow service by the bartender. **i do appreciate the owner reaching out on yelp to learn more about the issue, at the time of the review we were clearly very agitated at the rudeness of the manager** Had a reso for 8pm (showed up at 8:00)Was told we had no table Then the jerk off manager comes over and says it .. verbatim ""could be 10 mins, 20 mins, or maybe a half an hour depending on when someone gets up..""Asked for a comped drink at the bar while waiting and he says ""you can get a drink, but it won't be on me""What a joke--we walked out and walked 2 minutes to SPARKS down the block on 46th street.",0,0,0,Peter G.,"Glen Head, NY",4,6,3
5.0,2/6/2019,"Went in hangry, left full and happy! Service was extremely fast and precise, ask for Timmy if you want to experience the best service. Everything we ordered was served as requested. Their new cajun ribeye is mouth-watering deliciousness !!",0,0,0,R X.,"Manhattan, NY",47,6,2
3.0,2/6/2019,Came here for lunch and ordered the steak and French onion soup. The steak was good but as can be seen in photo very oily. Our experience here would have been more pleasant if our server was more attentive. We had to stand up and wave him over every single time to get his attention. Our steak took 40 minutes to arrive.. chocolate mousse cake was,0,0,0,Sara T.,"Greenwich Village, Manhattan, NY",144,77,76
3.0,2/2/2019,"2.5/5 stars for food, 4.75/5 for service=3.63 stars (sadly Yelp doesn't allow us to be that precise)Took my bro here for his birthday and ordered off the $42 restaurant week dinner menu:We picked: (Apps)Baked clamsSliced tomato and mozzarella(Entrees)8 oz filet mignonNy sirloin steak(Both came with broccoli and mashed potatoes)(Side)Creamed spinach (additional $7)(Desserts)NY-style cheesecake Chocolate mousse cakeHouse wine bottle: Malbec (additional $45)The side and apps were standard, nothing fancy but fine. The clams were pretty small, though. The comp bread basket was unimpressive, as it was filled with some stale onion rolls and sliced white loaf. Where the fresh, hot bread at?! The steaks, however, were overcooked twice. The first time, my bro ordered his medium rare and I ordered mine medium, but they both came out well done. When I told the waiter, the manager (I believe) came over and very quickly gave us new steaks. I ordered my second steak medium rare because I didn't want another mishap, but both of ours came medium to medium well. By this time, we were hungry and didn't want to wait any longer, so we just ate. The taste was fine..standard, buttery steakhouse steaks..just not cooked right either time. (Pretty inexcusable for a steakhouse tbh, though they gave us a free second bottle of wine we could not finish - in retrospect, I should've asked for the first bottle to be comp'd instead) I skimmed the reviews below and learned that other diners have also had issues with the way their steaks were cooked. Hmm...We took dessert to go, but it was horrible. The (plain with a drizzle of blueberry syrup) cheesecake had a thick, doughy pie crust attached to it (gross and flavorless, why?!), and the chocolate mousse wasn't actually a cake because it had an Oreo cookie crust. It was also overly sweet.If service had been terrible, I would've given 2 stars, but thankfully they had that going for them. Now if this steakhouse would just get its steak temps and desserts right...",0,0,0,K P.,"Norwood, NJ",0,46,6
5.0,2/1/2019,"This is actually one of my favorite steakhouses in NYC. It has a variety of red wine. Good food, service, and atmosphere. Seafood and side menu are also good. Highly recommend going there.",1,0,0,Takayuki H.,"Manhattan, New York, NY",95,26,17
4.0,1/30/2019,"Came here for restaurant week and had the French onion soup and filet mignon. Everything was good, service was nice and attentive, and the $26 restaurant week price was worth it. I subtracted a star because the steak preparation was inconsistent. One of my coworkers and I both requested medium rare and one steak came back closer to medium and the other was rare. Nonetheless, the steaks were still good and aren't a bad option for a power lunch in midtown.",0,0,0,Brian S.,"Greenwich Village, Manhattan, NY",77,289,111
5.0,1/28/2019,Had lunch here today for restaurant week with some friends. Everything was DELICIOUS.  Service was impeccable. We had the Salmon which was cooked perfectly. I was a bit surprised that a steakhouse could make the perfect Salmon  but they did it!! The portions were huge for lunch. We enjoyed everything.,0,0,0,Queen B T.,"Bronx, NY",0,34,1
4.0,1/28/2019,"Went here for lunch during Restaurant Week and ordered the french onion soup, the filet mignon, and the key lime pie. The food wasn't anything outstanding from my point of view but it was good in quality and flavor! My favorite was the key lime pie, it was really delicious and had a nice texture; the filet mignon (served with broccoli and mashed potatoes) was soft and it was cooked perfectly but it I don't think it was the best filet mignon I've ever had; finally, the onion soup was good but maybe I would order a different appetizer next time. Portions were very generous and the service was excellent, the waiter was really nice and attentive. Overall a very good restaurant and would consider returning if I'm in the area and craving steak.",0,0,0,Maria B.,"New York, NY",0,25,23
5.0,1/23/2019,"This place is exceptional, from the service to the food and ambiance. Awesome value for $33 price fix lunch, you will not be disappointed!!!",0,0,0,Juan L.,"New York, NY",78,9,22
4.0,1/22/2019,"I came here for lunch during restaurant week with my girlfriend. Luckily, my birthday was during this time so it was a good way to celebrate. As far as the atmosphere goes, it's very clean and neat. It's clear that the staff puts in effort into making the restaurant look presentable and comfortable to dine in. The waiter came fairly quick and answered our questions clearly. He also checked up on us pretty often to see if we needed anything. For our appetizers, I got the mushroom soup and my girlfriend got a caesar salad. Both came in a decent portion. Not too small and not too filling. It was just right. For the main course, I got the chicken parmigiana with rigatoni. My girlfriend got a steak (I forgot which one) and it came with broccoli and mashed potatoes. Her steak, broccoli, and mashed potatoes tasted very good. My chicken parmigiana was the reason why I gave this place 4 stars. While it was edible, I definitely felt like I had better from other restaurants. The rigatoni felt a little bit undercooked. It was still edible but it would've been more enjoyable if it had been cooked longer. The chicken was a good size, nothing to complain about except it was a little bit too dry. The tomato sauce didn't help at all because it was a little bit too salty. To sum my plate up, it was all over the place. Undercooked, dry, and salty for the most part. Still edible, however.Would I come back? Yes. Although I had a bad first impression with the chicken parmigiana, the steak my girlfriend had was delicious. I wouldn't let one bad plate stop me from coming here and I believe it's a good place for anyone to visit.",0,0,0,Vincent S.,"Brooklyn, NY",0,23,16
5.0,1/21/2019,"I came today to Ben & Jack's Steakhouse for my friend's birthday and took advantage of the restaurant week menu. It was my very first time coming to this steakhouse and I have to say that I was very impressed in many ways; first of all, the ambiance is very private and intimate, second, the food was great! Even though it was the restaurant week menu, the we both ordered the steak and it was a very large portion of really high quality meat and third of all, the service was extraordinary - Julio, our waiter was very attentive on everything, making sure we had the best experience possible in this restaurant. I have to say that this will not be the last time that I am coming to this restaurant and will surely recommend it to friends and family!",1,0,0,Anna A.,"Manhattan, New York, NY",0,3,0
5.0,1/16/2019,"Great steakhouse vibe with good food and good drinks - well worth the price point.  Bar service is attentive, friendly and welcoming.  The Wagyu hamberder was great and accompanied by good fries.  Check pictures posted by other reviewers.  The meal is a decent size.  Dirty martini with their house vodka was perfect.  House Cabernet that followed was good as well.  The place is not pretentious as some of the reviewers have described but it is definitely a higher-end establishment.  For me, a fabulous place to come for a happy hour drink and linger into dinner.",1,0,2,Sandy M.,"Los Angeles, CA",0,42,1
5.0,1/15/2019,"Absolutely delicious food, awesome bartender (mike i believe) and service!! Julio, our waiter was amazing and super accommodating! He made sure all of our needs were met and that we were content with our meal. Food was cooked exactly how we asked for it and appetizers (french onion and wedge salad) were split for us prior to serving since we had mentioned sharing. Petite filets were amazing and they even customized mashed potatoes to make it garlic mashed potatoes! Mac and cheese was served hot and had amazing flavor, would definitely recommend to anyone and will be back soon!",0,0,0,Shannon G.,"New York, NY",419,18,1
4.0,12/27/2018,"I've been to this Ben and Jack's three times and the customer service is stupendous. I feel as if I'm the only table when I'm there, even though it's usually pretty busy. The ambiance is comfortable and the food is yummy. (The Mac and cheese is on point). I'll definitely be going again.",0,0,0,LiberTee L.,"Brooklyn, NY",0,5,2
5.0,12/26/2018,"Had our family Christmas dinner at this incredible restaurant on Christmas Eve.   The food was truly amazing and our waiter, Ronnie, was without a doubt the best of the best.  This will be our go to restaurant on all future trips to NewYork!!",0,0,0,Kay K.,"Wilmington, NC",0,2,0
5.0,12/26/2018,"I had two things planned for a Boxing Day jaunt into the city: a walk around Bronx Zoo and a meal at a good steakhouse.Post-zoo, I had a 2:30 reservation booked at Ben & Jack's - a classy if not wholly original spot a few blocks east of Grand Central. While there are no shortages of steakhouses in Midtown, Ben & Jack's offers up a great deal for great steak: a three course prix-fixe lunch for $32.50.I went with french onion soup and a 12oz sirloin. The cup of soup came with a bubbling crust of cheese enveloping a rich, deep broth. Make use of the complimentary bread basket for this: it's too good to let a drop go to waste.The steak is as good as any I've had in New York: cooked a perfect medium rare, this dry aged prime beef was cut off the bone and managed to combine meltingly tender meat with a serious char. Even the simple sides of broccoli and mashed potatoes were delicious...and all the better when washed down with a fine ManhattanDessert came as the final course: a slice of cheesecake with a mound of fresh whipped cream. The cheesecake was good (not great or particularly memorable), but the whipped cream made the dish.",18,12,13,Craig G.,"Jersey City, NJ",107,358,112
4.0,12/24/2018,"Ben & Jack's Steakhouse, initially opened its first location on 44th Street in 2005 but closed down in 2012 for 5 years due to the renovations of the building, has finally returned in 2017 to its very own original location. The anticipated return definitely showed how they flourished as one of the top destinations for world-class steaks and chops and has been satisfying everyone's all sorts of cravings since then.Upon entering, you can't help but notice the impressively classical yet modern design of the interior. The high ceilings, every piece of rich oak wood panels built on-site in the restaurant, choice of furniture and crystal chandeliers all contribute to the classic and elegant atmosphere for a hedonistic dining experience. The wall-sized exhibition wine case is located in the dining room, facing all guests but also allowing guests to view a display of the restaurant's wide and varied selection of wines.To start off the dinner, there are several appetizers you just simply can't pass up on, with one being the Sizzling Canadian Bacon (extra thick by the slice). It is brined, smoked then grilled to yield the perfect ratio of fat and char. Staying true to its name, the thick slice of bacon came sizzling still on the plate before being served. This bacon might be thick sliced but it was still tender and juicy, with an extra crunch that pulls you back to the idea of your typical slice of bacon. It tastes even better with its own signature The Original (not just) Steak Sauce. Ben & Jack's uses market-fresh ingredients and products to bring the best flavors to every guest. The seared scallops and classic Caesar salad did just that; the scallops lightly yet perfectly seared to simply bring out and highlight the freshness, and the simple salad made with fresh vegetables with the right amount of dressing and cheese sprinkled atop definitely hit the spot. There are also many other salads and appetizers to try out like the Sesame-crusted Yellowfin Tuna with a balsamic reduction and wasabi sauce, baked whole clams and Maryland Crab Cakes.The dining experience was absolutely enjoyable; partly because of how veteran wait-staffs and executive chef Admir Alibasic explained and served each dish, making sure all guests enjoy their good in the best possible way. Chef Admir, also the creator of their steak sauce - prime accompaniment to every dish, is the one who personally checks all the USDA prime labeled beef when sent to the restaurant and makes it all happen, as it becomes dry aged meat. The selection of USDA prime steaks are from the top purveyors in NYC and dry-aged in-house and every cut whether it is the porterhouse, filet mignon, strip steak, or prime rib, it is all handpicked and surely top grade.The signature Porterhouse steak attacks your nose with amazingly delicious and mouth-watering aromas before it even comes in contact with your taste buds. It is lightly salted because that's basically all the flavoring you need. It is precisely cooked and perfectly tender, making every bite your second to last because it is purely delicious and simply can't stop. The baste of au jus (melted fat) that is poured back onto the steak makes each bite not only juicy but also full of its own flavors.There are several sides that are more commonly seen with steak dishes like the Creamed Spinach and German potatoes. They also have the Mac and cheese, which comes with a sweet onion taste, different from other steakhouses' mac and cheese.Ben & Jack's Steakhouse offers a wide selection of classic cocktails, wines and many more. Chef Admir has personally curated an extensive wine list of plenty of labels. This steakhouse came back to its original location just as strong, along with its other location; bring something very different to the table, setting a high standard and caliber for the rest. It offers more than just top-grade prime beef and steak, but all their products are market-fresh, and it exceptionally satisfies all guests in many different ways, which makes Ben & Jack's Steakhouse not just your typical steakhouse, one with an amazing experience - a hedonistic one.",0,0,0,Tom L.,"Brooklyn, NY",128,129,935
4.0,12/22/2018,Went there last night for dinner and ordered the burrata with tomatoes and roasted peppers porter house (medium) for two and few sides. The cream lesse creamed spinach was delicious and mushrooms are to die for there. Go there for the best steak,0,0,0,Marc A.,"Brooklyn, NY",3,30,22
4.0,12/16/2018,Great steaks.  Had our annual guys night here and loved the experience. Sides we're all very good but the prize was our Midwestern dry aged porterhouse for 4.:Charred on the outside and medium rare on the inside. Delicious and served with care by our friendly waiter.,0,0,0,A O.,"New York, NY",2,140,2
5.0,12/15/2018,One of the best steakhouses in the city. Service is top notch and the food is always delicious. Every time I want to go to a steakhouse this is the only place I think of.,0,0,0,Fazli G.,"New York, NY",26,17,0
5.0,12/8/2018,"Wow delicious steak, and fantastic service.  My first time having a dry aged steak, and it was phenomenal.  Had it family style with a group of seven.  The sear on the steak with the red middle was expertly cooked.  Sides of mushrooms, broccoli,  mac n cheese and mashed potatoes excellent.",0,0,0,Greg L.,"West Boylston, MA",0,5,0
