rating,time_created,text,useful,funny,cool,username,user_loc,user_friends,user_reviews,user_photos
3.0,5/7/2014,"I came to Rafele last Sunday for a small book club brunch.  My table had 4 people, and we were seated right away.  The place was pretty empty looking, but got crowded around 12:30.  Something important to note is that a company hosting food walking tours of NYC / West Village comes through here every 30-45 minutes, so there will constantly be groups of tourists either standing right outside or clogging up the front bar area.  When I was there, I didn't feel like my food or service was impacted (in fact, the food came out almost TOO fast to finish our conversation!), but consider yourself warned.At my table, we had the spinach frittata (mine, I enjoyed it and loved that it was $10), the French toast, and the Florentine benedict thing.  Everyone cleaned their plates.  Got some positive comments on the cappuccinos, too. The service was lightning fast and the guys were pleasant.  For me this would be a 3.5 star place... decided on 3 versus 4 because I probably wouldn't come back for brunch (partially because I'm a sucker for boozy brunches).  But if you live in the area, Rafele is a solid place and worth a try.",2,1,1,Dione D.,"Atlanta, GA",104,606,455
5.0,5/4/2014,"I went for brunch on Sunday and thought this place was excellent. It wasn't too crowded, though there were walking tour groups coming in and out and the service was great. I got the French Toast, which was to die for. I would come again, especially if I needed a place for a large group.",0,0,0,Christine C.,"Brooklyn, NY",33,12,2
5.0,5/4/2014,"This place is beautiful, the open kitchen and layout of the restaurant is amazing. but the food is even better, they have a great wine selection, the service is authentic Italian and the risotto rice balls and the mushroom pizza is to die for. GO, you will not regret it.",0,0,0,Olivia S.,"Manhattan, NY",25,13,0
3.0,4/27/2014,"I gave Rafele Ristorante three stars because the hostess started the experience badly. She asked if we had a reservation. When we told her no, she had to go get someone to tell him we didn't have a reservation and ask if we could be seated. Mind you, over half of the restaurant was empty. Anyways, when we got seated, our service was great. The food was really good and came out quickly. I had the gnocchi and my mom had the spinach ravioli. We both enjoyed our meals. If the hostess wasn't so rude, I would have given it four stars. I would suggest making a reservation to avoid this situation again.",0,1,0,Stephanie M.,"San Francisco, CA",13,130,46
3.0,4/19/2014,Good food and good service. I initially was turned off by we were not allowed to sit inside when we didn't have reservations.  There were plenty of empty tables.,0,0,0,Ninja h.,"New York, NY",0,241,280
5.0,4/18/2014,"Asked a few friends to join me for dinner and decided that Rafele would be a good choice.  I was right.  Everything was beautiful, delicious, fresh and seasonal, reasonable prices and great service.  It is located in the Village, near lots of live music venues.  It worked out perfectly for us.",0,0,0,Elizabeth B.,"Manhattan, NY",0,4,0
3.0,4/12/2014,"We feel bad giving Rafele a 3/5 because it was quite clear the manager felt like what he put in front of us today was a poor showing - and under different circumstances we probably would have walked out raving about how awesome this place is, but here is how it went down...We sat at the bar for a brief period of time watching them greet other patrons and it was quite clear the wait staff are well drilled and enthusiastic.Maybe it was just brunch on Saturday that sees this but Rafele sees waves and waves of tourist groups from what looks like a Greenwich Village walking tour.  Hence you get groups of like 20 people walking in who get rushed in and rushed out after what looks like one dish + wine.  Unfortunately this negatively affects the service for the rest of the patrons like us who are ass-parked in their seats waiting for their food as the focus seems to be on dealing with the walking tour people.  And the food is hence slow in getting out.As for the main pasta selections we had the tagliolini funghi which was really quite excellent but the spaghetti cacio e pepe was overloaded with the cacio to the point where we ended up leaving most of it untouched.  To be fair the manager took it off our final bill - in the end we think he felt bad about how this all played out, and so do we...",0,0,0,Stephen J.,"Manhattan, NY",79,233,4060
4.0,3/23/2014,"Visited Rafele on the recommendation of a friend, and our party thouroughly enjoyed our lunch.  Airy, open kitchen, clean, cool space, and great service.  Started with a simple margherita pizza - and it was just short of five stars.  Great char, and chew, fresh mozz, and sauce, but slightly soupy.  other apps included veal meatballs, and fried artichokes - both very good.  Pasta Carbonara entree was the highlight, other entrees chicken parm and chicken milanese were perfect.  So many options in the West Village  -- this has got to be one of the best !!!!",0,0,0,Robert M.,"Avon-by-the-Sea, NJ",4,72,0
4.0,3/17/2014,"This place is really lovely. It has a calm, no hassle vibe and the decor is beautiful. I had the mushroom pizza - be warned, you cannot really call it thin crust. I did enjoy it, the flavor was great, but I really prefer thin crust. My husband had the roasted chicken, which was delicious. The cheese cake is excellent. Not much else to say after going once, but I'd recommend it. Very attentive staff, as well.",0,0,0,Andrea Z.,"Brooklyn, NY",97,106,0
4.0,3/16/2014,"Great atmosphere and food was delicious. Per waiters recommendation, I got the chicken which was quite juicy and delicious. The wait staff was lovely. To top it off, the cheesecake was yummy too. I would definitely go back.",0,0,0,Leah D.,"Newark, NJ",268,196,206
4.0,3/14/2014,"Had a Valentine's day dinner there. Pre-set menu, 75 per person without drinks. Food was good, but I can't say it was memorable, i.e. I don't really remember what I ate. But whatever it was, it tasted good. Ambiance was nice, but we were sitting near a very cold window. I think it should be cool in summer when they make an open café out of it",0,0,0,Marina N.,"Midtown West, Manhattan, NY",9,17,0
5.0,3/13/2014,Quite possibly one of the best meals I've ever had. The Chef's tasting menu is only $45 per person for four courses and Rafele makes whatever he is feeling for you at the time. I wish we has known about this place before we came to NYC because we would have gone more times on our trip.,0,0,0,Brian G.,"Manhattan, KS",0,1,0
5.0,3/11/2014,"I love this place.  My friends and I like to go here for lunch to enjoy the wonderful food and the staff.  Rafele is a sweatheart! He always chats with us whenever he is there.  Our favorites are the Mista salad, the califlower and the breaded chicken with salad.  I just love it here! I can't wait to return.",0,0,0,Klysha R.,"New York, NY",144,250,136
5.0,3/10/2014,"This is the third time we've been to Rafele - we love it. It's simply the best, most authentic Italian food we have ever had. Everything from the wine list, to the home made pasta, to the amazing desserts. We will definitely be coming back :)",0,0,0,Normon S.,"New York, NY",1,44,1
4.0,3/8/2014,Went here for brunch today. Best French Toast I've ever tasted! The benedict with prosciutto and spinach was also delicious. The service was a little slow - a sign of its Italian authenticity ;) I will be back.,1,0,0,John R.,"New York, NY",64,348,0
5.0,3/6/2014,"The service and authenticity at Rafele are fantastic. Everyone is cheerful and very Italian which adds to the experience. They are very friendly and engage with everyone in great ways, so you feel as if you are with friends at all times here. We ordered the Margherita Pizza and the one with black olives. I'm not a black olive, or olive person, but boy what a balance in those slices of sweet marinara meshed with the sour olives. It gave the slices an incredible taste. So good. Also had the buratta with truffle oil and mushrooms and it was simply WOW. The wines are served at the perfect temperatures, and that's a HUGE thing for me since nearly 70% of all restaurants lack heavily in that department. Glasses of water are constantly filled, the servers pay you constant attention, and the look and design of the entire place is very, very nice. I'd recommend this as a date spot, or even if you're alone and just hungry, sit at the bar because you will have a very nice time. Enjoy!",2,0,0,Cyrus P.,"New York, NY",852,899,566
5.0,2/24/2014,"Best food in a long time! Good service, good atmosphere. Perfect place to bring a double date.  Food is outstanding!!",0,0,0,Cindy S.,"Williamsburg - North Side, Brooklyn, NY",0,1,0
4.0,2/23/2014,"I was tempted to give five stars but I think with anything there is always room for improvement. But with that being said I absolutely enjoyed my dinner at Rafele last night. While waiting for my friend I had the ""29"" cocktail which was terrifically strong. Once my friend arrived we got down to business and ordered the chicken liver pate and scallop with cannellini beans and caviar special to start. Both were amazing but the pate really took the cake. I strongly suggest it. For our entrees we ordered the seafood spaghetti (spaghetti schizzetto) and the pettole ragu. Dinner was magnificent and there is nothing I would have changed. Service was also outstanding. I cannot wait to return!",0,0,0,Monique C.,"Brooklyn, NY",0,9,7
2.0,2/23/2014,"I can't recommend Rafele. The main reason is because price to quality ration is poor and many other restaurants in the area offer way better food at this price. My experience is that Rafele is mediocre. Here are the things I liked:-A well made cocktail-Wine served at the proper temperature and in the right glass-Simple presentation of the food-Well considered and well written menuNot liked:-Food served not properly cooked and not promptly served. Arancini, what should be a delightfully lightly fried risotto dumpling with steaming, melty cheese inside was served half cooked and the cheese inside was cold. Basic stuff. Main dish, ravioli was in a moat of coagulated broth. There was a skin on the top. Plate was not hot. This is unacceptable. -Other main dishes, grilled steak and pork chop were cooked simply, but were not an improvement on what a home cook might accomplish.-The service was very outgoing and overly friendly to the point of dis-ingenuousness, much in the style of a server at TGI Fridays and many suburban American restaurants. While some people might like it, I do not prefer that kind of service.  She introduced herself by name and kept checking up to see if ""everything was OK"", interrupting our conversation repeatedly. She said she was SO happy we were there, etc. -The kitchen was not properly ventilated causing cooking smells to infuse our clothing. Even though this is not uncommon in my experience, I don't think it's ever OK, especially at $150 for two people. To be fair, I have only been to Rafele once, but I'm not sure how another visit would change the problems I experienced.",0,1,0,Jane s.,"Brooklyn, NY",0,12,0
5.0,2/22/2014,"Yelp brought me to Rafele Ristorante, and I was not disappointed. The waitstaff was friendly and attentive. We ordered the special starter of burrata with arugula and prosciutto- the creamy cheese was rich and fresh. I thought perhaps it might pair well with a harder vegetable (perhaps endive?) because the creaminess of the burrata wilted the arugula. It was tasty nonetheless. The Rafele pizza was a delicious mix of prosciutto and mozzarella, and had a rustic look to it.  I really enjoyed the hand made gnocchi- very flavorful. I'd definitely order it again. The beets ravioli was also very unique- had a slight pretty pink tinge but I was not a fan of the filling which had a bit of chestnut. A slice of the ricotta cheese cake was brought out at the end for a friend's birthday which was a great end to the meal.",2,0,0,Diana T.,"LITTLE NECK, NY",81,156,61
5.0,2/12/2014,"excellent food, atmosphere and service. Decor is a fusion of rustic and modern! I love open kitchen where you can see cooking. Fried artichokes and gnocco fritto are outstanding. Pizza is 100% authentic Italian.Owner/Executive Chef, Raffaele Ronca, and all his staff are always very friendly and welcoming.Definitely 5 stars!!!",0,0,0,FineDiner M.,"Brooklyn, NY",0,14,0
5.0,2/5/2014,"I like Rafele for a couple reasons.1. I can make a reservation for 10 people on a Friday night - the day of - without having to bribe the host/hostess. It's spacious enough to accommodate large groups. That's so rare in NYC!2. Downstairs seating by the wine cellar is secluded and quiet.3. Servers are attentive and helpful.4. I had a life-changing chicken liver pate appetizer served with ricotta and honey. If you see it on the menu, ORDER IT. It was so good that my boyfriend attempted to recreate it the next day. 5. Their pizza and pasta selections are delicious, unique, and nicely priced.6. Basically everything is yum.",3,2,1,Valerie L.,"San Francisco, CA",245,652,2
4.0,1/8/2014,"We stopped in for an emergency pizza. Sat at the Open Kitchen table. I enjoyed the vibe, food and the seats. Service was attentive.",0,0,0,Nick V.,"Absecon, NJ",325,107,23
5.0,1/2/2014,"Love this place, it is one of our go-to west village spots. The menu is fantastic and we can usually snag a seat at the bar for dinner. The cauliflower, gnocchi, and salad with fennel are faves. Plus the cheesecake is amazing.We love this place so much we had my husband's Christmas party there. During the summer they have a good amount of outdoor seating.",1,0,1,Persia T.,"New York, NY",337,187,23
5.0,12/28/2013,"Excellent food in a comfortable atmosphere.   This is traditional Italian food with a slight twist...great rich flavors.  Portions are generous and prices are decent.  Great caponata comes with breads...had excellent burrata appetizer, foccaccia style pizza.  Pork chop was perfectly cooked with a mushroom side and delicate jus. ..Cauliflower entrée was also wonderful, if you can believe it... Had a bufala ricotta cheesecake that was also wonderful. ..",0,0,0,Michael H.,"Belmont, CA",53,11,0
4.0,12/21/2013,Food was really tasty and cute atmosphere. Our waitress was very nice. And apparently Mr Big also likes this place!,0,0,0,Amy Z.,"Midtown East, Manhattan, NY",2,33,7
4.0,12/7/2013,"Amazing pizza fritta, branzino, etc.  Excellent service.",0,0,0,Katherine T.,"West Village, Manhattan, NY",5,7,58
5.0,11/23/2013,"Can't rave enough about this place.  The food was great, and so was the wine.  My wife loved her pumpkin ravioli and mushroom tagliatelle.  Must of all we loved the cozy, laid-back atmosphere and the super-friendly staff.  Would certainly come back.",0,0,0,Adam S.,"Madrid, Spain",9,183,0
5.0,11/17/2013,"The food was really delicious, and service was great as well. Probably the best italian food I've had in NYC. We ordered the mushroom pasta, the seafood pasta, the calamari, the margherita pizza, and an arugula salad. I was impressed with every dish. I kind of had high expectations after reading the reviews on this place. I'm glad I was not disappointed. I also loved the open kitchen! So beautiful!",0,0,0,E K.,"Orange County, CA",1,61,1
5.0,11/15/2013,Excellent dinner with outstanding service. We ordered the chef's tasting menu and we loved it. We had a wide variety of foods and way more than we should have eaten.  I couldn't tell you what my favorite was. I also ordered the sangria which was the best I have had.Tell your friends and check this place out.,0,0,0,Susan G.,"Centralia, WA",0,8,0
4.0,11/11/2013,"KenScale: 8.0/10Rafele is an Italian restaurant from chef Raffaele Ronca. Located on the Seventh Avenue in the West Village, I probably passed it by multiple times thinking it is just another neighborhood spot among a glut of Italian restaurants in the neighboor, but the quality of food was surprisingly good, with a lot of solid and well-executed Neopolitan dishes.I started the meal with Rafele pizza (with proscuitto, mozzarella, arugula), a solid starter. Then came pan seared veal and beef mealballs in light tomato sauce and roasted cauliflower salad with black currants, pine nuts, and breadcrumbs. Both dishes were well-executed, especially the cauliflower salad whose crunchy texture I enjoyed greatly. I shared two pastas afterward, spaghetti with mixed seafood and sun golden tomatoes and pettole pasta with Colorado lamb ragu. Both dishes were also pretty solid, with that rich flavor of rustic Italian cuisine without being overly salty (a big no-no when it comes to pastas for me). I also enjoyed the roasted organic chicken and grilled branzino. I liked the fact that branzino came without too much seasoning to allow me to savor the tenderness of the fish. For dessert, I had cheese cake, which was delicious but not amazing (I kind of wish I should've ordered more classic Italian sweets such as semifreddo). It's very easy to get a reservation at the restaurant online, but by no means was it empty when I came. The scene is pretty casual, and you can see the open kitchen and the brick oven next to it. I definitely consider Rafele better than an average Italian joint in the West Village, and do recommend it for a casual Italian dinner after strolling around SoHo or West Village.",3,1,1,Ken S.,"Manhattan, NY",512,612,4738
5.0,11/11/2013,"My mom and I visited New York to celebrate our 60th and 30th birthdays, and were introduced to Rafele during a Food Tour in Greenwich villiage.  We made reservations on the spot for the following night.Our server was Andrea, and she was absolutely terrific.  We met her during the food tour, and she treated us like old friends and restaurant regulars.  We decided to do the Chef Special which included 4 courses: appetizer, pasta, entree, and dessert.  This was a wonderful way to experience the menu, and to try several items I may not have ordered on my own.  The highlight for me was the pasta special which was a butternut squash ravioli -- TO DIE FOR.  Homemade pasta, cooked perfectly with a creamy butter sauce...I even recommended it to the table sitting next to us.  One of the side dishes for the entree was brussel sprouts, fried and seasoned.  I would NEVER have ordered these, but they were absolutely delicious.  The ricotta cheesecake was unlike anything I have had before -- I am accustomed to the American version made with cream cheese.  It was creamy and delicious without being too sweet, and was the perfect way to end the meal.If you have a chance, go to Rafele.  You won't regret it, and it may become a highlight for you as it did for my mom and I.AND thanks to Andrea for making our experience fun and personal!",0,0,0,Laura B.,"Lexington, SC",2,4,0
5.0,11/10/2013,"We've been twice for lunch now and ordered so many items on the menu. I never say this but this place does not have a weak dish! The finocchio, polpettine and carciofii (fried artichokes - I've never had this until now - amazing!) are excellent appetizers, as well as the cavolfiore (roasted cauliflower with black currants, pine nuts and breadcrumbs.) Pastas are a MUST - they're handmade in house, and I loved the carbonara. The service is always warm and personalized and we've never seen the place packed and stressful. Never a wait, no nonsense. Just a lovely place to go, especially on cold days in NYC, where you will leave feeling happy and satisfied.",0,0,0,Stacy S.,"Los Angeles, CA",2,15,1
5.0,11/2/2013,"Hands down my favourite Italian restaurant in NYC -- great ambience and of course the food is incredible -- i love their homemade pastas (the tagiolini al funghi and the gnocci are my favourite). Start with the fried calamari with sage and fennel and end with the ricotta cheesecake -- it really is a little piece of heaven. They have an amazing wine list too. If you're looking for an authentic Italian restaurant, you must try this one.",0,0,2,P D.,"New York, NY",0,5,0
5.0,10/26/2013,We were introduced to Rafele and his restaurant -- Ristorante Rafele (rafele.com). -- on the Original Greenwich Village Food and Culture Tour by FoodTours. After the tasting there. we returned for a meal. We opted for the tasting menu which was much more than a taste - all nine dishes we had were in more than generous portions. And they were all wonderful! I especially liked the Eggplant parmigiana and the Tagliolini Al funghi (mixed mushrooms and truffle pate). The staff was warm and friendly and provided professional service. I look forward to a return visit the next time I'm in NYC.,0,0,0,Joan D.,"San Francisco, CA",0,2,0
4.0,10/14/2013,"Discovered this place by chance while out shopping and then finding myself desperately hungry and in search of something a little decadent. For appetizer the zucchini flowers which was phenomenal. Next the lamb tagliatelle which was very good but not excellent. Very flavorful but the pasta was stuck together in places - giving you just a mouthful of plain old pasta. The cheesecake alone is worth coming for! It is light, not too sweet and with a perfect consistency.",0,0,0,Osa O.,"Los Angeles, CA",19,8,0
5.0,10/12/2013,"Our meal at Rafale was the highlight of our trip to NYC.  The delicious food, the gracious owner/chef and the service were impeccable.  We are big foodies from the wine country in California.  Needless to say, we have very high food standards.  We had the chef's tasting menu.  This is a four-course amazing meal, where Chef Rafale talks to us first about our likes, dislikes, and preferences (very reasonably priced, as well). He then prepared this food to our tastes.  We spent a long afternoon enjoying this sumptuous meal.  Everything was delicious and fresh, but do not miss the spaghetti cacio e pepe (pecorino cheese and pepper).  We're not sure how he takes such simple ingredients and turns them into something magnificent.  We'll be back and we would recommend this restaurant to anyone who wants a great NYC food experience.",0,0,0,Gail G.,"Healdsburg, CA",2,4,0
3.0,10/9/2013,Rafele is a really great neighborhood Italian joint. You can't go wrong with any pastas on their menu but the taglioni al funghi and the pettole ragu are highly recommended. Wine list is also pretty good.,0,0,0,Kathryn R.,"Manhattan, NY",16,106,0
4.0,10/8/2013,I went here on Saturday night with 3 friends while visiting New York. The location in the West Village was super easy to find and access all of the night life post dinner. I was really looking forward to the chef's special ravioli but sadly Chef Raffaele spilled the last of it so I went for the seafood pasta. It was still delicious! Had a bottle of the Montepulciano and we split a slice of cheesecake at the end. All in all a lovely dinner in a great location!,2,0,1,Carolyn L.,"Los Angeles, CA",911,706,290
3.0,10/6/2013,"This was a pretty decent Italian place.  Great outdoor seating if the weather permits, and good service.  The chicken liver pate (awesome with the honey and cream), the burrata, the lamb pasta dish and the seafood pasta... all good and at decent prices.  I'd go back again if I was in the neighborhood.",1,1,1,Ajay R.,"Brooklyn, NY",630,631,399
4.0,10/6/2013,Had a taste of the eggplant cannoli on our food tour. It was really good. Perfect crisp to the eggplant and it wasn't too thick or overpowering. It's filled with a good tasting cheese. I usually wouldn't order this but glad I had a taste.,0,0,0,Monica V.,"Ventura, CA",54,108,89
5.0,9/29/2013,"My brother recommended that we check out this place. I don't think he's ever recommended a restaurant to me before and he knows how I'm routinely unimpressed by Italian restaurants; a consequence of being in a family of outstanding Italian cooks. So we decided to check it out.One of my favorite Italian appetizers is caponata which is a mixture of chopped eggplant, peppers and onions with other savory things like capers and olives. My mother always makes it when she wants to treat me special. Here they put it on every table with an assortment of breads. Rafael's caponata is the first I've ever tasted that measured up to my mother's.We also had some other appetizers that were all good including mussels, crispy artichoke hearts and arancini. My daughter really loved the arancini. She's a huge fan of strong cheese. If you are, too, don't skip the arancini.We had a late lunch and this was an early dinner so I was the only one who had an entree. I got the spaghetti schizzetto and would recommend for anyone who likes seafood.The desserts were also fantastic. The cheesecake seems to be loved by everyone who eats here and the praise is well deserved. We also had the affogato, which is vanilla gelato with a shot of espresso poured over it. It's my wife's new favorite wherever it's served and she said it was delicious. We also had the tira mi su and it was also very good.There are a lot of places to eat in the Village but this place should not be skipped.",0,0,1,Eric F.,"Lowell, MA",46,25,24
4.0,9/26/2013,"I had a lovely date night dinner at Rafele with my husband.  We felt the staff was friendly and dinner was excellent.  I had the Branzino.  The ambience was hip, cool and romantic.  The only turn off was that when my plate was presented to me the actual plate was chipped.I know it shouldn't have been a big deal, but to me it was. What an eyesore!Hopefully next time they will sweat the details for me!",0,0,0,Yesenia D.,"Manhattan, NY",210,15,10
