rating,time_created,text,useful,funny,cool,username,user_loc,user_friends,user_reviews,user_photos
5.0,4/22/2019,"Insanely good.  Burger was delicious, fried chicken moist and so tender it was like filet mignon (but chicken).  Great service.  We are tourists so likely will never be back, but it was one of the best meals we had.  I wish I could have tried breakfast.",0,0,0,Mike D.,"San Diego, CA",0,144,1
5.0,4/14/2019,"I took some visiting friend to Nickel & Diner and we all LOVED it! It's a beautiful space with great cocktails & great menu. Great spot for after-work happy hour, and Felix who served us made us feel right at home! I will be back soon!!",0,0,0,Leah R.,"Tucker, GA",0,7,0
5.0,4/14/2019,"Cute, simple, clean and very organized little diner. Customer service is perfect and very educated on the area and how to travel To all the must see places. Great music too. Hip with spicy vibes just like the two of us",0,0,0,Jessica V.,"Kennewick, WA",648,6,15
4.0,4/13/2019,"Not your typical diner. Very modern and lovely inside. My coworker and I stopped in for a quick lunch one day around 1:15pm. It was packed! We were able to get one of the last tables available and seated right away. The menu is a bit pricy. $18 for a chicken sandwich and $10 or so for the vegetable soup. The chicken sandwich did not disappoint (besides for the price). It was a thick piece of white chicken and fried crispy with coleslaw on top of it. I gave half to my friend because it was too much for me. The sandwiches do come with fries so it justifies the price slightly. The service was fine, nothing great, although I understand they were very busy with the lunch crowd. I didn't exactly love this place, but I didn't dislike it. Not sure if I would return.",0,0,0,J K.,"New York, NY",4,164,95
5.0,4/11/2019,"Had dinner tonight with friends, it was so comfortable with no pressure of staying almost 3 hours. The food was wonderful and the wine was just right. It was a lovely evening indeed and we certainly would come again.",0,0,0,Lilli P.,"San Francisco, CA",0,1,0
1.0,4/11/2019,Not very pro. 3 out of 3 times have come in at 8:30 and kitchen is not open because there's only one person in. Stuff happens but it's a pretty unreliable spot.,1,0,0,alex l.,"Long Island City, NY",118,18,7
5.0,4/5/2019,Best place for brunch and dinner. The manager is a great host and made the dinner a very enjoyable one. I love this place and continue to come back!,0,0,0,Wanessa Y.,"Manhattan, NY",2,2,0
3.0,4/3/2019,"I went back recently and honestly, I'm so shocked and not as impressed! I loved Nickel & Diner when it first opened and I visited. The food was more flavorful and creative when it first opened. Versus now, it feels like the portion is a lot smaller, food is less creative and it taste mediocre.I brought my friends from Seattle here as I haven't been here for a couple of months now and I was extremely disappointed from the whole experience. I thought I was bringing my friends to an amazing brunch spot but.. it was just mediocre.Hope they can change my mind again!",1,0,1,Suki W.,"New York, NY",140,180,1395
5.0,4/3/2019,This is probably one of my favorite brunch spots! I walked in and was instantly attracted to the interior design. The hostess seated me quickly and the waitress walked me through the menu. The food was amazing and was cooked perfectly. Will definitely come back to try the rest of the menu!,0,0,0,Anny L.,"Brooklyn, Brooklyn, NY",0,6,5
5.0,3/31/2019,Best Burger I've ever had! It's so juicy and perfectly assembled!!! Even the fries are good! Next time I visit NY definitely will stop by again. The diner is so cute and the servers so kind!,0,0,0,Ysabel S.,"Sunnyvale, CA",231,18,5
1.0,3/23/2019,"You get better greetings at a MacDonald's drive thru then this place. Ask the maitre d to drop the attitude and stop yelling at the guests as they get through the door!By the polarizng reviews, you may or may not have an enjoyable experience at this place. Good luck!",0,0,0,Ronald A.,"Manhattan, NY",0,1,0
2.0,3/22/2019,"I've eaten in the restaurant before, and have always had a great experience.So, it was unfortunate that we decided that some people in our office decided to order lunch from here today, and had one of the worst ordering out experiences we've ever had.For the privilege of paying a $2.99 delivery fee, this is what we received:- 2 sad, soft, grilled cheeses, that was supposed to be on brioche, but was instead on a generic piece of bread. Not crispy or tasty in the slightest- 2 tomato soups that came with the grilled cheese, where they could barely bother to fill the container past the halfway mark- One BLT, that was also supposed to be on brioche, but was on the same sad bread, that came completely fallen apart (is sticking a toothpick in to hold it together too hard?), that was supposed to come with a side salad, but didn't. We asked for a side of tabasco, but that didn't come either.My side of hashbrowns were decent. That's all I can say. Maybe we sound like pretentious assholes. But we paid pretentious prices as a treat and got worse food than going to a regular diner. Thanks for ruining our Friday office lunch, Nickel and Dimer. Never again.",0,0,0,will s.,"New York, NY",7,10,2
2.0,3/16/2019,"Got chicken soup and did not come with chicken and the pieces of carrot and celery were all 1/2cm mini cubes. I paid $10 for chicken broth. Overpriced and was not substantial at all, obviously .... and before I ordred, the waiter said the soup is large. The food is not bad but not worth the money - save your cash and go somewhere else. Will say the decor is nice and the bathroom lighting is on point for selfies though, ha.",0,0,0,Nao H.,"Manhattan, NY",149,4,0
4.0,3/14/2019,"Diner feel. Trendy food. Came here after an event for a late lunch. Was seated for 3 with no problem at a cute booth by a window. The diner decor is cool, but even cooler with a bar behind the counter. We got 2 burgers and the chicken and waffles. All delicious. The Pat LaFrieda patty was HUGE and so good. The chicken was perfectly seasoned and addicting. Recommend both. Typical New York prices. However, service was not super attentive and we waited a while for our check even though we were some of the only people in there. Food was worth it, but I'm not over the top impressed.",1,0,1,Ashley O.,"Hartford, CT",266,62,100
3.0,3/10/2019,Modern day diner. Staff was nice but menu items were more attractive on the menu than on our table. Fresh fruit side (with pancakes order) doesn't mean an assortment but a handful of blueberrys or whatever they decide is the fruit of the day. The salad bowl says it comes with sweet potato but it's more of a decorative addition and no more than a teaspoon. Found the menu a bit misleading from these orders. Won't be returning.,0,0,0,Charles A.,"Brooklyn, NY",0,39,2
4.0,3/6/2019,"I came for brunch with a friend and the place was fairly packed. We opted to sit at the bar as there was a decent wait for a normal table. The bar area was almost full as well, but I didn't feel like I was on top of anyone and it was still very comfortable. I'm absolutely in love with the grain bowl! The portions are bigger than expected and the flavors blend mesh so well. Once you split the egg on top, it really brings it all together. My friend had ordered the eggs benedict, which was just okay and not really spectacular compared to other places.",0,0,0,Jensen D.,"North Dallas, Dallas, TX",232,49,98
5.0,3/6/2019,"Arrived Wednesday evening at 8PM for an 8:30 reservation. I waited at the bar where they offer me the drink menu. The restaurant wasn't too busy at this hour. When my friend finally arrived, we sat in the back in a diner style booth. I'd say it was quiet spacious and could've fit 4 people comfortably. The restaurant welcomes the late crowd as there were all sorts of people who came in throughout the evening time. They close at 11PM.Another friend joined us at the start of dinner so we had a size of 3. We were told to try the Clam Toast, which to me sounded like clams between two pieces of toasted bread. When it arrived, the saucy clams were wide open on top of... toasted bread! It was by far one of my favorites of the evening. The bread underneath soaked up the delectable sauce and tasted amazing a nice balance of savoriness. My next favorite was the Sliders. The patty was not over done and was well-flavored, with onions, American cheese, pickles, greens on top. No additional ketchup needed. We also went for the Braised Short Ribs and the potato puree was divine. The ribs were tender and the juice intact. The last item I had was the Skate Grenobloise, something totally new to me. It was tasty but I don't know if it would be my immediate choice. I did take home the leftovers short ribs and skate, which was delicious the next day.There's a cafe/morning option, as well as lunch menu available. Would have to come again to see how it compares to dinner.",1,0,1,Eunice C.,"Brooklyn, NY",184,254,132
2.0,3/4/2019,"if you want to pay $20 for a flat, dense waffle and over cooked scrambled eggs this is the place for you!in all fairness, the restaurant itself is cute and the latte i got was delicious. just overpriced for the quality of food.",1,1,0,Ana Maria H.,"Central Beaverton, Beaverton, OR",0,2,2
2.0,2/19/2019,"Came for coffee, it was on the pricier side and came lukewarm bordering cold. The service matched the coffee. This may be place you come for the food/the ambiance while eating the food, but maybe somewhere else if you want a good cup of coffee.",0,0,0,Trang B.,"San Jose, CA",182,733,97
1.0,2/17/2019,"The only fools are the customers. $19 for an egg Benedict--with not even a side salad or side of potatoes. $12 for an egg sandwich--on a English muffin I could have made for myself in 2 minutes in the comfort of my home. An egg, slice of cheese, link sausage cut in half. Oh and did I add--it doesn't come with any sides. Grossly overpriced, so blatant and obvious it just says ""let's play customers like a bunch of fools."" None of this food is worth a fraction. Don't waste your money. Nothing to see here. Literally nothing, on your plate for your money.",1,1,0,Whitney L.,"Manhattan, NY",1,59,12
3.0,2/11/2019,Did this place change ownership? I don't think so...but I have noticed a huge difference in the quality of food and service the last three visits the past month. Food is not as good as it use to be and seems like some turnover in staff makes for an overpriced and underwhelming diner. Same hip vibe though.,0,0,0,David J.,"Manhattan, NY",0,13,0
3.0,2/5/2019,"Service was fast and efficient. We came again for the egg sandwich as we had over the last couple of years (and enjoyed), but it's not how we remember it. The menu indicates that it comes on a Kaiser roll; instead it is now served on an English muffin. I suppose the bread's origin shouldn't really matter, but it was disappointing.",0,0,0,A L.,"New York, NY",4,50,159
3.0,1/22/2019,"I showed up for brunch at Nikel & Diner on a fairly slow cold Sunday with some friends. I was pleasantly surprised by how beautiful and large the space was and was excited to try their menu as I'd never been here before. I'm not sure if it was just our waiter or the fact that there wasn't a lot of people dining but our service was very poor. Our waitress kept spilling our drinks all over the table and never came back to clean it up and only asked us for drinks once.They seem to have a good selection for brunch and lunch and I was determined not to let our poor service ruin my opinion on the food. I ordered the classic Eggs Benedict that came with a side salad and unfortunately these were not good either. The eggs were practically boiled and the English muffins burnt. I would've sent them back but our waiter was never around. The drinks were good, however, I got a mimosa and white wine but overpriced for what you get and for the area.Maybe this was just an off-day for them but I wasn't very impressed and it was just okay.",1,0,1,Brittanny K.,"Brooklyn, NY",205,108,333
3.0,1/22/2019,"Super cute vibe, feels like an upscale, old fashioned diner.  Good space, easy to get a reservation for brunch on a Sunday.  It seems like they have plenty of space to accommodate. The food was ok. Two of us had the grilled cheese with tomato soup.  Both fine, nothing to write home about, a small grilled cheese on whole wheat bread with two kinds of cheeses and a very basic soup for $16 was a bit much.  I've had fancy grilled cheeses before, this was not that, it was much closer to a diner grilled cheese, but without the greasy satisfaction.  Overpriced.The service was not great.. I had accidentally misread the wine list and asked for a glass of pinot grigio.. the waitresses' response was ""we dont have that"" i was confused, i could have sworn i just read it on the menu, then my friend pointed out, ""its only by the bottle"" ok, my mistake, but she could have said so instead of acting like i made something up completely out of thin air. Then when i said Oh what white wine do you have by the glass, her response was ""its written right there"" pointing at the drink menu, which my friend was currently reading so I clearly could not see.  Just struck me as rude and unhelpful. Our drinks and food were delivered quickly but by the time we were done, she had disappeared, we had to ask the busboy for another round of drinks when he was clearing our plates.overall, cute space but the food and service could be improved.",1,1,1,Morgan G.,"New York, NY",4,16,1
2.0,1/20/2019,"Ordered the Nickle Burger. Their menu doesn't specify whether their buns are brioche/dairy, so I asked in the instructions to swap out the bun for a non-dairy bun if the regular had dairy.I got a slice of brown bread. ‍Pretty sure that a restaurant charging $26 (all inc.) for a burger by delivery, can do better than this. Just ludicrous. The fries were wet and cold.They refunded me 50% back - so they get an extra star.",3,0,0,Matthew D.,"Manhattan, New York, NY",46,183,314
1.0,1/18/2019,"the customer service is terrible, unfathomably rude to be more precise. the waiters' and greeters' churlish behavior is only indicative of poor training and ineffective management. no wonder this place has a not so nice reputation among coworkers.",0,0,0,Shantanu T.,"Elmhurst, Queens, NY",33,2,0
1.0,1/18/2019,"Crappy service with nasty attitudes esp the male greeter with the iPad, which is unfortunate because the food is semi-decent. The professionalism and maturity displayed at this restaurant is comparable to that of a pack of middle school mean girls. You could clearly see their attempt to come across as an upscale diner but they are below par or mediocre, at best.",0,0,0,Katherine T.,"New York, NY",174,15,2
5.0,1/15/2019,"Delicious!! I got the eggs Benedict with mushrooms and spinach and a latte with oat milk. The eggs were cooked perfectly, the portion size was perfect, and the latte was absolutely fantastic. I would definitely come here again!",0,0,0,Bella A.,"Manhattan, New York, NY",131,3,1
1.0,1/15/2019,"I generally do not like to complain about service, but the service I received at Nickel and Diner last week (09Jan2019) was unacceptable, to say the least. I understand mistakes happen, but how you handlethem is what sets good businesses apart from the rest. How do youbring an order out extremely late and not even say ""apologies for thewait"" (we waited over 15 minutes for the order to come in). No onecared to even acknowledge that a mistake was made. I reached out to them via email (info@nickelanddiner.com), yet it's been a week and no response. I'm obviously very upset about this experience. I've been toNickel and Diner multiple times, as it is close to my job. However,after this experience, I don't think I'll be coming back.",1,0,0,Ramon P.,"Bronxville, NY",0,3,0
5.0,1/13/2019,"Very cute cafe that takes reservations for brunch! I really liked my grain bowl. It was tasty and healthy.The service is very friendly and the seating is spacious and comfortable. I'd recommend to make a reservation before you go, because there's usually a long wait",2,0,1,Sinan Z.,"New York, NY",320,133,417
2.0,1/7/2019,"Really lovely design. Convenient location. On a recent visit, we were told the kitchen was closed (a weekday at 9am?), seated for coffee, and then brusquely told the kitchen had *just* reopened. Granola (served with Greek yogurt) tasted like it had been sitting on a shelf for months--stale, bland, store-bought. There are a ton of positive reviews here. Not sure what I'm missing.",1,0,0,Kettina B.,"New York, NY",7,24,0
4.0,1/2/2019,"I'd love to come back here for drinks sometime to see what those are like here. I had the cold brew milkshake, a novel idea. It was good. Not super coffee-like, but good. Then for food I had the lemon ricotta pancakes. They had the option of adding seasonal fruits etc. And I'd thought that meant on top/on the side, but they baked blueberries into the pancakes. It could've had a bit more of the lemon and ricotta element considering its description but for now I'll let it fly. The side of bacon I had was good as well. They also have a small coffee bar at  the front, I believe serving Stumptown. The decor here is like an elevated, elegant diner, and I do love the name. This is a nice place to go for lunch/brunch with friends as they have booths.",1,0,2,Celia N.,"Brooklyn, NY",46,178,655
4.0,12/30/2018,A cute little spot with good food and drinks. The chicken n waffles were tasty and came with a sweet and spicy sauce for the chicken. The cheeseburgers were reminiscent of White Castle burgers but WAY better! Happy they were able to make my new fav drink a French 76!,0,0,0,Cheryl B.,"Miami, FL",34,20,42
3.0,12/16/2018,The service is alright and the food is average...would not go here again. I got the grilled chicken salad and pancakes...waited for 40 mins to have my food ready,0,0,0,Teresa L.,"Manhattan, New York, NY",0,14,10
1.0,12/15/2018,The manager FELIX was so rude to us that we left.  He should not be in service business and this diner needs to seriously re-evaluate its hiring.,1,1,0,John B.,"New York, NY",0,1,0
5.0,12/15/2018,"If you're in the fence about where to go, go here. Best steak and eggs of my life. Service is fantastic, great coffee and bloody Mary's too.",0,0,0,Andrew W.,"Manhattan, NY",0,5,0
4.0,12/9/2018,"A ""hip"" diner with modern meets retro feels. Prices are more in line with SoHo/Tribeca than Chinatown, but the food quality lives up to the prices.  The staff is very friendly and helpful, though it did take a little long to receive the coffee I had to remind them about (and that was after the reminder). Other than that, a very good overall experience.",1,0,0,Bruce M.,"Manhattan, NY",52,15,17
4.0,12/7/2018,"LOOOVED everything about this quaint little place. . . From the cozy booths to the friendly waiters we felt right at home in this place. It was the perfect place to take a break from the cold and enjoy some fun people watching over brunch. Nickel & Diner absolutely nailed the upscale diner vibe, comforting flavors with unique foodie twists. The corned beef hash was fantastic! Would love to come back & try more :)",1,0,2,Mariel S.,"Los Angeles, CA",480,43,85
5.0,12/4/2018,"Uuhhhhmaazzzingly delicious.  We had an omelette and lemon ricotta pancakes and all to be washed down with an almond milk latte.  The omelette: veggies, fluffy, and seasoned to perfection.  It was paired with an amazing salad. Mild in flavor dressing. The pancakes were mouth watering, soft, melting, and fluffy!! Make sure to try these out for sure! We were able to walk in without wait, but they do take reservations. We wanted to return the following morning so I attempted to be proactive by making reservations for 8:30, however unfortunately I received a call that my reservation had to be cancelled due to kitchen issues. Really?? A kitchen malfunction!? :-) oh well. If you're in the neighborhood, try this place out.There's no parking, that I can remember at least. The decorating and music definitely had the New York feel to it.  This spot is definitely in my""must stop by again"" list.",4,3,2,Silvia D.,"Rancho Cucamonga, CA",69,215,260
5.0,12/1/2018,"Stopped in for a quick breakfast and was totally amazed!! We expected sub-par service and received A+ service. The food is absolutely delicious, the staff is very attentive but not overbearing and this place has the cleanest restrooms I've ever seen. Will definitely return to taste more menu items. The lemon-ricotta pancakes and crispy bacon are TO DIE FOR!! *Super impressed!!!",0,0,0,Tiffany G.,"Jersey City, NJ",0,3,0
4.0,11/28/2018,"Came here with a small group for a coworker's farewell dinner. Was seated in a cute booth in the back, a comfortable spot for easy conversation. I ordered the Nickel Burger, described as an 8oz Pat LaFrieda beef, arugula, red onion, tomato, spicy mayo and it was good, very heavy and filling. Loved the french fries that came with it, crispy and piled high. A coworker ordered the Fish & Chips, which also looked delicious. Service was friendly, checking in on us a few times.",0,0,0,Helen H.,"Brooklyn, NY",14,110,478
4.0,11/25/2018,"We were a group of 4 in this area and we wanted something to eat around 8pm on a rainy Saturday so we came here, we didn't want to wait too long since it was already kind of late for food so we were happy that we were able to sit right away. The ambiance is nice and relaxed, it does resemble an old school diner in terms of design but definitely a more modern version. The drinks we ordered were good, they have a basic wine list, some beer (bottle and on tap) and some cocktails, I had something called a bourbon sunrise which was good I enjoyed it and it hit the spot, as far as food we shared a braised meatball appetizer which only had 3 meatballs and some bread but we were able to share it anyway, we all enjoyed the flavor, as far as entrees my girlfriend had the bacon carbonara which she didn't like all that much because it was too salty, I had the chicken sandwich with fries, our company had chicken and waffles and fish and chips, the chicken was a bit spicy so those who are sensitive to that may need to avoid, the fries were good and I liked the chicken sandwich but far from my favorite, overall this place is solid to grab a quick meal, if I was right in the area I'd come back but I don't think I'd go out of my was to come back place because nothing stood out food wise.",1,0,2,Jerry L.,"New Rochelle, NY",171,335,1257
4.0,11/23/2018,"Bomb. I stumbled into this place but iwould come back over and over . This place hit the spot in ambience, food, and decor. Highly reccomend . :)",0,0,0,Lisa N.,"Los Angeles, CA",694,97,4
2.0,11/23/2018,"Chose N&D for Thanksgiving with friends and there was a lot lacking. First they changed there menu!! We made reservations based on a menu that was posted on Oct 29th. And when we looked at the menu before going to restaurant, it had totally changed. We were disappointed. Squash soup was not soup but purée squash and not super hot. Consume was good. Everything needed salt!!! It's like the chef wasn't even tasting items. The risotto was super undercooked- not even edible. I had to send it back. Desserts bland and not even a homemade crust! The gnocchi was good and so were the beets and salmon and Brussels sprouts. Won't go back again.",0,0,0,Amy H.,"Brooklyn, Brooklyn, NY",0,3,0
5.0,11/22/2018,"Update: Just came here for thanksgiving dinner. BEST TURKEY EVER! Chef Mike is the best! Came here last night for dinner and the new seasonal menu blew my mind. We shared the spinach salad, pork chop, and duck. I never leave that place without having the charcoal soft serve. Definitely come check out the new menu. Might go today for brunch too.",0,0,0,Cindy Q.,"Midtown West, Manhattan, NY",184,2,3
2.0,11/22/2018,"Thanksgiving can always be a challenge for restaurants.  Nickel and Diner was not up to the challenge today.We had a noon reservation and arrived early.  We were the first group there.  When the door opened we were escorted to our table.  Five minutes later we were told we had been seated at the wrong table and escorted to another one.We had our 18month old granddaughter with us.  We ordered drinks and all the menu selections rapidly.  Adam, our server was pleasant and effective...with what the kitchen gave him.Caesar salad, beet salad, gnocchi, and soups were excellent.  They also sent out risotto entree with the second course.  Brussel sprouts were ok but cold  After 1 hour 45 minutes we had no entrees and the toddler was acting out.  We took our entrees and dessert home to Brooklyn.  Turkey was undercooked, Steak, a 10 dollar up charge was excellent.  Salmon was good, but a small portion.  Desserts were unimpressive  Apple tarts ok.  Creme caramel had no flavor  To be fair, Adam and the front of the house were good.  Adam bought our drinks due 5o the delay.  The kitchen could not execute  When we left we did not see any diners with an entree.  We will go back, but not on a holiday.",0,0,0,Ray K.,"Henrico, VA",5,11,2
