rating,time_created,text,useful,funny,cool,username,user_loc,user_friends,user_reviews,user_photos
4.0,6/26/2018,"My girl and I came here one time because of that Matcha Latte.  Yeah I know, ""that's not the only thing they have...""  It was such a great finish after devouring the New Zealand Lamb Chops and the Grilled Chicken over cashews.  We were about to catch Infinity War at Union Square in the late afternoon and it was 12-ish.  So we originally wanted to order only a snack and that Matcha drink.  But then ""other people's food always looks better..."", so that's when we ordered those two amazing dishes.  Ya, this place has to compete with all those Chinatown favorites and it definitely separates themselves.",0,0,0,James P.,"Queens, Queens, NY",0,21,0
5.0,6/14/2018,"I love this place! Such a sleek and modern restaurant located near Little Italy. I didn't understand why it was called Diner, but I get it now, it serves diner classics in more modern flavors. It's such a great concept. The décor and seating area are also inspired by your classic diner. It's great for brunch, dinner with friends, or a date. Unlike other brunch places, they don't emphasize alcohol. They don't need to because they offer great coffee! I went with my friend for brunch on a Saturday. We were able to make a reservation, which is always a plus! We both ordered a cold brew with the Kale Cashew Bowl. Want almond milk with that coffee? They will happily bring you a little cup. As for the Kale Cashew Bowl. I love love loveeeeeed it. It's a big bowl of roasted sweet potato, avocado, asparagus, green beans, faro, cashews, served with a poached egg. It tasted amazing. Everything complemented each other so well, that I couldn't put my fork down. It's a very filling meal as well. I understand why people were complaining about the prices, but honestly, I expected it - for a spacious, nice restaurant downtown, these prices are common. The guys next to us ordered this egg burger, nicest presentation ever. I will be trying that next time. The wait staff were great. Very attentive and nice. All smiles. Definitely will be back to try other items.",1,0,0,Dana Y.,"New York, NY",354,254,738
5.0,6/8/2018,I am so elated that this diner is just a short walk from my job.  When first entering it has a cute coffee bar for those who want to grab a coffee to go.  Upon entering further it gives off a retro feel with a countertop/bar aligning the left side of the restaurant and booths aligning the right.  Who doesn't love a booth!  We ordered from the lunch menu.  I had the hanger steak salad while my friend had the grilled steakhouse burger.  We both were very satisfied.  The hanger steak was on point!  The way these ingredients came together made my palette extremely happy.  On top of that the service was excellent.  Very professional & welcoming.  We will be frequenting this restaurant.  Highly recommended.,0,0,0,Stephanie G.,"Brooklyn, NY",0,27,24
3.0,6/6/2018,The food is amazing but obviously the staff are too scared to tell the chef to take it easy on the salt. Please Mr chef ! Stop ruining all your food with tons of salt ! X,0,0,0,Neil D.,"London, United Kingdom",1,13,5
3.0,6/4/2018,"Hype in the surrounding Chinatown area. I was looking forward in coming here for awhile and after dining here for brunch on a Sunday, I was sadly disappointed with not only the food but the overall menu. The hostess also needs some attitude adjustment as well, smile! No one wants to see a RBF when you walk into an establishment. Ended up ordering the mushroom item on menu and it came out basically pieces of shredded mushroom stuck together with some cheese and salad. It was edible but not impressed....if I had to say the best part of the meal was probably my fries and even that was lacking. Thin fries with a few crumbles of cheese on it. Boring. My Arnold Palmer I ordered was also watered down and tasted like nothing. Stick with just a glass of water, don't bother. Overall - disappointed and I probably will not be back. Maybe their dinner menu is better? Let me know.",4,2,2,Billy C.,"Forest Hills, Queens, NY",455,210,797
4.0,6/1/2018,"Lunch Review:I went around 2 on a Friday and the place was decently full. It's a cute modern diner. The service wasn't great; it was hard to get the server's attention and she rarely came into the room we were in. I got the grilled BLT and my boyfriend got the burger. They were both good. I was hoping to try the charcoal soft serve, but they only had vanilla. The vanilla ended up being really good.",0,0,0,Jackie L.,"San Francisco, CA",224,35,101
3.0,5/28/2018,"Memorial Day weekend/Sunday brunch here, but bc of the rain, it was not very crowded when we got here around 11:30 am.  Iced latte was perfect, creamy but didn't lose the espresso taste. I had the classic egg sandwich and it was really greasy. The bottom bun was soaked in oil and you can see the oil running. Cheese was not running and the egg yolk didn't run out when I cut it. Other than that, it was good and flavorful. FYI, there was pesto paste on the bun.My friend's shaved vegetables was okay. It was what it is with a sweetness from the dressing.We would head to a cream puff store after here, so didn't try their desserts. Service: Main dishes came out like 15 mins after we ordered them. Our waiter was nice and friendly. The only thing is he didn't check on us nor refill our water. Bathrooms (only 2) were spacious, tho lol.",0,1,0,Jingqiao H.,"Lower East Side, Manhattan, NY",175,184,3014
5.0,5/27/2018,The kale walnuts bowl is amazing.  Must try!!!!!Foods are good here.  I had lunch with my friends but this time I try their breakfast and brunch menu instead.  Will come back to try different brunch dishes.,1,0,1,Linh N.,"Glen Oaks, NY",29,87,502
4.0,5/26/2018,Decor is super cute with big banquettes for larger groups.  Some smaller tables in the back room where you can sit and people watch out the windows. Came in for brunch and thought the food was good - BLT which was more of a croque monsieur remix and pancakes which were delicious. Also got a latte that was tasty. Obviously it's pricey...this is NYC. Waitstaff was extremely attentive until it was time to pay and then had to go out of our way to flag someone down. Would come back.,0,0,0,Genevieve H.,"Manhattan, NY",55,47,0
2.0,5/24/2018,"Overpriced diner quality food.  The perfect hipster approach.  Service on the two occasions I came here was very underwhelming.  I guess there's a specific dress code you need to meet in order to be provided quality service.  My guess is skinny jeans, fake glasses, and a huge sense of self-entitlement.",0,2,0,Joshua L.,"New York, NY",89,10,0
3.0,5/21/2018,"Rather an oxymoron design art deco interior using the traditional Chinese red columns and green tile bands, but assume it's a nominal kowtow / compromise to the gentrification of Chinatowns across USA.  A bit pricey for local Chinese, but since we were visiting from L.A. and wanted eggs ... we had the Eggs Florentine, poached eggs on a bed of Roasted Maitake mushrooms with a hefty side of bacon. All well done and yummy.  Service was fine.",0,0,1,Kitty L.,"Los Angeles, CA",0,19,2
1.0,5/10/2018,"Iced tea was $5 and was mostly ice and no refill offered!  Sliders came with onions, pickle slice and ketchup already on it - what if I were allergic?  Never going back!!!!!",0,0,0,Theodore A.,"New York, NY",1,8,1
2.0,5/9/2018,"To the management: Fries vs Veggies - at war at 5 & dime!For lunch we wanted a burger with salad and no fries. We were told that the chef makes no substitutions for anything at all unless it is already on the menu. The options were only ""white"" cheddar cheese or bacon. We noticed the sliders came with grilled onions and the chef agreed to add them ""as they were already somewhere on the menu"".-- Why onions and not greens too?We have never heard of a restaurant in this health conscious age that will not exchange fried potatoes for veggies. If we wanted salad we would have to order a separate house salad and still get the fries?!?! Note lettuce was on the menu elsewhere?!?! Go figure.)We were given the fries which were super dosed with salt, so inedible anyway. The burger was very good but smaller than advertised, still it was enough meat for us.The waitress felt horrible about the fries only rule. Why does management want to create these unpleasant interactions between guests and staff where they have to make apologies for the chef's rules? While we were there folks at other tables were allowed to add options that were not on the menu. Iced tea with just a splash of lemonade...those guests did not have to get an Arnold Palmer, or a lemonade and an ice tea separately.Someone else added chicken on the side of a dish where it was not normally served...but that was OK with the chef.How would exchanging salad or some lettuce for fries or a cup of crudités served just like the fries hurt the ego of the chef? Please change this silly regulation. Burgers can be eaten without fries without shame.",0,1,0,Wendy F.,"New York, NY",22,9,14
5.0,5/2/2018,"After a friend of mine suggested I check out Nickel and Diner, I finally went with a few friends of mine for an early dinner and I pretty quickly wondered what had taken me so long to finally make it in!VIBE: I was hesitant at first, wondering how a concept of ""diner"" meets fine dining would work out, but I was definitely impressed. The decor of the place is reminiscent of a diner, with the big comfy booths and long bar lined with stools, but the ambiance, service and food is that of a fine dining experience.DRINKS: We started with a round of drinks, a spicy margarita, the ruby soho, and at the suggestion of our waiter, Malic (more on him later), what he called gin and roses. Now, I'm not a gin kinda girl at all, but he convinced me to try it and to my great misfortune, I had to admit to him and the bartender (I think his name was Thaddeus) that I absolutely loved it. Thaddeus even came over and asked if the spicy margarita was spicy enough after we ordered another round (bonus points!)FOOD: I ordered the crab fettuccine (again at the suggestion of our waiter) and it was so unique, delicious and did not disappoint! **eye roll at another admission at a great suggestion lol**My friend, who is a vegetarian, loved the potato tasting, which for an appetizer was a generous size. The sauce was rich and delicious and the crispy things on top made for a great contrast of texture.My other friend got the burger and hardly said a word the entire meal, only making sounds of pleasure at every bite. She's a bit of a burger aficionado and it was safe to assume she was very happy with her choice!SERVICE: Malic was very friendly, hands on, and kept us laughing the whole time, without being too overbearing. He made us feel right at home and was definitely the cherry on top of our overall fantastic experience here!! If I could give this place more than 5 stars I would - can't wait to go back!",0,0,1,Nicoline S.,"Queens, Queens, NY",50,2,0
2.0,5/1/2018,"First of all this place is definitely not $$ but at least $$$: $24 chicken in Chinatown? That's an oxymoron. $25 vegetable entree? Must have some magic mushrooms in it for this price.The manager was very accommodating and mixed up two different teas for us in one pot, but when I asked him for whole wheat penne (from different dish) instead of fettuccine with our crab, we're told chef does not make substitutions (""pre-made"" makes one think?) Got Crab Fettucine and grilled-looking Cod. Fettuccine (by look and by taste) was too watery to stick to the pasta, and taste was a bit sourish-metallic and unnecessarily bitter. Honestly, I'm writing as I just swallowed my first bite and the sensation in my mouth is similar to having just chewed on aluminum foil (don't ask but I HAVE done it). When the waiter insisted that I share my opinion and I told him about the sauce being watery, the response was ""every chef makes it differently, that's why you get the spoon""Ironically, my girlfriend decided not to continue on the Cod, which I guess I chose as lesser of two evils. It was ok in my opinion. I guess we got lucky having chosen two different evils haha. I initially gave them 3 stars and was hoping to be able to add one for the food. The food obviously didn't deserve a star, but I subtracted one for the... punchlineSo here's the punchline: I went to add a 22% tip (just to round off not because I'm so generous) and paused thinking why two dishes and a tea are costing $68, then realized they added 20% service charge even though the menu said ""to parties of 6 or more."" We were 2.5.",2,0,1,Stanislav B.,"Manhattan, NY",75,53,2
5.0,4/13/2018,"Love love loveeeeee this place! Nickel & Diner has been on my list for a long time and I recently found myself in the area and starving. Nickel & Diner is beautiful inside--strongly reminiscent of your classic diner, but more sleek and modern. When my friend and I got the menu, EVERYTHING sounded great. The menu is not overwhelmingly extensive, but is still packed with great options for anyone. After a good 15 minutes of deciding, I settled on the Eggplant Parm Sandwich and my friend ordered the Classic Egg Sandwich. The food took a bit of time but that's probably because it was being prepared to perfection. My sandwich was great: very fresh tasting, lots of flavors, but not too salty, greasy, or heavy like I find many eggplant parms to be. My friend was also visibly very pleased with her choice. She raced about it even after she had finished it. I decided I wanted dessert, and the waitress told me they had vanilla, chocolate, and swirl soft serve. I asked for swirl but when it came it was vanilla and charcoal, as opposed to regular chocolate. It actually tasted quite good, but I wasn't really interested in eating charcoal, so I sent it back and the waitress had no problem replacing it. She was very understanding about it. The vanilla soft serve was great. My friend ordered the hot chocolate assuming there would be the marshmallow in it that we've seen in pictures on here; however, it didn't not come with it and she said the hot chocolate was watery. Neither issue put us off from Nickel & Diner. We both agreed we would definitely be back to try some more of the amazing stuff on the menu.",0,0,1,Kira L.,"Manhattan, New York, NY",0,13,21
2.0,4/10/2018,"The food here is INCREDIBLY overpriced. I have never felt so underwhelmed by a restaurant with such great reviews/chic ambience. My friends and I came here on a Saturday night. We had reservations ( we were a large group), but it wasn't a packed place. The food took forever to come. Maybe it's because we had a lot of people, but there wasn't very much going on outside of our table. We ordered fries for the table but they weren't very good. They tasted dry and underseasoned. McDonalds would have had better fries than that.I ordered the Salmon dish, and it was alright. Parts of it were cold, but parts of it were good. It wasn't cooked very evenly. There were well done parts of the filet, and rawer sides of the filet. The dish was small as well.BUT SPEAKING OF SMALL, EVERYONE'S DISH WAS MICROSCOPIC. THE CHESTNUT PAPARDELLE WAS LAUGHABLE. IT WAS LITERALLY LIKE 2 SCOOPS OF PASTA. For $22, that is almost immoral. It wasn't delicious enough to be worth that much. This place is also supposed to be $$, not $$$. We were APPALLED at how small the portions were. All the pasta dishes were small. Everything about the restaurant was small. The waitress's attitude was small too. You could tell that everyone was kind of shocked at how much money they had to dish for the quantity of food they got.Oh, and the REAL kicker in this story? A couple of us had to go out for SECOND DINNER after this. Thanks for the $30+ appetizer, Nickel and Diner. Won't be coming back.",8,3,2,Rebecca W.,"Los Angeles, CA",939,446,1007
3.0,4/8/2018,"Nice looking ""diner"" (sleek with a slightly retro feel due to the black & white color scheme) with booth and table seating available. Tables are spread out so there is lots of space to move around and you don't feel like you are brushing elbows with the party next to you. Waitress was attentive. This place is more upscale (re: expensive) than your local diner and it doesn't really have a lot of the traditional diner offerings... New American cuisine is a proper label. Definitely make a reservation if you plan to go.The plating of the food was nice & ""instagrammable"" but honestly was not very memorable for me. Ordered the roasted maitake mushroom. It was okay in terms of taste, but the portion seemed quite small for price paid. My friend said her kale cashew bowl was good and the portion looked decent. Matcha latte was good (not sweet).Overall, it's a ""just-okay"" spot for brunch/lunch if you want to try something different in the area. But the food didn't have any amazing ""wow"" factor to make me want to go back anytime soon.Food: 2 ""meh, I've experienced better"" but combined with the nice ambiance and attentive waitstaff, I give this place an overall score of 3.",1,0,0,Lisa C.,"Queens, NY",38,238,438
5.0,4/5/2018,"Perfect combo of coffeehouse, bar and restaurant, this great little spot really delivers. Came in for coffee and happy hour and really loved the small plate chicken. Sort of like chicken karaage with a brilliant sauce. Awesome. Then some pretty respectable fries and all made for a great snack. Mycolleague had a couple spicy margaritas which he said were good.Will definitely come back to try their full menu.",0,0,1,Bob K.,"Millbrae, CA",154,623,939
5.0,4/5/2018,This is an amazing place to get brunch. The waiters here are funny and vibrant. The environment has a lot of natural light and a casual feel.,0,0,0,Ashley K.,"Paramus, NJ",177,35,16
1.0,4/3/2018,We walked in here tonight at 10:30. There were 4 employees in the restaurant and not one would make eye contact or acknowledge us.  If they were closed they could've spoke up. Horrible customer service. Yelp says they close at 12:00am. We turned around and walked out and found a sweet little spot in Little Italy.,1,1,0,Stacey L.,"Katy, TX",2,188,68
4.0,4/1/2018,"As parts of Chinatown near Canal Street have begun to change over the years, I watched with interest a couple years ago as Nickel & Diner was built and finally opened.  This beautiful venue is a literal corner diner with a beautiful modern look inspired by art deco design of the past.  Complete with a long counter space with bar seating and several booths lined up along the side, this diner looks to merge the old and the new in a convenient downtown location that is a short walk from both the Grand Street and Canal Street stations in Chinatown.In addition to the beautiful main dining section, the back area (beyond the immaculate rest rooms) is a private room that can be rented out for parties.While Nickel & Diner opened a couple years ago, every time I have tried to drop in the place was so packed the wait was estimated at over 45 minutes.  Finally I decided to make a reservation and that made the process 10x smoother.  I highly recommend setting up a reservation before you go to guarantee your seat.Here's a rundown of what my girlfriend and I tried while we were at Nickel & Diner:ROASTED MAITAKE MUSHROOMS(Poached Eggs, heirloom ratatouille, melted provolone, fine herbs garlic butter)Absolutely delicious.  Even without the two perfectly poached eggs the mushrooms, cheese and ratatouille were delicious together.  Add in the poached eggs and you have a very satisfying dish that has layers of flavor.EGG WHITE FRITTATA(Fennel sausage, spinach, wild mushroom, puff pastry, ricotta, parmesan)In contrast to the maitake mushroom dish, this frittata was wonderfully rich.  It's actually a good thing it uses egg whites because the sausage, puff pastry and cheeses really kick this into high gear on the taste buds and I feel like having regular eggs with the yolks may have been *too* rich.  This dish is delicious, but very rich.POTATO HASHThis has consists of small potatoes cooked with sliced sweet peppers and cheese.  It was sweet and savory at the same time.  The potatoes were perfectly cooked and seasoned as well.BRIOCHE FRENCH TOAST(Fresh berries, caramelized banana, maple whipped cream)This dish was simple yet perfectly done.  The brioche had not been drowned in egg wash.  It had just enough to give it the right consistency and flavor.  The maple whipped cream was nice and tasty but I will be honest, I did not notice any caramelizing on the bananas.  They seem like they had been fresh sliced and tossed onto the dish (which honestly, I have no problem with).  The toast was cooked perfectly and had a wonderful texture.I was very pleased with my first Nickel & Diner experience and I look forward to going back.",2,0,0,Benson Y.,"New York, NY",393,1300,917
1.0,4/1/2018,"I have never experienced discrimination/racism the way I did at this Diner today. If I could give 0 stars I would.I entered with my husband and step son. My husband is Hispanic but appears middle eastern due to his beard. We were given a wait time of 30 minutes. They said they would serve us by the bar for now. The bartender was clearly unhappy with this, wanted us out, so they escorted us back to the front. Giving the benefit of the doubt, I figured it was because my stepson was underaged and should not eat by the bar, we said no problem.However, they then asked if we would like to be served in the waiting area for now, I agreed, assuming they'd seat us properly in a booth when one was free. Again, giving the benefit of the doubt, I thought we were seated there due to the diner being full. However, as more customers showed up, they were seated in booths immediately, no wait time, we watched  as customer after customer got seated. One lady even had an entire booth to herself, while we were kept in the front, at a small table in the waiting area. At this point the message was clear, the staff didn't want someone that looks like my husband at their diner.God bless the waitress who noticed how poorly we were treated and was very apologetic, trying to make our experience better. As we watched the staff talk about us and refuse to seat us at their restaurant, we bit our tongues, smiled, paid for the coffee we had, tipped and left. Nonetheless, it wasn't how we wanted to start our Easter Sunday, just had to put this out there, wish I had had the opportunity to try the food.",3,0,0,Lulu T.,"Queens, NY",84,3,0
3.0,3/31/2018,I just got a quick espresso. The double was a single and the taste was not my favorite,0,0,0,Markus M.,"Barnstable, MA",8,83,156
5.0,3/16/2018,"A diner with a modern twist has made their way into Chinatown. I love that the location is close to the subway station because it's easy to get to and less of a hassle. If you want to go shopping in SoHo after brunch, it's right there. Convenient, right?When we arrived, we were seated at the booths and I loved the contrasted teal against the minimal black and white interior. The boots were spacious for a party of 4 so it was very comfortable. There were so many little details I loved and I always appreciate the details at restaurants. My table ordered the salmon lox, fries, hash, steakhouse burger, and the egg sandwich. I really enjoyed the salmon lox and fries even though I couldn't finish the fries cause I was so full. The steakhouse burger was really good too. The burger was cooked perfectly and tasted delicious. I didn't try the egg sandwich but it looked so good, and the person eating it was totally feeling it. I'm also a person that's really into drinks (non alcoholic) so I was wondering if they'd have any smoothies but I was told those are coming soon so I'm excited to come back to try those. The service was great. I didn't experience any problems like my food not being ordered or forgotten. Our server was friendly and made sure we got what we asked for so good enough for me! It's definitely a cute new spot to go to for brunch and I'm certainly coming back again. I'm thinking of coming back for dinner since their dinner menu looks pretty tasty too!",0,0,0,Fionna C.,"Fresh Meadows, NY",22,77,85
5.0,3/13/2018,"Made reservations to have brunch for a bachelorette party (group of 8 people). The interior design is really clean and modern. Service was excellent and the food was reasonably priced. I got the egg white frittia and it was so tasty. My friends got eggs benedict, corned hash beef and waffles and they were happy with their meals. Definitely will recommend as a brunch place.",1,1,1,Tiffany K.,"Forest Hills, NY",24,112,163
1.0,3/6/2018,thanks for not informing us that you guys close the kitchen @ 10:00pm walked in rain just to get food ): & found out it was closed kitchen,0,0,0,Francois W.,"Mid City, Los Angeles, CA",0,1,0
1.0,3/3/2018,"This place is so over priced. Average Salad dish for brunch is $16. If you want to add an bacon or egg, easily go over $21 a salad dish. $6 for OJ. Jesus Christ.",1,1,0,Ivan C.,"Brooklyn, New York, NY",0,12,6
4.0,3/3/2018,"Went for brunch! Great coffee and cocktails at a reasonable price for NYC. I got the egg sandwich - it was good but the egg was a little too undercooked for my liking. My boyfriend got the French toast - it was good but could have gone without the lemony flavor. Overall, I'd definitely recommend!",0,0,0,Jessica P.,"Jersey City, NJ",3,49,6
