rating,time_created,text,useful,funny,cool,username,user_loc,user_friends,user_reviews,user_photos
4.0,3/28/2019,You better be RICH!  Very very expensive...went there for a gala after performance dinner for rich patrons of the ballet.  RICH!  Could never afford it my self as one of the artists.  Oh well...,0,0,0,Markie P.,"Manhattan, NY",0,16,17
5.0,2/4/2019,First time there and very much liked lunch. We don't like the uptown branch so were surprised. Restaurant is comfortable and light. No problem with noise. Food is terrific. Staff is professional and nice. There is no up-selling.....unlike the uptown branch.,0,0,0,Yan Z.,"Manhattan, New York, NY",29,14,3
5.0,1/31/2019,Love the venue - magnificent high ceilings. Food is amazing. Burrata to die for. Everything was excellent.,0,0,0,Ewelina A.,"New York, NY",4,12,27
1.0,1/1/2019,"We came here for New Years and had booked the most expensive VIP experience/table they had. We spent A LOT, and I mean A LOT, thousands of dollars to be able to have a memorable New Year's Eve experience. We flew all the way from Europe for this night. When we arrived, we had to give the doorman $200 TO LET US IN as the VIP line was even bigger than the general admission line. When we went inside, everything went really slow and by the time we were done with coatcheck, we were escorted to our table. Only then to find out that OTHER PEOPLE WERE SEATED AT OUR TABLE. We then had to wait and wait and wait (it was 11.30 by now CRAZY STRESSFUL), then they proceeded to give us a table at a general admission area, we refused because WE PAID FOR THE VIP AREA. What they had done was, they gave our table away to people that bribed them with cash. Eventually they put up another table NEXT to the VIP area, in the middle of the hallway pretty much. We had no other choice but to accept it or leave, so we sat down but because it was in the middle of the general dance floor, every drunk person started putting cups and empty glasses on our PRIVATE TABLE. Then they started picking at our food ON OUR PRIVATE TABLE. As the night went on, drunk people started hanging their coats ON OUR PRIVATE TABLE. Sitting down, ON OUR PRIVATE SEATS. All of this didn't happen to the people that they gave our initial table to because they were in a secluded VIP area where we supposed to be.We travel all over the world. Our family and friends will never, ever visit ANY Cipriani restaurant or venue again. We will stop hosting our charity events at Cipriani venues and discourage anyone to go there if they ask us. Thank you for ruining our New Year's eve, Cipriani.",5,2,0,K T.,"Manhattan, New York, NY",0,4,0
5.0,12/2/2018,"*Dessert only review* My partner wanted to wait out the rush hour traffic on our way out of town, so we decided to snag some open seats a Ciprianis and have an impromptu late afternoon dessert date. And I'm so happy we did. It was the BEST meringue cake I've ever had. This was a few months ago and I still think about it often! It literally melted in my mouth. Their tiramisu was also incredible, so smooth and rich. Our seats were positioned to look out over the rail. It was fun to watch everyone in grand central station going about their business. Watching the hundreds of people going in an out really made me appreciate the term New York Minute. The atmosphere was lively, people getting out of work, going to happy hour, having business meetings... etc., it was so fun! The dynamic between restaurant and busy station made for built in entertainment. Not sure if I'd love this for dinner but it made for a memorable and happy dessert date!",1,0,0,Kate M.,"Portland, ME",72,65,111
4.0,11/25/2018,"I come here every year for different events.  This place is really an elegant and gorgeous venue space.  They are very organized and their staff are pros.  I always have a fantastic time whenever I come here.  The food is pretty good.  They offer a nice assortment of appetizers.  For dinner its always the same either steak or fish.  I like their steaks but to me it's always a hit or miss.  Either you get a perfectly cooked steak (for me its rare) or a steak that is too well done and that is so not for me.  So now, instead, I order their fish (Chilean sea bass) it is cooked perfectly.  Their sides are nothing spectacular just potato and a vegetable.  I look forward to coming here again for future events.",1,1,2,Betty L.,"Sunnyside, NY",323,414,1887
2.0,11/13/2018,I loved this hall so much until it got to my food . The steak or chunk of meat was inedible and the staff looked like they were unable to handle the crowd. It just lost its charm after that.,1,1,1,Ayesha T.,"Malvern, PA",75,123,239
5.0,9/11/2018,"Attended the Legends Ball here on Saturday and I have to say the food was very good. My steak was delicious and perfectly cooked. My sister's meat was overdone and she should have said something. Mine was a perfect medium rare and you didn't need a steak knife. The burrata cheese appetizer was delicious too. The dessert was excellent as well. Service was very good and the venue is beautiful. All around great experience. I'm sure it was pretty pricey but since I didn't pay for it, I'm giving Cipriani's five stars.",0,0,0,Lily C.,"Islip, NY",35,461,428
1.0,9/9/2018,"I am beyond disgusted by this restaurant.  Friends met here for brunch after a night in the city, heading out for our trains.  The prices are not unexpected but very high.  We spent. $300 on brunch for a small party.  Every time anyone wanted to use the restroom, we were informed that the closest restroom which is in the adjacent restaurant is not open to Cipriani customers.  Then, when we were finished, and paid our large bill, we decided to go to the adjacent restaurant for a drink.  It is literally through the doors of Cipriani and it is pouring outside.  The manager refused to let us walk through the doors of Cipriani to go to the restaurant next door.  He insisted we would have to leave the restaurant, go outside and enter the doors of the other restaurant from the street.  After spending $300 in a restaurant, whose service otherwise was excellent, the manager's treatment was rude and unacceptable.  I hope the restaurant sees fit to terminate him because I frequent this restaurant often, and won't do so again given this.",1,1,0,Jennifer L.,"Sherman, CT",0,1,0
3.0,6/15/2018,Came here for a legal momentum luncheon. It's a beautiful large space with towering ceilings. The food was average but not bad.,0,0,0,J. Karim A.,"New York, NY",64,795,334
5.0,6/14/2018,"I have been here as a guest for several corporate events. The place is immense (for NYC standards). If you are planning an event here, you will  need a good lighting company to highlight the stunning arches on the walls. This food at Cipriani is consistently very good and the wait staff is always attentive.",0,0,0,Lori B.,"Manhattan, NY",28,123,670
5.0,4/26/2018,"Been coming here for years and had to revisit on this trip. Great place for movers and shakers and all the beautiful people. My friend made a reservation for our late lunch and the place was packed. Business men in suits, well dressed ladies, etc. I had my usual the white pasta with ham and then the branzino. He pasta is delicious and the fish served tableside. My friend had the veal chop which was Fred Flinstone size. We finished with the layer cake. The martinis are one of the best reasons to come here. There are served in large shot type glasses. The dirty comes with three mini olives. Two martinis are enough!!Love this place.",1,0,2,Maria-Elena T.,"Arlington, VA",357,1003,2869
4.0,4/7/2018,Finally got to go to this place after hearing tons about it and it was fun pretty good! The service is top notch and then bread basket they give you in the beginning is so good there's all different types served with butter. I had to order their famous Bellini which was delicious I got like 4 haha. Don't think they were too strong though. I got the pesto pasta which was pretty good nothing too special though. The calamari was perfectly cooked and crispy- definitely try it out! Overall good experience.,0,0,1,Melaina J.,"Tampa, FL",679,55,177
1.0,12/3/2017,"Have been here many times, the food is usual the space is fantastic. However, in light of the fact that they would agree to host a luncheon for DJT given his immigration policies we will never be back.",9,2,0,Dawn M.,"Schenectady, NY",183,28,16
4.0,10/2/2017,"I was at a wonderful wedding they catered at their event space near Grand Central Terminal. While walking around I discovered their restaurant in the Terminal, but didn't have time to eat there. This trip I did, and the food was terrific. My son and I stopped after touristing all day and even though we looked like bums they treated us like kings!We started with the beef tartar which was outstanding. It melted in our mouths!My son had the tagliolini with pomodoro. The sauce was perfectly balanced. I had the tagliatelle wth lamb ragu , off of the bar menu. My son finished with a lemon tart which was lite and delicious. You can't beat sitting on the balcony of the Terminal watching the world buzz by.",0,0,0,John G.,"Chicago, IL",308,337,69
2.0,6/13/2017,"Gorgeous venue but disappointing food. Came here for a work luncheon and was excited to try the food. Given the well-known restaurant name that exudes elegance and flair, it was very disappointing to taste mediocre food. The hor deurves were ehhh. Pigs in a blanket (could easily be Costco and heated up. Love costco by the way!). Lobster bites were weird. It was warm lobster stuffed into a small, hard and stale tortilla chip. Crab bites were wrapped with cucumber - this was okay but had a slight funny taste to it. On to the main lunch portion. Salad was good. Probably the dish of the three course meal. The entree was a split pea risotto. It tasted more like uncooked rice with three peas. Fish came on top of it. Super salty skin. Fish itself was decent. Onto dessert - really not sure what it was. All I know is that it had loads of cream everywhere and burnt sugar crystals sprinkled on top and on the side. It is like a meringue with soggy cake. The fruit that accompanied the cake was good at least.",4,3,3,Shelley L.,"New York, NY",96,466,1212
3.0,6/6/2017,"I've been to the Cipriano Downtown and have to say that it is way better. This location is inside of Grand Central and doesn't have the same feel. The chef at the one downtown always lets me specialize the type of grilled chicken salad I like, but here my waiter told me the chef could not. The service here isn't as good and the staff isn't as friendly. Overall though, my food that I ordered still came out good.",0,0,0,Stephanie G.,"New Haven, CT",349,85,19
1.0,5/19/2017,Over priced and overrated. Ordered the Cipriani club sandwich and it was literally warm pulled chicken with Mayo at $27 dollars!,2,0,0,Lerdie B.,"México, D.F., Mexico",6,6,1
1.0,2/8/2017,Skip the bar in Grand Central Terminal unless you are okay with a $16 glass of mediocre Chardonnay and a bartender who has zero personality.,1,0,0,Patricia T.,"Dobbs Ferry, NY",0,13,2
3.0,1/24/2017,"This review is about my NYE experience. Friends and I purchased a regular ticket, if I recall correctly it was $150. We did not do the flash pass, no table or anything. I feel like we didn't wait too long, my friends said we did but maybe I pregamed a bit too hard. This place was ok. It was my first real NYC NYE experience and it was no doubt a beautiful venue, a nice occasion to be dressed up. The wait time for drinks was FOREVER and I didn't have any food. I also recall the menu showing that almost everything had pork in it (which I don't eat) so I was restricted anyway. One suggestion Cipriani - try to make the appetizers a bit more diverse! Music was okay, but they did pass out champagne for midnight which was nice!Fell a few times, the floor was slippery. A friend's friend fell and cut his hand on a beer bottle and had to go to the hospital for stitches. I wasn't present for the incident but it plays into the narrative that the floor was slippery and the staff couldn't really keep up with the incidents. Bathroom was clean and BEAUTIFUL might I add. Random thing I remember from that night. I feel like venues like Cipriani really do try offer a positive NYE experience, so I'm giving them three stars cause I feel for them - and the staff. Don't forget to tip them. They are working hard to make YOUR night the best it can be.",3,4,1,Aysha S.,"New York, NY",475,69,16
5.0,12/20/2016,"My (A list) office party was held here this year (the catering location, not the restaurant).  It's an old bank and the architecture is amazing.  Seriously high ceilings with pillars.  The food was delicious, the desserts were delicious.  My office doesn't settle for anything less than stellar so they pulled out all the stops.  The drinks were flowing, dancing area was spacious.  The staff was fabulous and very friendly.  We had a great time.  The acoustics were harsh in such a large, high ceiling space so if it's an event specifically for acoustics, not the right option.  On the dance floor the band sounded great.  Toward the back it was just loud.  Those who chose not to dance and to wanted talk had to sit in a second room with the desserts.  Definitely a beautiful location for a fancy office party.",0,0,0,H S.,"New York, NY",3,167,0
4.0,12/12/2016,"Pappardelle here was awesome but the space in the restaurant was kinda small, so I rated 4 out of 5.",1,0,1,Kazuya O.,"New York, NY",132,4,0
5.0,11/22/2016,"Wowwww! Cipriani is an architecturally stunning, Italian Renaissance inspired venue!!!! The space itself took my breath away. This is THE PLACE for any large event. Upon entering for an award dinner, there were countless staff lined up to collect coats. As I moseyed my way to the bar area, there was an endless supply of hors d'oeuvres. Fortunately, there was no need to chase trays. With lots of bartenders ready to assist, guests were able to get drinks at lightning speed. Let me fast forward to the meal.By the time we sat, salad and bread was already on each of the several hundred plates at the event. The speedy service continued with one server placing risotto directly onto our plates followed by another server topping that with the most massive and beautiful piece of sea bass that I've ever seen in my entire life. The best part was that the food didn't just look nice, but it tasted fantastic. I watched the entire table, including my husband who doesn't ever eat fish, devour their plates. Somehow, we all had room for dessert which was a chocolate shell filled with vanilla, coffee, and chocolate sorbet topped with berries. I'm pretty confident that every single guest in the room was extremely pleased with the meal and service. If you choose to book an event here after reading this review, don't forget to give thanks where thanks is due. Invite me!",6,2,4,Leah D.,"Newark, NJ",268,196,206
5.0,9/7/2016,"Went when we were waiting for a train. Sat quickly and decided to do appetizers for dinner to share. Had the calamari and prosciutto with mozzarella. Both were fantastic and more than enough for both of us to be full. Calamari was just rings (I don't like the tentacles) and had great sauce (one almost buttermilk based ranch flavored tartar sauce and the other was an excellent marinara). The prosciutto was also delicious with sliced mozzarella underneath. Although pricy, definitely delicious! Both dishes were about $27 a piece. But the staff was attentive and friendly and given the location and amount of food and how happy we were, I'd go back again.",2,0,0,Angela M.,"West Hartford, CT",191,288,131
4.0,8/5/2016,I went during restaurant week for lunch with friends. We went around 1:30 and it wasn't packed at all. My best description of the food is that it was tender. Everything was great. I expected it to be a bit more fancy but it was very nice. We had a great view of the main walkway. Occasionally there was a loud train announcement but it was pretty pleasant.,1,0,0,Emily H.,"Bronx, NY",197,12,13
4.0,7/28/2016,"I believe this is one of the most known places here in NYC. I love the look of this place, I mean this is one of the most charming place I've been in the city. The food is really good as well, real Italian food. Everything is very pricey here, be aware of that.",0,0,0,Erica S.,"New York, NY",0,27,0
3.0,6/30/2016,"Perfect pasta! Love the place. I ordered the tagliteri and it was perfectly done. The squid rissoto is also good. The only problem: service. 2 issues in 1 night:1. Appetizers were ordered, never arrived but it showed up in the bill2. The waitress were fighting in spanish, a whole spnish soup drama was going on, since we spoke spanish we understood all the words.. guys take it to the kitchen.. Becauae of the bad service I gave it 3 stara but the food was good.",0,0,0,Maritza T.,"Maricopa, AZ",6,14,11
5.0,3/13/2016,We had the pleasure of attending a benefit for Winston Prep Academy here last night. The place is stunning! It used to be a bank so it has the high (really high!) ceilings along with very ornate woodwork and huge Corinthian columns in all of the corners. The wait staff was huge and they were all spot on! During the cocktail hour I never held an empty glass or plate for more than a few minutes before someone came by with a tray to take it. The h'orderves were all outstanding! I lost track of how many different things they had to offer but there was a lot. When we took our seats the outstanding service continued. My water and wine glass were NEVER empty. The entrees were delicious.  Had the prime beef with a side of green beans and a sliced potato. Dessert was either a chocolate mousse cake or ice cream and fresh berries. Both were delicious. The bathrooms were very clean and had attendants. I sincerely hope to be back next year or sooner!,9,5,7,Robert M.,"Roseland, NJ",1005,330,403
5.0,3/1/2016,I love this place the food is so good. Grand central is pretty touristy but the food is really worth it. I for one like that it's in grand central.,0,0,0,Lisa M.,"New York, NY",0,20,0
5.0,2/18/2016,5 Star restaurant with a first class atmosphere and top notch service. This restaurant defines quality and sets the standard for an exceptional experience.,0,0,0,David G.,"New York, NY",0,44,12
4.0,2/9/2016,"I love Cipriani. This is the real deal. The view of the clock, the nice selection, the sound of the train announcements in the background.As nice as the made the Campbell Apartment which is right there, they will never match the old world charm that Cipriani seems to do effortlessly.You can't fake this kind of stuff -- not to the locals.",3,0,2,Russell W.,"New York, NY",40,150,0
2.0,2/2/2016,Food was good for Restaurant week but where we sat was the worst!! We had a corner table beside the stairs and a homeless guy kept going up and down the stairs.  Snorting and sneezing.  They should NOT have a table at this corner. So unappetizing!!,0,0,0,Vered C.,"ASTORIA, NY",29,10,10
5.0,1/25/2016,"In love with this space!!! Went to a premier party here a few weeks ago and everything was spectacular. The food, the service and the ambiance were on point. It was star studded event and needless to say it looked and felt like Hollywood. I would for sure recommend this space for an event.",0,0,0,Gina E.,"New York, NY",0,3,0
5.0,1/17/2016,"Great place, very very upscale.Great venue to throw a large party for a company.We will be back!",0,0,0,Can H.,"Laguna Beach, CA",0,15,0
5.0,1/3/2016,"We came here for nye party! It was awesome!!! Susan, our waitress, was great! She was the light of the night!!! She made sure that we are taken care of! Despite, having a very busy night, with many drunk people, to wait-on, Susan was full of positive energy!  She really was amazing! The food was okay! There were little appetizers and little deserts. Considering what we paid for the event, we could have had better selections of food and drinks.  Restroom had a huge line, but Cipriani found another solution, as the super luxurious port-a-potties.",0,0,2,S G.,"Marina Del Rey, CA",93,127,67
1.0,1/1/2016,"Came for the NYE party 2015. The venue was great, the food amazing and staff very helpful, friendly and polite. But the number of bathroom was ridiculous, who thought that four toilets would be enough should be fired!! The worst part was the DJ. Awful line up, didn't know how to engage the crowd, was cutting all the songs and changing without any sense. Didn't stop talking, he was trying to show off himself more than his work. He was also really rude. I enjoy the party because of the food and venue  and friends but the music was a big no no!!!",3,3,1,Beatriz P.,"Alexandria, VA",6,3,0
1.0,12/31/2015,The staff did completely a horrible job on managing the event. VIP line was filled with people who bought general admission tickets. They only announced that the line was specifically for VIP once people got closer to the door and guided them to stand on the other long line. No one was smart enough to communicate in advance where to line up. This was non sense. DO NOT buy a VIP ticket if you want to get in faster and not shiver in the cold because they will not treat you like VIPs.,3,1,0,Christina L.,"New York, NY",92,59,178
5.0,11/13/2015,"Beautiful, stunning architecture. This spot used to be a bank and it felt like the ceilings were 50 feet high with some of the bank teller Windows left for charm. I went to and event and the coat check people were very polite and fast. There was a bathroom attendant to help with any lady minute necessities and the door men were very friendly.",3,2,3,Cara G.,"Venice, CA",152,470,420
3.0,11/6/2015,"Two parts to this review...  was here for a gala, and the building itself is across from Grand Central. Large entry, with a coat check to the left and a side bar area that was filled with three different long bars, more than enough to handle the 500+ people that came that night along with the bars on the other side.  Large space that reminded me of a mini Grand Central (being a former bank) with the design and arched ceiling. Bathrooms off to the corners.Second, the food. Appetizers passed included salmon, tuna tartar, and pigs in a blanket - all good. A mozzarella & prosciutto salad with pear that was good, a Filet Mignon steak that was entirely too dry, and sea bass that was a massive cut that was bigger and thicker than the steak medallion - not bad and better spiced, in my opinion. The potatoes stuffed with veggies were ok. Potato au gratin was only so-so, too. The dessert - a lemon meringue that was only ok. Drinks were strong and the service was pleasant. I suppose it's tough to cook the same thing for 500+ people at once, but I've had better at large events.Overall, an interesting event space. Just watch out for the echo when you're on a microphone inside.",3,0,0,Hank C.,"Jersey City, NJ",1732,2830,1188
5.0,10/10/2015,"I don't know about the restaurant a Grand Central Station but Cipriani across the street in the old Bowery Savings Bank is the best there is. Ambiance, food... pure  New York.",0,1,1,Allen C.,"Manhattan, NY",0,31,0
5.0,9/2/2015,"The Bellini's here are amazing! Its a must place if your going to NY anytime soon. Although the restaurant is a little cramped, especially in the corner, the food was absolutely amazing!",0,0,0,Sidaq G.,"Los Angeles, CA",0,8,0
4.0,9/1/2015,"The food was definitely very good and amongst one of the best I've had in a while. The view was also very nice since you're on the top and able to have a bird eye view of the whole grand station. The service was also very good and the price is to be expected. Avg drink is $18 each and and meal is around $30. Just know that you're paying for the location, food and service.",1,0,0,Kelly T.,"Atlanta, GA",17,143,155
4.0,5/19/2015,Great service every time!!! Great drinks! Food is ok but as long as the wine selection is good I am content! Champagne is very good!  Atmosphere is nice! Alive! I love to sit outdoors spring and summer! Outdoor sitting area is very limited so make reservations a few days prior to your visit!,0,0,0,Susanita F.,"Jersey City, NJ",6,4,354
4.0,4/18/2015,"The Chicken with mushrooms was exquisitely done, but the accompanying mashed potatoes were not befitting a restaurant of this caliber.  I would expect real mashed, not the powdered stove top mix one can make at home.  Ambiance was great.  And the arugula salad was excellent.  I guess the mashed is not their forte, but if not real potatoes why even offer it at these prices?  Service was attentive.",0,1,0,Vincent P.,"Yorkville, Manhattan, NY",3,3,0
