rating,time_created,text,useful,funny,cool,username,user_loc,user_friends,user_reviews,user_photos
1.0,3/9/2015,"Friday, 3/6/2015 my husband and I had reservations at Cipriani's.  We know this is an expensive restaurant, so with it being ""Restaurant Week"", we thought we would give it a try.  First of all, we didn't realize that this location was in Grand Central Station right out in the open. No one mentioned that when we made the reservation and they should have!  People walk by, stop in with their bags etc., and it totally takes away from the ambiance-in fact there is no ambiance, so I was immediately disappointed by that.  I dressed nicely for a nice restaurant, but this location simply did not require anything but jeans and a sweatshirt. The first server to come over to us was not very nice.  He did not say hello, welcome to Cipriani's, my name is...nothing at all like that.  He just said drinks?  I was not impressed. He quickly and wrongly surmised that we were not going to spend a lot of money so he shoved us off onto another server, which was fine, he was much nicer, just somewhat inexperienced, but a very nice man.  We ordered a bottle of champagne to start the evening and then we ordered the menu for restaurant week.  I must say, for a restaurant like Cipriani's, I expected so much more than what we got.  My husband and I both ordered the Buffalo mozzarella.  It was not good quality, and it came with cherry tomatoes cut in half with a few shreds of basil.  No olive oil.  It was an embarrassment.  Next came the entrees.  My husband got veal ravioli and I got the lemon sole.  The ravioli were quite small and came on a small plate with no sauce and they were dry and tasteless.  I could not believe they would even serve something like that!  It was pitiful and a disgrace!  My lemon sole which made no mention of any sauce that would be on it, came with a red sauce all over it which made me wonder why.  Lemon sole is usually lightly broiled and served with nothing but maybe a little butter, salt and pepper.This fish was old and they were covering that fact with the sauce.  Another disgraceful dish.  Dessert was equally awful.  They brought out a pumpkin pie that looked brown and not at all appetizing and a lemon meringue pie that was worse than what you would get in a diner. In fact, I know at a diner the pies would have been awesome compared to these sad desserts! Needless to say, the best part of our meal was the champagne.  I feel that if you are going to participate in restaurant week, that you should put your best foot forward or don't even bother.  As a result of our experience, we have absolutely no desire to come to Cipriano's and pay regular prices because we have such a bad taste in our mouths, no pun intended.  Unfortunately, because Cipriani was so focused on making the most money they could, they blew an opportunity to ""wow"" us having us wanting for more and coming back again.  Now we will never be back to any of their locations.  There are plenty of very good restaurants in NYC, so we don't need Cipriani's. My husband and I were in the restaurant business for 24 years as owner/operators.  We understand the business fully and we would never serve the food that we were served, ever, to anyone. We owned fine dining establishments that were respected for the food and the service and the ambiance.  Cipriani's had no ambiance, terrible food, and inexperienced service.  A lose, lose, lose situation.  I hate wasting my money.  I don't mind paying good money for good food and good service, but this was not the case here.  I might as well have thrown my money up in the air so the pigeons who fly around and over your head could pick it up and use it for nesting!",4,5,1,Kathy S.,"Lavallette, NJ",63,10,0
1.0,3/9/2015,"My wife and I dined at Cipriani's (Grand Central Station) location on Friday evening, 3/6/2015. Both my wife and I have been in the restaurant business (owned and operated 3 fine Italian dining restaurants for 24 years); so our palates are truly diversified and knowledgeable. We enjoy dining in the New York City restaurants as often as we can. Now, let's get down to business. The original server that approached us was rude. He actually tried pushing our drink and food order even before i took my jacket off. Once he realized that we were going to be dining, not to be rushed, he passed us on to another, kinder, less experience waiter (which was fine). Appetizers: so they call that fresh, homemade Buffalo Mozzarella ? Can't be. Little pieces served with cherry tomatoes and a few shreds of basil. I was embarassed and I don't even owe the place! Not even a trace of Olive Oil, which the young, inexperienced waiter brought for us. Entrees: My wife's fish was pitiful. With a sauce that I can't even discribe. I have never, in all my years in the industry, saw a sauce like that before. We would have enjoyed it more if it came from a can. My so-called homemade veal stuffed ravioli's had to be freeze dried. Had to be....Had to be.....I am telling you, they were the smallest, tasteless, driest ravioli that I have ever tried (where was the sauce?). Desserts: ""let's see? What do we have left over in the freezer from the holidays that we can serve, oh yeah, what about this frozen pumpkin pie, back here by the frost bitten fish....here we go.....let's get rid, I mean, serve this to our wonderful patrons who like to spend a lot of money on less than edible food. But, they are eating at Cipriani's!""   FYI - Whipped cream may of helped, but I doubt it. The one thing that I will say, is that the bottle of Champagne and my wife's beautiful eyes and smile were magnificent !!!!! Thank you babe for saving the evening !!!!",0,0,0,John S.,"Brielle, NJ",0,7,0
2.0,12/29/2014,"I have been there twice this year and both times my experience was dissapointing. It has become a tourist trap, mediocre food (especially pasta, which they used to be known for) and not cheap at all. Not going back.",0,0,0,Ramona C.,"New York, NY",1,40,0
5.0,12/10/2014,"This place is really amaizing !!! Beautiful high Cielins, great deco, great service till the end!!!  Very recommend for big parties!!!",0,0,0,James D.,"Chelsea, Manhattan, NY",883,99,65
5.0,12/4/2014,Here for the Outreach Foundation Luncheon. Great organization which provides so much for the rehabilitation of Americans in greater NYC. One of the best venues in NYC that define service and opulence. The space use to be a Dime Bank and fortunately they kept much of the original architecture and finishes. Real taste of old NY.,0,0,0,Sung Moo C.,"Hoboken, NJ",72,144,68
5.0,11/15/2014,"Gorgeous, high cathedral like ceilings in an old bank. Here for an event, didn't have to pay..maybe that factors in for the 5 stars..Definitely would recommend this place for an event.Great cocktail hour with excellent service.App. of burrato with tomatoes was out of this world.Waiters walked around with giant trays of filet mignon to place on each plate.. Amazingly fast service at a large event.   Quality of the filet was pretty average, the sauce was delicious.  (should have gone with other option- chilean sea bass, which looked amazing). Chocolate covered strawberries and other treats for dessert were all very good.Great time!",1,0,0,Alexandra C.,"New York, NY",854,2017,62
4.0,9/21/2014,"I recently attended an award show dinner at this location, and won't lie, I was pretty excited about the food (and the award too, obviously!).First off, they really, really packed us in. I felt as if I was sitting on top of everyone. How they fit all those people on those tiny tables is beyond me. The food? Phenomenal. I especially loved the steak. It was a filet and quite a large serving of it. Thankfully, it was not overcooked, but medium rare (how I prefer steaks).There was also a dessert that was equally stellar, a fruit cobbler cake of sorts. Yum.Now I'll have to come back and dine there regularly.",3,0,0,Shu Jin S.,"New York, NY",134,933,5
3.0,9/12/2014,"Went there for lunch,- the quality of the food overall was pretty good (we had the branzino and chilean seabass). However, service was slow and lazy, and the food was frankly overpriced for what it was.",0,0,1,Omar Q.,"Manhattan, NY",0,2,0
1.0,9/6/2014,"Came to have 1 mimosa before a train...$19 for a mimosa...same price as a full glass of champagne. How does that make sense? I mean it's grand central station, not the Ritz.",0,2,1,Margaret P.,"New York, NY",0,16,0
5.0,8/8/2014,"Cipriani is a true class act, and I expected nothing less. I attended a business luncheon function this past week and was just so impressed by the overall experience. The enormous space is pristine and beautiful! The moment you walk in, you feel like you have arrived somewhere special. The service was of the highest quality, from the bartenders to the waiters to the management. And the food...amazing! We dined on the freshest mozzarella and tomatoes, Chilean sea bass, and sorbet with fruit in a chocolate bowl. Everything was perfect!",2,0,0,Krista J.,"Brooklyn, NY",749,1181,35
3.0,6/27/2014,"Great event space, but the food is nothing exciting (can't be helped as a result of mass production). My favorite part of our event's three-course menu was the lobster salad appetizer and that essentially just required boiling of said crustacean and slicing some veggies...",0,0,0,Vanessa H.,"Manhattan, NY",91,143,0
4.0,6/16/2014,"Came here for a wedding and was taken away by the high celings and architecture of this former Bowery Bank. It is truly beautiful and takes you back to  a by gone era.The service and food was top notch. The cocktail hour consisted of so many delicacies that it was hard to stop and I wound up eating ""strategically"".  Most memorable was the carpaccio, tuna tartare and other tuna appetizer, the porcini mushroom phylo tarts, the cold calamari/lobster salad. The pastas and risotto were also delicious. Dinner started with a whole cold lobster out of the shell-exquisite. By the time the Chilean Sea Bass came, I was beside myself but enjoyed this perfectly cooked masterpiece anyway. It was an incredible experience from start to finish, and one I will treasure.",0,0,0,Idania D.,"Manhattan, NY",35,255,764
1.0,6/5/2014,"We really should have just walked out when the first thing that happened when we walked up was 3 staff members arguing in front of my fiance and I about which of them would have to seat us, but we didn't.  Service was slow, lazy, and inconsistent (I spent half the time there with an empty water glass).  The food was at best mediocre (and one of our pastas was undercooked to the point of almost bring hard in the middle), especially for the price, and the portions were small.  No beer on tap, and even their house wine was $11/glass.To add insult to injury, after taking over 10 minutes to box one plate of leftovers (the boxing of which two of the staff argued about who would do in front of us as well) and bring the check (note that this was after waiting 10+ minutes clearly ready to go before having to flag someone down to request the check), the waiter had the audacity to circle the precomputed tips on the bill, as if to say, ""you look cheap, so don't forget."" Then he took another 5 minutes to run my card with the place half empty.  No buddy, you got $4 on a $50+ check because you suck at your job.This is a restaurant in a train station, it is completely inexcusable how slow they are.  And that's leaving aside the fact that for less than 1/2 the price, you could get better food down in the for court. Let them fleece tourists and commuters who don't know any better, but don't be a sucker yourself.",5,3,1,S R.,"Manhattan, NY",0,16,0
1.0,5/18/2014,"Ate some chicken here, got very sick and started vomiting, had to leave :(",0,0,0,Robert H.,"Manhattan, NY",1,36,0
3.0,3/3/2014,"I enjoyed the Prefix menu, and it was a good value. The regular menu was a bit pricey, even for Manhattan. Get the carafe of wine, it's a better value than wine by the glass. The house red is actually quite good, and the medium carafe was at least 4 glasses of wine. The ricotta cheese cake was fantastic.  Everything we ate was good. Location very convenient if meeting someone. Service was good.",0,0,1,Jeanine C.,"Mountain View, CA",130,36,0
1.0,1/30/2014,"For the price and location, this was a huge disappointment.The food was very cheap, bland, and not good at all.The service was terrible.Avoid",2,1,2,PP K.,"Brooklyn, NY",0,12,0
1.0,11/13/2013,"Our office got delivery from Cipriani via Seamless.  Order was half an hour later than their ""projected"" delivery time, which was already an hour long. Food was cold when it arrived. But the worst part of the whole thing, because I can deal with slow delivery, it's not always the restaurant's fault, but the portion was tiny.  I ordered a hot lunch special from them, expecting a lunch. What I got was a plastic container that normally would hold a side dish at most take out places, with both my main course and side piled into it.  For $10 I expected actual food. For the same price I could have gotten three times (not an exaggeration) as much food at the deli across the street, which is what I had to do after eating my ""lunch"". Never again.",1,1,0,Ethan C.,"Jersey City, NJ",28,24,1
2.0,11/1/2013,"Well I was a  little skeptical about the quality of the food and service because it's in a train station, yet I sat at a nice table over looking grand station, I ordered the tomato mozzarella basil and was very disappointed, the presentation was non existent, only few cherry tomatoes on the plate and way to much mozzarella and a little bit of spaghetti basil that was of course not enough. This mess is $24.95 ridiculous. Then I had the baked tagliolini with ham, that dish looked like mac&cheese to me. Not bad but over priced. The service wasn't bad. Over all im not coming back. This place is over rated.",1,1,0,Hacina S.,"Philadelphia, PA",19,4,6
3.0,10/7/2013,"I have to give Cipriani 3 stars exclusively because of the ambiance: the ceiling is so high and the decor so reminiscent of a classic Italian cathedral it must be one of a kind in NYC. Open bar was pretty good quality compared to the norm for a firm party too. What really drags this place down is the quality of the food and the service: the app was an over-cooked/ under-seasoned pseudo-pasta thing, and the entree were huge chunks of roast beef drenched in oil - which the servers were spilling everywhere along with the wine.",0,0,0,Vanni P.,"San Jose, CA",138,574,2
4.0,8/14/2013,"Came here for a technology event showcasing a new line of OLEDs.Space is huge.  Staff was very polite and they dressed up very classy.The tables on the side of the event space still has pens attached to them.  From what I notice, I guess this used to be a bank.  I didn't get a chance to walk around downstairs, but I'm pretty sure there's a vault somewhere.  The ceilings are so high, but very detailed in architecture and style.  This place has one of the highest ceilings I've seen in a building, other than Grand Central Terminal across the street.Bartenders at this venue were very fast, even though everyone was pushing to get their drink on line.  The servers who came out with plates on hand to serve mini eats were fearless, because once they come out, a horde of people would rush to them to grab what's left on the plate.  Anyone have any company or big partys at this venue? Let me know! I would love to come back.",6,0,4,Steven L.,"Manhattan, NY",1292,706,4316
3.0,8/12/2013,"Wedding Event, pretty place, good food. I don't have much else.",0,0,0,Annette V.,"New York, NY",801,234,36
5.0,7/13/2013,"I went to this restaurant for a black tie event and I loved this restaurant.  The decor and atmosphere of the restaurant was tastefully and meticulously done.  It was clear that there was a lot of attention to detail and careful though had been put into the atmosphere.  The ceiling is really high giving the restaurant a really elegant look and making the place grander.  I'm not sure what dinner is like normally, but because I was at a black tie event, everyone was pretty much in a tuxedo or formal dress/gown.Drinks were great and the 3 courses dinner was amazing.  I had a salad, a well-done steak and the dessert was to-die for.  Wow, just thinking about the food is making me really hungry.  The service was amazing.  Everyone was trained really well and were really attentive.  Throughout the entire event, the wait staff was always ready to refill our wine/drink glasses, remove trays, or simply check up on us to make sure the food and/or drinks were to our liking.Definitely a place I'd love to go to again, but it's pricey.",1,0,2,Ruth A.,"Manhattan, NY",2,16,0
2.0,6/26/2013,"I went there yesterday for lunch with my friend. Everyone said great things about this restaurant, so we said ""why not?! Let's try!"" We ordered the lunch menu (25USD) which includes a choice of three different starters, three main courses and dessert. I chose to have the Octopus carpacio and for main course the Chicken Cacciatore. It was quite good but portions were really minimal. But still tasted good. The reason why I gave it a two stars, it is because for the awful service we had not from the server, but from the manager on duty (A gentleman with glasses and a pink tie). When we entered into the restaurant he was seating at the bar and when he saw us, he just stood up like nothing happened and without any smile or welcoming attitude. When we asked for the dessert (which took quite a long time), he just told us "" it's coming "". No apologies or guilt signs. When we asked for the dessert for the second time, he came with 2 extra bowls of ice cream to apologize. The intentions were good but the way he did it was extremely rude. He just ""threw"" the 2 extra bowls of ice cream on our table and left without saying anything. We felt like he just wanted us to ""shut up"" and eat our ice cream and leave. Never met any manager like that. I would go back because overall food was good and servers were kind. But with such a manager around, I would just lose my appetite and my mood.",4,2,0,Frank G.,"Manhattan, NY",2,18,3
5.0,5/19/2013,"I was here for a beautiful wedding. And I ate. A lot.Food: the cocktail hour was so good that I had a bit of everything and nothing seemed unimpressive. From Shrimp Cocktail to pasta to pork and beef, everything was just perfect. I ordered steak for dinner, which was cooked the way I like. The lobster appetizer and scrumptious dessert makes me drool just thinking about it (see photographs I've uploaded).Service: everyone here is trained so well and is extremely attentive. Our table was served quality drinks and there always seemed to be wait staff on standby to take care of us. Decor: Stunningly beautiful. Everything is tastefully done. Nobody's rushing anyone anywhere.",3,0,2,Marcus C.,"Fresh Meadows, NY",820,586,1284
5.0,3/19/2013,I come here at least once a year for large scale events/galas.  As my job often finds me at these sorts of events I've learned to overlook the glitter and to dread the inevitable rubber chicken or overcooked beef.  This is not the case at Cipriani's.  The decor is tasteful.  The food is excellent (and that's saying something when they're serving 200 steaks at a clip). The events (from a spectators perspective) always seem to go off without a hitch.  Congrats Cips we'll be back.,0,0,0,Elisa C.,"New York, NY",69,59,29
4.0,1/9/2013,"Review is for NYE party held hereCame here with a large group and we had a seated table (without bottle service). It was pricey but I'll say overall it was worth it. Staff was very very friendly, lines for the bar were never too long. Crowd was dressed very nicely. You can wear anything from a nice jacket and tie to a tuxedo if it pleases you. (weren't too many people in tux's though). The music was pretty fun (started off lame though)The venue itself is GORGEOUS, very big and spacious. The only thing I will say is initially coming inside the music from the door sounded kinda crazy cause it was bouncing around in too much space. Near the dance floor it sounded fine though. The dance floor did get a bit crammed later but at least everyone was friendly.If you get the seated table you can either be near the dance floor (loud, but near the action) or kinda far away in a corner in another side. Both have their pluses. We ended up being kinda far away which was good when we wanted to talk but it wasnt as lively if you want to hear the music. If you want to be closer to the action i suggest you request that or maybe you have to have a bottle table? not totally sure. Hors d'oeuvres were actually really really good. It's a shame we were so full we didnt get chance to eat much of them. If you have a table they bring out some just for you.Overall I would definitely recommend if you can afford the price tag. It's a fun experience which is not the s%&tshow that some new years eve's parties are. Good mix of lively people but a little more mature. Great way to avoid amateur hour without being so uptight that its dull.",11,4,6,Keon D.,"Alexandria, VA",454,318,84
4.0,11/2/2012,"Beautiful space on the site of the old Bowery Savings Bank.  The gorgeous stonework was preserved, as were the old teller's windows!  The Bellinis were excellent.  The food was OK to good.  The service was very attentive and way above average for this sort of place.  A festive place to have an event!",0,0,0,Joel S.,"New York, NY",37,675,16
4.0,10/25/2012,"I came here for the TJ Martell Honors Gala, so this might be a bit of a skewed review since the menu was already fixed. We had the string bean, asparagus and mushroom salad with fava bean/parmesan/whole grain flatbread for the appetizer, which was mind-blowingly awesome. Cipriani rolls were like flaky, croissant rolls - delicious and buttery with awesome texture. For the main, there was amarone braised short ribs with leek-tied carrots and a little potato croquette thing. The flavors were amazing on the short ribs, although the sides were just OK. Dessert was tiramisu in tulip shaped chocolate cups. Yum! Service was absolutely superb, and they were graceful despite it being such a well-attended and bustling event.",0,0,0,Lily L.,"New York, NY",332,260,59
5.0,9/12/2012,"We stopped in for Bellinis, Limoncello, and dessert after eating somewhere else. They gave us the best table in the place for dessert. Everything was amazing and impeccable service. So, elegant. I can't wait to go back",4,1,0,Leza H.,"Las Vegas, NV",17,105,1
4.0,8/29/2012,"Came here for a private benefit and almost didn't get let in because I was wearing ripped jeans. Oops. The food was good, although the restaurant was so huge, with high high ceilings, that it's great for large events or a large amont of people dining but definitely not what you want if you're looking for super small cozy and intimate. the decor was nice. Service was good and prompt. Also I bumped into Adriana Lima in the bathroom.",0,0,1,Sisi R.,"New York, NY",39,75,0
4.0,4/22/2012,Awesome event room (former massive bank hall).,1,0,1,James R.,"New York, NY",887,196,56
5.0,3/28/2012,"10hrs of shopn, 5hrs of spa time, ahhhhhhhh now at cipriani's (my FAV rest here). Cipriani's is an old building in SOHO w high ceilings and amazing artwork. Food was absolutely deeeee-Lish. We had scrumptious pasta and mouthwatering desserts-but you cannot go to NYC without a Cipriani bellini. It's necter from heaven and an absolute MUST!      MERCI NEW YORK. Best place n the world AFTER France. Arabic Blood. French heart. I think i was french in another life.",1,3,3,Rita A.,"San Diego, CA",132,215,125
3.0,3/4/2012,"I am giving this place three stars based on one five star experience and one barely two star experience.  Both times that I have been here, I just came for the Bellini.  The first time, we just happen to be in the neighborhood, got some amazing news, and thought the best way to immediately celebrate was to come here and have at least one round of Bellini. The two of us have had our fair share of Bellini experiences- even at it's birthplace at Harry's Bar in Venezia- and it was here we consumed positively the best Bellini ever!  To top it off, the service was sublime and the atmosphere as well (don't forget to admire the ceiling of Grand Central- breathtaking).  However, the second time we came here, a few months after the first,   we were hopeful for the same stellar taste and service.  Unfortunately, we felt like we were back in the Harry's Bar in Venezia- the wait staff too consumed in themselves to truly be attentive and make a drink beyond a just plain OK (questioning why these prices are so high).  It was not even as if we came at a busy hour, but rather simply a day when the entire waitstaff was in a bad mood. As a side note, the best Harry's Bar I have ever been to in the world (the one time I didn't order a Bellini from them) is in Firenze- if you're ever in the neighborhood, it's well worth every penny (or centesimo).",1,2,1,Courtney T.,"Nolita, Manhattan, NY",1,44,0
4.0,11/9/2011,I really want to give a 3.5-star rating.  But I'm bumping it up to 4-stars since the service is impeccable!  The space is gorgeous and adequately cavernous without being pretentious.  Some of the food is phenomenal.  Some of it was quite common and didn't taste as wondrous as you'd expect such an establishment to prepare.  I highly recommend this as an option for a major fundraising or corporate party event.  Going through the wait time to get a reservation for solo dining???  I'm not so sure.,0,0,0,Christopher M.,"New York, NY",1591,1629,394
