rating,time_created,text,useful,funny,cool,username,user_loc,user_friends,user_reviews,user_photos
4.0,5/6/2011,"I have only been here for a private event and they certainly knew how to cater to an enormous crowd. Great food and attention to detail actual made everything work when space was tight -- yes, even for the amazing large room they have.",0,0,0,John R.,"Warren, NJ",180,1233,353
4.0,1/3/2011,"Hit this club for NYE celebration. We really had a great fun. Who doesn't? It was NYE with DJ, dance floor, drinks. It is located right across the grand central station. This used to be a bank before but they converted into restaurant/club. Their ceilings are high, huge and nicely decorated.Best part was we didn't had to wait too long to get into the club on NYE. Club was really huge and too spacious. DJ rocked definitely and I think a friend of DJ who is DJ too he played some rocking Indian song... we made my NYE. Cheers.",2,0,0,Miss K.,"Dallas, TX",115,98,76
4.0,12/25/2010,"Great food and staff. Always on my map when I stop bye the big apple. As always, the manager sent over a few rounds of their famous B's. They know how to take care of the girls!Food is wonderful and desserts are worth trying. It is on the high side though as far as pricing goes.Happy Holidays!",0,0,0,Cloe A.,"Malibu, CA",5,45,0
5.0,12/8/2010,The lobster risotto is to dieeee for !!!! I finished the whole huge plate,0,0,0,khalifa a.,"Washington, DC",3,22,24
5.0,2/13/2010,"The epitome of New York swank, Cipriani creates the ultimate dining experience.  Known for its distinctive cuisine and classic service, the venue exudes Italian Renaissance charm with its towering marble columns, soaring ceilings, and magnificent inlaid floors.  The food was fantastic and the service superb.  For those with means to indulge in a night of extravagance and luxury, it really doesn't get better than this.Appetizer: Fresh Crab with Advocado and Tomato ConcasseMain Course: Roast Filet of Beef with Sauce Perigroudine, Bundle of String Beans with Leeks and Patate AnnaDessert: Teardrop TiramisuDrink: Delamain Cognac Grand Champagne ""Pale and Dry""$$$$",2,0,0,David Y.,"Sacramento, CA",83,178,9
2.0,10/24/2009,"Cipriani is about the scene & not the food. Don't get me wrong, the food is good, but not great. And for what they charge, shit, they can keep it. Determining a quality italian eatery is not hard to do, especially the traditional ones. It's all about homemade, quality, ingredients. There's absolutely no reason why you need to charge a premium on tomato sauce. But yet, Cipriani comes up with ways to burn a hole in your pocket. If it wasn't for the astronomical prices, they would have earned another star or two. For half the price, I have a spot where I can bring my own bottle, eat large portions, & the chef will come out and greet me personally. Luka's: Ridgefield Park, NJ .....Chef Luka, you owe me one.",3,1,0,Los X.,"New York, NY",18,118,1
2.0,6/15/2009,"Picked up a quick sandwich for lunch from here.  The sandwich was a little overpriced at $8 and was not that big or meaty.  It was a decent sandwich, but I would definitely recommend looking elsewhere for food before overpaying for this place.",0,1,0,David W.,"New York, NY",168,834,0
4.0,2/16/2009,"Cipriani gets the job done and more, especially with gatherings and celebrations. The two times I came here for my school's fundraiser dinner, the food, the ambience, and good company deliver. Not to mention networking. Although the time spent was short-lived during each event, the time had was wonderful. I came with friends and we hung out with the waiters to get extra food, and we forgot after appetizers that there was still entree.Braised lamb shanks, carpaccio, caneton à l'orange (duck), gamberetti all'olio e limone (shrimp), prosciutto e mozzarella, and insalata di fagiolini caciocavallo e pomodoro (string beans and good stuff) were just a few of the starters we had. I have had the risotto con asparagi and pomodori gratinati for first course, and both weren't bad. The filetto di manzo al barolo (roast beef) and carre di agnello arrosto (lamb) were both great and tender. If you want more and have been friendly with the waitress, this was the best time to get seconds for my friends and myself. But usually, you were so full before entrees anyways, from all the alcohol and the appetizers. Of course there was dessert: torta di cioccolato and crostata di fragole. Followed by some line dancing and inebriated people, time was well-spent. Everything was good. If anything was bad, the other ones made up for it. You'll spend a paycheck.",2,0,0,Mark Anthony B.,"Westchester County, NY",200,168,120
4.0,1/29/2009,"FYI this is a review specifically of the luncheonette not the hideous restaurant / event exposition. I wanted to mention the value you get here for lunch with a variety of tasteful hot entree selections - lamb, fish, pastas, beef, and great panini's, salads, and sandwiches. Drawbacks are long lines at peak lunch hours, very limited seating, filled with attention mongering egotistic clientele in their Brioni/Belvest suits and CL heels - lucky you won't have a chance to sit beside them.Harry's at the Pierre would be the location to go but overall Cipriani is over rated, over priced, and just over except for the luncheonette - i'm not being cheap but just a value connoisseur coz i work for my paper.",0,0,0,Kelvin T.,"New York, NY",59,285,19
5.0,1/4/2009,"My company had a holiday party at Cipriani 2 years ago and I still cant get that night out of my head.  The food, location, drinks, ambiance, and service was just top notch.... highly recommended!!!!!",1,0,1,Paul M.,"New York, NY",1158,153,103
4.0,1/2/2009,"It's been years since I've attended one of these big NYE productions with ridiculous ticket prices. It's usually a huge disappointment so I didn't come here with high expectations. I thought it was going to be a disaster with the long line outside to get in then the bottle neck to get to the mandatory coat check on the inside. Once I got through the craziness of the crowd, I looked before me and there was the most beautiful interior of a ballroom that I have ever seen. The ceilings were sky high with gorgeous marble columns going down either side of the space. Absolutely breathtaking. For an event that attracted easily 1,000 people, it wasn't the disaster I was expecting. Hors d'oeuvres and open bar through 3am were included. I was able to snag a few bites and the bars were easily accessible all night. Drinks were surprisingly stiff too. The staff and bartenders were friendly and responsive. The DJ was really good too even though I think he did the New Year's countdown a few minutes too early.Dancing the night away with friends at Cipriani 42nd Street made for a great start to 2009.",7,1,11,P W.,"New York, NY",187,796,191
4.0,1/1/2009,"My girlfriend and I went here for the 08 into 09 New Year's Gala. From when you first walk in you walk into a huge open area where the ceilings are about 100 feet high, kinda looks like a huge mansion. The wait staff is very attentive and friendly every time I tried to give a staff member a tip they would always walk away from it, which was pretty interesting. h'ors d'eouvre kept on comming and drinks were flowing.  I would have to say there were 5 bars and all of them served guests in a very timely manner.I would definitely go back for another event hosted in Cipriani.",4,0,1,Amador A.,"Queens, NY",431,780,289
4.0,12/18/2008,"My job had it's corporate holiday party here, last night.Free drinks & free food...you really can't (and shouldn't...it's free, man) complain.The place use to be a bank, it's huge...reminds me of a venue to hold a wedding or event of the likes. I did like the old bank teller windows still chillin' around the place...don't know if I'd choose to hold an event here (but since I wasn't the one paying at this particular event, I could give two shits).The food kept coming & the alcohol kept a-flowing.Having a corporate (free) event here? Sure, I'll go.",7,8,6,Chita D.,"New Erection, VA",2,229,6
3.0,12/16/2008,"Came here for a private event but the space felt too big and the food was just okay. I like the cozy feeling of their downtown location better, but had fun dancing here.Date Rating: N/A (depends on the event)Pick up Scale: N/A (again depends on the event)Strong Suggestion: Come dressed to the nines.",3,3,3,Megan C.,"New York, NY",4019,835,1062
3.0,12/6/2008,"Was there for an event. Such grandeur and how lovely the interior is. Didn't think too highly of the wait staff. Perhaps they got some temps for large events? They seemed to take forever to tend to my requests. Also, I'm not a big fan of food served at events. First the pre-fixe option does not appeal to me. Second, I think the stress on the kitchen to dish up food at the same time for all the guests would to some degree affect the overall taste and presentation. I would say the meal was fine... nothing ooh-la-la. Perhaps the organizer was on a budget :pAnyway, I've also felt the same way with the Cipriani's lunch take-out spot. Not too impressed.",0,1,0,Laur T.,"New York, NY",26,780,0
5.0,2/21/2008,"Last night was the second time I was here; both times were for events.The space is beautiful, high vaulted ceilings with mosaics, and there were gargoyles set into the end of each arch.The waitstaff is incredibly attentive; I went over to the h'ors d'eouvre table and a server plucked items for me and placed them on my plate, then handed me a fork. There were hot entree stations, a wine and cheese station, as well as servers walking around with finger foods. As for alcohol, oh my god! Not only did they have servers walking around with champagne and bellinis, there were three or four open bars.The setting is elegant, the service is elegant, the presentation is elegant, sorry to use the same superaltive, but it was a first class event  at a first class place.",1,0,0,PJ G.,"New York, NY",292,229,5
4.0,1/13/2008,"Was here for an awards ceremony, great upscale space.  Definitely a spot every NYer should experience at least once.  Had the signature bellini and risotto.  Filet was a pretty generous cut too.",1,0,0,Charmaine L.,"New York, NY",1,11,0
4.0,1/9/2008,"Oh how I love Cirpriani.  My alumni association has an event every January here, and it's always well done.  They have our school mascot tastefully projected everywhere in the main room.  Multiple bars, multiple food stations.  The food is great, though I guess it doesn't take much to make carpaccio, proscuitto, grilled asparus, grilled onions.  It was all very good food, and there was lots of it.  And best of all, they serve white peach bellinis.  What can be better than a night eating food and drinking white peach bellinis.  I love these things.Though they did start flashing the lights, and trying to get us out as soon as our reserved time ended.  Guess they needed to clean up.",1,0,1,Linda W.,"New York, NY",39,421,124
3.0,1/8/2008,"My company rented Cipriani out for our corporate holiday party.  We packed it to its gills -- I estimate that there were easily over a thousand people in here.Surprisingly enough, the multiple bars were fully staffed and equipped to handle such large volumes.  I did not have to wait long at any one point to get a drink, and they were all well-made and plenty alcoholic in nature.They had buffet-style snacks, and although I very rarely eat anywhere that has a buffet, I had a taste of the grilled arthichokes -- and they did not disappoint.  I am sorry to say that I missed out on their penne pasta in red sauce, my favorite dish and a famous dish of theirs, but my friends all assured me that it was delicious.Really, the only reason it loses stars is unfair, because it had nothing to do with the actual venue -- there was a truly awful Beatles cover band playing, and it really ruined the atmosphere.",0,1,0,Shasha M.,"Los Angeles, CA",60,279,7
1.0,2/6/2006,"I was less than impressed with this restaurant. Although the view was interesting--the balcony overlooks Grand Central Terminal--the smell of cleaning solution was prevalent throughout the whole meal...not exactly appetizing. The wait staff is inattentive, and the food is only mediocre for the price. I am a brunch addict, so I went for the eggs benedict on the prix fixe brunch menu, and found everything merely so-so. The potatoes with red pepper were not even edible, in my opinion. There are much better restaurants in the area, and I won't be going back.",4,2,0,Michele W.,"Los Angeles, CA",153,309,0
4.0,12/13/2005,"A very elegant eatery located in no other than Grand Central Station, Cipriani's offers professional service frequented by a suit-and-tie clientele.  Their 'Safe Way to Gaining Weight' lunch special is the way to go.  For $24, you will get a mixed green salad, a choice of chicken or pasta, dessert, and coffee.  This restaurant is my midtown pick if you are looking for something on the upscale side for your lunch escape.  Make reservations.",0,0,0,Sarah B.,"New York, NY",41,280,505
